title,published_utc
Why Intel Stock Shot Higher on Wednesday,2022-12-22T00:13:00Z
"Visa, Mastercard are 'great defensive names' for 2023, but PayPal and Coinbase stocks could be set for a rebound, analysts say",2022-12-22T00:30:00Z
NVIDIA (NVDA) vs. Taiwan Semiconductor (TSM): Which is the Better Investment for 2023?,2022-12-22T02:46:00Z
Groove As You See Fit: Spotify Users On iPhone To Get 'Right Music' For Workouts Via HealthKit Data,2022-12-22T05:41:28Z
Market Volatility Drops Further Following Rebound In US Consumer Confidence,2022-12-22T09:59:31Z
The 2023 Hyundai Ioniq 5 raises the bar for electric cars,2022-12-22T10:01:00Z
The Biggest Reason Apple Stock Is a Screaming Buy for 2023,2022-12-22T10:10:00Z
"As U.S. fails to crack down on Big Tech, Europe shows what progress looks like",2022-12-22T11:21:00Z
Wall Street Breakfast: SBF Associates Flip,2022-12-22T11:44:54Z
5 Surprising Strategies for Building Wealth in the Stock Market,2022-12-22T13:11:00Z
iPhone 14 Was No Match For This Smartphone In Marques Brownlee's Blind Camera Test,2022-12-22T13:27:28Z
Netflix (NFLX) Grows International Portfolio With Danish Shows,2022-12-22T13:44:00Z
Could Apple Still Be the World's Largest Company in 2023?,2022-12-22T14:15:00Z
Alphabet (GOOGL) Boosts YouTube Streaming Efforts With NFL Deal,2022-12-22T14:36:00Z
"Stocks remain overpriced, even vs. the dot-com bubble. But you can still find good picks in these 2 sectors.",2022-12-22T14:54:00Z
This Historical Trend Debunks Predictions For Weak First Half Of 2023: Analyst,2022-12-22T15:13:12Z
"Why Apple, Roku, and Shopify Stocks All Tumbled Thursday",2022-12-22T20:25:00Z
"Apple Analyst Reduces FY23 Estimates Citing Macro, Supply Chain And Geo-Political Headwinds",2022-12-22T21:19:42Z
"Amazon stock breaks below 2020 low for the first time, heads for worst year since dot-com bust",2022-12-22T23:37:00Z
"Tesla, Apple, Amazon, CarMax, Cleveland-Cliffs: Why These 5 Stocks Are Drawing Investors' Attention Today",2022-12-23T00:49:31Z
Bull of the Day: Jabil (JBL),2022-12-23T09:00:00Z
Warren Buffett's 3 Most Intriguing Tech Investments,2022-12-23T10:12:00Z
Why Apple's No Longer Interested In NFL Sunday Ticket,2022-12-23T10:27:00Z
Better Buy for 2023: Disney vs. Amazon,2022-12-23T11:01:00Z
S&P 500 Bull Market: Here's How to Start Preparing for the Upswing,2022-12-23T11:15:00Z
2023 Should Be a Great Year to Go Bargain Shopping for Growth Stocks,2022-12-23T11:16:00Z
Berkshire Vs. Direct Apple Ownership - Take The Safe Path,2022-12-23T11:39:39Z
What another record in options trading volume says about the stock market,2022-12-23T12:17:00Z
Better Buy: Microsoft Stock vs. Apple Stock,2022-12-23T12:30:00Z
"Here's how U.S. investors can position themselves for the sea change out of Japan, according to Bank of America and Citi",2022-12-23T13:52:00Z
"Tesla Short Sellers Have $15B In 2022 Profits, And They Are Still Piling On",2022-12-23T16:07:34Z
Apple May Hit This Big Milestone Sooner Than Expected,2022-12-23T23:27:31Z
What to expect for the stock market in 2023 after the biggest decline since the financial crisis,2022-12-24T13:09:00Z
Apple Bans TikTok? Netflix Merger? 7 Bold Tech Predictions For 2023,2022-12-24T13:41:08Z
"Tesla short sellers have collected nearly $14 billion since Elon Musk agreed to buy Twitter, making Tesla the most profitable short of 2022",2022-12-24T13:47:00Z
TikTok Concerns,2022-12-24T14:00:00Z
PepsiCo's Chief Design Officer Talks About the Human Side of Innovation,2022-12-24T14:00:00Z
Inflation and the FTX Collapse Got These Investors Talking,2022-12-24T14:01:00Z
'Peak TV' is coming to an end as streaming services look to cut costs,2022-12-24T14:12:00Z
"Bulls And Bears Of The Week: Tesla, Apple, Disney, And Schiff Says MicroStrategy's Bitcoin Buys A Sign Of Desperation",2022-12-24T17:05:30Z
What the end of the stock market's ‘FANG-era’ means for ETFs,2022-12-24T19:59:00Z
Want millions more in retirement? This small investment tweak can make a big difference.,2022-12-24T20:57:00Z
Which FAANG Stock Will Be the Top Performer in 2023?,2022-12-25T10:21:00Z
2 Stocks Warren Buffett Should Buy in 2023,2022-12-25T11:01:00Z
"Poor Earnings, Shallow Recession To Drag S&P 500 Initially, But I Expect Strong Recovery To 4,151 By Year-End 2023",2022-12-25T13:00:15Z
Better Buy: Apple vs. Nvidia,2022-12-25T13:10:00Z
3 'Dividend Dreams' That Boast 268% Payout Growth and 12% Yields,2022-12-26T09:42:00Z
The Media Industry Is Handing Apple and Amazon a Big Opportunity,2022-12-26T10:07:00Z
Warren Buffett vs. the Market: What It Means for Investors,2022-12-26T11:01:00Z
Is iShares MSCI ACWI Low Carbon Target ETF (CRBN) a Strong ETF Right Now?,2022-12-26T11:20:08Z
Apple Stock: Bear vs. Bull,2022-12-26T12:19:00Z
No love for meme stocks — stock-trading kids are loading up on Apple and index funds,2022-12-26T12:30:00Z
What a Weakening U.S. Dollar Means for Large-Cap Tech Stocks,2022-12-27T05:22:00Z
"S&P 500 Settles Higher, Market Volatility Drops",2022-12-27T10:20:55Z
Could This New Content Category Get Netflix Back in Shape?,2022-12-27T11:20:00Z
Should Motley Fool 100 Index ETF (TMFC) Be on Your Investing Radar?,2022-12-27T11:20:05Z
Should You Invest in the First Trust Indxx NextG ETF (NXTG)?,2022-12-27T11:20:05Z
Is Franklin U.S. Large Cap Multifactor Index ETF (FLQL) a Strong ETF Right Now?,2022-12-27T11:20:05Z
Should iShares Russell Top 200 ETF (IWL) Be on Your Investing Radar?,2022-12-27T11:20:07Z
Is iShares U.S. Equity Factor ETF (LRGF) a Strong ETF Right Now?,2022-12-27T11:20:09Z
3 Reasons Amazon Stock Could Soar in 2023,2022-12-27T13:45:00Z
Alphabet (GOOGL) Enhances YouTube With Recent Features,2022-12-27T13:55:00Z
'Manna from heaven' inflation and 'a world that's not ending.' A top strategist offers ideas on investing in a brighter future.,2022-12-27T14:43:00Z
Charter's (CHTR) Slow Internet Customer Growth Impacts Prospects,2022-12-27T14:50:00Z
1 Growth Stock Down 39% to Buy Right Now,2022-12-27T15:17:00Z
DraftKings Analyst Sees Upside In Stock After NFL Week 16,2022-12-27T17:01:51Z
3 Top Dividend Growth Stocks I'm Buying to Close Out 2022,2022-12-27T17:13:01Z
Gene Munster Tells Benzinga Where He Thinks Tech Will Go In 2023,2022-12-27T18:54:47Z
"Elon Musk Now The Subject Of A Fictional Movie Character: 'A Weird Relevance In Exactly The Current Moment,' Director Says",2022-12-27T19:58:23Z
2022: Winners & Losers,2022-12-27T22:19:00Z
Apple (AAPL) Dips More Than Broader Markets: What You Should Know,2022-12-27T22:45:26Z
Why Apple Investors Suffered a Tough Time on Tuesday,2022-12-27T23:42:04Z
Why Last Week's Selloff was a Christmas Gift to Investors,2022-12-27T23:58:00Z
"Tesla, Apple, Lightjump,  Southwest, Gilead: Why These 5 Stocks Are Drawing Investors' Attention Today",2022-12-28T02:22:11Z
The 2023 Chevrolet Bolt EUV review: The electric hatch is a top-rated EV under $30K,2022-12-28T10:01:00Z
5 Unstoppable Metaverse Stocks to Buy in 2023,2022-12-28T10:52:00Z
"S&P 500 Records Losses, Market Volatility Increases",2022-12-28T10:52:37Z
"Crypto Crash: Shiba Inu Is Down 76% in 2022, but Will It Bounce Back in 2023?",2022-12-28T10:59:00Z
Should Franklin U.S. Large Cap Multifactor Index ETF (FLQL) Be on Your Investing Radar?,2022-12-28T11:20:06Z
Should John Hancock Multifactor Large Cap ETF (JHML) Be on Your Investing Radar?,2022-12-28T11:20:08Z
Is Fidelity High Dividend ETF (FDVV) a Strong ETF Right Now?,2022-12-28T11:20:08Z
"Stock Market News for Dec 28, 2022",2022-12-28T14:31:00Z
"This asset will crush all others in 2023, says hedge-fund manager who nailed one big call of 2022",2022-12-28T14:56:00Z
Netflix's (NFLX) Glass Onion Hits the Right Chord With Viewers,2022-12-28T14:58:00Z
Tesla vs. Apple: One Is Cheaper and Grows Faster Than the Other,2022-12-28T15:15:00Z
Alphabet's (GOOGL) Music Streaming Boosted With Latest Move,2022-12-28T15:28:00Z
Netflix's (NFLX) Robust International Content Aids Prospects,2022-12-28T15:42:00Z
Alphabet (GOOGL) to Strengthen YouTube With Search Engine,2022-12-28T15:54:00Z
2023 Market Outlook: 15 Top Stock Picks for the New Year,2022-12-28T16:11:00Z
"Got $1,000? 2 Smart Stocks to Buy Hand Over Fist",2022-12-28T16:30:00Z
Tesla And Apple Could Spark A Santa Claus Rally: Analyst,2022-12-28T16:46:05Z
"Apple Nears 2-Year Lows, but This Dow Jones Stock Just Hit All-Time Highs",2022-12-28T18:09:00Z
3 Catalysts For Apple Stock In 2023 — First 'Major New Product' Launch In 8 Years?,2022-12-28T18:19:58Z
Why Apple Stock Was Sliding Today,2022-12-28T19:33:00Z
2022 stock carnage erases $5.2 trillion in market cap from these 10 FANG+ stocks,2022-12-28T20:08:00Z
"Dow ends over 350 points lower as investors weigh housing data, 2023 recession concerns",2022-12-28T21:26:00Z
3 Companies With Rock-Solid Free Cash Flow,2022-12-28T21:55:00Z
"""Krampus Rally"" Threatens Last Sessions of 2022",2022-12-28T22:54:00Z
Apple: Out Of Control,2022-12-29T04:15:44Z
Why Fear Level Among US Investors Is Increasing,2022-12-29T08:17:21Z
"This couple’s honeymoon plans fell apart when a hurricane hit, but the alternative turned out even better",2022-12-29T10:01:00Z
The 2023 Honda Civic: Tasteful design and athletic driving character in an efficient package,2022-12-29T10:01:00Z
1 Warren Buffett Stock I Wouldn't Touch With a 10-Foot Pole,2022-12-29T10:15:00Z
Market Volatility Increases On Recession Concerns,2022-12-29T10:53:37Z
"Wharton Professor Jimmy Siegel Says Real Inflationary Challenges Over, Predicts 15-20% Rally For US Stocks In First Half Of 2023",2022-12-29T11:30:05Z
"Wall Street Breakfast December 29: Apple Hits 52-Week Low, iPhone Estimates Fall (Podcast)",2022-12-29T12:01:56Z
"Apple Hits Fresh 52-Week Low, Here's A Look At Recent Price Target Cuts By The Most Accurate Analysts",2022-12-29T12:47:00Z
Want to Invest Like Warren Buffett? Buy These 2 Top Stocks and Hold Them Forever,2022-12-29T13:30:00Z
2 Blue Chip Stocks to Buy No Matter What Happens in 2023,2022-12-29T13:45:00Z
Disney's (DIS) New Avatar Movie Crosses $1B at Box Office,2022-12-29T13:59:00Z
Better Buy: Microsoft vs. Apple,2022-12-29T14:00:00Z
1 Growth Stock Down 28% to Buy Right Now,2022-12-29T14:01:00Z
"Here's the next mega tech stock likely to fall into the bear market's clutches, according to this chart",2022-12-29T14:38:00Z
Stock Market Sell-Off: Is Microsoft a Buy?,2022-12-29T14:53:00Z
"Have $3,000? 2 Smart Stocks to Buy at a Discount Right Now",2022-12-29T15:30:00Z
Why This Netflix Analyst Is Double Upgrading The Streaming Stock: 'Difficult For Competitors To Catch',2022-12-29T15:47:17Z
"Why Amazon, Alphabet, and Apple Stocks All Rallied Thursday Morning",2022-12-29T16:51:27Z
Loup's Gene Munster Explains The Slide In Apple Shares: 'It's As Simple As That',2022-12-29T17:06:33Z
Apple shares look to snap four-day losing streak after report of improved iPhone Pro production,2022-12-29T19:17:00Z
Markets Turn Bullish with a Half-Session Left in 2022,2022-12-29T22:50:00Z
Investor Fear Eases After Nasdaq Rises More Than 2%,2022-12-30T08:08:19Z
73% of Warren Buffett's Portfolio Is Invested in These 5 Stocks,2022-12-30T10:06:00Z
"Got $5,000? 2 Tech Stocks to Buy and Hold for the Long Term",2022-12-30T10:15:00Z
"Dow Surges Over 300 Points, Market Volatility Decreases",2022-12-30T10:36:22Z
This Market-Beating Growth Stock Is Too Cheap to Ignore,2022-12-30T11:42:00Z
"Good riddance 2022. Here are five key themes for investors heading into the new year, according to BNY Mellon.",2022-12-30T13:32:00Z
3 Top Stocks Worth Buying for the Long Term in 2023,2022-12-30T13:53:00Z
Apple Inc. (AAPL) Is a Trending Stock: Facts to Know Before Betting on It,2022-12-30T14:00:12Z
Amazon (AMZN) to Boost Sports Streaming With Standalone App,2022-12-30T14:11:00Z
"Stock Market News for Dec 30, 2022",2022-12-30T14:32:00Z
Comcast's (CMCSA) Project Up Helps in Philadelphia Expansion,2022-12-30T14:46:00Z
"Earnings Outlook for 2023 and Featured Reports for Apple, JNJ, & Others",2022-12-30T17:58:00Z
"Why Taiwan Semiconductor, Qualcomm, and Skyworks Solutions Fell Today",2022-12-30T18:15:21Z
"11 predictions for money, technology, stocks and crypto for 2023",2022-12-30T20:57:00Z
"Many Stocks Are at 52-Week Lows, but Don't Fall for These Traps",2022-12-30T21:00:00Z
Don't Wait for a Market Crash: These 2 Top Stocks Are on Sale,2022-12-30T22:15:00Z
Have $500? These 2 Stocks Could Be Bargain Buys for 2023 and Beyond,2022-12-30T22:37:09Z
Where Will Apple Stock Be in 1 Year?,2022-12-31T10:25:00Z
"Even in an Advertising Slowdown, These 3 Stocks Are Long-Term Winners",2022-12-31T12:00:00Z
These 20 stocks were the biggest losers of 2022,2022-12-31T13:16:00Z
3 Unstoppable Growth Stocks to Buy After a Stock Market Sell-Off,2022-12-31T14:00:00Z
Where Will Unity Software Stock Be in 3 Years?,2022-12-31T15:45:00Z
Disney breaks below 2020 low to record its cheapest share price of the ‘Star Wars’ era,2022-12-31T15:48:00Z
Bulls In A Bear Market: These 10 Stocks Clocked Gains In Excess Of 100% In 2022,2022-12-31T16:11:14Z
"Buy shares of only the strongest companies to make money in 2023, including 'the kings of cash flow,' says this five-star fund manager",2022-12-31T16:41:00Z
"ChatGPT is called 'an iPhone moment in AI,' but will it make money like the iPhone?",2022-12-31T16:44:00Z
This company has wiped out more investor wealth in 2022 than Tesla,2022-12-31T16:54:00Z
4 Red-Hot Growth Stocks to Buy in 2023 and Beyond,2022-12-31T17:30:00Z
"One question looms about where tech stocks go now, after one of their worst years on record",2022-12-31T18:57:00Z
Streaming will look more like cable TV in 2023: Here are 5 trends to watch for,2022-12-31T20:15:00Z
2023 Dividend Growth Portfolio Review And Look Ahead,2023-01-01T06:30:54Z
2 Beaten-Down Warren Buffett Stocks to Buy in 2023,2023-01-01T10:13:00Z
80% of Warren Buffett's Portfolio Is Invested in These 7 Stocks as 2023 Begins,2023-01-01T10:50:00Z
"Down 28% in 2022, Is Apple Stock a Buy for 2023?",2023-01-01T11:00:00Z
EWT: Taiwan Has No Trigger Till Semis Recover (Technical Analysis),2023-01-02T05:14:52Z
My Dividend Growth Portfolio - Final 2022 Recap,2023-01-02T07:44:31Z
Should Goldman Sachs ActiveBeta U.S. Large Cap Equity ETF (GSLC) Be on Your Investing Radar?,2023-01-02T11:20:08Z
Should Invesco NASDAQ 100 ETF (QQQM) Be on Your Investing Radar?,2023-01-02T11:20:10Z
3 Dividend-Paying Tech Stocks to Buy in January,2023-01-02T13:00:00Z
Did Buffett Beat the Market in 2022? Here's How His Top 5 Stocks Performed,2023-01-02T14:04:01Z
"1 Stock to Buy, 1 Stock to Dump This Week: Li Auto, Walgreens",2023-01-02T14:14:00Z
Warren Buffett Bought This Chip Giant in 2022. Should You Do the Same in 2023?,2023-01-02T16:15:00Z
3 Reasons Apple Stock Keeps Falling,2023-01-02T16:20:00Z
Better Semiconductor Stock: TSMC vs. Intel,2023-01-02T16:30:00Z
The 10 Best Stocks to Buy in January 2023,2023-01-02T17:11:39Z
5 things you really should not buy in 2023,2023-01-02T18:19:00Z
Rotate To Value In 2023: 1 Strong Dividend Buy And 1 Urgent Sell,2023-01-03T06:13:57Z
Where Will The Trade Desk Stock Be in 5 Years?,2023-01-03T10:04:00Z
Walt Disney Stock Looks Marvelous for Patient Investors,2023-01-03T10:20:00Z
2 Stocks to Invest in Virtual Reality,2023-01-03T10:20:00Z
"If You Invested $100 in Berkshire Hathaway in 1965, This Is How Much You Would Have Today",2023-01-03T10:50:00Z
23 Top Dividend Stocks to Buy and Hold in 2023,2023-01-03T10:55:00Z
"The Zacks Analyst Blog Highlights Apple, Johnson & Johnson, CSX, American International Group and CenterPoint Energy",2023-01-03T11:15:00Z
Should Schwab Fundamental U.S. Large Company Index ETF (FNDX) Be on Your Investing Radar?,2023-01-03T11:20:05Z
Is iShares Core S&P U.S. Growth ETF (IUSG) a Strong ETF Right Now?,2023-01-03T11:20:08Z
Should You Follow Warren Buffett's Lead and Buy This Stock?,2023-01-03T11:45:00Z
2 Hot Stocks to Buy and Hold Until You Retire,2023-01-03T12:42:00Z
These five trading days accounted for nearly all of the S&P 500's losses in 2022,2023-01-03T13:05:00Z
Disney's (DIS) New Avatar Movie Leads the Global Box Office,2023-01-03T13:44:00Z
"Here's how the most important dispute hanging over the crypto industry may play out, says industry watcher",2023-01-03T13:49:00Z
"This easy, free iPhone hack naming a legacy contact could be the most important estate planning move you make this year",2023-01-03T14:14:00Z
NFL Week 17 Indicate Operators Benefited From OSB Launch In Ohio: Analyst,2023-01-03T17:57:55Z
10 Best Stock Traders In Congress In 2022 (Spoiler: Nancy Pelosi Isn't No. 1),2023-01-03T18:53:15Z
A Bull Market Is Coming: 3 Stocks Near Their 52-Week Lows to Buy Right Now,2023-01-03T19:00:00Z
What 15 Analyst Ratings Have To Say About Apple,2023-01-03T19:00:16Z
"Why Apple Stock Dropped on Jan. 3, 2023",2023-01-03T19:50:29Z
"Cars and videogames: Nvidia rolls out $799 gaming card, partners with Foxconn on EVs",2023-01-03T21:32:00Z
"Tesla stock wipes out three day bounce, hits lowest price in more than 2 years",2023-01-03T21:44:00Z
Apple valued below $2 trillion for the first time in more than 21 months as stock slides,2023-01-03T22:02:00Z
Valuation Squeezes Continue into 2023,2023-01-03T22:38:00Z
"EXCLUSIVE: Top 10 Searched Tickers On Benzinga Pro In December 2022: Where Do Tesla, Apple, AMC Rank?",2023-01-03T23:54:34Z
"Tesla, Amazon, Apple, Aurinia Pharma, Vera Therapeutics: Why These 5 Stocks Are Drawing Investors' Attention Today",2023-01-04T01:09:13Z
"Apple Crossed The Whopping $3 Trillion Mark Exactly A Year Ago Today — Now, It's Not Even In The $2 Trillion Club",2023-01-04T02:14:50Z
Apple Now In Tough Spot,2023-01-04T07:54:36Z
Investor Fear Increases Slightly As US Stocks Settle Lower On First Trading Session Of 2023,2023-01-04T08:04:02Z
What the Smartest Investors Know About Apple Stock,2023-01-04T10:12:00Z
"Down Over 20% In 2022, These 3 Warren Buffett Stocks Are Smart Buys in 2023",2023-01-04T10:31:00Z
"Volatility In Markets Increases, Fed Minutes In Focus",2023-01-04T10:48:38Z
Should SPDR MSCI USA StrategicFactors ETF (QUS) Be on Your Investing Radar?,2023-01-04T11:20:08Z
Should Schwab U.S. LargeCap ETF (SCHX) Be on Your Investing Radar?,2023-01-04T11:20:09Z
"Nasdaq, S&P 500 Futures Rise Ahead Of FOMC Minutes, Manufacturing Data — Analyst Sees January Effect Lifting Smid-Cap Stocks",2023-01-04T11:20:54Z
Wall Street Breakfast January 4: Apple Dips Below $2T (Podcast),2023-01-04T12:05:25Z
"Down 30%, Apple Stock Is Still Risky",2023-01-04T12:30:00Z
Leading Contract Chipmaker TSMC Fails To Impress Analysts,2023-01-04T13:13:39Z
4 Cheap Dividend Stocks to Buy Now,2023-01-04T13:15:00Z
Could the Dow Jones Keep Outperforming the Nasdaq Composite in 2023?,2023-01-04T13:20:00Z
Apple Price Target Cut By Bullish Analyst Amid Demand Woes: Why He Still Sees It As A 'Rock Of Gibraltar Name' For 2023,2023-01-04T13:29:21Z
"FDA Permits Pharmacies To Distribute Abortion Pills, Tesla's Aggressive Discounting May Have Hit Gross Margins, Goldman Sachs Bullish On M&A Activity In Late 2023: Top Stories Today",2023-01-04T13:31:23Z
"Stock Market News for Jan 4, 2023",2023-01-04T14:31:00Z
Shopify's (SHOP) Commerce Components to Attract Merchants,2023-01-04T15:03:00Z
Investors Should Consider This Warren Buffett Advice in 2023,2023-01-04T15:07:00Z
39% of Warren Buffett's Portfolio Is Invested in These 3 Tech Giants,2023-01-04T15:49:00Z
Here are the chip companies that should benefit the most from the government's massive incentives,2023-01-04T16:00:00Z
Alphabet (GOOGL) to Boost YouTube TV With Multi-Screen Viewing,2023-01-04T16:50:00Z
Apple Stock: You Have Been Warned Again,2023-01-04T16:54:25Z
"PYPL's Outgoing Traffic From Prominent Merchants Stabilized, Analyst Says",2023-01-04T16:56:36Z
CES 2023: LG goes big with wireless 97-inch OLED TV,2023-01-04T17:25:00Z
"CES 2023: A new 'metaverse' headset gets early buzz as AI, augmented reality and car tech look to make a splash",2023-01-04T17:53:00Z
Why PayPal Stock Rallied on Wednesday,2023-01-04T18:04:12Z
FOMC Meeting Minutes Live: December Fed Minutes Recap,2023-01-04T19:15:59Z
"Jeff Bezos may return to helm Amazon, says forecaster of double-digit stock market losses last year",2023-01-04T20:42:00Z
"Yikes, there's not much worth streaming in January 2023. Here's what to watch anyway.",2023-01-04T21:05:00Z
Apple (AAPL) Outpaces Stock Market Gains: What You Should Know,2023-01-04T22:45:21Z
"Short sellers score $300 billion in 2022; bets against Tesla, Amazon, Meta bring in the most",2023-01-04T22:49:00Z
"Tesla, Amazon, Apple, Alibaba, Microsoft: Why These 5 Stocks Are Drawing Investors' Attention Today",2023-01-05T00:49:54Z
Wednesday Recap: Minty Fresh Breadth,2023-01-05T01:06:00Z
Apple Stock Pulls Back: Is Now the Time to Buy?,2023-01-05T06:09:00Z
2 FAANG Stocks to Buy Hand Over Fist in 2023 and 1 to Avoid Like the Plague,2023-01-05T10:06:00Z
3 Myths To Debunk About Apple,2023-01-05T10:12:01Z
"S&P 500 Settles Higher, Volatility In Markets Declines",2023-01-05T10:38:30Z
3 Dow Stocks Down 30% to 55% That Are Screaming Buys for 2023,2023-01-05T10:52:00Z
Why Tesla Is Preferred Choice Of Uber Drivers: Cathie Wood Weighs In,2023-01-05T10:59:42Z
Should You Invest in the Technology Select Sector SPDR ETF (XLK)?,2023-01-05T11:20:08Z
Should Vanguard Russell 1000 ETF (VONE) Be on Your Investing Radar?,2023-01-05T11:20:08Z
Should iShares S&P 500 Growth ETF (IVW) Be on Your Investing Radar?,2023-01-05T11:20:08Z
A Bull Market Is Coming -- 1 Unstoppable ETF to Buy Now,2023-01-05T11:30:00Z
"Microsoft will benefit from ChatGPT, OpenAI in multiple ways — potentially at Google's expense, analyst says",2023-01-05T12:51:00Z
CES 2023: Samsung unveils smart home hub that doubles as a wireless charger,2023-01-05T12:52:00Z
Samsung's Consumer-Products Chief And Analysts Expect Demand Headwinds To Improve From 2H 2023,2023-01-05T13:30:59Z
Shopify Just Threw a Big Lifeline to Meta Platforms and Alphabet,2023-01-05T14:08:00Z
"Vanguard says the outlook for the 60/40 model of stocks and bonds is looking rosier, but here's the allocation it prefers the most",2023-01-05T14:13:00Z
T-Mobile US Analysts Cheer Its Preliminary Q4 Subscriber Numbers,2023-01-05T17:57:34Z
"Microsoft's AI Chatbot Could Bring 21% In Gains For Stockholders, But Analysts Are Torn Over Cloud Biz",2023-01-05T19:00:54Z
"AppLovin Likely Stock For Additional Estimate Revisions Ahead Of Courtesy Secular And Fundamental Pressures, Analyst Says",2023-01-05T19:01:08Z
3 Top Chip Stocks Paying Dividends,2023-01-05T19:14:00Z
Qualcomm Launching Snapdragon Satellite: What Investors Should Know About New Product,2023-01-05T20:36:42Z
"Looking for clues about iPhone supply? Ask AT&T, Verizon and T-Mobile",2023-01-05T22:59:00Z
Samsung forecasts big slump in fourth-quarter profit as tech demand wanes,2023-01-06T00:44:00Z
"Apple's Iconic 1970s Trade Sign, Steve Wozniak's Tool Box Up For Auction — Here Are The Hefty Starting Bids",2023-01-06T04:43:49Z
Apple: We're Buying Below $100,2023-01-06T06:49:23Z
Apple Pay Later: What's The Game Plan For Monetization?,2023-01-06T08:51:23Z
My Top Stock to Buy for 2023 (and It's Not Even Close),2023-01-06T10:05:00Z
5 Stocks Warren Buffett Is Betting Big on for 2023,2023-01-06T10:06:00Z
"You Could've Become a Millionaire With Just $1,000 Invested in This Warren Buffett Stock",2023-01-06T11:13:00Z
Is Schwab Fundamental U.S. Broad Market Index ETF (FNDB) a Strong ETF Right Now?,2023-01-06T11:20:06Z
Should BNY Mellon US Large Cap Core Equity ETF (BKLC) Be on Your Investing Radar?,2023-01-06T11:20:06Z
Are Growth Stocks in for More Pain in 2023?,2023-01-06T12:22:00Z
4 Artificial Intelligence Stocks to Buy in 2023,2023-01-06T12:45:00Z
Citi has just cut its rating on U.S. stocks to underweight. Here's why and what it prefers.,2023-01-06T13:51:00Z
Tech Sell-Off: 2 Growth Stocks to Buy in 2023,2023-01-06T14:30:00Z
Investing in Tech ETFs,2023-01-06T17:24:27Z
"Qualcomm Satellite Messaging Partnership Likely To Trigger Iridium's Revenue Stream, Analyst Says",2023-01-06T18:43:29Z
"No one's having fun in the stock market these days, and that might be a sign that a bottom is near",2023-01-06T21:09:00Z
Verizon shares log best six-day stretch since 2020,2023-01-06T21:59:00Z
1 Warren Buffett Stock Down 27% to Buy in 2023,2023-01-06T22:15:00Z
"Android has a response to iPhone's satellite connection, thanks to Qualcomm",2023-01-06T22:28:00Z
3 Top Tech Stocks to Buy in January,2023-01-06T22:33:00Z
Why Apple Stock Was the Apple of Investors' Eyes Today,2023-01-06T23:43:11Z
Better Buy: Tesla vs. Apple,2023-01-07T10:05:00Z
3 Compelling Reasons Why Amazon Stock Is a Smarter Pick Than Apple in 2023,2023-01-07T10:50:00Z
1 Unstoppable Vanguard ETF I'm Stocking Up on in 2023,2023-01-07T12:45:00Z
"You're Thinking About Going to the Gym, but Are You Thinking About Investing in It?",2023-01-07T13:00:00Z
Qualcomm Stock: Bear vs. Bull,2023-01-07T13:00:00Z
Wall Street Breakfast: What Moved Markets,2023-01-07T13:17:49Z
3 Apple Stock Predictions for 2023,2023-01-07T14:00:00Z
Tesla: The Inevitable Re-Rating Is Here - Time To Add?,2023-01-07T15:00:00Z
Everyone Is Talking About This Stock. Is It a Good Long-Term Option?,2023-01-07T15:15:00Z
A Fresh Face-Off on the Market Cap Game Show,2023-01-07T16:43:00Z
Dozens in Congress beat stock market in 2022 despite downturn on Wall Street: analysis,2023-01-07T18:11:00Z
Can you trust mobile banking apps? How to stay as safe as possible when banking on your phone.,2023-01-07T20:08:00Z
"‘He is financially secure and owns two homes’: I finally met the man of my dreams, but he treated our waitress like dirt and tipped her 10%. Am I overreacting?",2023-01-07T22:49:00Z
Cathie Wood Sees Tesla Stock Hitting $500 By 2026 Even Without Autonomous Driving & Ride-Hailing Service,2023-01-07T22:49:13Z
Q4 S&P 500 Earnings/Guidance: Is There Any Reason for CEOs to Be Optimistic?,2023-01-08T09:56:00Z
12 Stock Market Predictions for 2023,2023-01-08T10:06:00Z
Can Shiba Inu Reach $1 in 2023?,2023-01-08T12:30:00Z
"Apple Should Return To $3T Soon, Issues Are Temporary",2023-01-08T12:36:16Z
2 Top Stocks in Warren Buffett's Secret Portfolio to Buy Now and Hold Forever,2023-01-08T13:10:00Z
