title,published_utc
TSMC: Why Buffett's Buying Big,2023-01-09T00:30:00Z
"Apple Has Canceled The Next iPhone SE, Top Analyst Says — And This Company Stands To Benefit Big",2023-01-09T04:33:27Z
"Globalization is not dead, but it is facing a big tail-risk, expert says",2023-01-09T04:49:00Z
6 Monster Stock Market Predictions for the Week,2023-01-09T05:09:00Z
2 Warren Buffett Stocks That Are No-Brainer Buys and 1 to Avoid Like the Plague,2023-01-09T10:06:00Z
Apple Watch User Says He Ended Up In Emergency Room After His Gadget Exploded,2023-01-09T10:36:08Z
"S&P 500 Surges Over 2%, Market Volatility Declines",2023-01-09T10:54:23Z
Should Invesco Dynamic Large Cap Growth ETF (PWB) Be on Your Investing Radar?,2023-01-09T11:20:09Z
"Ahead Of Tech Earnings, Analyst Says Sector Is 'Under-Owned' — Repeats Calls For 20% Rally",2023-01-09T11:43:25Z
"More Chinese Firms Likely To Snatch iPhone Market Share From Taiwan Peers, Analyst Says",2023-01-09T12:31:56Z
"Solana Dropped 90% Last Year, But Has Kicked Off 2023 With a Bang. Is This Bull Rally Real?",2023-01-09T12:54:00Z
FTC's proposed ban on noncompete agreements could have biggest impact on tech industry,2023-01-09T13:11:00Z
"CES 2023: AMD, Nvidia, auto applications get the hype, but analysts say this one chip maker ruled",2023-01-09T13:15:00Z
Apple (AAPL) Expands Fitness+ With New Kickboxing Workout,2023-01-09T15:14:00Z
"Fed's Powell won't stop rate hikes until he 'terrifies' the wealthiest of investors, says this CIO",2023-01-09T15:22:00Z
This Day In Market History: Apple Introduces The iPhone,2023-01-09T15:46:00Z
2 Stocks to Watch From the Challenging Computer Industry,2023-01-09T16:47:00Z
Why Apple Was Rising Today,2023-01-09T16:50:09Z
"The iPhone Was Unveiled 16 Years Ago, Here's How Much $1,000 Invested In Apple Stock After The Debut Is Worth Today",2023-01-09T17:24:24Z
"Look for a big cut to TSMC's 2023 outlook as a bullish sign for chips, one analyst says ahead of earnings",2023-01-09T17:28:00Z
Apple's First Attempt to End Corrective Pattern,2023-01-09T18:16:00Z
Sen. Mark Warner: 'Let's restart antitrust' tech legislation,2023-01-09T21:01:00Z
Disney CEO Bob Iger wants employees to return to the office four days a week,2023-01-09T21:27:00Z
Broadcom stock dinged in final minutes on report Apple working on its own WiFi/Bluetooth chips,2023-01-09T21:55:00Z
Why Microsoft Stock Topped the Market Today,2023-01-09T23:22:00Z
Why Qualcomm Stock Got Mashed on Monday,2023-01-10T00:37:21Z
"Tesla, Apple, Nuwellis, Revance, Lululemon: Why These 5 Stocks Are Drawing Investors' Attention Today",2023-01-10T01:04:40Z
"Apple Senior Exec Helping Bolster Tech Giant's Sports Streaming, Services Said To Be Leaving",2023-01-10T03:39:35Z
Inari Amertron falls after report that Apple plans to drop broadcom chip,2023-01-10T07:15:00Z
Zacks Industry Outlook Highlights Apple and Lenovo,2023-01-10T10:00:00Z
Better Semiconductor Stock: ASML vs. Qualcomm,2023-01-10T10:25:00Z
Better Buy: Tesla vs. Amazon,2023-01-10T10:27:00Z
US Stocks Show Tentativeness On Tuesday As Traders Wait On Word From Fed Chair Jerome Powell,2023-01-10T11:11:31Z
Should You Invest in the iShares U.S. Technology ETF (IYW)?,2023-01-10T11:20:05Z
Should You Invest in the Vanguard Information Technology ETF (VGT)?,2023-01-10T11:20:07Z
Chinese stocks have been on a tear. Morgan Stanley says it's turning even more bullish on China.,2023-01-10T12:03:00Z
"RIP Leon...Or, Maybe Not: Why Apple's New Ad Features A Dead Lizard Coming Back To Life",2023-01-10T12:27:46Z
2 Growth Stocks Down Over 25% to Buy in 2023,2023-01-10T14:00:00Z
Apple Inc. (AAPL) is Attracting Investor Attention: Here is What You Should Know,2023-01-10T14:00:11Z
"Stock Market News for Jan 10, 2023",2023-01-10T14:09:00Z
"Bumble's Solid Payer Trends, ARPU Growth And App Downloads Earns It Analyst Conviction As It Closes Gap With Tinder",2023-01-10T14:38:33Z
"Got $1,000? 5 Buffett Stocks to Buy and Hold Forever",2023-01-10T15:05:00Z
This Top Chip Stock Is Expanding Into EVs -- Is It a Buy for 2023?,2023-01-10T15:49:41Z
"Apple, Microsoft And Other Information Technology Stocks From Benzinga's Most Accurate Analysts",2023-01-10T16:03:43Z
1 Green Flag and 1 Red Flag for Apple Stock in 2023,2023-01-10T16:15:00Z
IBM just broke a winning streak that lasted nearly three decades,2023-01-10T19:58:00Z
Mega Millions Tops $1.1 Billion: Here's How Much You'll Actually Win And 10 Things You Can Buy With The Winnings,2023-01-10T21:42:17Z
Could Apple WiFi chips just be a ploy to get a better deal from Broadcom?,2023-01-10T21:47:00Z
Apple (AAPL) Gains But Lags Market: What You Should Know,2023-01-10T22:45:20Z
Apple Said To Make Moves Toward Making Own Watch Displays And iPhone Screens,2023-01-11T03:20:59Z
Fundsmith Equity Fund 2022 Annual Letter To Shareholders,2023-01-11T08:15:00Z
"$10,000 Invested in These Growth Stocks Could Make You a Fortune Over the Next 10 Years",2023-01-11T10:11:00Z
1 Warren Buffett ETF That Could Help You Retire a Millionaire,2023-01-11T11:00:00Z
Apple Investors Don't Need To Be Jittery About Near-Term 'Unit Disruptions' Ahead Of Q1 Earnings: Analyst  Says This Metric More Important,2023-01-11T11:14:19Z
3 Stocks to Buy Before the Bull Market,2023-01-11T11:20:00Z
Should Schwab U.S. LargeCap Growth ETF (SCHG) Be on Your Investing Radar?,2023-01-11T11:20:09Z
Microsoft: Shark Tank Deal For ChatGPT,2023-01-11T11:58:31Z
2 Must-Watch Big Tech Earnings Reports,2023-01-11T12:05:00Z
"The holiday PC market stunk for everyone except Apple, report says",2023-01-11T12:52:00Z
Alphabet (GOOGL) Boosts YouTube Music With Redesigned Library,2023-01-11T13:08:00Z
Alibaba To Rally Around 23%? Here Are 10 Other Analyst Forecasts For Wednesday,2023-01-11T13:15:07Z
This has been a bad sign for stocks historically — when there's a big gap between how companies and the government measure profits,2023-01-11T13:34:00Z
Better Buy for 2023: Disney vs. Netflix,2023-01-11T14:00:00Z
Masimo (MASI) Gets Favorable Ruling in Apple Watch Patent Suit,2023-01-11T14:01:00Z
Is Apple a Screaming Buy Right Now?,2023-01-11T15:00:00Z
Viral TikTok Video Shows You How To Deliver Perfect Shots Of Moon On iPhone 14,2023-01-11T15:33:19Z
Apple's (AAPL) Plan to Use Homegrown Chips to Hurt Suppliers,2023-01-11T15:56:00Z
5 Tech ETFs Riding High on Sectors' Comeback to Start 2023,2023-01-11T16:10:00Z
Lower Stock Prices are the Fed’s Goal,2023-01-11T16:40:00Z
Is Verizon the New Cable Bundle?,2023-01-11T17:30:00Z
Q4 Earnings Season Predictions: Biggest Winners and Losers,2023-01-11T17:58:00Z
Apple Is Making a Headset. Is It a Game Changer?,2023-01-11T18:00:00Z
TikTok emerges as biggest winner as digital advertising faces its worst patch in a decade,2023-01-11T20:15:00Z
"Zelenskyy Says 'No Third World War,' Angela Bassett Makes Marvel Movie History, Which Streamers Won Big: Here's What Unfolded At The Golden Globes",2023-01-11T21:48:17Z
"The PC boom and bust is already 'one for the record books,' and it isn't over",2023-01-12T00:02:00Z
"Tesla, Apple, Atlis Motor, KB Home, Fisker: Why These 5 Stocks Are Drawing Investors' Attention Today",2023-01-12T00:50:33Z
Steve Jobs Saw This Tech As 'Terrible' Idea — But Apple Could Be Bringing It To Macs Soon Anyway,2023-01-12T02:39:23Z
Market Rises Ahead of U.S. CPIs,2023-01-12T05:18:00Z
"For Cues On Apple's Upcoming Q1 Results, Watch This Key Supplier's Earnings Print Tonight, Says Munster",2023-01-12T06:14:31Z
Apple Analyst Pretty Sure You Won't See Physical Buttons On iPhone 15,2023-01-12T09:59:25Z
Where Will TSMC Stock Be in 1 Year?,2023-01-12T10:20:00Z
3 Reasons to Buy Apple Stock in 2023,2023-01-12T10:25:00Z
"US Stocks End Sharply Higher, Market Volatility Increases",2023-01-12T10:34:36Z
1 Warren Buffett Stock Is Cheaper Than It Has Been in Years -- Is 2023 the Time to Buy?,2023-01-12T10:57:00Z
Is Meta Platforms Sitting on a $1 Trillion Opportunity?,2023-01-12T11:14:00Z
Should You Invest in the Invesco DWA Technology Momentum ETF (PTF)?,2023-01-12T11:20:06Z
My Top Tech IPO to Buy in January,2023-01-12T11:35:00Z
Wall Street Breakfast: Simplify The CPI,2023-01-12T12:00:01Z
The Apple and Meta Battle Is Moving to the Metaverse,2023-01-12T12:30:00Z
"The PC industry just suffered its worst decline on record, again",2023-01-12T12:45:00Z
"PC Shipments Crashes in Q4 on Weak Demand, Macroeconomic Woes",2023-01-12T12:49:00Z
New Data Center Chips Could Mean Massive Growth for 1 Tiny Semiconductor Company,2023-01-12T13:37:00Z
"Company News for Jan 12, 2023",2023-01-12T14:26:00Z
"The best inflation-fighting investment for 2023 offers 3 other advantages vs. the stock market, says this analyst",2023-01-12T14:34:00Z
"Taiwan Semiconductor stock rises after chipmaker warns of falling revenue, deteriorating margins",2023-01-12T14:36:00Z
Why Apple Is My Favorite Big Tech Stock Right Now,2023-01-12T15:06:00Z
TSMC’s U.S. stock rallies as Wall Street talks about bottom in the chip sector,2023-01-12T19:34:00Z
Top ETF Stories Of 2022 & 2023 Outlook,2023-01-12T21:16:00Z
Tim Cook asked Apple to cut his pay after making nearly $100 million last year,2023-01-12T23:19:00Z
Bank of America: Buffett Sees It As The Best House In A Bad Neighborhood,2023-01-12T23:19:59Z
"Tesla, Amazon, Apple, Bed Bath & Beyond, Marathon Digital: Why These 5 Stocks Are Drawing Investors' Attention Today",2023-01-13T01:07:44Z
Why Apple CEO Tim Cook Is Staring At A Big Pay Cut In 2023,2023-01-13T02:19:21Z
iPhone's Long-Term Prospects Intact But Here's Why Analyst Still Expects Apple To Give Soft Outlook On Feb. 2,2023-01-13T06:00:13Z
3 Warren Buffett Stocks to Avoid Like the Plague in 2023,2023-01-13T10:06:00Z
Apple Is Reportedly Designing Chips to Cut Broadcom Out of the Mix -- Time to Sell Broadcom Stock?,2023-01-13T12:00:00Z
Wall Street Breakfast January 13: Earnings Season (Podcast),2023-01-13T12:45:00Z
"Tesla is a 'soft-landing' stock, says Goldman Sachs. Here are its picks for a gentle economic landing and stocks for a recession.",2023-01-13T13:32:00Z
Can the PC Market Bounce Back From Its Multi-Year Lows?,2023-01-13T13:58:00Z
Top-Performing Hedge Fund In 2022 Has This Strategy To Thank: How Much Did It Make Last Year?,2023-01-13T15:46:54Z
Best Investment for 2023: Value vs. Growth?,2023-01-13T16:35:00Z
Is It the Right Time to Buy Apple Stock?,2023-01-13T16:45:00Z
Is Berkshire Hathaway a Value Stock?,2023-01-13T16:46:00Z
Why Metaverse Cryptocurrencies Jumped This Week,2023-01-13T18:44:24Z
Apple will examine commitment to workers' rights after shareholder push,2023-01-13T20:28:00Z
Don't Ignore These Companies' Cash-Generating Abilities,2023-01-13T21:39:00Z
The ‘best places to work’ in America are dominated by tech companies — but these three Silicon Valley giants did not make the list,2023-01-13T21:43:00Z
Is It Time to Buy the Dow Jones' 3 Worst-Performing December Stocks?,2023-01-14T12:20:00Z
3 Top Stocks to Buy for the Long Haul,2023-01-14T12:50:00Z
281 Billion Reasons Why You May Regret Not Buying Apple Stock,2023-01-14T14:00:00Z
Big Tech CEOs Give Investors Something to Think About,2023-01-14T14:44:00Z
Big Tech Job Cuts and Dividend Stocks to Watch,2023-01-14T16:41:00Z
"""Rule Breaker Investing"": Old, New, Borrowed, and Blue",2023-01-14T16:48:00Z
How big tech's move into healthcare could make you money,2023-01-14T20:48:00Z
I'll Avoid These Sectors In 2023,2023-01-15T08:39:32Z
2 Cheap Tech Stocks to Buy Right Now,2023-01-15T13:20:00Z
Take Warren Buffett's Advice: Buy Stocks With These 3 Attributes,2023-01-15T13:24:00Z
Should iShares S&P 100 ETF (OEF) Be on Your Investing Radar?,2023-01-16T11:20:07Z
History Says the Nasdaq Could Soar in 2023 -- 5 Stocks You'll Wish You'd Bought if It Does,2023-01-16T12:10:00Z
"Zacks Value Trader Highlights: Berkshire Hathaway, Apple, Bank of America, Chevron, The Coca-Cola",2023-01-16T12:31:00Z
"The Zacks Analyst Blog Highlights Lenovo Group, HP, Dell Technologies and Apple",2023-01-16T13:33:00Z
Warren Buffett Owns a Lot of Stocks -- Here's the One I'm Most Excited About,2023-01-16T13:45:00Z
Is TSMC Stock a Buy Now?,2023-01-16T14:34:42Z
3 Tech Stocks Approved by Warren Buffett,2023-01-16T14:53:11Z
2 Top Tech Stocks to Buy for the Long Haul,2023-01-16T15:37:00Z
2 Tech ETFs to Help You Capture the Sector's Rebound,2023-01-16T15:40:45Z
Better Growth Stock in 2023: Apple vs. AMD,2023-01-16T16:00:00Z
2 FAANG Stocks to Buy in 2023 and 1 to Avoid: Here's Why,2023-01-16T18:27:00Z
Ryan Cohen Takes Stake In Alibaba — Nudges Board To Boost Share Buybacks By Another $20B: WSJ,2023-01-17T01:18:26Z
Is Big Tech Overshadowing the Stock Market Rebound?,2023-01-17T05:40:00Z
Did Amazon Just Overpay for 'Thursday Night Football'?,2023-01-17T10:10:00Z
Warren Buffett Is Raking in $4.84 Billion in Annual Dividend Income From These 6 Stocks,2023-01-17T10:21:00Z
CBOE Volatility Index Settles At One-Year Low As Banks Kick Off Quarterly Earnings Season,2023-01-17T10:43:12Z
3 Great Foreign Companies to Invest In Right Now,2023-01-17T11:03:00Z
Ryan Cohen takes stake in Alibaba: report,2023-01-17T11:19:00Z
Should Vanguard Mega Cap Growth ETF (MGK) Be on Your Investing Radar?,2023-01-17T11:20:05Z
"China's Pandemic Pain, Apple 'Surprise' Rumors, Summers Backing Of IRS And More: 5 Key Stories You May Have Missed From The Weekend",2023-01-17T12:39:57Z
Microsoft Is Playing the Long Game in Artificial Intelligence,2023-01-17T12:45:00Z
Apple launches faster MacBook Pro laptops with new custom chips,2023-01-17T15:04:00Z
FAANG Stocks Look Ready to Soar Later This Month. Here's Why.,2023-01-17T15:05:00Z
Will Warren Buffett Own a Virtual Reality Stock in 2023?,2023-01-17T15:10:00Z
"Can Apple Weather Economic Storm, Will Enterprise Spending Fall Off Cliff? Analyst Weighs In Ahead Of Tech Earnings Season",2023-01-17T15:25:14Z
"How a 'triple-barreled buy signal' and other green flags could send the S&P 500 20% higher, says this money manager",2023-01-17T15:30:00Z
Alibaba Stock Surges on Improving Outlook for Chinese Equities,2023-01-17T18:25:00Z
Supreme Court asks U.S. government to weigh in on Apple patent dispute,2023-01-17T22:06:00Z
Apple (AAPL) Gains As Market Dips: What You Should Know,2023-01-17T22:45:24Z
"2023 'is the year AI crosses the chasm,' but for one reason, John Chambers says",2023-01-18T01:02:00Z
"Metaverse Token Outperforms Bitcoin, Ethereum With 73% Weekly Spike Amid Apple-Linked Rumors",2023-01-18T03:23:57Z
Apple Mentioned This Word 23 Times During Tuesday's Launch — Munster Thinks It Can Boost Mac Growth By Up To 5%,2023-01-18T06:07:28Z
3 Rock-Solid Dividend Stocks to Buy in 2023,2023-01-18T10:10:00Z
"In a Stunning Move, Apple Plans to Ditch Highly Valued Wireless Component Suppliers",2023-01-18T10:15:00Z
"Opinion: After the recession, a new dynamism will emerge",2023-01-18T11:00:00Z
10 Best Stocks to Buy Now for Long-Term Investors,2023-01-18T11:00:00Z
Is Invesco FTSE RAFI US 1000 ETF (PRF) a Strong ETF Right Now?,2023-01-18T11:20:06Z
Should Vanguard Russell 1000 Growth ETF (VONG) Be on Your Investing Radar?,2023-01-18T11:20:10Z
3 Stocks to Buy if They Take a Dip,2023-01-18T11:31:00Z
Viral TikTok: Can Anyone Really See Where You've Been With Just A Little iPhone Trick?,2023-01-18T12:25:34Z
"Apple will delay AR glasses, focus instead on cheaper mixed-reality headset: report",2023-01-18T12:54:00Z
2 Top Stocks to Buy in 2023 and Hold Forever,2023-01-18T13:15:00Z
One of Wall Street's biggest bulls last year says he's learned his lesson and isn't chasing stocks right now,2023-01-18T13:36:00Z
OPEX Looms: 3 Reasons Markets May Need to Digest,2023-01-18T13:50:00Z
The 5 tech earnings reports to watch as holiday-season results start to flood in,2023-01-18T14:29:00Z
"Down 22% to 30%, 3 Warren Buffett Dividend Stocks to Buy Right Now",2023-01-18T14:45:00Z
Better Buy in 2023: Apple Stock vs. Amazon Stock,2023-01-18T15:00:00Z
"U.S. corporate greed has gone too far, says Norway fund manager who voted against Apple CEO’s pay",2023-01-18T15:11:00Z
Roblox's (RBLX) December Metrics Indicate Promising Growth,2023-01-18T16:45:00Z
Is Artificial Intelligence a Fad or the Next Big Thing?,2023-01-18T16:48:14Z
Here Come the FAANG Earnings Charts,2023-01-18T17:16:00Z
Microsoft Is Laying Off Thousands. Here's What It Means for Investors.,2023-01-18T18:51:22Z
Alphabet (GOOGL) to Expand Portfolio With Grogu Tracker,2023-01-18T21:09:00Z
Why Qualcomm Stock Defied Gravity Today,2023-01-18T22:23:33Z
Can Tech Stocks Realistically Help You Retire Early?,2023-01-19T10:20:00Z
2 Warren Buffett ETFs to Stock Up On in 2023,2023-01-19T10:45:00Z
"Up 133% Already in 2023, Is This Metaverse Crypto a Buy?",2023-01-19T10:59:00Z
Better Buy: Apple Stock vs. Disney Stock,2023-01-19T11:00:00Z
Should WisdomTree U.S. LargeCap Dividend ETF (DLN) Be on Your Investing Radar?,2023-01-19T11:20:09Z
Apple Investors Have Reason To Cheer As iPhone's Share Of Global Smartphone Market Climbs To Record In Q4,2023-01-19T11:25:57Z
How Does Warren Buffett Handle a Bull Market?,2023-01-19T12:15:00Z
Best Stock to Buy: Amazon Stock vs. Apple Stock,2023-01-19T12:50:29Z
Tesla To Rally Around 138%? Here Are 10 Other Analyst Forecasts For Thursday,2023-01-19T12:57:18Z
"Viral TikTok: iPhone Users, Elevate Your Photography Game With Long-Exposure Hack",2023-01-19T13:10:49Z
Alphabet (GOOGL) to Boost YouTube TV With Redesigned Features,2023-01-19T13:24:00Z
New to Investing? 3 Stocks to Buy in 2023 and Hold Forever,2023-01-19T13:45:00Z
Apple Stock Is Down 25% From Its High. Time to Buy?,2023-01-19T14:45:00Z
The Latest Analyst Ratings for Apple,2023-01-19T17:01:05Z
"U.S. labor secretary, in Davos, calls for 'serious' dialogue between business and labor",2023-01-19T19:22:00Z
Meta: The $22B WhatsApp Opportunity,2023-01-19T20:00:00Z
The 2023 Jeep Compass is a practical daily commuter with good off-road chops and a rugged exterior,2023-01-20T10:00:00Z
Will Amazon Be the Largest Company in the World at the End of 2023?,2023-01-20T10:02:00Z
89% of Warren Buffett's Secret Portfolio Is Invested in Just 5 Stocks,2023-01-20T10:06:00Z
3 Stocks Warren Buffett Is Almost Certainly Buying in 2023,2023-01-20T10:55:00Z
The Global Smartphone Market Just Fell Off a Cliff. Apple Beat the Odds.,2023-01-20T11:03:00Z
Should You Invest in the Fidelity MSCI Information Technology Index ETF (FTEC)?,2023-01-20T11:20:04Z
Should Vanguard Growth ETF (VUG) Be on Your Investing Radar?,2023-01-20T11:20:06Z
Apple Stock: Bull vs. Bear,2023-01-20T11:27:00Z
A Bull Market Is Coming. 3 Growth ETFs to Buy Right Now,2023-01-20T11:45:00Z
'Overbought and overpriced.' Why this investor sees a bubble popping for this popular group of stocks,2023-01-20T12:21:00Z
2 Top Warren Buffett Stocks to Buy in 2023 and Hold Forever,2023-01-20T13:03:00Z
"DraftKings, FanDuel And These Streaming Apps Climb Apple's App Store Rankings As NFL Playoffs Kick Off",2023-01-20T13:34:40Z
1 Huge Reason Stocks Could Rally in 2023,2023-01-20T15:00:00Z
Major tech layoffs from Alphabet and Microsoft could make gains for some equity hedge funds this year,2023-01-20T15:55:00Z
"Netflix (NFLX) Q4 Earnings Miss, Revenues Up Y/Y on User Gain",2023-01-20T16:38:00Z
Masimo (MASI) Expands Partnership with Philips for W1 Watch,2023-01-20T18:15:00Z
3 Growth Stocks That Got Crushed in 2022 but Are Poised for a Rebound,2023-01-21T10:30:00Z
Dow Jones Bear Market: The Smartest Investors Are Buying These Beaten Down Stocks,2023-01-21T10:39:00Z
Reviewing Goldman Sachs' Disappointing Quarter,2023-01-21T12:00:00Z
Alibaba: Ryan Cohen Is Right,2023-01-21T12:38:53Z
2 Genius Dividend Stocks to Buy in 2023,2023-01-21T12:48:00Z
3 Top Warren Buffett Stocks to Buy in 2023,2023-01-21T13:00:00Z
Wells Fargo Steps Back From Mortgage Market,2023-01-21T13:18:00Z
Want To Invest Like Warren Buffett? All The Moves The Billionaire Made Last Quarter,2023-01-21T22:11:00Z
3 Growth Stocks Available at Bargain Basement Prices,2023-01-22T10:00:00Z
Warren Buffett Has $32 Billion in These 5 Stocks,2023-01-22T10:25:00Z
Apple Announces New Chips -- Should Semiconductor Companies Worry?,2023-01-22T13:00:00Z
"1 Stock to Buy, 1 Stock to Dump This Week: Visa, Intel",2023-01-22T13:16:00Z
This Oil Stock Is Beating Apple at Its Own Game,2023-01-22T14:48:00Z
"If I Could Buy Only 1 Stock, This Would Be It",2023-01-22T16:21:00Z
"Retail traders are buoying the stock market, but support could prove fleeting: analysts",2023-01-22T21:27:00Z
Broadcom: A Bite Of An Apple,2023-01-23T08:44:26Z
Will Apple Stock Beat the Market in 2023?,2023-01-23T10:10:00Z
Why Warren Buffett Wants Apple Stock to Tumble,2023-01-23T10:52:00Z
Nervous About the Stock Market? 1 ETF to Keep Your Money Safer,2023-01-23T11:15:00Z
Is John Hancock Multifactor Large Cap ETF (JHML) a Strong ETF Right Now?,2023-01-23T11:20:08Z
"Apple Avoids Layoffs, Dogecoin Surges, South America Does A Eurozone And More: 5 Key Stories You May Have Missed From The Weekend",2023-01-23T12:57:37Z
Skechers To Rally 40%? Here Are 10 Other Analyst Forecasts For Monday,2023-01-23T13:09:45Z
Tech Shows Initial Signs of Revival: Trend Likely to Continue,2023-01-23T13:15:00Z
Big Tech layoffs are not as big as they appear at first glance,2023-01-23T13:22:00Z
Investors Are Betting on Tech Again,2023-01-23T13:48:00Z
Warren Buffett Just Beat the S&P 500 by the Widest Margin Since 2007. Can He Do It Again in 2023?,2023-01-23T13:54:00Z
Is Most-Watched Stock Apple Inc. (AAPL) Worth Betting on Now?,2023-01-23T14:00:11Z
Want to Get Richer? 3 Stocks to Buy in 2023 and Hold Forever,2023-01-23T14:19:14Z
Market on Tipping Point of New Bull Trend: These 5 Charts Illustrate Why,2023-01-23T15:02:00Z
"Don't let the 'bear market house of mirrors' fool you, Morgan Stanley's Mike Wilson warns of the stock market",2023-01-23T15:48:00Z
Why Buying This FAANG Stock Could Be a Genius Move,2023-01-23T16:01:00Z
Big Tech Reports: Global Week Ahead,2023-01-23T16:44:00Z
Stock Market Recovery: These 4 Stocks Have Been on the Rise in 2023,2023-01-23T17:00:00Z
Why Apple (AAPL) is Poised to Beat Earnings Estimates Again,2023-01-23T17:10:13Z
MATANA Is Back: Which Stocks to Buy Now,2023-01-23T17:49:00Z
"Earnings Watch: Microsoft, Tesla and Intel are about to face the doubters",2023-01-23T18:19:00Z
Why Apple Stock Was Climbing Today,2023-01-23T20:10:00Z
Amazon Earnings Set to Disappoint: Time to Buy AMZN Stock at a Steep Discount?,2023-01-23T21:02:00Z
Tesla Bull Says Time For Tim Cook To Step Down: Apple In 'Serious Trouble' If Elon Musk's Company Begins Making Phones,2023-01-24T00:29:50Z
Big Tech Layoffs; Signs of Trouble in the Housing Market,2023-01-24T02:21:00Z
Markets Turn More Bullish Ahead Of Earnings,2023-01-24T08:23:00Z
"Nasdaq Rises Over 2%, Volatility In Markets Decreases",2023-01-24T10:32:47Z
Is WisdomTree U.S. Quality Dividend Growth ETF (DGRW) a Strong ETF Right Now?,2023-01-24T11:20:08Z
Should WisdomTree U.S. LargeCap ETF (EPS) Be on Your Investing Radar?,2023-01-24T11:20:09Z
1 Warren Buffett Stock to Buy in 2023 and Hold Forever,2023-01-24T12:00:00Z
3 Hidden Stocks That Could Make You a Fortune,2023-01-24T12:45:00Z
Here’s what Apple’s mixed-reality headset could feature,2023-01-24T12:45:00Z
"The big banks want to take on PayPal in e-commerce, but that's harder than it seems",2023-01-24T12:49:00Z
How to Find Strong Computer and Technology Stocks Slated for Positive Earnings Surprises,2023-01-24T13:50:07Z
Timing the Market: EPS is a Lagging Indicator,2023-01-24T14:00:00Z
Will Meta Platforms Be a Trillion-Dollar Stock by 2030?,2023-01-24T14:10:00Z
"Trump Beefs Up Defamation War Against New York Prosecutor, Apple Weighs Content Deals With Disney, Likely Lawsuit On Google For Influencing Online Ad Market: Today's Top Stories",2023-01-24T14:18:51Z
"The Zacks Analyst Blog Highlights Microsoft, Tesla, Apple and Alphabet",2023-01-24T14:30:00Z
"Stock Market News for Jan 24, 2023",2023-01-24T14:33:00Z
"The Zacks Analyst Blog Highlights Apple, Microsoft, Meta Platforms, Alphabet and NVIDIA",2023-01-24T14:35:00Z
"The Zacks Analyst Blog Highlights Apple, Alphabet, NVIDIA, Microsoft and Meta Platforms",2023-01-24T14:40:00Z
If the stock market crashes in 2023 it will be the fault of the Fed and U.S. banks. Here's what could go wrong.,2023-01-24T15:18:00Z
Apple is making a move for Premier League U.K. rights,2023-01-24T15:51:00Z
What's in Store for Big Tech ETFs in Q4 Earnings?,2023-01-24T16:00:00Z
Viral TikTok: Multitasking On Your iPhone Be Tedious No More,2023-01-24T16:05:10Z
S&P 500 ETFs in Focus as SPY Turns 30,2023-01-24T16:59:00Z
2 No-Brainer Growth Stocks to Buy in 2023,2023-01-24T18:44:41Z
Can Netflix Win A Best Picture Like Apple? Will Big Box Office Movies Have Their Day In The Awards Spotlight Again? 2 Big Questions From The Academy Award Nominations,2023-01-24T19:50:40Z
Why Alphabet Stock Pulled Back Today,2023-01-24T22:12:11Z
Apple (AAPL) Gains As Market Dips: What You Should Know,2023-01-24T22:45:18Z
Better Buy in 2023: Apple Stock vs. Disney Stock,2023-01-25T10:07:00Z
3 No-Brainer Warren Buffett Stocks to Buy Right Now,2023-01-25T10:16:00Z
Should iShares Core S&P 500 ETF (IVV) Be on Your Investing Radar?,2023-01-25T11:20:05Z
Better Buy: Apple Stock vs. Netflix Stock,2023-01-25T11:27:00Z
"Apple's Chip Strategy Is Great News for Shareholders, Bad News for Skyworks, Broadcom, and Qualcomm",2023-01-25T11:30:00Z
Will Soft Processor Revenues Hurt Intel (INTC) Q4 Earnings?,2023-01-25T12:01:00Z
Will Lower Data Center Revenues Dent Intel (INTC) Q4 Earnings?,2023-01-25T12:04:00Z
Zacks Investment Ideas feature highlights: Amazon and Apple,2023-01-25T12:43:00Z
Why U.S. oil companies may be tempted to purchase European rivals on the cheap,2023-01-25T12:58:00Z
The Coming AI Revolution: 5 Companies at the Forefront,2023-01-25T14:07:00Z
Think You Know How To Use Apple Watch? Wait Until You See This Viral TikTok Hack,2023-01-25T14:08:49Z
"Microsoft could be the cloud sector's 'canary in the coal mine,' even as AI efforts offer promise",2023-01-25T15:16:00Z
MSCI Scheduled to Report Q4 Earnings: What's in the Cards?,2023-01-25T17:27:00Z
Google Finally Drops The Hammer,2023-01-25T18:10:58Z
Next Apple Mac Pro To Be 'More Powerful' But Gurman Flags Big Tradeoffs,2023-01-26T05:05:36Z
