title,published_utc
Apple couldn't save the smartphone industry from its worst year since 2013,2023-01-26T06:45:00Z
From Apple To IRS And Coinbase To Japan: The Full List Of Sam Bankman-Fried's FTX Creditors,2023-01-26T06:56:56Z
2 Warren Buffett Stocks That Could Crush the Market in 2023,2023-01-26T10:17:00Z
"Volatility In Markets Decreases, S&P 500 Closes Slightly Lower",2023-01-26T10:25:09Z
1 Growth Stock Down 15% to Buy Right Now,2023-01-26T11:07:00Z
This Ridiculously Cheap Warren Buffett Stock Could Make You Richer,2023-01-26T11:10:00Z
4 Set-It-and-Forget-It Stocks,2023-01-26T11:15:00Z
Should You Invest in the iShares Expanded Tech Sector ETF (IGM)?,2023-01-26T11:20:06Z
Should SPDR Portfolio S&P 500 Growth ETF (SPYG) Be on Your Investing Radar?,2023-01-26T11:20:06Z
Should iShares Russell Top 200 Growth ETF (IWY) Be on Your Investing Radar?,2023-01-26T11:20:07Z
Should Invesco QQQ (QQQ) Be on Your Investing Radar?,2023-01-26T11:20:08Z
Shiba Inu Is Up Almost 40% in 2023. Here Are 3 Reasons to Sell,2023-01-26T11:45:00Z
Can Airpods Be Turned Into Portable Speakers? This Viral TikTok Makes A Bold Claim,2023-01-26T11:57:27Z
The Best Fintech Stock to Buy in 2023,2023-01-26T11:59:00Z
"Fed rate cuts always lead to stock-market gains — but this one thing must happen too, veteran Wall Street strategist says",2023-01-26T12:22:00Z
"Lam Research to trim 7% of workforce, increase R&D spending as memory-chip crunch hits outlook",2023-01-26T12:48:00Z
"If Cash Is King, These Nasdaq Stocks Reign Supreme",2023-01-26T13:06:00Z
Does This VR News Make Apple Stock a Buy for 2023?,2023-01-26T14:00:00Z
Earnings Preview: Apple (AAPL) Q1 Earnings Expected to Decline,2023-01-26T15:01:15Z
"Triple Threat Ahead as February Opens with Fed Decision, GDP Data, Jobs Report",2023-01-26T17:47:00Z
These 3 Companies Can't Get Enough of Their Own Stock,2023-01-26T19:57:00Z
Apple Earnings Preview: Time to Buy AAPL Stock?,2023-01-26T20:53:00Z
"QQQ is bleeding assets, but are ETF investors ‘finally bailing’ on growth stocks just as tech stocks jump in 2023?",2023-01-26T21:12:00Z
Elon Musk's South Korean Fans Piled $15B Of Savings Into Tesla Shares: Courtesy Of 'Squid Game' And 'Paradise?',2023-01-27T00:55:10Z
"Bitcoin, Ethereum, Dogecoin Give Up Early Gains: Analyst Says 2 Altcoins Are 'Going Through The Roof'",2023-01-27T02:39:05Z
Chevron Delights Shareholders with $75 Billion in Share Buybacks,2023-01-27T06:27:00Z
80% of Warren Buffett's Portfolio Is Invested in These 7 Stocks,2023-01-27T10:06:00Z
Nasdaq Jumps 2%; Volatility In Markets Decreases Further,2023-01-27T10:27:49Z
4 FAANG Stocks Wall Street Thinks Will Be Big Winners in 2023 -- and 1 Analysts Aren't So Bullish About,2023-01-27T10:52:00Z
"Got $1,000? 5 Buffett Stocks to Buy in 2023 and Hold Forever",2023-01-27T11:10:00Z
Should Vanguard Mega Cap ETF (MGC) Be on Your Investing Radar?,2023-01-27T11:20:07Z
Is WisdomTree U.S. Total Dividend ETF (DTD) a Strong ETF Right Now?,2023-01-27T11:20:07Z
Should iShares Russell 1000 Growth ETF (IWF) Be on Your Investing Radar?,2023-01-27T11:20:08Z
Should Invesco S&P 500 Top 50 ETF (XLG) Be on Your Investing Radar?,2023-01-27T11:20:08Z
"Apple Won't Be Developing Wi-Fi Chip For Now, Says Analyst — Making This Chipmaker 'Biggest Winner",2023-01-27T11:25:49Z
"Zacks Investment Ideas feature highlights: Chevron, Kinder Morgan, Agilent Technologies, Apple and Microsoft",2023-01-27T11:52:00Z
67.65% of Warren Buffett's Berkshire Hathaway Portfolio is in These 4 Stocks,2023-01-27T14:02:36Z
"Investors beware. It's the market relationship with data that may pivot when the Fed pauses, says Citi.",2023-01-27T14:28:00Z
A 'humbling' for David Solomon? Economist refers to his investment bank as 'Goldman Sags' in cover story.,2023-01-27T14:59:00Z
Apple Unveils Original iPad On This Day In Market History,2023-01-27T16:19:04Z
How Many Shares Should I Buy of a Stock?,2023-01-27T16:43:18Z
"How to Invest $100,000",2023-01-27T17:10:44Z
Will This Week's Big Tech Earnings Be a Train Wreck?,2023-01-27T19:39:00Z
S&P 500 Makes Weekly Gains As Inflation Eases: What's Next For The Market?,2023-01-27T21:00:07Z
Tesla's Future As A Super Conglomerate?,2023-01-28T00:49:01Z
Big Banks Try to Take On Apple Wallet and PayPal,2023-01-28T12:00:00Z
Google: I'm Buying The DOJ Panic,2023-01-28T13:11:48Z
What's Going on With REITs? An Investors Guide,2023-01-28T14:00:00Z
Is Apple Stock Headed To $250? Why Gene Munster Says 'One Of The World's Greatest Companies' Is Poised To Double,2023-01-28T17:42:00Z
‘It is an employer’s market’: Tech layoffs may have turned the Great Resignation into the Great Recommitment,2023-01-28T18:21:00Z
5 Top Stocks for February,2023-01-29T10:45:00Z
2 FAANG Stocks Investors Should Buy Hand Over Fist for 2023,2023-01-29T11:24:00Z
Why 2023 Is Tesla's Year To Prove Itself,2023-01-29T11:45:00Z
"1 Stock to Buy, 1 Stock to Dump This Week: Caterpillar, Peloton",2023-01-29T13:24:00Z
Penny Stocks & What To Watch in the Stock Market This Week 1/30-2/3,2023-01-29T18:08:44Z
Apple iPhone 14 Saves Two Stranded Women In Canada: Here's How Rescuers Were Able To Find Them,2023-01-29T19:58:35Z
Apple's Q1 2023: This Earnings Report Might Be Different,2023-01-30T05:27:02Z
"Economic Data, Earnings and the Fed Could Sink Stocks this Week",2023-01-30T07:37:00Z
Qualcomm: Apple Risk Fading,2023-01-30T09:34:49Z
"Amazon, Alphabet, Apple, Intel and Microsoft are part of Zacks Earnings Preview",2023-01-30T10:00:00Z
3 Reasons Why 19%+ Dividends Are Dangerous for Your Retirement,2023-01-30T10:09:00Z
Nearly 43% of Warren Buffett's Portfolio Is Invested in These 5 Tech Stocks,2023-01-30T10:52:00Z
Will Apple Follow Tech Peers In Announcing A Mass Layoff This Week? Analyst Says iPhone Maker In A 'Unique' Position,2023-01-30T11:05:52Z
Should Invesco FTSE RAFI US 1000 ETF (PRF) Be on Your Investing Radar?,2023-01-30T11:20:08Z
"Meta, Alphabet, And Apple: A Quant Overview Ahead Of Earnings",2023-01-30T13:00:00Z
Why These Analysts Are Warning Investors January Stock Market Rally 'Will Not Last',2023-01-30T15:24:01Z
"Big Week Ahead for Q4 Earnings, Econ Data",2023-01-30T15:25:00Z
Wall Street Waits for Fed FOMC and Key Economic Data,2023-01-30T15:53:00Z
Meta Platforms (META) to Report Q4 Earnings: What to Expect,2023-01-30T17:48:00Z
"Facebook earnings: Meta's 'darkest days' may be ahead, but some analysts say ad sales still on track",2023-01-30T17:58:00Z
"Dollar Weakness, Easing Of Supply Constraints Likely To Add To Better Margins For Apple, Analyst Says",2023-01-30T18:10:59Z
"Spotify Likely For Upside From Gross Profit Leverage, Pricing Power From Music Subscriptions, Analyst Says",2023-01-30T18:13:31Z
"Meta Needs To Slash Another 7.5K Jobs To Accommodate Metaverse Ambitions, Analyst Says",2023-01-30T18:25:09Z
The 'return of the DOJ' hangs over Google as online ads decline,2023-01-30T20:36:00Z
What stock-market investors need to know as busiest week of earnings season begins,2023-01-30T20:39:00Z
"Nasdaq books worst skid in 5 weeks, stocks slump ahead of Fed rate decision, tech earnings deluge",2023-01-30T21:24:00Z
"Could Big Tech layoffs grow? Apple, Amazon, Facebook and Google may give hints in biggest week of holiday earnings.",2023-01-30T21:31:00Z
Time to Take Another Bite of Apple Before Q1 Earnings?,2023-01-30T22:48:00Z
Apple Executives Reportedly Imposed Rules On Employees Deemed Illegal By Federal Agency,2023-01-31T05:00:25Z
"It's a key week for the stock market. If you're not nervous, you should be, this global strategist warns.",2023-01-31T07:11:00Z
Another Chance to Look Back and Score Stock Picks,2023-01-31T09:24:00Z
Bargain Shopping? 2 Unstoppable Stocks to Buy Hand Over Fist in 2023,2023-01-31T10:35:00Z
3 Dividend Stocks That Beat the Market in 2022 but Are Still Worth Buying Now,2023-01-31T10:45:00Z
Volatility In Markets Increases Sharply Ahead Of Big Earnings,2023-01-31T10:48:42Z
Apple Just Laid the Groundwork for Its Next Multibillion-Dollar Opportunity,2023-01-31T11:15:00Z
Apple Could Teach Fellow Top Warren Buffett Stock Chevron a Valuable Lesson,2023-01-31T11:18:00Z
Should WisdomTree U.S. Total Dividend ETF (DTD) Be on Your Investing Radar?,2023-01-31T11:20:08Z
Interactive Brokers and Generac Holdings have been highlighted as Zacks Bull and Bear of the Day,2023-01-31T13:14:00Z
Apple earnings may rely on an unlikely hero amid iPhone uncertainty,2023-01-31T13:19:00Z
Is Intel a Value Stock or a Value Trap for 2023?,2023-01-31T13:33:00Z
Biggest Earnings Week of the Season: Key Stocks to Watch,2023-01-31T13:50:00Z
The Fed and the stock market are on a collision course this week. What's at stake.,2023-01-31T13:59:00Z
This newsletter editor has been recommending stocks and bonds this year and says the rally has room to run,2023-01-31T14:09:00Z
Where Will Broadcom Stock Be In 1 Year?,2023-01-31T14:14:39Z
Better Tech Stock in 2023: Apple vs. AMD,2023-01-31T16:15:00Z
Apple (AAPL) to Report Q1 Earnings: What's in the Offing?,2023-01-31T17:27:00Z
"Apple execs violated labor law after remarks that interfered with addressing workplace issues, NLRB finds ",2023-01-31T17:39:00Z
"Q4 Earnings Season Scorecard and Analyst Reports for Apple, Meta & Mastercard",2023-01-31T17:41:00Z
Will Lower Ad Revenues Hurt Meta Platforms' (META) Q4 Earnings?,2023-01-31T17:48:00Z
Tesla & Supercharged Electric Vehicle ETFs in Focus,2023-01-31T18:45:00Z
What Happens This Week Will Lead the Market for 2023,2023-01-31T19:41:00Z
‘We don’t want to work for jerks’: A bad boss takes a heavy a toll on your mental health. (It's the equivalent of being in a bad marriage.),2023-01-31T20:00:00Z
Big Tech Earnings Preview: Time to Buy Amazon or Alphabet Stock?,2023-01-31T20:48:00Z
"Tesla, Amazon, Apple, Context Therapeutics, Snap: Why These 5 Stocks Are Drawing Investors' Attention Today",2023-02-01T00:55:56Z
Tech stocks just had their best January in decades — here's why that may not be a good sign,2023-02-01T01:32:00Z
Big Tech Earnings Preview: Time to Buy Apple Stock?,2023-02-01T02:34:00Z
"The Zacks Analyst Blog Highlights Apple, Meta Platforms, Mastercard, CVS Health and Ameriprise Financial",2023-02-01T10:00:00Z
"An Investment of Just $1,000 in Any of These 3 Stocks Could've Made You a Millionaire",2023-02-01T10:10:00Z
1 Warren Buffett Stock to Buy Hand Over Fist in 2023,2023-02-01T11:00:00Z
Is iShares ESG Aware MSCI USA ETF (ESGU) a Strong ETF Right Now?,2023-02-01T11:20:05Z
Should SPDR Portfolio S&P 500 ETF (SPLG) Be on Your Investing Radar?,2023-02-01T11:20:08Z
Should iShares Russell 1000 ETF (IWB) Be on Your Investing Radar?,2023-02-01T11:20:09Z
"Michael Burry says sell and Jim Cramer says buy. As the Fed meets, here's how they both could be wrong on stocks.",2023-02-01T12:03:00Z
Could Big Tech Drive ESPN Out of Business?,2023-02-01T12:05:00Z
Snap stock has lost the one thing it had going for it,2023-02-01T12:56:00Z
Could Apple Stock Help You Become a Millionaire?,2023-02-01T14:37:00Z
"Too little, too late? Snap stock plunges as turnaround remains a work in progress",2023-02-01T15:06:00Z
"Amazon, Apple, Microsoft set records with their spending on Washington lobbying",2023-02-01T17:08:00Z
"Samsung holds prices on Galaxy smartphones amid inflation, slumping market",2023-02-01T18:01:00Z
Will Slowing Services Growth Hurt Apple's (AAPL) Q1 Earnings?,2023-02-01T18:17:00Z
Snap Falls on Another Set of Weak Results,2023-02-01T19:21:00Z
2 Tech Stocks to Buy as Fed Pivot Hopes Rise on Peak Inflation Bets,2023-02-01T20:30:00Z
"AWS, Buy With Prime And More Key Catalysts For Amazon Investors To Watch Ahead Of Q4 Earnings",2023-02-01T21:00:32Z
"23 Things That Didn't Exist When Tom Brady Entered The NFL: Tesla, Bitcoin, iPhones, Social Media And More",2023-02-01T21:05:00Z
"How To Allocate $20,000 Among 10 Dividend Income And Growth Stocks And ETFs",2023-02-01T21:51:51Z
Meta stock spikes nearly 20% as cost cuts and $40 billion for investors overshadow earnings miss,2023-02-01T23:27:00Z
"Biden's plan to curb credit-card late fees could undercut Apple, Google app stores",2023-02-01T23:32:00Z
"Apple Likely To Report Drop In Earnings, Here's A Look At Recent Price Target Changes By The Most Accurate Analysts",2023-02-02T07:08:31Z
Investor Optimism Improves Further Following Fed's Rate Hike,2023-02-02T07:32:54Z
"Apple, Amazon And 5 Stocks To Watch Heading Into Thursday",2023-02-02T08:24:24Z
CEF's Return of Capital Explained,2023-02-02T10:06:00Z
"Nasdaq Futures Fly As Meta Keeps Tech Earnings' Buoyancy Intact: Will Apple, Amazon, Alphabet Toe In Line?",2023-02-02T11:34:23Z
Alphabet earnings: What to expect from the Google parent company,2023-02-02T12:52:00Z
"There's still too much risk in stock and bond markets. Earn this easy 4.5% return while you wait for stability, says trader who hit 2 big calls in 2022.",2023-02-02T12:54:00Z
Goldilocks Econ Data Presides Over Pre-Market,2023-02-02T15:39:00Z
Economic Data Deluge,2023-02-02T16:04:00Z
"Apple, Amazon and Alphabet earnings are coming. Here's what the stock options market is bracing for.",2023-02-02T17:16:00Z
'The Year Of The Efficient Rabbit': Why Analysts Are Raising Their Price Targets On Meta Platforms (Including One Doubling The PT),2023-02-02T17:16:36Z
"Qorvo Vulnerable To Inventory Overhang, Analysts Say Post Q4",2023-02-02T18:06:12Z
Why Cloudflare Stock Was Soaring on Thursday,2023-02-02T18:51:55Z
Trading Strategies For Apple Stock Before And After Q1 Earnings,2023-02-02T20:15:32Z
Did Jerome Powell Give the Greenlight to Stock Investors?,2023-02-02T20:17:00Z
"Ahead of Apple earnings, did wireless companies send a troubling signal?",2023-02-02T20:21:00Z
Bottom In? Meta Platforms Surges After Earnings,2023-02-02T20:31:00Z
"S&P 500 surges to end at over five-month high, Nasdaq closes up 3.3% as Meta leads rally in tech sector stocks",2023-02-02T21:29:00Z
Did Jerome Powell Give the Greenlight to Stock Investors?,2023-02-02T21:36:00Z
Apple Shares Slide After Q1 Miss Amid Weak iPhone Sales; Installed Active Devices Cross 2B Mark,2023-02-02T22:12:33Z
Apple (AAPL) Misses Q1 Earnings and Revenue Estimates,2023-02-02T22:45:13Z
"Cavalcade of Earnings: AAPL, AMZN, GOOGL & More",2023-02-02T23:16:00Z
"Tesla, Amazon, Apple, Alphabet, Gaucho Group: Why These Five Stocks Are Drawing Investors' Attention Today?",2023-02-03T01:09:11Z
"Big Tech Calls From Apple, Amazon, Alphabet Paint 'Different Picture' Than What Tech Bears Hoped For Says, Wedbush Analyst",2023-02-03T01:38:10Z
Apple (AAPL) Q1 2023 Earnings Call Transcript,2023-02-03T02:00:27Z
Meta stock enjoys its best day since 2013 amid 'meteoric' shift,2023-02-03T02:46:00Z
"Elon Musk And Biden Agree On Something After All: Apple, Google's Tax On Apps Are No-Go",2023-02-03T02:46:45Z
"Apple offers breadcrumbs for a forecast, but is that enough to reassure Wall Street?",2023-02-03T04:05:00Z
Compounders And Dividends: January 2023 Portfolio Update,2023-02-03T05:22:25Z
'Sunnier Days Will Return:' Apple Analysts Say Rare Q1 Miss Shouldn't Stop You From Owning Stock,2023-02-03T08:08:34Z
The 2023 Kia EV6 vs. the VW ID.4: Two very different approaches to going electric,2023-02-03T10:01:00Z
This Is Warren Buffett's No. 1 Stock to Buy (and You Won't Find It in Berkshire Hathaway's Portfolio),2023-02-03T10:21:00Z
Here's What Key Metrics Tell Us About Apple (AAPL) Q1 Earnings,2023-02-03T10:29:00Z
Meta Platforms CEO Mark Zuckerberg got $12.5 billion richer yesterday,2023-02-03T10:33:00Z
"If I Could Only Invest in ETFs, Here Are the 5 I Would Buy",2023-02-03T11:22:00Z
"SiTime Stock Is a Top Holding, but Is It a Buy Now?",2023-02-03T11:33:00Z
Nasdaq Futures Deflate As Apple Leads Tech Disappointments: Traders Look To Jobs Data For Mitigating Impact,2023-02-03T12:00:04Z
"Wall Street Breakfast Podcast: Alphabet, Amazon, Apple",2023-02-03T12:06:13Z
Apple Stock Falls After Earnings,2023-02-03T12:14:00Z
Meta movin' up: How Wall Street warmed up to Facebook once again,2023-02-03T13:04:00Z
e.l.f. Beauty and Hasbro have been highlighted as Zacks Bull and Bear of the Day,2023-02-03T13:09:00Z
10 Best Dividend Stocks To Buy in February,2023-02-03T13:19:00Z
Qorvo stock drops nearly 10% as analysts expect inventory correction to continue,2023-02-03T13:26:00Z
2 Top Stocks to Buy in February,2023-02-03T13:53:00Z
2 Dividend-Paying Tech Stocks to Buy in February,2023-02-03T14:21:00Z
"Apple (AAPL) Q1 Earnings Miss Estimates, Revenues Decline Y/Y",2023-02-03T14:35:00Z
Amazon To Rally Over 48%? Here Are 10 Other Analyst Forecasts For Friday,2023-02-03T15:03:54Z
They're baaaaack. Retail participation in the stock market just surpassed the GameStop days.,2023-02-03T15:20:00Z
"Why Tim Cook Says The PC Industry Contraction Is 'Rough In The Short Term,' But Confident In The Long Term For Apple's Mac",2023-02-03T15:30:17Z
Apple Earnings 'Not A Slam Dunk': 4 Analyst Takes On Tech Giant's Mixed Report,2023-02-03T15:57:49Z
ETFs in Focus on Apple's First Earnings Miss Since 2016,2023-02-03T16:10:00Z
Why Apple Stock Was Up on Friday,2023-02-03T17:45:48Z
'This too shall pass': Qualcomm's stock avoids pain from forecast miss as it still looks better than other chip stocks,2023-02-03T17:48:00Z
"Making Sense of Apple, Amazon and Big Tech Earnings",2023-02-03T19:45:00Z
Why FAANG Stocks Made Big Moves Friday,2023-02-03T19:59:00Z
Why Apple Stock Gained 11% in January,2023-02-03T22:15:26Z
AbbVie Q4 Preview: What's in Store?,2023-02-03T22:31:00Z
"Apple Earnings Miss, But the Stock Rallies Anyway",2023-02-03T22:53:00Z
Apple's Tough Year Should Be Bought On Weakness,2023-02-04T06:50:11Z
Wall Street Breakfast: What Moved Markets,2023-02-04T13:27:19Z
"U.S. stocks fall after blowout jobs report, disappointing earnings, but Nasdaq books longest weekly win streak since November 2021",2023-02-04T13:35:00Z
Apple is producing more. But now the worries are who will buy?,2023-02-04T13:51:00Z
"Apple CEO Tim Cook Says Layoffs Are Last Resort, But 'You Can Never Say Never'",2023-02-04T14:03:43Z
Apple earnings show steepest sales decline in more than 6 years,2023-02-04T14:14:00Z
Apple Vs. Meta: Which Is The More Attractive Choice?,2023-02-04T15:09:42Z
Big Tech’s squeeze of technology innovators is costing you more for apps and other internet services,2023-02-04T15:28:00Z
"Tech stocks have been minting money this year, but many investors fear getting burned if they buy the rally now",2023-02-04T15:53:00Z
'Patience will be rewarded': Why Wall Street analysts aren't freaking out over Amazon's results and think shares are worth more,2023-02-04T17:15:00Z
Wedgewood Partners Fourth Quarter 2022 Client Letter,2023-02-05T07:00:00Z
"Wedgewood Partners - Meta Platforms: If You Build It, They Will Come",2023-02-05T08:30:00Z
Apple: Risks Remain But Upside Potential Evident,2023-02-05T08:51:13Z
S&P 500 Earnings Update: Corporate High-Yield Had a Good Week,2023-02-05T09:16:00Z
"1 Stock to Buy, 1 Stock to Dump This Week: Pinterest, PayPal",2023-02-05T13:24:00Z
"‘The Last of Us’ leads Spotify streams of Linda Ronstadt’s ‘Long Long Time’ to spike almost 5,000%",2023-02-06T03:09:00Z
"Amazon, Alphabet, Apple, Meta and Microsoft are part of Zacks Earnings Preview",2023-02-06T09:26:00Z
The Aston Martin DBX 707 might be the James Bond car of your dreams,2023-02-06T10:00:00Z
Buying This Fund Is Like Buying Apple With a 12.1% Dividend,2023-02-06T10:10:00Z
Should Vanguard S&P 500 ETF (VOO) Be on Your Investing Radar?,2023-02-06T11:20:07Z
Should SPDR S&P 500 ETF (SPY) Be on Your Investing Radar?,2023-02-06T11:20:08Z
This Stock Just Became One of the Most Profitable Companies on the Market,2023-02-06T11:33:00Z
"Spotify’s Traffic, Not Earnings Is Driving the Stock Higher",2023-02-06T12:39:00Z
3 Stocks I Will Never Sell,2023-02-06T12:40:00Z
Best Inverse/Leveraged ETFs of Last Week,2023-02-06T13:00:00Z
3 Stocks to Avoid This Week,2023-02-06T13:15:00Z
"Big Tech just added to a shrinking forecast, but maybe Bob Iger can brighten the mood",2023-02-06T13:31:00Z
Is Trending Stock Apple Inc. (AAPL) a Buy Now?,2023-02-06T14:00:12Z
META & CVX Buybacks: Who Benefits Most?,2023-02-06T14:31:00Z
"Company News for Feb 6, 2023",2023-02-06T14:32:00Z
"The next few days may reveal whether investors have been riding one big suckers rally, says this strategist.",2023-02-06T14:35:00Z
Analyst Says Be Careful With Big Tech Stocks: 'Nothing In This Space Is Cheap Anymore',2023-02-06T15:41:07Z
1 Supercharged Nasdaq Stock to Buy Hand Over Fist Before It Jumps Higher,2023-02-06T15:57:06Z
Why Taiwan Semiconductor Manufacturing Is Falling Today,2023-02-06T16:14:35Z
PayPal Analyst Downgrades Stock Citing Branded Checkout Market Share Loss To Apple Pay,2023-02-06T17:32:28Z
Q4 Corporate Earnings Move in the Opposite Direction of Economic Indicators,2023-02-06T17:50:00Z
"Week Ahead: Disney, Powell & Market Breakouts",2023-02-06T18:33:00Z
"AppLovin Is Vulnerable To Hyper-Casual Headwinds, Further Hampered By Google's Ad Restrictions, Analyst Says",2023-02-06T18:42:39Z
Former Hedge Fund Manager Lists 3 Reasons Berkshire Hathaway Has 'Everything We Look For In A Stock',2023-02-06T19:14:34Z
"Google is ready to roll out its ChatGPT rival, 'Bard' ",2023-02-06T19:52:00Z
Time to Buy PayPal Stock Before Earnings?,2023-02-07T00:30:00Z
"After Apple And Snap, Microsoft Gaming CEO Swipes At Zuckerberg's Metaverse: 'Poorly Built Video Game'",2023-02-07T01:04:10Z
"Tesla, Apple, Bed Bath & Beyond, AMC, Pinterest: Why These 5 Stocks Are Drawing Investors' Attention Today",2023-02-07T01:20:48Z
Archer Daniels Midland and Ollie's Bargain Outlet have been highlighted as Zacks Bull and Bear of the Day,2023-02-07T10:00:00Z
3 Stocks That Are Great Long-Term Picks,2023-02-07T10:04:00Z
2 FAANG Stocks That Can Double Your Money by 2027,2023-02-07T10:21:00Z
Will Apple Learn From Meta's Virtual Reality Mistakes?,2023-02-07T10:33:00Z
7 Red Flags for Apple's Future,2023-02-07T11:05:00Z
Is SPDR MSCI USA StrategicFactors ETF (QUS) a Strong ETF Right Now?,2023-02-07T11:20:05Z
Should Engine No. 1 Transform 500 ETF (VOTE) Be on Your Investing Radar?,2023-02-07T11:20:05Z
Where Will Qualcomm Stock Be In 1 Year?,2023-02-07T12:28:00Z
Top-Performing ETF Areas of Last Week,2023-02-07T13:00:00Z
"Pinterest's stock tumbles on sales, earnings misses",2023-02-07T13:07:00Z
Amazon's Ad Business Is Firing on All Cylinders,2023-02-07T13:31:00Z
Looking for Turnaround Plays? 5 EPS Reports to Watch this Week,2023-02-07T13:40:00Z
"Apple's Stock Is Resilient, but Business Is Not Immune to Macro Headwinds",2023-02-07T14:01:00Z
The stock market is a 'drunken psycho.' Why this hedge-fund manager is shorting some of the market's biggest stocks.,2023-02-07T14:24:00Z
"Company News for Feb 7, 2023",2023-02-07T14:39:00Z
PayPal faces the 'burden of proof' as it looks for a rebound,2023-02-07T15:28:00Z
Want To Copy 'Master Trader' Nancy Pelosi's Investments? There's An ETF For That. Here Are The Holdings,2023-02-07T16:34:31Z
Skyworks Analysts Call Out Apple Content Gain And Broad Market Strength Post Mixed 1Q,2023-02-07T16:51:26Z
ETF Asset Report of Last Week: Value Tops,2023-02-07T18:00:00Z
Retail Earnings Preview: Will Inflation’s Chill Deliver the Iciest Holiday Season,2023-02-07T18:38:00Z
Why Criteo Stock Zoomed Nearly 8% Higher on Tuesday,2023-02-07T22:45:51Z
Biden on tech: 'Pass bipartisan legislation to strengthen antitrust enforcement',2023-02-08T03:13:00Z
"The luxurious, reliable 2023 Lexus ES is all about responsible indulgence",2023-02-08T10:01:00Z
"Why Apple, Microsoft, and Warner Bros. Discovery Stocks are No-Brainer Buys Right Now",2023-02-08T10:02:00Z
Amazon: I Still See Huge Downside Risk,2023-02-08T10:20:32Z
3 Stocks to Add to Your Portfolio in the Event of a Market Downturn,2023-02-08T10:35:00Z
Is Schwab Fundamental U.S. Large Company Index ETF (FNDX) a Strong ETF Right Now?,2023-02-08T11:20:06Z
Should Fidelity Nasdaq Composite Index ETF (ONEQ) Be on Your Investing Radar?,2023-02-08T11:20:07Z
Should Vanguard S&P 500 Growth ETF (VOOG) Be on Your Investing Radar?,2023-02-08T11:20:08Z
Biden targets stock buybacks — do they help you as an investor?,2023-02-08T11:24:00Z
Wall Street Breakfast Podcast: State Of The Union,2023-02-08T12:14:05Z
"S&P 500 Rises Over 1%, Market Volatility Decreases",2023-02-08T12:17:24Z
Disney earnings: What to expect,2023-02-08T13:25:00Z
Want to Get Richer? 2 Top Stocks to Buy Now and Hold Forever,2023-02-08T13:30:00Z
No wonder Powell didn't commit to extra hikes. Here are five reasons the January jobs report may be too good to be true.,2023-02-08T13:33:00Z
Apple CEO Tim Cook Highlights Critical Insights About Latest Quarter's Results,2023-02-08T13:41:56Z
Better Buy: Tesla vs. Apple,2023-02-08T14:00:00Z
Apple Revenue Declines for the First Time Since 2019. Time to Sell?,2023-02-08T15:00:00Z
2 Top Tech Stocks to Buy Right Now,2023-02-08T18:49:00Z
"Earnings Roundup: Apple, Amazon, Starbucks, and More",2023-02-08T20:12:00Z
"Why Apple, Amazon, and Meta Platforms All Fell on Microsoft's AI News",2023-02-08T21:51:39Z
"Here's what's worth streaming in February 2023, from 'Dear Edward' to 'Wakanda Forever' and 'You'",2023-02-08T23:16:00Z
AppLovin stock set to recover more than $1 billion of its vanished valuation after strong forecast,2023-02-09T01:27:00Z
"Disney stock jumps as Iger plans 7,000 job cuts in return to earnings stage",2023-02-09T01:31:00Z
Meta Platforms Announces $40 Billion Share Buyback - Buyback Wednesdays,2023-02-09T07:06:24Z
This Is Retail Investors' Favorite Stock to Own (and It's Not Apple or a Meme Stock),2023-02-09T10:21:00Z
2 Tech Stocks That Could Set You Up for Life,2023-02-09T10:40:00Z
These 3 Tech Stocks Are Building the Future,2023-02-09T11:00:00Z
Netflix Stock Is Down 48% From Its High. Time to Buy?,2023-02-09T11:17:00Z
Should Vanguard Large-Cap ETF (VV) Be on Your Investing Radar?,2023-02-09T11:20:02Z
Volatility In Markets Increases; Nasdaq Drops Sharply,2023-02-09T11:24:31Z
"Meme stocks and cannabis were investing fads, but Morgan Stanley says AI is the real deal",2023-02-09T13:32:00Z
‘No one is immune’: Activist investors target tech companies after stocks dive,2023-02-09T13:37:00Z
