title,published_utc
Smartphone Sales Are Peaking. Here's Why Apple Doesn't Really Care,2023-02-09T14:00:00Z
2 Excellent Stocks to Buy in 2023 and Never Sell,2023-02-09T15:00:00Z
Dell Is the Worst of the Worst in a Miserable PC Industry,2023-02-09T15:30:00Z
The Most Shorted Stocks Lead the Market in 2023: Can it Continue?,2023-02-09T16:03:00Z
TikTok is the next Chinese product the U.S. could shoot down,2023-02-09T17:26:00Z
Here’s how — and where — Netflix has started cracking down on password sharing,2023-02-09T17:27:00Z
"AppLovin Analysts Like Near-Term Stability Post Q4 Performance; Remain Cautious Over Apple, Google's Privacy Covenants",2023-02-09T18:25:53Z
AppLovin’s stock soars more than 30% as Wall Street sees a bottom for mobile-ad market,2023-02-09T23:46:00Z
"To help protect older loved ones from scams, it helps to understand you’re vulnerable, too",2023-02-10T10:02:00Z
85% of Warren Buffett's $354 Billion Portfolio Is Invested in Just 10 Stocks,2023-02-10T10:06:00Z
Better Growth Stock: Nvidia vs. Apple,2023-02-10T11:15:00Z
Is WisdomTree U.S. LargeCap Dividend ETF (DLN) a Strong ETF Right Now?,2023-02-10T11:20:07Z
1 Exceptional Growth ETF to Buy Before the Next Bull Market,2023-02-10T11:30:00Z
ChatGPT Mania: 3 Stocks to Buy Hand Over Fist,2023-02-10T13:16:00Z
"This nearly 150-year-old fund hasn't cut its dividend since 1938. Here are the stocks it likes, and four it doesn't.",2023-02-10T13:30:00Z
Microsoft Vs. Google: Analyst Says There's A Clear 'Usain Bolt Style' Leader In Week's AI Battle,2023-02-10T13:34:50Z
China's Economic Reopening Is Boosting Sales for Apple and Easing Supply Chain Constraints,2023-02-10T13:42:00Z
Will the Nasdaq ETF Lose Shine on Weak Tech Earnings?,2023-02-10T16:05:00Z
Apple Continues Consolidation In This Pattern: Here's Why The Stock Looks Headed Higher,2023-02-10T16:19:21Z
"This Analyst Upgrades Major Semiconductor Stocks, Sees Demand Improvement In 2H",2023-02-10T16:45:56Z
These 3 Companies Generate Serious Cash,2023-02-10T18:21:00Z
3 Metaverse Stocks to Buy Right Now,2023-02-10T22:00:00Z
How to Buy Stocks Like Warren Buffett's Right-Hand Man Charlie Munger,2023-02-10T22:55:00Z
Opinion: These Will Be the 3 Largest Stocks by 2030,2023-02-11T10:50:00Z
"Up 14% in 2023, Is It Safe to Invest in the Nasdaq Right Now?",2023-02-11T12:15:00Z
Apple And Autodesk: I'm Buying One And So Should You,2023-02-11T13:00:00Z
Where Will Skyworks Solutions Stock Be in 1 Year?,2023-02-11T13:07:00Z
3 Artificial Intelligence Stocks That Could Beat the Market in 2023,2023-02-11T14:00:00Z
These 20 AI stocks are expected by analysts to rise up to 85% over the next year,2023-02-11T15:26:00Z
The Smartest Investors Are Buying These 3 Beaten-Down Stocks,2023-02-11T18:26:00Z
Where and how to charge an electric car for free,2023-02-11T18:37:00Z
Super Bowl LVII: When is it? Where is it? And how much are tickets?,2023-02-11T19:17:00Z
This 1 Key Figure Shows Apple Stock's Growth Potential,2023-02-12T10:20:00Z
Is It Too Late to Buy Apple Stock?,2023-02-12T12:00:00Z
Where Will Apple Stock Be in 3 Years?,2023-02-12T12:35:00Z
Has Google Already Lost The ChatGPT War?,2023-02-12T21:00:00Z
"Apple: Uncertain Economic Fundamentals, Time For A Downgrade",2023-02-13T07:56:27Z
Can PayPal Get Out of Its Way?,2023-02-13T12:46:00Z
"Super Bowl recap: Pregnant Rihanna breaks Twitter, Eagles coach Nick Sirianni memes himself --- and Elon Musk was there",2023-02-13T13:24:00Z
"Spy Balloon Saga, Meta Job Cuts, Googlers Pan Pichai For 'Botched' ChatGPT Rival And More: 5 Key Stories You May Have Missed From The Weekend",2023-02-13T13:31:46Z
Here are five companies to pick if Goldman Sachs is right about the stock market being flat in 2023,2023-02-13T13:47:00Z
History Suggests the Nasdaq Could Soar in 2023: 3 Trillion-Dollar Growth Stocks to Buy If It Does,2023-02-13T14:30:00Z
2 Chip Stocks That Could Win Big From the Space Economy,2023-02-13T14:35:01Z
"'It’s a major aspect of keeping my mind sharp.' Video games aren't just for kids -- older players get mental challenge, competitive spirit from gaming.",2023-02-13T15:13:00Z
"The 7-year curse: If you're thinking of investing in certain Super Bowl advertisers, be forewarned",2023-02-13T15:38:00Z
Is Rihanna the first billionaire to perform at a Super Bowl halftime show?,2023-02-13T16:12:00Z
"10 Stocks That Are Crushing Short Sellers In 2023: Where Do Tesla, Apple, Lucid Motors Rank?",2023-02-13T17:24:09Z
1 Billion Reasons to Love Apple Stock,2023-02-13T21:42:47Z
Palantir: Soaring On Good News,2023-02-13T23:00:19Z
Why Apple Stock Inched Up by Nearly 2% Today,2023-02-13T23:40:30Z
5 essential EV charging apps,2023-02-14T10:02:00Z
3 EV Stocks That Are on a Multi-Decade Growth Runway,2023-02-14T10:45:00Z
"The peak of this market rally is almost here, says JPMorgan. Time to ditch U.S. stocks, and buy these instead, says Wall Street giant.",2023-02-14T13:46:00Z
This Semiconductor Stock Has Too Much Dependency on Apple -- Is It Time to Sell?,2023-02-14T14:24:02Z
"Why Apple, LVMH, and PepsiCo Are No-Brainer Buys Right Now",2023-02-14T15:07:00Z
"Why Apple, Corsair Gaming, and Alphabet Are No-Brainer Buys Right Now",2023-02-14T16:00:00Z
Mark Cuban Sounds Alarm On ChatGPT: 'We're Just In The First Inning Of What's Going To Happen',2023-02-14T18:59:46Z
Best Tech ETFs In Nasdaq's Worst Week Since December,2023-02-14T19:20:00Z
Berkshire Hathaway boosted its Apple stake last quarter,2023-02-14T19:26:00Z
Here's How Many People Watched Super Bowl LVII And What It Could Mean For Fox Stock,2023-02-15T00:16:15Z
Warren Buffett Didn't Buy a Single New Stock to End 2022. But He Cut From 8.,2023-02-15T01:08:00Z
These 8 billionaires have more combined wealth than half of Silicon Valley's residents,2023-02-15T02:34:00Z
Tracking Warren Buffett's Berkshire Hathaway Portfolio - Q4 2022 Update,2023-02-15T08:18:30Z
An 8.5% Dividend and 12.7% Payout Walk Into a Cantina,2023-02-15T10:20:00Z
Volatility In Markets Drops Sharply Following Inflation Data,2023-02-15T10:42:33Z
Warren Buffett Just Bought 4 Stocks. Here's the Best of the Bunch.,2023-02-15T10:52:00Z
Apple Stock: Headed to $177?,2023-02-15T11:06:00Z
"Want to play the lottery? These are the most speculative stocks of the year, by one measure",2023-02-15T12:04:00Z
Wall Street Breakfast Podcast: 13F Filings,2023-02-15T12:11:50Z
Why Video Game Stocks Are in Trouble,2023-02-15T12:45:00Z
13F: 3 of Buffett's Latest Moves,2023-02-15T14:34:00Z
Time to Take a Bite Out of Apple ETFs Following Warren Buffett?,2023-02-15T18:08:00Z
GenZ and the Future of Investing,2023-02-15T19:44:00Z
"No Summons For Elon Musk But Apple's Tim Cook, Other Big Tech CEOs Subpoenaed By House Panel Over Content Moderation",2023-02-16T03:29:14Z
Apple: The Right Company At The Wrong Price,2023-02-16T08:02:23Z
"S&P 500 Settles Higher, Market Volatility Falls Further",2023-02-16T10:30:01Z
Why I’m Calling for Double-Digit Gains and 9%+ Dividends From CEFs This Year,2023-02-16T10:52:00Z
Apple reportedly delays launch of mixed-reality headset until June,2023-02-16T12:26:00Z
"Zacks Market Edge Highlights: Robinhood, PayPal, Block, Apple and Chewy",2023-02-16T13:04:00Z
"Stock Market News for Feb 16, 2023",2023-02-16T14:32:00Z
Another 'Volmageddon'? JPMorgan becomes the latest to warn about an  increasingly popular short-term options strategy.,2023-02-16T14:33:00Z
"Up Over 20% in 2023, Apple Is Still an Ultimate Bear Market Stock",2023-02-16T15:15:00Z
"Roku Gets Apple iOS Comparison, Price Target Raises From Analysts After Q4 Beat",2023-02-16T16:35:04Z
"Paramount Adds 9.9M Streaming Subscribers In Q4: How It Stacks Up To Netflix, Disney+ And Other Rivals",2023-02-16T18:26:46Z
Grading Berkshire Hathaway's Q4 Trades,2023-02-16T20:23:00Z
2 Warren Buffett Stocks to Buy Hand Over Fist and Hold for 30 Years or More,2023-02-17T11:30:00Z
Bad news for the 'pessimistic bulls'. Here's 10 reasons why a U.S recession won't happen.,2023-02-17T11:50:00Z
Some of these 'overpaid' CEOs are taking pay cuts. Will it matter?,2023-02-17T13:28:00Z
A Once-in-a-Decade Investing Opportunity Is Here. 2 Vanguard ETFs to Buy Now.,2023-02-17T13:30:00Z
"Zacks Value Trader Highlights: Taiwan Semiconductor, Chevron, US Bancorp, Apple and Amazon",2023-02-17T13:42:00Z
Here is What to Know Beyond Why Apple Inc. (AAPL) is a Trending Stock,2023-02-17T14:00:11Z
Apple Falls In This Pattern After Fed Turns Hawkish: What To Watch For Next,2023-02-17T16:46:11Z
Tesla Disputes Firings Over Unionization Claims: Here's What The EV Giant Says Happened,2023-02-17T18:14:24Z
Interview With David Rolfe of Wedgewood Partners,2023-02-17T20:48:00Z
Breaking Down the Latest Wall Street News: AI to Pizza,2023-02-18T13:00:00Z
"Twilio's Layoffs, Spotify's Strategy, and Super Bowl Ads",2023-02-18T13:31:00Z
Meme-stock era record falls: Retail traders dumped $1.5 billion a day into U.S. equities in January,2023-02-18T13:48:00Z
Better Buy: Apple vs. Amazon,2023-02-18T14:10:00Z
Zebra Technology's Analysis Points to Improved Infrastructure,2023-02-18T18:03:00Z
Amazon wants workers back in the office three days a week,2023-02-18T18:12:00Z
"As Big Tech cuts workers, other industries are desperate to hire them",2023-02-18T18:21:00Z
Best Stock to Buy: Amazon Stock vs. Alphabet Stock vs. Apple Stock,2023-02-18T18:35:36Z
‘I’ll be single this Valentine’s Day’: He forgot his wallet and took the receipt for his taxes. Is this nuts?,2023-02-18T21:19:00Z
75% of Warren Buffett's Portfolio Is Invested in 5 Stocks: Here's the 1 That's Made Him the Most Money,2023-02-19T10:52:00Z
Roku Blazes Higher on Huge Upgrade: 5 Big Analyst Calls | Pro Recap,2023-02-19T10:58:00Z
My Grand Experiment: The High-Growth Portfolio,2023-02-19T12:00:00Z
76% of Warren Buffett's Berkshire Hathaway Portfolio Value Is in These 5 Stocks,2023-02-19T12:10:00Z
5 Top Stocks With Magnificent Share-Repurchase Track Records,2023-02-19T13:15:00Z
Is The Trade Desk Stock a Buy Now?,2023-02-19T15:13:00Z
Surprise! Warren Buffett Owns a Brand-New FAANG Stock,2023-02-20T10:06:00Z
Should Schwab 1000 Index ETF (SCHK) Be on Your Investing Radar?,2023-02-20T11:20:05Z
Is Goldman Sachs ActiveBeta World Low Vol Plus Equity ETF (GLOV) a Strong ETF Right Now?,2023-02-20T11:20:06Z
Google Braces For A Frightening Lollapalooza Effect,2023-02-20T12:00:00Z
"If You Invested $10,000 in Nvidia in 2013, This Is How Much You Would Have Today",2023-02-20T13:00:00Z
Only 1 Of The 10 Biggest S&P 500 Companies Of 2000 Is Still In The Top 10 Today,2023-02-20T18:11:51Z
20 Billion Reasons Alphabet's Moat Isn't as Big as It Seems,2023-02-21T10:00:00Z
What Tech Crash? 5 Tech ETFs Up Double-Digit Past Month,2023-02-21T13:00:00Z
"There's a real risk of World War 3.1, and the battleground will be microchips, strategist says",2023-02-21T13:37:00Z
"Biden's Secret Ukraine Trip, Meta's Monetization Move, Musk's Displeasure At ChatGPT Parent's Trajectory And More: 5 Key Stories You May Have Missed From The Weekend",2023-02-21T14:13:57Z
"Apple Analyst Is Maintaining Rating, While Noting Services Weakness Amid Advertising Softness",2023-02-21T15:46:58Z
Someone Just Paid More For A First-Generation Apple iPhone Than Price Of Tesla Model Y,2023-02-21T16:24:46Z
"Elon Musk Has Criticized Passive Funds, But 3 Of The Largest Now Collectively Own More Tesla Stock Than Its CEO",2023-02-21T16:46:51Z
Microsoft teams up with Nvidia and Nintendo in 10-year deal to stream Xbox games ,2023-02-21T19:18:00Z
"AppleTV+ Set To Offer Exciting Content In March: 'Ted Lasso,' MLS Sports Rights And This A-List New Series",2023-02-21T21:13:50Z
Why Apple Stock Tasted Sour on Tuesday,2023-02-21T23:37:32Z
Apple Watch Ban Ruling Won't Be Vetoed By Biden Administration,2023-02-22T02:13:20Z
SPY Breaks Lower: Technical Analysis in Focus Ahead of FOMC Minutes,2023-02-22T04:58:00Z
Aircraft Bomb Prank Via Apple AirDrop Gets High School Kid Detained,2023-02-22T05:00:25Z
Volatility In Markets Increases Sharply Ahead Of Fed Minutes,2023-02-22T10:25:18Z
Has PayPal Reached a Once-in-a-Decade Buying Opportunity?,2023-02-22T10:30:00Z
My Top 5 Stocks To Own In The S&P 500,2023-02-22T11:00:00Z
5 Artificial Intelligence Stocks to Buy Now,2023-02-22T11:15:00Z
A Recession May Be Inevitable: 1 ETF to Buy Right Now,2023-02-22T11:45:00Z
Over 1 Trillion Reasons to Like PayPal Stock,2023-02-22T11:59:00Z
Why Meta Stock Should Pay a Dividend,2023-02-22T14:06:00Z
"Got $5,000? These 2 Low-Risk Growth Stocks Also Pay Dividends",2023-02-22T14:37:00Z
"The stock market is due a bounce after the 697-point selloff in the Dow, says this analyst. Here's why. ",2023-02-22T14:52:00Z
"Analyst Says This MedTech Giant Stock Offers 'Too Much Optionality,' Upgrades Rating",2023-02-22T18:15:30Z
Why Abbott Laboratories Stock Sank Today,2023-02-22T23:07:29Z
