title,published_utc
Elon Musk Could Face Regulatory Ire Over His Twitter Stake: Reuters,2022-04-06T01:46:41Z
Twitter Shares Details On Edit Button: Says Didn't Get The Idea From Elon Musk's Poll,2022-04-06T02:54:59Z
Elon Musk Began Buying Twitter Shares In January: How He Built His Stake (Graph),2022-04-06T02:59:44Z
Rivian Says On Track To Meet 2022 Output Target After Stock Drops 9%,2022-04-06T03:29:10Z
Mark Cuban Is 'Very Bullish' On Ethereum Merge For These Two Reasons,2022-04-06T03:47:28Z
S&P 500: What To Make Of Tuesday’s Weak Close,2022-04-06T04:32:00Z
"Why Tesla Rivals Nio, Xpeng And Li Auto Are Trading Lower In Hong Kong Today",2022-04-06T04:51:57Z
Tesla Battery Supplier CATL Gets Nod For Plant In Germany,2022-04-06T05:33:25Z
Elon Musk Leads With His Heart: Jack Dorsey Reacts To Twitter Stake,2022-04-06T05:48:06Z
Amazon Dubs Take Over Of 800 Future Retail Stores By Reliance A 'Sham Transaction',2022-04-06T05:48:09Z
Dogecoin Co-Founder Has This To Say On His Expectations From Elon Musk As Twitter Board Member,2022-04-06T07:26:02Z
Elon Musk's SpaceX Set To Launch First All-Private ISS Mission With Axiom Space On Friday,2022-04-06T08:46:28Z
Should You Invest in Tesla Before the Stock Split?,2022-04-06T09:00:00Z
"Used cars cost more than new ones? Here’s what’s going on, and where to find the bargains.",2022-04-06T09:01:00Z
The No. 1 Reason I'm Buying More of These 2 Stock-Split Stocks,2022-04-06T10:00:00Z
"Dogecoin Continues To Outperform Bitcoin, Ethereum: What You Need To Know",2022-04-06T10:09:00Z
Can THORchain Keep Surging?,2022-04-06T10:15:00Z
Nio Worker Reportedly Used EV Maker's Servers To Mine Ethereum Illegally,2022-04-06T10:20:56Z
Should You Invest in Tesla Right Now?,2022-04-06T11:10:00Z
Here's the first Wall Street recession call of the new inflation era,2022-04-06T11:32:00Z
"Twitter's stock is not out of the technical woods yet, even after record rally",2022-04-06T11:41:00Z
"Morning Brief: Top Stories Dominating Financial Media on Wednesday, April 6",2022-04-06T11:55:57Z
Elon Musk admits his Twitter investment isn't passive and reveals that he began buying the stock in January,2022-04-06T11:57:00Z
$100 Invested In Dogecoin When Elon Musk Disclosed Twitter Stake Would Have Already Fetched You This Much,2022-04-06T12:09:19Z
2 Undervalued EV Stocks You Can Buy and Hold for the Next Decade,2022-04-06T12:17:00Z
Twitter edges toward edit button,2022-04-06T12:23:00Z
Twitter put Elon Musk on the board so he wouldn't pull another Tesla,2022-04-06T12:34:00Z
GM and Honda are setting their sights on making cheaper EVs,2022-04-06T12:37:00Z
6 Stocks That Moved the Market in March,2022-04-06T13:22:47Z
The Value Of The Companies Elon Musk Sits On The Board Of Will Blow Your Mind,2022-04-06T13:28:46Z
Is EVgo Stock a Buy?,2022-04-06T13:48:00Z
"Benzinga's Daily Brief On Trending Tickers For April 6, 2022: Tilray, System1, Tesla And More",2022-04-06T13:50:08Z
What Were Your Best And Worst Stock Buys? What Does The Zinger Nation Think?,2022-04-06T13:59:03Z
Warren Buffett's Top Stocks,2022-04-06T14:00:00Z
Ford's (F) Q1 U.S. Vehicle Sales Decline Y/Y on Chip Crisis,2022-04-06T14:17:00Z
General Motors (GM) & Honda (HMC) to Tie Up for EV Development,2022-04-06T14:20:00Z
"Did Elon Musk's Twitter Stake, Board Appointment Coincide With His Exit From Another Company?",2022-04-06T15:19:34Z
Why Tesla Stock Is Falling Today,2022-04-06T15:26:05Z
Deutsche Bank Becomes First Major Bank To Predict Recession,2022-04-06T15:34:03Z
Why Nio Stock Is Tumbling Again Today,2022-04-06T16:04:27Z
"Daniel Yergin on Russia, China, and Global Energy Markets",2022-04-06T18:11:00Z
Analysis: Do Language Clues Point To Early Friction Between Elon Musk And Twitter?,2022-04-06T18:30:06Z
Tesla Stock Fell Today -- Is the Market Overreacting?,2022-04-06T19:01:13Z
Best & Worst Performing ETFs of Q1,2022-04-06T19:05:00Z
"No, Elon Musk Didn't Just Ask Mark Zuckerberg If He Could Buy Facebook",2022-04-06T19:45:32Z
"Stocks finish lower for second day, Nasdaq sheds 2.2% as Fed minutes detail rapid balance sheet reduction plan",2022-04-06T20:20:00Z
"Space Swap: Richard Branson Wants Trip With SpaceX, Suggests Elon Musk Flies With Virgin Galactic",2022-04-06T20:28:13Z
Has Elon Musk Sold Shares Of Twitter Already?,2022-04-06T20:30:30Z
Why Tesla Shares Rose 24% Last Month,2022-04-06T21:17:26Z
What Can Elon Musk Do At Twitter? Here's What An Ex-Tesla Board Member Has To Say,2022-04-07T01:15:03Z
"Cathie Wood Bought Over $121,000 Worth Of Shares In This 3D Printing Partner Of Elon Musk's SpaceX On Wednesday",2022-04-07T02:38:52Z
Elon Musk Met Joe Biden's Administration Today: Reuters,2022-04-07T03:01:05Z
"Why Tesla Rivals Nio, Xpeng, Li Auto Are Falling Again In Hong Kong Today",2022-04-07T05:01:33Z
Tesla Hikes Prices Yet Again In The US For Some Model 3 Variants,2022-04-07T05:19:51Z
NFT Of World's First Tweet On Sale For $47M — But Jack Dorsey Has One Objection,2022-04-07T05:51:44Z
"Elon Musk Teases Tesla Giga Texas 'Grand Opening Party' With Video, Photos; To Speak At Event Tonight",2022-04-07T06:25:08Z
"BREAKING: Tesla Recalls 127,785 Model 3 Vehicles In China Over Manufacturing Defects",2022-04-07T08:52:06Z
Elon Musk Shares Photo Of Him Smoking Weed To Show What Twitter Board Meetings Will Look Like Now,2022-04-07T09:25:55Z
How Tesla's Engineering-First Approach Beats the Competition,2022-04-07T10:45:00Z
Why Is Dogecoin Crashing Today?,2022-04-07T11:12:57Z
Cybertruck And More: Tesla's Giga Texas Event Today Expected To Dish Out Surprises,2022-04-07T11:14:11Z
Elon Musk has already made more than $1 billion on his Twitter stock,2022-04-07T11:48:00Z
Sonic Automotive (SAH) Adds Raleigh to its EchoPark Footprint,2022-04-07T12:11:00Z
"Why 'The Black Swan' Author Thinks Its A Good Idea To Be Rich, But A Bad One To Be 'Too Rich'",2022-04-07T12:29:00Z
The stock market is behaving a lot like it did during the Iraq war. Here's the future if the pattern continues.,2022-04-07T13:07:00Z
Dogecoin Co-Creator's Salty Take On Miami Bitcoin Conference: 'Cringe And Crashes',2022-04-07T13:14:35Z
3 Stocks I'm Buying During a Tech Stock Correction,2022-04-07T13:40:00Z
"Chart Wars, Twitter Vs. Meta Platforms: How Has Elon Musk's Role As Shareholder Influenced Stock Price?",2022-04-07T14:17:04Z
Is Gores Guggenheim a Buy?,2022-04-07T14:27:00Z
1 Homebuilder to Buy for the Long Term,2022-04-07T15:03:00Z
Ron Baron: Tesla will more than triple deliveries in 3-4 years,2022-04-07T15:17:17Z
Why Tesla Stock Was Riding High This Morning,2022-04-07T16:20:00Z
"After Tequila, Belt Buckles And Flamethrowers, Could This Be The Next Great Tesla Novelty Item?",2022-04-07T17:29:42Z
All The Run-Ins Elon Musk Has Had With The SEC,2022-04-07T18:56:29Z
"Can Rivian, Lucid and Lordstown Survive in the World of Tesla?",2022-04-07T20:05:00Z
Will Howard Schultz Stick Around at Starbucks?,2022-04-07T20:21:00Z
Are Stock Splits A Catalyst?,2022-04-07T20:31:00Z
How Elon Musk May Have Just Reignited His War With The SEC,2022-04-07T20:39:44Z
"Bitcoin paycheck from NFL? Here’s what it takes to happen, says Aaron Rodgers",2022-04-07T21:32:00Z
Tesla (TSLA) Outpaces Stock Market Gains: What You Should Know,2022-04-07T21:45:18Z
"Tesla's Lead Times Longer Than Ford, GM Due To This Reason, Says Munster",2022-04-08T01:21:11Z
"Elon Musk, Twitter's largest single shareholder and board member, pledges 'significant improvements.' Will Tesla's founder attempt to change how you tweet?",2022-04-08T01:30:00Z
Dogecoin Sees Sudden Spike As Tesla Features Mascot At 'Cyber Rodeo' Event,2022-04-08T02:47:33Z
BREAKING: Elon Musk Gives Cybertruck Update At 'Cyber Rodeo' Event,2022-04-08T03:12:36Z
"Nio Down 6%, Xpeng Falls 5.8% In Hong Kong Today: What's Driving The EV Stocks Down?",2022-04-08T04:52:24Z
Twitter: Can Elon Musk Bring Sustained Share Price Growth?,2022-04-08T07:29:00Z
Tesla Giga Shanghai Said To Remain Shut Amid COVID-19 Lockdowns,2022-04-08T08:33:39Z
Elon Musk To Do 'Unusual' AMA With Twitter Staff To Quell Worries: Report,2022-04-08T08:48:12Z
The 2022 Hyundai Kona Electric is a great buy and a top safety pick,2022-04-08T09:00:00Z
Elon Musk Touts Giga Texas As Earth's Most Advanced Car Factory: 'Feels Like An Alien Has Landed',2022-04-08T10:43:53Z
Their CEO Came From Tesla. Now It's One of the Best EV Stocks,2022-04-08T11:00:00Z
"This Indian Billionaire Outperformed Elon Musk Last Year In Wealth Growth — Now, His Companies Are Also Fetching Multibagger Returns For Investors In 2022",2022-04-08T11:28:52Z
Here's one way to potentially get more from a 60/40 portfolio,2022-04-08T12:45:00Z
"Stock Market News for Apr 8, 2022",2022-04-08T12:46:00Z
Tesla Deliveries Are Finally Beating Expectations,2022-04-08T12:47:00Z
"As Elon Musk Makes The World 'More Fun,' Dogecoin Sees Short-Lived Spike",2022-04-08T12:49:11Z
"Move Over, Elon: 5 Unlikely Celebrities Who Served On Corporate Boards",2022-04-08T13:20:28Z
"Benzinga's Daily Brief On Trending Tickers For April 8, 2022: SoFi, Tesla, Taiwan Semiconductors And More",2022-04-08T13:47:19Z
Missed Out On Tesla? My Best Stock-Split Stock to Buy And Hold,2022-04-08T14:53:00Z
Growth Stocks Are Selling Off Again -- Here's How to Handle Stock Market Volatility,2022-04-08T15:00:00Z
This Buffett Powerhouse Stock Just Announced a Stock Split,2022-04-08T15:30:00Z
"Twitter Is A Ghost Town And Needs Elon Musk, CEO Of Trump's Competing Social Media Platform Says",2022-04-08T15:31:36Z
"Dogecoin, Tesla In Top 10 But This Crypto Is Robinhood's Top Recurring 'Buy' Asset",2022-04-08T15:35:31Z
Why Tesla Stock Tumbled Today,2022-04-08T15:39:19Z
Should You Bet on Volkswagen's (VWAGY) Electrification Blitz?,2022-04-08T15:42:00Z
Toyota (TM) Trims 2022 Overall US Auto Sales View Amid Chip Woes,2022-04-08T15:48:00Z
Mercedes-Benz (DDAIF) Reports U.S. Auto Sales Numbers for Q1,2022-04-08T16:00:00Z
"Tesla (TSLA) Recalls More Than 127K EVs, Hikes Model 3 Price",2022-04-08T16:02:00Z
Why This Tesla Analyst Sees Giga Texas Serving A 'Hearts And Lungs Of Future EV Production',2022-04-08T16:29:04Z
Elon Musk Says Robot Production Could Start In 2023,2022-04-08T17:07:45Z
Why Lithium Americas Stock Crashed 10% Today,2022-04-08T20:12:17Z
Why Rivian Stock Plunged This Week -- and Could Fall Further,2022-04-08T20:50:18Z
Why General Motors Stock Was Kind of a Wreck This Week,2022-04-08T21:16:05Z
"U.S. stocks end mostly lower, with Dow, S&P 500 Nasdaq sliding for the week as investors digest Fed plans amid rising yields",2022-04-09T00:33:00Z
5 Things On Dogecoin Community's Radar With Elon Musk Joining Twitter Board,2022-04-09T08:57:25Z
Here's Why It Could Still Be Early Innings for Bitcoin,2022-04-09T12:15:00Z
These 2 Meme Stocks Have Legitimate Long-Term Upside,2022-04-09T14:53:00Z
2 Stocks That Could Be Worth More Than Tesla by 2030,2022-04-09T15:30:00Z
Where Will Tesla Stock Be In 2030? Analyst Weighs In,2022-04-09T15:49:08Z
Elon Musk Asks If Twitter HQ Should Be Converted To Homeless Shelter,2022-04-10T05:52:30Z
"1 Stock To Buy, 1 To Dump When Markets Open: UnitedHealth, NIO",2022-04-10T10:52:00Z
2 Top Electric Vehicles Stocks to Buy for the Long Haul,2022-04-10T12:32:00Z
GM and Honda Deepen EV Partnership to Cut Costs,2022-04-10T13:08:00Z
What Twitter would look like if Elon Musk gets his way,2022-04-10T16:53:37Z
Why Dogecoin Is Soaring Today,2022-04-10T18:12:26Z
"In series of tweets, Elon Musk suggests Twitter overhaul, takes shots at company",2022-04-10T20:22:00Z
"Elon Musk Wants to Delete 'W' From Twitter, And His Followers Can't Stop Talking About It",2022-04-10T20:49:41Z
Elon Musk And Jeff Bezos Agree Over Something For A Change: What To Do With Twitter HQ,2022-04-11T01:25:17Z
BREAKING: Tesla's China Sales Jumped 85.5% In March,2022-04-11T02:44:13Z
"Elon Musk Has Declined To Join Twitter Board, Says CEO",2022-04-11T03:36:50Z
"Tesla Rivals Nio, Xpeng Down Over 8% In Hong Kong Today: What's Behind The EV Slide?",2022-04-11T05:09:41Z
Shark Tank's Kevin O'Leary Says 'Bitcoin Mining Is Going To Save The World',2022-04-11T07:27:09Z
Lithium Americas To Benefit From Growing Resource Nationalism,2022-04-11T07:39:38Z
Elon Musk Calls Tesla Co-Founder Eberhard 'Pure Poison',2022-04-11T07:55:58Z
Why Twitter Shares Are Plunging Today,2022-04-11T08:49:38Z
How to avoid car dealers’ high markups,2022-04-11T09:04:00Z
"Tesla Getting Into Lithium Mining Is True 'Vertical Integration,' Says Gene Munster",2022-04-11T09:52:32Z
Twitter CEO says Elon Musk will not join its board of directors,2022-04-11T10:23:00Z
My Best Semiconductor Growth Stock to Buy Now and Hold,2022-04-11T11:08:00Z
"Ahead Of Planned Tesla Entry, Indians Are Buying More Electric Vehicles Than Ever",2022-04-11T11:10:10Z
China's Nio halts EV production as COVID lockdowns disrupt its supply chain,2022-04-11T11:50:00Z
Analyst Sees Tesla Taking 8% Volume Hit In Q2 From China COVID-19 Lockdowns,2022-04-11T11:58:00Z
"Tech Sell-Off: 2 Growth Stocks to Buy, and 1 to Sell",2022-04-11T12:01:00Z
Dogecoin On A Volatility Rollercoaster As Elon Musk Touting Meme Coin Fails To Give Definite Momentum Again,2022-04-11T12:10:58Z
"It's still not time to invest in China, argues Bank of America. Here's why.",2022-04-11T12:41:00Z
What Does Elon Musk Want From Twitter Stock?,2022-04-11T12:55:00Z
"Tesla, Nio And More: How Cathie Wood's Ark Shuffled EV Bets In Q1",2022-04-11T13:06:33Z
Market At The Cusp Of Major Fall,2022-04-11T13:25:00Z
NASA Is Helping Nissan With This EV Technology: What You Need To Know,2022-04-11T15:12:17Z
Is Tesla Stock a Buy Right Now?,2022-04-11T15:30:00Z
Why Tesla Stock Keeps Falling,2022-04-11T15:48:23Z
Does Elon Musk's About-Face On Twitter Portend 'Game Of Thrones' Battle Ahead?,2022-04-11T15:51:48Z
Analysis: The Twitter Board Rule That Could Explain Why Elon Musk Isn't Joining,2022-04-11T16:19:26Z
"The Zacks Analyst Blog Highlights Tesla, While Blue Bird, Harley Davidson, and Nikola",2022-04-11T16:25:00Z
These inflation protection funds are on sale,2022-04-11T16:52:00Z
"Dr. Fauci warns: Don't 'pooh-pooh' COVID because of low hospitalizations, as new daily cases and deaths extend increases",2022-04-11T17:08:00Z
Why Rivian Stock Jumped Today,2022-04-11T18:20:59Z
"Way.com Seeks To Make Car Ownership 'Affordable, Rewarding And Fully Digital'",2022-04-11T19:24:05Z
Markets Fall Amid New 2-Year High For 10-Year Treasury Note,2022-04-11T20:05:52Z
"Dow falls more than 400 points, Nasdaq finishes 2.2% lower as Treasury yields keep surging",2022-04-11T21:19:00Z
Cathie Wood Trims Twitter Stake By $8.7M As Elon Musk Declines Board Seat,2022-04-12T01:47:45Z
"Tesla Said To Submit Plan For 100,000-Sq-Ft Sales And Delivery Center In This Florida City",2022-04-12T02:26:21Z
'The Big Short' Fame's Michael Burry Takes Note Of Rising S&P 500 Price-To-Sales Ratio,2022-04-12T03:06:22Z
"Why Tesla Rivals Nio, Xpeng Are Going Higher In Hong Kong Today",2022-04-12T04:45:54Z
"This Tesla, Nio Battery Supplier Has Regained Over Half The Market Share In China",2022-04-12T06:52:59Z
This crowdsourced site shames car dealers for huge markups,2022-04-12T09:04:00Z
Tesla Rival Xpeng Puts Up Special P7 Edition For Sale: Here's What You Need To Know,2022-04-12T09:44:58Z
Is iShares MSCI USA Equal Weighted ETF (EUSA) a Strong ETF Right Now?,2022-04-12T10:20:07Z
Looking for Tech Stocks? These 3 Are Great Buys,2022-04-12T11:00:00Z
1 Homebuilder to Invest in the Texas Land Rush,2022-04-12T11:08:00Z
Better Stock-Split Stock: Amazon vs. Tesla,2022-04-12T11:20:00Z
Tesla Wrests SUV Leadership In China; Model Y Tops Category In Q1,2022-04-12T11:24:23Z
Dogecoin Whales Go Restless As 56M DOGE Move In One Transaction,2022-04-12T11:35:19Z
What’s Going On At Twitter?,2022-04-12T11:38:00Z
'The Bitcoin PAC' Aims To Vote Out Anti-Crypto Politicians Like Elizabeth Warren,2022-04-12T11:54:05Z
A Peek Into The Markets: US Stock Futures Down Ahead Of March Inflation Report,2022-04-12T11:55:46Z
Tesla Has Ramped Up Hiring For Elon Musk's Humanoid Robot Project,2022-04-12T11:55:55Z
2 Top Cryptocurrencies to Buy Now and Hold for the Next Decade,2022-04-12T11:58:00Z
EV Roundup: Updates From Tesla (TSLA) and General Motors (GM) Create Buzz,2022-04-12T11:59:00Z
Here's How Much You'd Have If You Invested $1000 in Tesla a Decade Ago,2022-04-12T12:30:05Z
This value fund manager is sticking with Netflix and Facebook's parent — and has a new position in another megacap tech stock,2022-04-12T12:33:00Z
"Shopify, Alphabet, Amazon, and Tesla Stocks Are Splitting -- Which Ones Are the Best Buys?",2022-04-12T13:00:05Z
Chart Of The Day:  Fundamentals And Technicals Agree – Tesla To Keep Falling,2022-04-12T13:29:00Z
Honda (HMC) Pledges $63B Investment for Bold EV Efforts,2022-04-12T13:36:00Z
"American Axle (AXL) Inks Deal to Buy Tekfor, Drive EV Growth",2022-04-12T13:44:00Z
"Robot-Run ETF Known For Tesla, Apple Bets Cut Out Chipmakers In March And Bet On This Retail Giant Instead",2022-04-12T14:10:57Z
Dogecoin Trades Muted As Rival Meme Coin Shiba Inu Makes Way To Robinhood,2022-04-12T14:32:42Z
Texas-Made Tesla Model Y Price And Range Leaked,2022-04-12T14:58:15Z
This Apple Cofounder Sold His Stake For $800 On This Day In 1976: How Much Would It Be Worth Now?,2022-04-12T15:46:29Z
"Why Tesla, Rivian, and Lucid Stocks Moved Up Today",2022-04-12T15:56:41Z
Why Nio Shares Dropped Tuesday,2022-04-12T17:38:00Z
What Is Twitter Blue? And How Much Subscription Revenue Could Twitter Make?,2022-04-12T18:02:10Z
Did Donald Trump-Affiliated SPAC Stock Spike On Fox News Joining Truth Social?,2022-04-12T20:48:02Z
Charging Into the Future With EVs,2022-04-12T22:05:00Z
Elon Musk Sued By Former Twitter Shareholders Over Late Stake Disclosure: Report,2022-04-13T00:47:54Z
"California man admits buying hundreds of MacBooks stolen from Tesla, Stanford University and U.C. Berkeley",2022-04-13T02:05:00Z
Biden to allow more ethanol in effort to ease gas prices --- here's what you need to know,2022-04-13T02:10:00Z
"Tesla Reopens Roadster Reservations In China, A Day After US Bookings Return",2022-04-13T02:33:54Z
Dogecoin To Use SpaceX's Starlink For Offline Transactions,2022-04-13T04:04:37Z
"Why Tesla Rivals Nio, Xpeng Are Struggling In Hong Kong Today",2022-04-13T04:12:59Z
Taiwan Suffers Fallout From China COVID-19 Lockdowns As 11 Firms Said To Suspend Production,2022-04-13T05:30:32Z
"Elon Musk's SpaceX, NASA Now Target April-End To Send Crew-4 Astronauts To Space",2022-04-13T05:52:57Z
Tesla Rival Lucid Launches Luxury Sedan With Higher Range: What You Need To Know,2022-04-13T06:35:18Z
"Warren Buffett-Backed Tesla Rival BYD Teases Upcoming Electric Sedan With More More Images, Specs",2022-04-13T08:46:45Z
Further Gains Possible For Tesla Around Earnings,2022-04-13T09:25:00Z
"Why Cathie Wood Is Still Bullish On Tesla Amid Recession Fears, Shanghai Production Hit",2022-04-13T10:31:36Z
Beyond Tesla: 3 Monster Stock-Split Stocks to Buy in April,2022-04-13T10:45:00Z
Shopify Stock Split: 1 Reason to Be Skeptical,2022-04-13T11:07:00Z
"Tesla Said To Battle Bill That Could See Direct Sales, OTA Updates Banned In Oklahoma",2022-04-13T11:30:19Z
"‘Private markets get it,’ but disruptive tech is beaten-up in the stock market, says ARK's Cathie Wood",2022-04-13T11:35:00Z
Why Cathie Wood's Ark Has Substantially Reduced Its Twitter Stake,2022-04-13T11:55:09Z
Is It Better to Buy Before or After a Stock Split? Consider These 3 Charts.,2022-04-13T12:05:00Z
Can I Buy Shares of Tesla in My Roth IRA?,2022-04-13T12:08:00Z
Elon Musk sued over delayed SEC disclosure as he amassed his Twitter stake,2022-04-13T12:27:00Z
Better Stock-Split Buy: Tesla vs. GameStop,2022-04-13T12:38:54Z
"Here's the playbook if the rest of the world breaks free from the U.S. dollar, says Credit Suisse's monetary plumbing guru ",2022-04-13T13:27:00Z
General Motors (GM) Partners Glencore for Cobalt Supply for EVs,2022-04-13T14:22:00Z
Stock Wars: Twitter Vs. Meta Platforms,2022-04-13T14:27:01Z
Should You Buy Alphabet Before the Stock Split?,2022-04-13T14:57:33Z
Allison's (ALSN) Defense Network Expansion to Reduce Costs,2022-04-13T15:37:00Z
"Elon Musk, Tesla Silent On Well-Being Of Locked Down Shanghai Workers",2022-04-13T16:33:53Z
2 Big Reasons Nio Stock Is Flying High Today,2022-04-13T16:53:26Z
Why This Legendary Tesla Investor Plans To Hold EV Stock For At Least 8 More Years,2022-04-13T17:49:53Z
Phony Press Release About Tesla M&A Causes Penny Stock To Surge 200%,2022-04-13T18:32:42Z
Tesla (TSLA) Reports Next Week: Wall Street Expects Earnings Growth,2022-04-13T19:00:34Z
Is Nio Stock a Buy After Today's Surprise Rally?,2022-04-13T20:04:00Z
Potential Tesla Cybertruck And Van Production Start Dates Shown In Leaked Document,2022-04-13T20:18:20Z
Nio Has Not Completely Halted Production As Widely Believed: Report,2022-04-14T01:02:09Z
Tesla Bull Cathie Wood Now Has An 'Open Mind' On GM After Months Of Dissing The Stock,2022-04-14T03:18:05Z
Judge reduces award in  Tesla racial discrimination suit from $137 million to $15 million,2022-04-14T03:40:00Z
"Tesla Rivals Nio, Xpeng Jump In Hong Kong: What's Driving EV Stocks Today?",2022-04-14T04:13:51Z
Tesla Will Have To Pay Just One-Ninth Of The $137M Claim In Racism Lawsuit,2022-04-14T06:05:53Z
Ford Said To Be Eyeing A Steep Price Hike For Mustang Mach-E EVs In China,2022-04-14T08:21:20Z
Could Tesla Join the Dow After Its Stock Split?,2022-04-14T09:21:00Z
Big electric trucks and SUVs are the new gas guzzlers,2022-04-14T09:41:24Z
Mercedes EV Beats Tesla To Clock 621.37 Miles In A Single Charge,2022-04-14T10:00:35Z
BREAKING: Elon Musk Offers To Buy 100% Of Twitter,2022-04-14T10:26:56Z
5 Top Stocks to Buy on Earnings Beat Potential,2022-04-14T10:45:00Z
Why Dogecoin Is Seeing A Sharp Spike Right Now,2022-04-14T10:45:29Z
Tesla and Netflix Earnings: What to Watch,2022-04-14T11:05:00Z
Why Twitter Shares Are Ripping Higher Right Now,2022-04-14T11:07:05Z
"Elon Musk Approaches Twitter Board With A Buyout Offer, Wants To Take It Private: All You Need To Know",2022-04-14T11:29:15Z
Why the Heck Is Shopify Splitting Its Stock?,2022-04-14T11:30:00Z
Tesla China Rival Backed By Warren Buffett And Cathie Wood Now Gets BlackRock's Attention,2022-04-14T12:18:39Z
"Ford Emphasizes Tesla-Like Strategy, Says Online Sales To Be A 'Bigger Part' Of Its Future",2022-04-14T12:22:34Z
Elon Musk's Twitter 'Soap Opera' Will End In A Takeover: Dan Ives,2022-04-14T12:35:12Z
"Default risk, commodity shocks and other things investors need to remember as Ukraine war enters new phase",2022-04-14T12:48:00Z
"Indian Billionaire On Track To Surpass Warren Buffett, Bill Gates In Wealth As Green Energy Stock Skyrockets 115%",2022-04-14T13:07:36Z
"Benzinga's Daily Brief On Trending Tickers For April 14, 2022: Morgan Stanley, Rite Aid, Twitter And More",2022-04-14T13:07:59Z
Does Elon Musk Actually Want To Buy Twitter? 'Maybe This Is All A Joke',2022-04-14T13:19:44Z
Best Penny Stocks to Buy? 3 to Watch as Musk Offers $43B for TWTR,2022-04-14T13:30:01Z
CFRA Downgrades Twitter After Musk Offer: Here's Why,2022-04-14T14:23:47Z
3 Growth Stocks You Can Buy Right Now With Less Than $100,2022-04-14T14:45:00Z
A  brief history of Elon Musk and Twitter,2022-04-14T14:46:20Z
Elon Musk's First Official Tweet Came Before Twitter And Tesla IPOs: Here's What The Tesla CEO Said,2022-04-14T15:34:09Z
Why Tesla Stock Short-Circuited Today,2022-04-14T16:10:02Z
Toyota (TM) to Recall 460K Vehicles Over Software Glitch,2022-04-14T16:26:00Z
How Tesla Stock Can Be Overvalued And Substantially Undervalued At The Same Time,2022-04-14T16:46:26Z
"Twitter gave rise to Elon Musk's fame, and amplified his ideas",2022-04-14T16:57:00Z
Does The 'Future Of Civilization' Depend On Twitter? Here's What Elon Musk Says,2022-04-14T19:05:00Z
"Why Cathie Wood Says Nio, Xpeng Could Be Immune To Chinese Regulatory Crackdown",2022-04-14T19:22:55Z
Stocks fall Thursday ending holiday week lower; Twitter sheds 1.7% after Musk bid,2022-04-14T20:35:00Z
Elon Musk's 11 Most Retweeted Tweets,2022-04-14T21:32:10Z
Most Indexes End Shortened Week Lower; Twitter Board Meets,2022-04-14T23:23:00Z
CATL to partner with Indonesian state companies on $6 billion EV battery project,2022-04-15T02:42:00Z
Twitter: A Musk Deal,2022-04-15T06:18:48Z
"Tesla Sees Price Target Upped To $4,600 At Cathie Wood's Ark On Bullishness Surrounding This Service's Launch",2022-04-15T06:53:44Z
Indian EV Entrepreneur Adopts Elon Musk's Strategy: Devote More Time On Engineering And Leave Operations To Others,2022-04-15T06:54:52Z
"Why Is Dogecoin Going Up With Bitcoin, Ethereum Firmly In The Red?",2022-04-15T08:51:53Z
Tesla Backpack Inspired By Cybertruck Design Seems To Be In The Cards,2022-04-15T10:05:26Z
Why Is Everyone Talking About Electric Vehicle Stocks?,2022-04-15T11:31:00Z
"Twitter CEO Said To Tell Employees Amid Elon Musk Offer: Company Bigger Than 'One Human, Any Human'",2022-04-15T11:40:00Z
Elon Musk wants to buy Twitter in a deal valuing the social-media company at more than $43 billion,2022-04-15T11:58:00Z
Shopify Stock Split: The Real Reason It Matters,2022-04-15T12:05:00Z
Growth vs. Value Investing: The Winning Strategy Might Surprise You,2022-04-15T12:15:00Z
"Biden talks up domestic manufacturing's role in fighting inflation, but some economists aren't buying it",2022-04-15T12:27:00Z
"Robinhood CEO Details How Dogecoin Can Be The Future Currency Of The Internet, Elon Musk Weighs In",2022-04-15T12:29:07Z
My Top Stock Split Growth Stock to Buy Right Now,2022-04-15T13:13:00Z
Is Now the Time to Buy Electric Vehicle Stocks?,2022-04-15T13:21:00Z
Goldman Sachs Is Advising Twitter On Elon Musk's Offer: Here's What The Tesla CEO Had To Say,2022-04-15T13:39:54Z
Lessons For Elon Musk: 5 Notorious Failed Hostile Takeovers,2022-04-15T13:59:55Z
Tesla's Giga Shanghai To Resume Operation Beginning Monday Following Protracted Shutdown: Report,2022-04-15T16:19:16Z
Tesla's Optimus Robot Could Arrive As Soon As EV Full Self-Driving,2022-04-15T16:53:51Z
Elon Musk embodies the quality people hate most in a boss,2022-04-15T16:53:54Z
Twitter Takes The Poison Pill: Here's What It Means For Elon Musk And Shareholders,2022-04-15T17:39:59Z
