title,published_utc
"EV Roundup: Tesla (TSLA) Q1 Earnings Smasher, Toyota (TM) $383M Outlay & More",2022-04-25T13:40:00Z
"Auto Roundup: Sneak Peek Into TSLA, GPC, LAD, AN & CVNA's Q1 Results",2022-04-25T14:02:00Z
Deleting Twitter under Musk’s ownership is the new moving to Canada,2022-04-25T14:28:38Z
Tech Titans Are Poised To Report,2022-04-25T14:35:00Z
Jack Dorsey: Twitter board  has 'consistently been the dysfunction of the company’,2022-04-25T15:38:00Z
Why Dogecoin Is Rising Today,2022-04-25T16:05:29Z
Why Tesla Shares Dropped Monday,2022-04-25T16:23:02Z
"As Musk-Twitter M&A Continues To Heat Up, This Obscure Memecoin Surges 10,800%",2022-04-25T17:20:39Z
"Dogecoin jumps 17%, outperforms bitcoin, as supporters count on Musk to make Twitter more ‘doge-friendly’",2022-04-25T18:09:00Z
"Musk Is Now Twitter's Big Bird, Multiple Reports Say",2022-04-25T18:14:58Z
"Takeover Secured: Elon Musk, The World's Richest Person, To Buy Twitter For $44B",2022-04-25T18:55:39Z
Dogecoin Soars As Musk Strikes Twitter Deal: Where's The Crypto Headed Next?,2022-04-25T19:34:37Z
#RIPTwitter? These numbers show the company has plenty of life,2022-04-25T19:54:00Z
An Orange Ray Of Light For Truth Social? Trump Says 'No' To Twitter Return Despite Musk News,2022-04-25T20:21:05Z
"Even if Musk let Trump back on Twitter, Trump says he's not interested",2022-04-25T20:32:00Z
Twitter (TWTR) Approves Sale to Elon Musk for $54.20/Share,2022-04-25T21:23:00Z
Twitter + Elon = Twitterverse Eruption: How The Social Media Platform's Denizens Reacted To Musk Buyout,2022-04-25T21:59:54Z
Twitter CEO Says No Job Cuts Planned Until Elon Musk's $44B Takeover Closes,2022-04-26T00:52:03Z
"GM to make hybrid Corvette, teases a fully electric version",2022-04-26T00:56:00Z
"Bitcoin, Ethereum Rebound, Dogecoin Outperforms On Musk's Twitter Takeover: Why Crypto Analysts Are 'Cautiously' Bullish",2022-04-26T01:07:17Z
"No Knights Came To Twitter's Rescue As Musk Swooped Down, 'Soap Opera' Now Over, Says Analyst",2022-04-26T02:03:46Z
Cathie Wood Trims Tesla Stake By Another $8.2M Amid Elon Musk's Twitter Takeover,2022-04-26T02:34:57Z
'Everything In Its Right Place:' Jack Dorsey Reacts To Elon Musk's Twitter Takeover,2022-04-26T03:28:09Z
"Why Nio, Other EV Peers Are Trading Higher In Hong Kong Today",2022-04-26T04:34:03Z
Fisker CEO Disappears From Twitter As Elon Musk Seals Takeover,2022-04-26T04:40:54Z
"Twitter Agrees To $44 Billion Takeover From Elon Musk: What To Know, And What To Do",2022-04-26T05:21:42Z
Twitter Workers In 'Dark' Will Get Opportunity To Get Answers From Elon Musk,2022-04-26T05:36:57Z
"Tesla: Best EV Stock, But Not At This Price",2022-04-26T06:00:38Z
"Nio Rolls Out 200,000th EV In Record Time, Says On Track With 2022 Plans",2022-04-26T06:00:44Z
Here's How Much Twitter CEO Could Walk Away With If Elon Musk Shows Him The Door,2022-04-26T07:37:52Z
Using Tesla As Collateral To Buy Twitter,2022-04-26T07:41:17Z
Why Jack Dorsey and Elon Musk changed their CEO titles,2022-04-26T08:00:22Z
Warren Buffett-Backed BYD's Flagship Han EV Sedan Drives Into Brazil: What You Need to Know,2022-04-26T08:12:57Z
White House Declines Comment On Elon Musk's Twitter Buyout But Says Wider Social Media Concerns Remain,2022-04-26T08:16:45Z
Dogecoin And Shiba Inu See 400% Surge In Large Transactions,2022-04-26T08:39:50Z
Bill Ford Says F-150 Lightning 'Most Important' Launch Of His Career,2022-04-26T09:36:59Z
Jack Dorsey In For $978M Payday Once Elon Musk Completes Twitter Takeover,2022-04-26T09:43:19Z
"If You Invested $100 In Dogecoin When Elon Musk Made His Twitter Offer, Here's How Much You'd Have Already",2022-04-26T09:58:44Z
Musk's Twitter Bid Turned It Into A 'Trading Sardine'; Is It Good For The Company?,2022-04-26T10:15:00Z
Tech Sell-Off: 1 Stock-Split Stock to Buy Now and Hold Forever,2022-04-26T10:37:00Z
"Texas Governor Wants Elon Musk To Bring Twitter Near Tesla, SpaceX In His State",2022-04-26T10:46:13Z
Floki Inu Vs. London: Meme Coin Named After Elon Musk's Pet Launches 'Aggressive' Ad Campaign In UK,2022-04-26T11:06:01Z
This Dominant Manufacturer Could Offer Shelter in a Market Storm,2022-04-26T11:25:00Z
India's Top Transport Leader Says Tesla Welcome To Make EVs In India — But Importing From China Is A Deal-Breaker,2022-04-26T11:27:42Z
Jeff Bezos Raises The China Question As Elon Musk Inks Twitter Deal,2022-04-26T11:37:00Z
Twitter Has Often Faced Regulatory Heat In India — Minister Hints Elon Musk Takeover Won't Change This Overnight,2022-04-26T11:52:37Z
It looks like nothing will stop Elon Musk from owning Twitter,2022-04-26T11:54:00Z
"Shareholders push for more board diversity at Tesla, Google, Wells Fargo and Home Depot",2022-04-26T11:57:00Z
Dogecoin Daily: It's A Musky-Musk-Musk Day,2022-04-26T11:59:39Z
Reaction to Twitter and Musk split along party lines ---'An encouraging day for free speech' or 'a platform where only the loudest can be heard'?,2022-04-26T12:13:00Z
Twitter agrees to be bought by Elon Musk for $44 billion,2022-04-26T12:15:00Z
A Big Tech encore and Twitter showdown will shape biggest week of earnings season,2022-04-26T12:24:00Z
Could Rivian Become the Next Tesla?,2022-04-26T13:03:00Z
"Stock Market News for Apr 26, 2022",2022-04-26T13:28:00Z
"A secular bear market is here, says this money manager. These are the key steps for investors to take now.",2022-04-26T13:47:00Z
3 Top Auto Stocks to Buy for the Long Haul,2022-04-26T14:17:00Z
Analysis: Will Elon Musk's Twitter Kowtow To Chinese Communist Party Influence?,2022-04-26T14:56:30Z
How to delete your Twitter account if Elon Musk’s takeover bid pushes you to sign off,2022-04-26T14:57:00Z
Why Tesla Stock Just Crashed 7%,2022-04-26T15:32:28Z
"Lyft, Unilever, JLL and dozens more companies want Congress to break stalemate on clean energy before midterm elections",2022-04-26T16:10:00Z
'Soap Opera Ends': Analysts React To Musk's Twitter Buyout,2022-04-26T17:11:50Z
Will Tesla shed value after Gates’ huge short position on the stock?,2022-04-26T18:23:04Z
Twitter's board accepts Elon Musk's offer --- and users are either celebrating 'free speech' or saying 'RIP Twitter',2022-04-26T18:29:00Z
5 People Richer Than Warren Buffett (For Now),2022-04-26T18:29:21Z
300M Dogecoin Moved In One Go As Market Enthusiasm Sends Whales Into Frenzy,2022-04-26T19:07:43Z
Elon Musk's Twitter gambit is another reminder that America's billionaires need to pay more in taxes,2022-04-26T19:33:00Z
Could Elon Musk Face A Margin Call On His Tesla Shares?,2022-04-26T20:06:42Z
"Nasdaq Falls 4% As Tesla, AMD Take A Big Slide",2022-04-26T20:22:34Z
Elon Musk Tries To Explain His Approach To Twitter Moderation,2022-04-26T21:43:35Z
Deja Vu All Over Again? Market Fears Harsh Fed Moves,2022-04-26T22:02:00Z
Fighting Loneliness And Finding Happiness: Elon Musk Sets His Sights On Mars,2022-04-26T22:22:33Z
Why Musk's Twitter Bid Was Accepted Just 10 Days After Poison Pill Activation,2022-04-26T23:23:00Z
Fisker CEO Defends Twitter Exit After Musk Takeover: Here's What He Has To Say,2022-04-27T01:23:46Z
Here's How Much Elon Musk Will Have To Shell Out If He Changes His Mind On Buying Twitter,2022-04-27T02:59:38Z
Coinbase CEO: Elon Musk Buying Twitter Is A 'Great Win' For Free Speech,2022-04-27T03:47:08Z
"Nio, Xpeng Fall, Li Auto Rises: What's Moving Hong Kong EV Stocks Today?",2022-04-27T04:28:29Z
S&P 500: Expect Lower Prices; What The Market Is Saying About The Twitter Deal,2022-04-27T04:40:00Z
"Tesla Rival Lucid Bags Deal To Sell 100,000 EVs To Saudi Arabia",2022-04-27T04:56:01Z
"Elon Musk Notes Donald Trump's Truth Social Trouncing Twitter, TikTok On Apple's App Store",2022-04-27T05:20:54Z
Why I Sold Tesla And Bought Ford,2022-04-27T06:28:51Z
"Elon Musk's SpaceX, NASA Gear Up To Send Crew-4 Astronauts To Space Later Today",2022-04-27T06:42:55Z
Twitter Acquisition Impacting Tesla Stock: What Investors Should Know,2022-04-27T07:39:19Z
"Elon Musk Can't Badmouth Twitter Or Its Representatives, Takeover Deal's Terms Dictate",2022-04-27T07:39:27Z
Tesla Cushions Downside For Battery Supplier LG Energy Solution In Q1: What You Need to Know,2022-04-27T09:15:36Z
"GM To Spend $2B On Self-Driving Startup Cruise This Year, Just A Permit Away From Charging Customers",2022-04-27T09:35:30Z
Here's What Tesla Bears Miss About Its Future,2022-04-27T10:15:00Z
Warren Buffett Loses World's 5th Richest Position To Indian Energy Tycoon — Bill Gates Could Be Next,2022-04-27T10:21:30Z
Cathie Wood Sits Out Tuesday's Dip In Tesla As Stock Loses $126B In Value Amid Musk's Twitter Deal,2022-04-27T10:23:30Z
Ford Reveals Another Electric Truck In The Works; CEO Says Gearing To Disrupt Tesla's EV Dominance,2022-04-27T10:36:17Z
Teen Tracking Elon Musk's Jet Shares Backup Plan 'Just In Case' His Twitter Account 'Disappears',2022-04-27T10:44:48Z
ARKK Innovation Fund Down 65% From All Time High; Tesla Remains Biggest Bet,2022-04-27T11:33:00Z
Should You Buy Tesla Ahead of Its Stock Split?,2022-04-27T11:40:00Z
Twitter credit faces a 'multiple-notch' downgrade as Musk's buyout leads to significant spike in debt,2022-04-27T11:59:00Z
"1 Cryptocurrency With 5,400% Upside, According to Cathie Wood",2022-04-27T12:10:00Z
"If Elon Musk and Twitter don't complete their deal, one of them will have to pay $1 billion",2022-04-27T12:11:00Z
"Musk is no stranger to juggling, but is Twitter going to take too much attention from Tesla?",2022-04-27T12:30:00Z
2 Undervalued EV Stocks You Can Buy and Hold for the Next Decade,2022-04-27T12:45:00Z
Why Tesla Is Worth the Risk,2022-04-27T13:03:00Z
These 21 large-cap stocks have now crashed at least 50%,2022-04-27T13:20:00Z
5 ETFs That Tumbled Most on Apr 26 Market Sell-Off,2022-04-27T15:15:00Z
Why Tesla Is My Top Electric Car Stock to Buy and Hold,2022-04-27T15:17:15Z
"Tesla stock up 3%, EV maker recovers some of the $126 billion of market cap lost this week",2022-04-27T16:02:00Z
Why Tesla Stock Is Bouncing Back Today,2022-04-27T16:34:13Z
"Some Celebrities Leave Twitter, Other Notables Return: What Investors Should Know",2022-04-27T18:53:59Z
Tech Analyst Beth Kindig Talks About Finding Stock Opportunities,2022-04-27T19:36:48Z
"Top Stock Reports for Tesla, Medtronic & IBM",2022-04-27T20:37:00Z
"Dow, S&P 500 eke out gains but Nasdaq slips after booking biggest dive since 2020",2022-04-27T20:39:00Z
Base Model Y Delivery Dates Slip Further Into 2023: Here's How Long You'll Have To Wait,2022-04-27T21:36:11Z
11 Largest Leveraged Buyouts Of All Time,2022-04-27T22:09:54Z
"Elon Musk didn't break the law in Tesla's SolarCity takeover, judge rules",2022-04-27T22:48:00Z
Why Elon Musk Thinks Twitter Has To Upset The Far Right And Left Equally,2022-04-28T00:51:24Z
Elon Musk Says Twitter Should Have This Signal-Like Feature To Ensure Privacy,2022-04-28T02:01:24Z
"Why Nio, Xpeng Are Pushing EV Stocks Higher In Hong Kong Today",2022-04-28T04:20:19Z
Elon Musk Said To Have Clinched Victory In SolarCity Takeover Shareholder Lawsuit,2022-04-28T04:36:57Z
The Trouble For Big Tech Stocks In 2 Charts,2022-04-28T04:48:00Z
Ford CEO Jim Farley Seeks 'Smart Deals' With Mining Industry Amid Soaring Metal Prices,2022-04-28T05:35:26Z
Warren Buffett-Backed Chinese EV Maker BYD More Than Triples Earnings In Q1,2022-04-28T06:28:33Z
"Elon Musk Tweets He'll Buy Coca Cola Next To 'Put Cocaine Back In,' But Admits He Can't Pull Off This McDonalds 'Miracle'",2022-04-28T08:12:59Z
SpaceX Successfully Docks Crew-4 Astronauts With International Space Station 16 Hours After Taking Flight,2022-04-28T08:22:13Z
3 Stocks That Could Be Worth More Than Tesla by 2030,2022-04-28T09:06:00Z
Ford Plans More Price Hikes As It Sees $4B Commodity Headwinds This Year,2022-04-28T09:07:52Z
Is Elon Musk's Twitter Buyout a Done Deal?,2022-04-28T09:47:00Z
"The Zacks Analyst Blog Highlights Tesla, Medtronic, IBM, Lowe's Companies and Intuitive Surgical",2022-04-28T09:50:00Z
Tesla Could See 50% Revenue Growth in Next Few Years,2022-04-28T10:00:00Z
Should You Invest in the Consumer Discretionary Select Sector SPDR ETF (XLY)?,2022-04-28T10:20:07Z
Will Tesla Live Up to Its Trillion Dollar Valuation?,2022-04-28T10:45:00Z
3 Top EV Stocks Ready for a Bull Run,2022-04-28T11:07:00Z
3 Companies Leading Tesla in Autonomous Driving,2022-04-28T11:30:00Z
"Nikola Begins Production, Shipment Of Electric Semi Trucks A Year Ahead Of Tesla",2022-04-28T11:34:00Z
"FCC Has No Authority To Block Elon Musk's Twitter Purchase, Commissioner Carr Says",2022-04-28T11:34:56Z
Twitter Founding Team Member: Elon Musk's Free Speech Approach 'Very Naïve And Unserious',2022-04-28T11:48:37Z
Is the S&P 500 All You Need to Retire a Millionaire?,2022-04-28T12:10:00Z
1 Growth Stock Down 65% to Buy Right Now,2022-04-28T12:25:00Z
Tesla Is The Most Overvalued Car Company Ever,2022-04-28T12:30:00Z
Musk's bid to end SEC settlement deal over Tesla tweets is denied,2022-04-28T12:38:00Z
1 Cryptocurrency I'd Buy Right Now,2022-04-28T12:45:00Z
Tesla Did It Again: Another Record Quarter,2022-04-28T12:55:00Z
"Boomers are leaving the stock market. Here's what comes next, says this strategist.",2022-04-28T14:11:00Z
Why Tesla Stock Is Sinking Today,2022-04-28T14:36:05Z
A Former Twitter CEO Goes Off On Musk's Tweets About Vijaya Gadde: What You Need To Know,2022-04-28T15:37:34Z
Tesla Stock Is Falling Today: Is It Time to Buy?,2022-04-28T16:20:31Z
"Netflix, Tesla, Twitter. Investors Have a Lot to Talk About.",2022-04-28T16:29:10Z
250M DOGE Move In One Go: Will The Whales Ever Calm Down?,2022-04-28T16:42:27Z
"Tesla stock looking at 15% weekly loss, Twitter stock stays below Musk's offer",2022-04-28T17:10:00Z
"Elon Musk Has Lost More In The Last Week Than The Value of eBay, Coinbase and These Other Companies",2022-04-28T18:12:29Z
What Elon Musk's Twitter Deal Says About His Wealth,2022-04-28T19:22:54Z
"Elon Musk wants to make Twitter ‘maximum fun’. Here’s what Cathie Wood, Anthony Scaramucci and Sam Bankman-Fried are saying",2022-04-28T20:40:00Z
Why Are Dolly Parton And Elon Musk Trending Together On Twitter?,2022-04-28T22:19:04Z
Cathie Wood Sells $8.8M More Of Tesla Stock On The Dip Amid Elon Musk's Twitter Deal Funding Concerns,2022-04-29T01:30:15Z
"BREAKING: Elon Musk Sells $3.9B Of Tesla Shares, Says No 'Further Sales' Planned",2022-04-29T02:26:09Z
SpaceX's Falcon 9 To Launch Another 53 Starlink Satellites On Friday,2022-04-29T03:03:58Z
Elon Musk sells nearly $4 billion in Tesla stock following Twitter deal,2022-04-29T03:55:00Z
"Why Nio, Other EV Peers Are Slipping In Hong Kong Today",2022-04-29T04:45:14Z
"Elon Musk Talked Twitter Job Cuts, Monetizing Posts With Bankers To Boost Profits: Report",2022-04-29T05:17:49Z
"'I'M BACK:' Donald Trump Returns Online On TRUTH Social, Sends Digital World SPAC Stock Soaring",2022-04-29T05:39:57Z
"Is The S&P Finally Buyable? Plus What To Do With Netflix, Tesla And Amazon",2022-04-29T06:33:00Z
Here are the top 10 electric cars of the year,2022-04-29T09:02:00Z
"Volkswagen Aims To Install 8,000 EV Fast-Charging Spots In Europe By 2024",2022-04-29T09:21:32Z
5 Stocks to Buy At Lucrative Valuation After April Mayhem,2022-04-29T12:05:00Z
Tesla And 2 Other Stocks Insiders Are Selling,2022-04-29T12:14:03Z
"Twitter earnings underscore need for Elon Musk to take 'more short-term risks,' analyst says",2022-04-29T12:26:00Z
GM's Q1 lobbying spending was its highest ever for a quarter,2022-04-29T12:38:00Z
Could Elon Musk Really Be 'The Simpsons' Villain Hank Scorpio?,2022-04-29T12:39:30Z
"EXCLUSIVE: Dogecoin Co-Creator Billy Markus On The Negatives Of Cryptocurrency, NFTs And Elon Musk",2022-04-29T12:44:34Z
Is Lucid Group Stock a Buy?,2022-04-29T12:52:00Z
Legendary Investor Repeats Warning Of 'Mother Of All Crashes': Why We Aren't Worried,2022-04-29T13:00:00Z
"'So bad, it's good.' This beleaguered stock market has one big asset on its side, say strategists.",2022-04-29T13:49:00Z
These 2 Giants Have A Bullish Catalyst Moving Forward,2022-04-29T15:30:00Z
HOG vs. TSLA: Which Stock Is the Better Value Option?,2022-04-29T15:40:10Z
Why Tesla Stock Just Popped 5%,2022-04-29T16:23:31Z
Why Tesla Stock Plunged After Musk's Successful Bid for Twitter,2022-04-29T16:36:00Z
Solid User Growth of Twitter Masks Sales Miss: ETFs in Focus,2022-04-29T18:30:00Z
This Obscure Stock Has Outperformed Tech And EV Giants,2022-04-29T19:14:51Z
What Was Your 'A-Ha' Moment In The Markets?,2022-04-29T20:00:11Z
"Dow, S&P 500 book worst April since 1970 as U.S. stocks close sharply lower",2022-04-29T20:57:00Z
Taking Twitter Private Sounds Like a Good Idea,2022-04-29T21:10:00Z
Should you buy Tesla as it trades at a discounted valuation of $917.15?,2022-04-29T21:13:42Z
5 Stocks That Keep Beating the S&P 500,2022-04-30T10:00:00Z
"2 Reasons to Buy Snap, and 1 Reason to Hesitate",2022-04-30T11:09:00Z
Better Buy: Microsoft Stock or Every Nasdaq Stock?,2022-04-30T11:26:00Z
Many tech stocks that have crashed are still too expensive to buy,2022-04-30T11:29:00Z
Weekend reads: How companies and consumers fight inflation and handle shrinkflation,2022-04-30T11:29:00Z
Wall Street Breakfast: What Moved Markets,2022-04-30T12:29:15Z
"Musk can allow more objectionable content on Twitter, but he can't escape accountability completely",2022-04-30T14:48:00Z
Why Dogecoin Is Sinking Today,2022-04-30T20:38:51Z
Death to the car dealership — the Tesla sales model is poised to take over America,2022-05-01T01:09:00Z
How Rivian Sank Amazon's First Quarter of 2022,2022-05-01T11:00:00Z
"Facebook Whistleblower Optimistic About Musk's Twitter Move, Says He Can Take Feedback Better Than Zuckerberg",2022-05-01T12:39:15Z
"With Elon Musk’s Twitter bid, there’s more at stake than freedom of speech: 'It gives him a lot more influence over governments'",2022-05-01T15:26:00Z
'Back As Interim CEO Of Twitter:' Aave Crypto Founder Cracks Same Joke That Got Him Suspended After Account Is Restored,2022-05-02T00:40:08Z
"Tesla Updates Availability, Price Of Charging Accessories: What You Need to Know",2022-05-02T00:41:06Z
Ford To Steeply Hike Mustang Mach-E Prices In China This Week: Report,2022-05-02T02:02:31Z
"'Predatory' Cryptos: Wikipedia Stops Taking Bitcoin, Ethereum Donations",2022-05-02T02:46:05Z
"Elon Musk Ships Tesla Powerwalls To Ukraine For Ambulant Clinics, Draws Praise From Vice Premier",2022-05-02T03:10:15Z
Playing Elon Musk-Fave Video Game 'Elden Ring' With Children's Toy Controller? One Twitch Streamer Makes It Possible,2022-05-02T04:19:36Z
Ukraine Thanks Elon Musk With An NFT Portrait To 'Keep The Memory Forever',2022-05-02T05:02:29Z
Elon Musk's Mom Says Stock Surge Paid For Him To Move To Canada,2022-05-02T07:38:53Z
Tesla Giga Shanghai Production Rises To 80% On Easing COVID-19 Curbs,2022-05-02T07:52:35Z
"Zacks Investment Ideas feature highlights: Alphabet, Amazon and Tesla",2022-05-02T08:56:00Z
"April Market Wrap: After Miserable Month For Stocks, Have Equities Bottomed?",2022-05-02T08:59:00Z
What is a VinFast VF 8 and what's it like to drive one?,2022-05-02T09:00:00Z
The 10 bestselling EVs in 2022 so far,2022-05-02T09:03:00Z
Elon Musk Thinks This Energy Source Will Be World's Preferred Choice,2022-05-02T09:35:35Z
"The Zacks Analyst Blog Highlights Tesla, Pool, Alcoa, Zebra Technologies and SVB Financial Group",2022-05-02T09:56:00Z
"Cathie Wood Finds Elon Musk's Comment On Psychedelics, Ketamine An 'Interesting Thesis' For This Stock",2022-05-02T10:01:50Z
"Elon Musk's Investment Advice, Tesla Giga Shanghai Update, Warren Buffett's Bitcoin Bashing And More: 5 Key Stories You May Have Missed From This Weekend",2022-05-02T10:29:15Z
Big US Pension Fund Raised Stake In Tesla And This Automaker In Q1,2022-05-02T11:06:02Z
Indian Auto Giant Relied Out 'DIY' To Whip Out First EVs — Now It Commands A 90% Market Share Of A Burgeoning Market,2022-05-02T11:23:04Z
5 Top Stocks Likely to Beat Earnings Estimates,2022-05-02T11:39:00Z
Elon Musk Reacts To WSJ Report That 'Shadow Crew' Of Billionaires Including Peter Thiel Pushed Him To Buy Twitter,2022-05-02T11:47:39Z
Dogecoin Daily: Elon Musk Reacts To Mark Cuban's Idea And More,2022-05-02T12:04:53Z
Storied VC says investors are unlearning the lessons of the last bull market. Jeff Bezos says you should listen.,2022-05-02T13:36:00Z
Peak Earnings Season: Energy Stocks Set To Report Big Profits,2022-05-02T14:03:00Z
"NIO, Li Auto deliveries fall in April due to COVID-19 resurgence, but stocks swing higher",2022-05-02T14:13:00Z
"Twitter shares are still below Musk's offer price for the company. Should you buy it cheaper now and make a tidy profit? Proceed with caution, experts say.",2022-05-02T14:24:00Z
Could China influence Twitter if Musk succeeds in buying the social-media platform? It would not be easy. Here’s why.,2022-05-02T14:32:00Z
"Why Tesla Stock Dropped, Then Popped on Monday",2022-05-02T15:46:37Z
"Biden speeding up EV lithium battery funding in response to Russia, supply-chain inflation ",2022-05-02T17:52:00Z
"ESG investing was intended to make the world a better place but has become a 'gravy train' for companies, says NYU valuation expert",2022-05-02T20:03:00Z
Why Rivian Stock Gained Momentum on Monday,2022-05-02T20:03:11Z
All The Meme Gold From Elon Musk's Latest Buying Excursion,2022-05-02T20:13:45Z
"10 Most-Searched Tickers On Benzinga Pro In April: Musk Mania, Apple Drops, Several Newcomers Move Up",2022-05-02T21:26:36Z
NYSE Or NASDAQ? Here's Why Stocks Get Listed,2022-05-02T22:38:25Z
Cathie Wood Sells Another $6.4M In Tesla — Adds To Stake In These 2 Stocks,2022-05-03T00:56:18Z
Rivian To Get $1.5B In Incentives For Planned Georgia EV Factory,2022-05-03T02:10:32Z
Elon Musk Plans Crusade On Twitter Spam And Bots — New Data Reveals The Size Of His Problem,2022-05-03T03:12:18Z
"Nio, Other China Tesla Rivals Fall: What's Weighing On Hong Kong EV Stocks Today",2022-05-03T04:41:06Z
"Roe V. Wade Leak Draws Reactions: Elizabeth Warren Says 'Not Going Back,' Bernie Sanders Wants Codification, And More",2022-05-03T04:41:15Z
"US To Spend Over $3B For Boosting EV Battery Production, Supply Chains",2022-05-03T07:27:10Z
"Tesla Confirms Annual Shareholder Meeting In August, Delays Proxy Filing: What This Means For Investors",2022-05-03T08:37:28Z
Elon Musk Just Gave Great Investing Advice You Should Absolutely Follow,2022-05-03T09:52:00Z
"Ford Says F-150 Lightning Has Even More Horsepower, Payload Capacity Than Promised",2022-05-03T10:24:03Z
Elon Musk Looks To Tie Up Less Of His Own Wealth Into Twitter Deal: Analyst Sees Tesla Stock Getting A Boost If This Materializes,2022-05-03T11:05:03Z
Elon Musk Says Will Try His Best to Retain Twitter Shareholders' Stake In New Private Company,2022-05-03T11:22:31Z
"2 Stock Split Stocks That Crushed Earnings, and 1 That Didn't",2022-05-03T11:45:00Z
"Ukraine Says Elon Musk's Starlink Providing 'Crucial Support,' Serving 150,000 Users Per Day",2022-05-03T11:51:32Z
"Elon Musk Says He Is On The 'Warpath' With Trolls, Wants Twitter To Be 'Broadly Inclusive'",2022-05-03T12:03:30Z
"Dogecoin Daily: Fed Meeting Weighs On Price, Dogefather Elon Musk And Co-Founder Create Social Buzz",2022-05-03T12:09:25Z
Why Investors Shouldn't Worry About EV Battery Prices -- Yet,2022-05-03T12:21:00Z
"Tesla asks for more time to file proxy, foiling hopes of fresh look into Musk's holdings",2022-05-03T12:31:00Z
Why Tesla Stock Plummeted 19% Last Month,2022-05-03T13:17:14Z
"Twitter Can Unlock 'Full Potential' If It Opens Up Algorithm To Third-Party Developers, Say Ark Analysts",2022-05-03T13:31:06Z
"Stocks may keep sliding until institutions join retail investors in capitulation, this firm says",2022-05-03T13:50:00Z
"Sonic (SAH) Earnings & Sales Miss Estimates in Q1, Up Y/Y",2022-05-03T14:31:00Z
"Group 1 (GPI) Earnings & Sales Top Estimates in Q1, Up Y/Y",2022-05-03T14:33:00Z
"Harley-Davidson (HOG) Q1 Earnings Lag Estimates, Fall Y/Y",2022-05-03T15:14:00Z
Cummins' (CMI) Q1 Earnings & Revenues Surpass Estimates,2022-05-03T15:56:00Z
Why This Trader Is Ignoring Elon Musk's Investing Advice,2022-05-03T16:10:16Z
Tesla Recalls And Replaces One Customer's Model X,2022-05-03T16:33:00Z
Why Tesla Stock Popped on Tuesday,2022-05-03T16:36:17Z
“Don’t Be Bearish.” The Inevitable End Of Bad Advice,2022-05-03T17:26:00Z
New Twitter Feature Allows Messages To A Circle Of Friends: Why Some Users Don't Like It,2022-05-03T20:29:40Z
Elon Musk says he could take Twitter public again in a few years,2022-05-03T20:59:00Z
Elon Musk Brings Mom As Date To Met Gala: What Happened Next?,2022-05-03T23:43:47Z
Elon Musk Will Return Twitter To Public Ownership In About 3 Years After Takeover: Report,2022-05-04T00:50:59Z
Tesla Bull Cathie Wood Makes This Singular Trade Ahead Of Key Fed Meeting,2022-05-04T02:34:55Z
Elon Musk's Brother Kimbal Met Ukraine Leaders To Discuss Rebuilding Projects 'After The War',2022-05-04T04:41:57Z
"Nio Down 1.6%, Xpeng Falls 3%: Why Hong Kong EV Stocks Are Slipping Today",2022-05-04T04:52:34Z
Why Snap Lost 21% in April,2022-05-04T05:12:34Z
Tesla Confirms Plans For New Shanghai Plant That Would Double China Capacity,2022-05-04T06:27:33Z
No More Free Twitter? Elon Musk Says These Types Of Users May Have To Shell Out Money To Use The Platform,2022-05-04T06:51:37Z
"Analyst Significantly Lowers Delivery, Profit Estimates For Nio Rival Li Auto: What You Should Know",2022-05-04T09:08:18Z
Elon Musk Bashes Apple Once Again — Says iPhone Maker Imposes '30% Tax On The Internet',2022-05-04T09:21:10Z
Tesla's Model Y Zips Past Sibling Model 3 As Best-Selling EV In Q1: Report,2022-05-04T09:42:52Z
Bitcoin Traders Fooled On 'Buy The Dip' Calls: This Signal Shows Best Time To Enter,2022-05-04T09:48:55Z
Is Elon Musk Moving the Goalposts for His Twitter Deal?,2022-05-04T09:51:00Z
"Another 40,000 Dogecoin Holders Exit At $0.12",2022-05-04T09:56:31Z
"Biden brings key quantum tech group under White House authority, with hopes for faster EV charging and more",2022-05-04T11:07:00Z
Elon Musk Causes Sudden Surge In ApeCoin As He Changes Twitter Profile Picture To BAYC,2022-05-04T11:12:33Z
Elon Musk suggests 'slight cost' for Twitter's commercial and government users,2022-05-04T11:59:00Z
