title,published_utc
3 Growth Stocks You Can Buy and Hold for the Next Decade,2022-05-04T12:05:00Z
Markets are primed for how Powell will respond to this key question on interest rates,2022-05-04T12:39:00Z
"Lear (LEA) Tops Q1 Earnings Estimates, Lowers '22 Guidance",2022-05-04T13:45:00Z
"BorgWarner (BWA) Q1 Earnings Top Estimates, Decline Y/Y",2022-05-04T13:59:00Z
"Meritor (MTOR) Q2 Earnings & Sales Top Estimates, Increase Y/Y",2022-05-04T14:00:00Z
Why electric cars are getting pricier even as batteries get cheaper,2022-05-04T15:13:59Z
Why Tesla Stock Dropped This Morning,2022-05-04T16:34:46Z
Elon Musk Invited Before UK Parliament To Discuss Twitter Takeover,2022-05-04T17:24:21Z
"U.S. new-car sales seen slightly higher in April, but tight inventories and rising prices will keep a lid on any big jumps",2022-05-04T18:17:00Z
Is Ford Using A Word Created By Elon Musk In Latest Advertising Campaign?,2022-05-04T23:21:19Z
Flights To Hawaii Could Include Starlink On Board Soon,2022-05-04T23:32:50Z
Bill Gates says Elon Musk's approach to misinformation could make Twitter worse,2022-05-05T00:25:00Z
'Massive Misallocation' Of Capital: Cathie Wood Joins Elon Musk To Find Fault With Passive Investment,2022-05-05T02:12:46Z
Bill Gates Says Shorting Tesla Not A Statement About Climate Change,2022-05-05T04:33:39Z
"Why Nio, Other EV Peers Are Shooting Up In Hong Kong Today",2022-05-05T04:40:58Z
Bill Gates Takes Swipe At Elon Musk Over Twitter Acquisition: 'He Actually Could Make It Worse',2022-05-05T05:22:41Z
Tesla Battery Supplier CATL's Stock Tumbles As Profit Falls 24% On High Raw Material Costs,2022-05-05T08:02:19Z
Can Apple Be The New Tesla - Smartphone On Wheels By 2025?,2022-05-05T09:08:11Z
Yuga Labs Refunds Failed Transactions After $150M Ethereum 'Wasted Fees' From NFT Sale,2022-05-05T09:18:15Z
How to Buy Tesla for the Cost of a Penny Stock,2022-05-05T09:30:00Z
Elon Musk's Starlink Now Lets You Take Your Internet Connection Anywhere Within US — But It Comes At A Cost,2022-05-05T09:32:22Z
Russian Rocket Body Shatters Into 16 Pieces In Space,2022-05-05T09:58:37Z
"Ford Mach-E EV Sales Nearly Double In April, Gas-Powered Mustang Struggles",2022-05-05T10:10:46Z
Twitter Faces Advertiser Skepticism At New York Event Ahead Of Elon Musk Takeover,2022-05-05T10:36:29Z
Twitter Offshoot Bluesky Releases Early Code For Decentralized Social Network,2022-05-05T10:57:58Z
Is It Time to Buy the Nasdaq's 3 Worst Performing April Stocks?,2022-05-05T11:35:00Z
"Elon Musk suggested getting into the lithium business, and these surging stocks show why",2022-05-05T11:43:00Z
Elon Musk Bags Over $7B In Twitter Deal Financing,2022-05-05T12:03:07Z
"Elon Musk says Larry Ellison, Binance, Sequoia will now help fund Twitter bid",2022-05-05T12:48:00Z
'This Is What's Going To Happen Next': Ross Gerber Reveals Tesla's Next Big Move,2022-05-05T13:06:15Z
Should Tesla Shareholders Be Worried About Elon Musk's Twitter Purchase?,2022-05-05T13:36:56Z
Rivian Stock Is Starting to Look Attractive,2022-05-05T13:49:00Z
"This trader predicted the bond meltdown, tech selloff and oil's surge. Here's what she says is coming next.",2022-05-05T13:55:00Z
"CNH Industrial (CNHI) Q1 Earnings Top Estimates, Down Y/Y",2022-05-05T14:00:00Z
Why Tesla Stock Crashed Today,2022-05-05T15:30:59Z
The Timing of Tesla's Stock Split Could Be in Jeopardy,2022-05-05T16:33:39Z
Why Twitter Shares Rose 27% (but not 40%) Last Month,2022-05-05T17:00:32Z
Money Talks? The Link Between Congressional Stock Trading And Corporate Lobbying,2022-05-05T18:45:49Z
"Rate hikes and stock sell-off? Here's what it means for your retirement portfolio, and whether you should add crypto into it",2022-05-05T19:22:00Z
"Dow ends nearly 1,100 points lower and Nasdaq sheds 5%, marking its worst day in two years",2022-05-05T20:44:00Z
Another Elon Musk Biography Coming: Here's Which Company Is Behind It,2022-05-05T22:33:12Z
Nio Announces Secondary Listing In Singapore Amid Fears Of US Expulsion,2022-05-06T00:52:52Z
Cathie Wood Cuts Twitter Stake By 85% As Elon Musk Bulks Up Takeover Financing — Also Trims Tesla,2022-05-06T02:23:34Z
"Why Nio, Other EV Peers Are Nosediving In Hong Kong Today",2022-05-06T04:48:52Z
"Tesla Raises Model Y Prices Again In Canada Amid Inflation, Supply Chain Woes",2022-05-06T06:58:46Z
SpaceX Said To Be Planning Starship Test Flight Soon Amid FAA Aproval Delay,2022-05-06T07:15:00Z
LFG Surpasses Tesla To Become Second Largest Corporate Bitcoin Holder,2022-05-06T07:30:24Z
Is Tesla Stock An Even Riskier Bet After Elon Musk's Twitter Deal?,2022-05-06T07:46:00Z
Tesla Battery Supplier CATL Said To Actively Explore Sites For US Manufacturing Plants,2022-05-06T07:51:36Z
Tesla's India Team Shifts Focus To Wider APAC Region Amid Regulatory Woes,2022-05-06T09:02:49Z
Elon Musk's $400M Backing From a16z For Twitter Also Brings Facebook In The Picture,2022-05-06T09:23:08Z
"Lucid To Hike EV Prices From June, Sticks To Lowered 2022 Target As Supply Issues Linger",2022-05-06T09:43:55Z
Shopify Stock: Bull vs. Bear,2022-05-06T10:30:00Z
"Elon Musk Linking Up Twitter Deal Funds With Larry Ellison, Others 'Smart And Strategic,' Says Analyst",2022-05-06T10:47:40Z
Tesla: Overvalued By 85.26% And Not A Technology Company,2022-05-06T12:30:00Z
"Tenneco (TEN) Q1 Earnings Miss, Revenues Surpass Estimates",2022-05-06T12:38:00Z
"Investors Heavily Search Tesla, Inc. (TSLA): Here is What You Need to Know",2022-05-06T13:00:07Z
2 Top EV Stocks Ready for a Bull Run,2022-05-06T13:28:00Z
Why Grimes And Elon Musk Had To Rename Their Baby,2022-05-06T16:03:10Z
Fundamentals Of U.S. Stocks Dominating Major Indices Are More Important Than Ever,2022-05-06T16:14:00Z
Did Donald Trump Tell Elon Musk To Buy Twitter? Here's What The Tesla CEO Says,2022-05-06T18:55:57Z
Defense Wins Ballgames; 3 Stocks That Will Bulletproof a Portfolio,2022-05-06T18:59:00Z
Hardware Updates Noted For The Model S On Tesla's Website,2022-05-06T19:10:49Z
Why Tesla Stock Was Slumping on Friday,2022-05-06T20:07:00Z
3 Simple Risk Management Rules To Stop Losing Money On Tesla,2022-05-06T20:15:23Z
"People Really Want To Work At Twitter After Elon Musk Buyout, Including This Celebrity",2022-05-06T20:39:47Z
"No, Elon Musk Didn't Ask Out Sky Ferreira At Met Gala And Get Rejected",2022-05-07T05:56:54Z
"Got $3,000? 3 Growth Stocks to Double Up On Right Now",2022-05-07T10:26:00Z
3 Reasons Why Cathie Wood Is an Excellent Stock Picker but Warren Buffett Is a Better Investor,2022-05-07T11:15:00Z
Gates on Musk's Tesla: 'There's a difference between electric cars being adopted and companies becoming infinitely valuable',2022-05-07T12:14:00Z
5 Stocks That Moved the Market in April,2022-05-07T12:32:00Z
Lawsuit May Delay Elon Musk's Twitter Takeover: Here's What You Need To Know,2022-05-07T13:35:46Z
"'Bubble stocks popped' but it's still not safe to buy them, says Ray Dalio, founder of world's biggest hedge fund",2022-05-07T14:31:00Z
"Becoming Homeless, Jobless For Bitcoin: Why Binance CEO CZ's Mom Dubbed Him 'Stupid Kid'",2022-05-07T18:03:14Z
Here Is How Elon Musk Aims To Quintuple Twitter's Revenue By 2028,2022-05-07T18:24:53Z
"Bond Market Woes, And Forward S&P 500 Earnings Weakened A Little",2022-05-08T04:49:00Z
Will Amazon and Tesla Bounce Back With Their Upcoming Stock Splits?,2022-05-08T09:57:00Z
3 Meme Stocks That Are Actually Solid Long-Term Picks,2022-05-08T11:55:00Z
Does Berkshire Hathaway Think Progressive Is a Better Auto Insurer Than GEICO?,2022-05-08T12:30:00Z
NFT Market Valuation to Rise To Over $13B By 2027: Report,2022-05-08T14:06:29Z
Is Lucid Group Stock a Buy Now?,2022-05-08T14:48:00Z
"Despite Friday's Swoon, We're At A Bottom; Buy These Beaten Down Big Cap Tech Stocks",2022-05-09T03:40:00Z
Ethereum Creator Vitalik Buterin Urges Elon Musk To Support 'Non-Intrusive' Anti-COVID Tech,2022-05-09T03:48:54Z
WeChat Gives Cues On Why Elon Musk's Ambitious Twitter Revenue Plan Is 'Achievable:' Analyst,2022-05-09T05:08:55Z
"If your car’s lease is coming to an end, buying it is probably a smart move",2022-05-09T09:03:00Z
Is Direxion NASDAQ100 Equal Weighted Index Shares (QQQE) a Strong ETF Right Now?,2022-05-09T10:20:05Z
"Tesla A Decade Away From Hitting Full EV Autonomy, China Future Uncertain, Says Morgan Stanley Analyst",2022-05-09T11:10:37Z
"Why Tesla Bull Cathie Wood Is Betting This Stock, Dubbed 'Stay At Home' Play By Many, Will Win Big",2022-05-09T11:15:53Z
"Tesla Received 3M Job Applications In 2021, Plans To Ramp Up Hiring At New Factories This Year",2022-05-09T11:31:17Z
Dogecoin Crashing Hard Today But Its Mascot Dog Is Having A Sound Sleep,2022-05-09T11:47:01Z
"Long-Time Bitcoin Bear Offers $1,000 To Every Retweeter If His Prediction Of BTC Hitting $10K In 2022 Goes Wrong",2022-05-09T11:52:40Z
"Elon Musk pitch deck for Twitter promises to nearly triple ad revenue, create $10 billion subscription business: report",2022-05-09T11:59:00Z
Is Tesla Doomed If Elon Musk Buys Twitter?,2022-05-09T12:45:00Z
"Zacks Investment Ideas feature highlights: Tesla, Apple, Devon Energy, ZIM Integrated Shipping Services, and Eagle Bulk Shipping",2022-05-09T12:49:00Z
Now Might Finally Be the Time to Buy Rivian,2022-05-09T14:26:46Z
Why Tesla Stock Is Still Falling,2022-05-09T14:47:02Z
Tesla Refuses To Integrate Apple's CarPlay — You Can Do It Anyway,2022-05-09T14:47:52Z
Why Hindenburg Research Is Shorting Twitter: 'Musk Holds All The Cards',2022-05-09T16:09:44Z
5 Best-Selling EVs In The World In 2022,2022-05-09T17:55:13Z
Tesla Faulty Brakes Accuser Admits Lying About Incident: What's Next?,2022-05-09T19:37:00Z
"Coinbase shares plunge almost 80% from November high, amid selloffs of crypto stocks and funds",2022-05-09T20:21:00Z
Elon Musk And JB Straubel Reuniting For Panel This Week: Here's How And When You Can See It,2022-05-09T20:44:36Z
"Tesla AI Head Returns To Bay Area Temporarily, Says His Sabbatical Isn't Over",2022-05-10T01:10:04Z
Terra (LUNA) Crypto Founder Says 'Failure Of UST Is Equivalent To The Failure Of Crypto Itself',2022-05-10T01:49:00Z
Tesla Said To Halt Shanghai Production Again — This Time Due To Supply Woes,2022-05-10T02:45:56Z
Cathie Wood Cuts Another $32M From Tesla Stake — Initiates Position In This Legacy Automaker Instead,2022-05-10T04:16:51Z
"Nio Down 9%, Xpeng Skids 12%: Why Are Hong Kong EV Stocks Crashing Today",2022-05-10T04:33:37Z
"Why The Scarier This Looks, The Better It Is For Our Trading Accounts",2022-05-10T05:04:00Z
Elon Musk And Mom Get Nostalgic About India Visit And Seeing The Taj Mahal,2022-05-10T08:33:11Z
"Tesla April China Sales Hit Rock Bottom, Underperform Industry: What Investors Should Know",2022-05-10T09:06:40Z
"Nio Plans To Make Cheaper EVs Under Sub-Brand At NeoPark, Production To Begin In 2 Years: Report",2022-05-10T09:19:34Z
"Cathie Wood Cuts Twitter Stake By Another $6.4M, Edges Towards Complete Exit",2022-05-10T09:21:18Z
A Peek Into The Markets: US Stock Futures Higher Ahead Of Fed Speakers,2022-05-10T09:40:49Z
"'Tight Race But Won't Give Up:' Volkswagen CEO Praises Tesla Again, Says Elon Musk's Pace Surprised Him",2022-05-10T09:50:57Z
A four-step business plan for Elon Musk as he prepares to buy Twitter,2022-05-10T10:29:33Z
Could Tesla Overtake Ford and GM in Sales by 2025?,2022-05-10T11:00:00Z
"Noted Apple, Tesla Analyst Says Market In A Bubble: 'Wish I Had Better News'",2022-05-10T11:07:55Z
3 of the Top Growth Stocks on Earth,2022-05-10T11:40:00Z
Tesla suspends production at Shanghai plant due to supply-chain problems: report,2022-05-10T11:56:00Z
"Stock Market News for May 10, 2022",2022-05-10T12:34:00Z
Expert Ratings for Tesla,2022-05-10T13:14:01Z
Here's a list of 50 companies that are well-armed to beat back inflation,2022-05-10T13:27:00Z
Cathie Wood wades into GM as Ark Invest trims Tesla stake further,2022-05-10T13:48:00Z
"Benzinga's Top Ratings Upgrades, Downgrades For May 10, 2022",2022-05-10T14:17:39Z
Emma Chamberlain Causes Stir In India Over Her Met Gala Choker: Here's What It's All About,2022-05-10T14:19:43Z
What You Could Buy With These CEOs' Yearly Compensation: From Eloon Musk To Eric Wu,2022-05-10T14:44:33Z
Why Tesla Stock Finally Popped Today,2022-05-10T14:49:45Z
"Chicago Mayor Lori Lightfoot says Roe v. Wade leak a ‘call to arms’ for LGBTQ+ rights, too",2022-05-10T15:46:00Z
Stock Split Mania; Nintendo Joins The Party,2022-05-10T18:35:00Z
The Big Breaking News That Sent Nio Stock Surging Early Today,2022-05-10T19:02:52Z
Yellen says run on UST stablecoin illustrates crypto's risk to financial stability,2022-05-10T19:41:00Z
Dow books fourth straight day of losses as stocks end mixed,2022-05-10T20:48:00Z
Elon Musk Says Tesla Will Expand Giga Shanghai But No New Plant Planned In China,2022-05-11T00:48:18Z
Apple's Latest EV Patent: What You Need To Know,2022-05-11T01:45:15Z
Is Tesla Buying A Lithium Mining Company? What Elon Musk Has To Say,2022-05-11T02:07:13Z
Elon Musk Says Starlink Fighting Russian Cyberwar: 'They're Ramping Up Their Efforts',2022-05-11T02:56:43Z
"Why Nio, Other EV Peers Are Soaring In Hong Kong Today",2022-05-11T05:02:15Z
Elon Musk Not Worried About Impact Of China Lockdowns On Tesla Production,2022-05-11T05:25:53Z
Here are the 10 fastest EVs (and how much they cost),2022-05-11T09:02:00Z
Why People Are Searching For 'Elon Musk Taj Mahal' On Google,2022-05-11T09:53:03Z
Dogecoin Creator Weighs In On Elon Musk's Plan To Reinstate Donald Trump's Twitter,2022-05-11T10:37:42Z
Volkswagen Seeks To Pull A Ford With EV Focused Company In US Amid Tight Race With Tesla: Report,2022-05-11T10:56:20Z
Tesla Analyst Contradicts Elon Musk On China Lockdown Impact: 'Giga Shanghai Ramp-Up Unlikely Until June',2022-05-11T11:00:44Z
Twitter Founder Jack Dorsey Backs Elon Musk On Reinstating Donald Trump,2022-05-11T11:05:55Z
Another Company Puts Bitcoin On Balance Sheet,2022-05-11T11:20:19Z
Cathie Wood Adds $1.1M Stake In This 3D Printing Partner Of Elon Musk's SpaceX,2022-05-11T11:23:42Z
Tesla Playing Quidditch While EV Rivals Hockey Around Mining Goals: Morgan Stanley Analyst,2022-05-11T11:24:05Z
Morgan Stanley's done better than most forecasting markets during this turbulent year.  Here's what it says is coming next.,2022-05-11T13:11:00Z
Why Tesla Stock Tapped the Brakes on Wednesday,2022-05-11T15:04:55Z
Here's What Warren Buffett Thinks About Tesla And Elon Musk,2022-05-11T15:06:20Z
"Tesla (TSLA) Recalls 130K Cars, Halts Giga 3 Operations",2022-05-11T16:20:00Z
5 Things You Might Not Know About Rivian Founder RJ Scaringe,2022-05-11T16:33:00Z
"Gene Munster Turns Cautious On Tech Stocks, But Not Apple Or Tesla: Here's Why",2022-05-11T16:41:25Z
FANGMAN Stocks and Tesla: Sell or Buy More?,2022-05-11T18:57:00Z
Markets Resume Selloff Following Worse-Than-Expected CPI Report,2022-05-11T20:11:10Z
SEC investigating Elon Musk's belated disclosure of his Twitter stake,2022-05-11T21:46:00Z
Did You Know Twitter Launched A Video Game? Here's The Lesson It Teaches,2022-05-11T22:01:42Z
Jack Dorsey To Hit The Twitter CEO Repeat Button? Wild Charles Thinks So,2022-05-11T23:53:21Z
Elon Musk Said To Face Federal Probe Over Violating Rules In Disclosure Of Twitter Stake,2022-05-12T01:56:47Z
Is 'The Big Short' Fame's Michael Burry Indicating More Pain For Investors?,2022-05-12T02:40:36Z
Elon Musk Suggests You Use Chronological Tweets Feature Over Whatever 'The Algorithm' Suggests,2022-05-12T07:30:16Z
3 Stocks Ready to Bounce Back,2022-05-12T10:00:00Z
"The Zacks Analyst Blog Highlights Tesla, BRP Group, and Dorman Products",2022-05-12T11:58:00Z
"Zacks Market Edge Highlights: Meta Platforms, Amazon, Alphabet, Microsoft, and Tesla",2022-05-12T12:06:00Z
"Rivian reaffirms production outlook despite supply-chain snags, boosting stock",2022-05-12T12:11:00Z
"Stock Market News for May 12, 2022",2022-05-12T12:36:00Z
