title,published_utc
Twitter founder Jack Dorsey finally tweets about Elon Musk’s takeover bid,2022-04-15T17:46:41Z
Why Dogecoin Is Up Today,2022-04-15T17:57:32Z
Tesla and other automakers look to restart production plants in Shanghai,2022-04-15T18:32:00Z
Gina McCarthy denies she's leaving as Biden's climate lead after reports cite frustration with slow pace of emissions fight,2022-04-15T18:44:00Z
Should Tesla Shareholders Worry About Musk's Involvement With Twitter?,2022-04-15T18:53:00Z
"Elon Musk Causes Searches For 'Buy Twitter Stock' To Explode By 1,147%, Following The Recent Offer To buy Twitter",2022-04-15T19:03:55Z
"If You Invested $1,000 In Tesla, Apple, Microsoft And Other Top Stocks 5 Years Ago, Here's How Much You'd Have Now",2022-04-15T19:57:59Z
Why Elon Musk's Bid For Twitter Isn't The Best Move For Shareholders,2022-04-16T05:56:38Z
"3 Stocks Cathie Wood Is Buying That Should Be on Your List, Too",2022-04-16T10:00:00Z
Wall Street Breakfast: What Moved Markets,2022-04-16T11:45:38Z
The Smartest Stocks to Buy With $20 Right Now and Hold Forever,2022-04-16T12:00:00Z
Tesla's Shanghai Factory Is Finally Supposed to Reopen,2022-04-16T12:05:00Z
Is Tesla a Safe Stock to Buy Now?,2022-04-16T12:20:00Z
Three value stocks that can provide safety as interest rates rise,2022-04-16T13:24:00Z
"Elon Musk says Twitter shareholders should 'love' his buyout offer, but Wall Street doesn't seem to agree",2022-04-16T13:51:00Z
Here's how Elon Musk's buyout offer for Twitter stacks up to what he paid for his stake,2022-04-16T13:53:00Z
Twitter employees blanch at prospect of Musk ownership,2022-04-16T13:58:00Z
"Elon Musk's Twitter takeover bid draws surprise, skepticism --- and celebration",2022-04-16T14:01:00Z
"How Much $1,000 Invested In Tesla Now Will Fetch If Stock Hits Ark Invest's Updated $4,600 Price Target By 2026",2022-04-16T14:44:42Z
"Stocks To Watch: Twitter Twists + Earnings For Netflix, J&J And Tesla",2022-04-16T14:55:16Z
"Dogecoin could become internet’s currency, Robinhood CEO says",2022-04-16T18:17:00Z
"Here’s why Millennial investors will come back to stock and crypto markets, despite Fed rate hikes, says chief executive at eToro",2022-04-16T19:26:00Z
Elon Musk is developing fleets of domestic humanoid “buddy robots”,2022-04-16T21:49:22Z
S&P 500 Earnings Weaker But Should Still Be OK And Watching Crude Oil,2022-04-17T05:40:00Z
"3 Stocks To Watch In The Coming Week: Netflix, Tesla, Procter & Gamble",2022-04-17T07:05:00Z
What Does Cyber Rodeo Mean for Tesla?,2022-04-17T10:00:00Z
3 Things to Watch in the Stock Market This Week,2022-04-17T11:00:00Z
Tesla Earnings: The Most Important Thing to Watch,2022-04-17T15:05:00Z
This Fund Manager Thinks Musk Will Make a Sweetened Bid For Twitter On 4/20,2022-04-17T15:38:47Z
Elon Musk Has These 3 Options Following Twitter's Poison Pill; 'It Now Becomes A Game of High Stakes Poker',2022-04-17T20:03:07Z
Recession fears and the stock market --- is it too late to play defense?,2022-04-17T21:27:00Z
"Bitcoin, Ethereum, Dogecoin Sluggish Over Holiday Weekend: Stocks Could Define Crypto Direction In Key Earnings Week",2022-04-18T01:14:46Z
"If You Invested $100 In Shiba Inu When Elon Musk Said He Didn't Own Any, Here's How Much You Would Have Now",2022-04-18T01:23:00Z
"Why Cathie Wood Is 'Open-Sourcing' Ark's Projection Models For Tesla, Other Holdings With Big Potential",2022-04-18T01:30:43Z
U.S. stock futures fall headed into big earnings week,2022-04-18T02:24:00Z
Elon Musk Takes Shot At Mark Zuckerberg Over Money Spent Protecting Him,2022-04-18T03:33:53Z
Jack Dorsey Says Twitter Board Has 'Consistently Been The Dysfunction Of The Company',2022-04-18T05:46:51Z
"Elon Musk Says Tesla Now Has Over 100,000 FSD Beta Testers, Up Nearly 67% Since January",2022-04-18T06:10:06Z
"Indian Electric Vehicle Maker Recalls 3,215 Units Amid Fire Incidents",2022-04-18T07:30:03Z
Is Elon Musk Considering Tender Offer For Twitter Shareholders? Cryptic Musical Tweet Sparks Speculations,2022-04-18T07:50:21Z
Elon Musk Celebrates Dogecoin-Themed Easter — And The Meme Coin Is Still Plunging Hard,2022-04-18T08:12:49Z
Elon Musk's SpaceX Launches Yet Another US Spy Satellite,2022-04-18T08:44:49Z
"Alphabet, Amazon, Tesla, and Shopify Stock Splits: Which High-Flying Stocks Are Next to Split?",2022-04-18T09:21:00Z
China Q1 GDP Defies COVID-19 Impact But March Data Begins To Reflect Softness: What You Need To Know,2022-04-18T09:22:46Z
A Peek Into The Markets: US Stock Futures Down; Bank of America Earnings In Focus,2022-04-18T09:22:59Z
Elon Musk Celebrates Dogecoin-Themed Easter But The Meme Coin Is Still Plunging Hard,2022-04-18T09:29:26Z
Here's Why You Probably Shouldn't Buy Twitter Right Now,2022-04-18T09:39:00Z
Elon Musk's Haircut Once Again In The Limelight,2022-04-18T09:41:03Z
EXCLUSIVE: Analyst Says Recent Fire Incidents Threaten To Derail EV Adoption In India,2022-04-18T10:17:29Z
"SNL Dubs Twitter 'The Giuliani Of Apps,' Mocks Elon Musk's Takeover Attempt In New Skit",2022-04-18T11:03:48Z
"Tesla Gets New Price Target From Ark, Elon Musk Hints At Tender Offer, China GDP And More: 5 Key Stories You May Have Missed From This Weekend",2022-04-18T11:26:55Z
Tesla Bear Michael Burry Defends SEC After Elon Musk's Rebuke,2022-04-18T11:45:55Z
Elon Musk's bid for Twitter spells trouble for Tesla investors --- here's why,2022-04-18T11:53:00Z
Tesla's Giga Berlin Is Just Over 120 Miles From Volkswagen's Plant — But CEO Diess Isn't Worried,2022-04-18T12:00:47Z
3 Stocks to Avoid This Week,2022-04-18T12:10:00Z
"Taiwanese Assembler Is Prioritizing Apple Over Tesla Amid COVID-19 Lockdown In Shanghai, Says Analyst",2022-04-18T12:26:07Z
Tesla (TSLA) to Retain Earnings Beat Streak in Q1 Amid Chip Woes,2022-04-18T12:41:00Z
Could Volkswagen Be a Top EV Stock by 2025?,2022-04-18T12:53:00Z
"Auto Roundup: Honda's (HMC) Big EV Bet, KMX's Mixed Q4 Results & More",2022-04-18T12:54:00Z
Why Earnings Season Could Be Great for Tesla (TSLA),2022-04-18T12:58:00Z
Tesla Stock Split And More: What Retail Investors Want To Know From Elon Musk And Team On Wednesday's Quarterly Call,2022-04-18T13:02:26Z
Where Tesla Stands With Analysts,2022-04-18T13:25:16Z
"Here's what could trigger another 'risk-on, risk-on' bout for stocks and bonds",2022-04-18T13:33:00Z
"If I Had to Buy 1 Stock-Split Stock, This Would Be It",2022-04-18T13:47:45Z
"Earnings Season Off To Shaky Start As Investors Eye Consumption, Musk",2022-04-18T13:53:00Z
Q1 Earnings To Gather Pace This Week,2022-04-18T14:02:00Z
Here's the charitable-giving strategy that helps the 1% cut their tax bills,2022-04-18T14:23:00Z
"Tesla (TSLA) Recalls 600K Cars, Resumes Operations at Giga 3",2022-04-18T14:25:00Z
"Big Week Ahead in Q1 Earnings, Econ Data",2022-04-18T14:34:00Z
Why Nio Shares Are Sinking Today,2022-04-18T15:23:51Z
"If You Lease A Tesla, Get Ready To Go Shopping Again: EV Giant Ends Lease Buybacks",2022-04-18T15:57:47Z
"A New Virtual Currency, Berkshire Hathaway's Stake in HP, and More",2022-04-18T16:30:00Z
Why Tesla Stock Popped on Monday,2022-04-18T17:08:52Z
"Top Research Reports for Tesla, Broadcom & Comcast",2022-04-18T17:31:00Z
"'If Elon Musk Wants To Buy Twitter, He Will': So Here's How To Trade It",2022-04-18T17:56:30Z
Elon Musk Wants Twitter. But Is It Only About Free Speech?,2022-04-18T18:06:00Z
Is The End Near For Musk And Tesla?,2022-04-18T19:32:14Z
"Dow, S&P 500 and Nasdaq end lower for 2nd straight session as investors brace for big earnings week",2022-04-18T20:29:00Z
This Is How Elon Musk Says He Can Save Twitter $3M A Year,2022-04-18T23:32:16Z
"Ford Stops Online Orders For 2022 Mustang Mach-E, Says Slammed By High Demand",2022-04-19T00:57:30Z
Apollo Global Ready To Team Up With Elon Musk For Twitter Bid: Report,2022-04-19T02:41:35Z
Feds probed Tesla for racial discrimination before California filed suit,2022-04-19T04:01:00Z
"Why Tesla Rivals Nio, Xpeng Are Trading Lower In Hong Kong Today",2022-04-19T04:11:51Z
Tesla Q1 2022 Earnings Preview: Where Next For The Electric Vehicle Maker's Stock?,2022-04-19T04:13:00Z
Jack Dorsey On Twitter: 'Look How They Massacred My Boy',2022-04-19T04:20:34Z
Tesla Faces Federal 'Open Investigation' Over Racism Allegations: What You Should Know,2022-04-19T04:57:46Z
"'Rich Dad, Poor Dad' Author Says Elon Musk Has Left 'Rats And Rodents' At Twitter 'Running For Cover'",2022-04-19T05:37:37Z
Tesla Graphite Supplier From Australia Bags $107M In Loans From Biden Administration,2022-04-19T06:17:15Z
A Peek Into The Markets: US Stock Futures Mixed Ahead Of Earnings,2022-04-19T09:13:13Z
Elon Musk says he doesn’t own a home and sleeps in friends’ spare bedrooms,2022-04-19T09:30:00Z
3 Reasons to Sell Dogecoin Right Now,2022-04-19T09:57:00Z
Elon Musk Says SpaceX Aiming For 5-Day Launch Cadence For Reusable Falcon Rocket,2022-04-19T10:04:35Z
Tesla's New Factory in Germany Is Ramping Up Quickly,2022-04-19T10:05:00Z
Should You Invest in the Fidelity MSCI Consumer Discretionary Index ETF (FDIS)?,2022-04-19T10:20:08Z
Top 5 U.S. Giants Likely to Win Big on Q1 Earnings This Week,2022-04-19T10:42:00Z
Jack Dorsey Takes Aim At Ethereum: 'Not Interesting To Me',2022-04-19T11:12:07Z
5 Things to Know About Tesla Stock,2022-04-19T11:20:00Z
Tesla Down 16% This Year As Green Stocks Struggle — But This Indian Renewables Company Has Posted A Whopping 114% Gain,2022-04-19T11:30:22Z
10 Biggest Price Target Changes For Tuesday,2022-04-19T11:31:48Z
"Tesla earnings: Wall Street worries about China shutdowns, Musk's Twitter distraction",2022-04-19T11:35:00Z
"The Zacks Analyst Blog Highlights Tesla, Broadcom, Comcast, Sanofi and Infosys",2022-04-19T11:36:00Z
"Elon Musk Aside, Is Twitter a Buy Today?",2022-04-19T12:24:00Z
Here's How Much Tesla's Giga Shanghai Shutdown Will Impact The EV Maker,2022-04-19T13:27:00Z
Here are 30 stocks that Goldman Sachs likes when the economy stutters and markets gyrate,2022-04-19T14:00:00Z
Why This Analyst Thinks Tesla's Growth Can 'Shock Wall Street' For Several Years,2022-04-19T15:13:27Z
Tesla Set to Beat Estimates in Q1 Earnings: ETFs to Buy,2022-04-19T15:15:00Z
Analysis: Will The Real Elon Musk Please Stand Up?,2022-04-19T16:10:11Z
Why Elon Musk wants Tesla to start mining lithium,2022-04-19T16:15:09Z
Musk v. Twitter Drama Continues to Play Out; JBHT Beats in Q1,2022-04-19T16:22:00Z
Why Tesla Stock Popped Before Earnings,2022-04-19T16:43:39Z
Which EV maker should you buy between Nio and Tesla?,2022-04-19T18:23:01Z
Is Now The Time To Buy Stock Or Options In Tesla Or United Airlines?,2022-04-19T19:15:33Z
"Dow jumps nearly 500 points, U.S. stocks end sharply higher as earnings season heats up",2022-04-19T20:36:00Z
Could Starlink Go Public Via SPAC? Rumors Of Palihapitiya Deal Increase,2022-04-19T20:40:40Z
Here's The Latest On Elon Musk's Possible Twitter Takeover,2022-04-19T21:27:18Z
"Charging Into Q1, Tesla Looks To Continue Historic Rise",2022-04-19T21:59:00Z
Cathie Wood's flagship ARK fund tumbles more than 60% from its 2021 peak,2022-04-19T23:04:00Z
Elon Musk said to be willing to invest $15 billion of his own money to buy Twitter,2022-04-20T00:10:00Z
"As Netflix Crashes 25%, 'The Big Short' Fame's Michael Burry Warns Of A Similar Fate For Tesla",2022-04-20T01:06:49Z
"Cathie Wood Cuts Twitter Stake By $5.3M Amid Takeover Bids From Elon Musk, Others",2022-04-20T02:14:26Z
'Woke Mind Virus:' Elon Musk Reacts To 25% Netflix Stock Plunge,2022-04-20T03:23:23Z
Buying A Porsche With Dogecoin And Shiba Inu Is Now Possible,2022-04-20T03:43:56Z
"Nio, Xpeng Rise, While Li Edges Lower: What's Up With Hong Kong EV Stocks?",2022-04-20T04:37:16Z
Elon Musk Sends Out Another Cryptic Post Hinting At Tender Offer For Twitter,2022-04-20T05:29:59Z
Dogecoin Knockoff Named After Elon Musk And Mars Sees Sudden 43% Spike,2022-04-20T06:49:12Z
"Australian Scientists Test A Cheaper, Eco-Friendly Way To Charge Your Tesla",2022-04-20T07:09:04Z
"Tesla's 'Brutal' China Disruptions Main Worry For Investors Ahead Of Q1 Earnings, Says Analyst",2022-04-20T07:32:19Z
Cryptic tweet from Elon Musk raises speculation about Twitter tender offer,2022-04-20T08:48:00Z
"5 Stocks To Watch For April 20, 2022",2022-04-20T09:02:14Z
Elon Musk's Starlink Gets Praise From Ukraine's Vice Premier For Quick Internet Restoration In 5 Villages,2022-04-20T09:10:18Z
Better Stock Split Buy: Amazon or Tesla?,2022-04-20T10:00:00Z
2 Companies That Could Be Worth $1 Trillion by 2030,2022-04-20T10:01:00Z
A Peek Into The Markets: US Stock Futures Flat Ahead Of Earnings; Netflix Shares Plunge,2022-04-20T10:11:57Z
Growth Stocks: 3 Tips for Successful Investing,2022-04-20T10:30:00Z
"The Zacks Analyst Blog Highlights Netflix Inc, Tesla, Dow, Freeport-McMoRan and Newmont",2022-04-20T10:49:00Z
The news coming from this giant volcano is even gloomier than the new forecasts from the IMF and World Bank,2022-04-20T11:21:00Z
Wall Street Breakfast: Elon Musk's Favorite Day,2022-04-20T11:26:03Z
"No Parallels Between Netflix And Tesla, Says Ark Analyst",2022-04-20T11:40:29Z
3 Charts Showing How Top Stocks Have Performed After a Split,2022-04-20T11:53:00Z
Better Electric Vehicle Stock: Tesla or Ford,2022-04-20T12:25:00Z
Is Twitter Going Private? What Investors Need to Know,2022-04-20T12:33:00Z
2 Electric Vehicle Stocks You Can Buy and Hold for the Next Decade,2022-04-20T12:42:00Z
"Tesla Q1 Earnings Preview: Sales, Profit To Grow On Record-Breaking Deliveries",2022-04-20T13:35:00Z
Earnings Beats Currently Tracking Low As Wall Street Awaits More Reports,2022-04-20T14:14:00Z
"Pre-Markets Looking Beyond Q1, Move Higher",2022-04-20T14:30:00Z
Tesla Hires Geologist: What Investors Should Know,2022-04-20T15:08:09Z
It's 'Doge Day' again. Supporters wanted to push Dogecoin 'to the moon'. Here's how it is trading,2022-04-20T18:38:00Z
Why Investors Are Selling Tesla Ahead of Today's Earnings,2022-04-20T19:07:07Z
"Tesla Q1 Earnings Highlights: Electric Vehicle Maker Hits Record Revenue, Deliveries, Profits And Margins Amid Headwinds",2022-04-20T20:32:37Z
Tesla (TSLA) Surpasses Q1 Earnings and Revenue Estimates,2022-04-20T21:35:09Z
Tesla Q1 results: Dan Ives is cautious for current fiscal quarter,2022-04-20T21:44:58Z
"Tesla (TSLA) Zooms Past Q1 Estimates, CSX Also Beats",2022-04-20T21:58:00Z
Who Really Won The Super Bowl? It Might Have Been Tesla According To This Chart,2022-04-20T22:10:04Z
Supply chain challenges finally caught up to Tesla,2022-04-20T23:43:58Z
Elon Musk Says Tesla Likely To Make Over 1.5M Cars This Year,2022-04-21T00:53:45Z
"Elon Musk Says Tesla Giga Shanghai Returning 'With A Vengeance' After COVID-19 Halts, Sees Record Q2 Output",2022-04-21T01:27:29Z
Cathie Wood Sells $66M In Tesla Stock On Earnings Day,2022-04-21T03:59:10Z
"Nio, Xpeng Fall Over 5%: What's Weighing On Hong Kong EV Stocks Today?",2022-04-21T04:24:13Z
"Tesla Supplier CATL, Warren Buffett-Backed BYD Dominate EV Battery Market In China",2022-04-21T06:46:56Z
"5 Stocks To Watch For April 21, 2022",2022-04-21T07:41:17Z
"Elon Musk Will Not Face 'Gag Order' Over 2018 Tweet, Judge Rules",2022-04-21T08:38:05Z
"A Peek Into The Markets: US Stock Futures Higher Ahead Of Earnings, Jobless Claims; Tesla Beats Q1 Views",2022-04-21T09:28:54Z
"Tesla's Robotaxi To Reach Volume Production In 2024, Elon Musk Sees Unit As A Massive Growth Driver",2022-04-21T09:44:44Z
"Twitter Stock: Buy, Sell, or Hold?",2022-04-21T10:15:00Z
Why This Data Point From Tesla's Q1 Earnings Spells Trouble For Legacy Automakers,2022-04-21T10:40:33Z
Elon Musk Says Come Work At Boring Company As It Fetches $5.7B Valuation In Fresh Funding Round,2022-04-21T11:27:28Z
Wall Street Breakfast: Streaming Sea Change,2022-04-21T11:31:03Z
"Tesla rides higher prices to fatter profit, as Elon Musk complains about costs",2022-04-21T11:57:00Z
"Elon Musk Says Tesla Bot Will be Worth More Than EV, Full Self-Driving Businesses",2022-04-21T12:03:56Z
Tesla (TSLA) Delivers 5th Consecutive Earnings Beat in Q1,2022-04-21T12:08:00Z
"Tesla posts record profit, Q1 sales jump 81% despite supply-chain disruptions",2022-04-21T12:13:00Z
Why Tesla Shares Are Trading Higher Today,2022-04-21T12:27:08Z
Elon Musk Wants to Buy Twitter. What's Going On?,2022-04-21T12:45:00Z
10 Biggest Price Target Changes For Thursday,2022-04-21T12:45:43Z
"2 Growth Stocks With Monster Upside of at Least 215%, According to Cathie Wood",2022-04-21T12:53:00Z
'Embarrassing:' Elon Musk Reacts To Tesla Being Pitted Against Rivian On Operating Expenses,2022-04-21T12:54:11Z
Electrifying Everything Is Getting Cheaper and Cheaper,2022-04-21T13:00:00Z
Beyond Stock Splits: 1 Growth Stock to Buy Now and Hold Forever,2022-04-21T13:07:00Z
Penny Stocks Moving in Premarket? Buying Small-Caps on April 21st,2022-04-21T13:28:57Z
"As Putin eyes a date to declare victory, here's a Ukraine scenario that could slam stocks by another 10%",2022-04-21T13:42:00Z
Elon Musk's SpaceX Fast Response To A Russian Attack Recognized As 'Eye-Watering' By US Military Official,2022-04-21T14:32:58Z
Why Tesla Shares Took Off Today,2022-04-21T14:33:24Z
"'We will speak softly and carry a large Javelin,' Biden says, as he unveils $800 million in new Ukraine aid",2022-04-21T15:14:00Z
Is It Too Late to Buy Tesla?,2022-04-21T15:29:26Z
3 Reasons Why Tesla’s Monster Earnings Will Help It Keep Crushing The Nasdaq in 2022,2022-04-21T16:17:51Z
"Ark Invest Analyst Sees This Tesla Product Driving EV Stock To $4,600 Per Share",2022-04-21T16:35:20Z
Funding Secured For Possible Elon Musk Twitter Takeover,2022-04-21T16:56:28Z
Meta Upgraded To Strong Buy This Week On Valuation,2022-04-21T17:26:27Z
Why Rivian Stock Is Plunging Today,2022-04-21T17:35:18Z
"More consumers want to use cryptocurrencies for purchases, but merchants are hesitant to accept them",2022-04-21T18:11:00Z
Why Lithium Americas Stock Plunged 12% Today,2022-04-21T18:38:38Z
"Dow, S&P 500 book sharpest declines in nearly 2 weeks after Fed's Powell signals half-point interest rate hike likely in May",2022-04-21T20:30:00Z
Expert opinion: Tesla is a stock of the decade,2022-04-21T20:35:44Z
Markets Fall As Investors Weigh Earnings,2022-04-21T20:41:15Z
Tesla Stock: Bull vs. Bear,2022-04-21T20:50:23Z
Tesla Is Extending Lead In EV 'Arms Race' But Risks Remain: 4 Analysts React To Record Q1,2022-04-21T22:03:40Z
Cathie Wood Trims Tesla Stake By $94M And Buys More Shares Of This Chinese EV Stock,2022-04-22T01:42:45Z
EV Maker Li Auto Among 17 New Chinese Firms Facing Risk Of Getting Delisted In US,2022-04-22T02:20:20Z
How Are Companies Navigating the Inflationary Waters?,2022-04-22T02:41:00Z
Elon Musk Sighs Heavily As His Tweet To 'Defeat Spam Bots' Gets Reply From Dogecoin Scammer,2022-04-22T03:21:19Z
"Nio, Xpeng Plummet: What's Dragging Hong Kong EV Stocks Today?",2022-04-22T04:46:57Z
"Barack Obama Says People 'Dying,' Democracy 'Under Threat' Due To Disinformation On Social Media",2022-04-22T04:56:33Z
Tesla Stock Hits Four Figures Once Again,2022-04-22T05:28:00Z
"Auto Bromance: Elon Musk Says Volkswagen 'Lucky' To Have CEO Diess, Credits Him For EV Push",2022-04-22T05:36:34Z
SpaceX's Falcon 9 Takes Another 53 Starlink Satellites To Space — Some Confuse Rocket With 'UFO',2022-04-22T07:12:53Z
"Musk in talks with private-equity firm over possible Twitter takeover bid, say sources",2022-04-22T09:22:00Z
3 Charts That Best Explain the Faith in Tesla,2022-04-22T09:45:00Z
How Shopify's CEO Becomes More Powerful Through Its Stock Split,2022-04-22T10:55:00Z
Tesla's Market Cap Is Over $1 Trillion -- and It's Still Growing,2022-04-22T11:00:00Z
Elon Musk's Starlink Inks Deal With First Aviation Customer: What You Need to Know,2022-04-22T11:14:28Z
What is Earth Day? Why celebrating it matters to your money and your health,2022-04-22T11:43:00Z
Could Polestar Become the Next Tesla?,2022-04-22T11:44:00Z
Elon Musk says he has received funding commitments for Twitter buyout and is exploring tender offer,2022-04-22T11:53:00Z
Why Tesla Could Be a $10 Trillion Company in 20 Years,2022-04-22T12:00:00Z
"1 Growth Stock, 1 Dividend Stock, and 1 Cryptocurrency to Buy Now",2022-04-22T12:30:00Z
Can Fuel Cells Beat Batteries in the Trucking Market?,2022-04-22T12:57:00Z
"France's Renault Plans To Spin-Off Electric Vehicle Unit, Mulls IPO",2022-04-22T12:59:41Z
3 Disruptors I Love Right Now,2022-04-22T13:10:00Z
"Stocks have weathered surging bond yields but can't take too much more, this Morgan Stanley strategist warns",2022-04-22T13:13:00Z
How young people of color can save the Earth — and build wealth while they're at it,2022-04-22T13:19:00Z
Tesla Still Expects Big Growth This Year,2022-04-22T14:16:00Z
Why Now Is The Time To Watch These 8 Lithium Stocks,2022-04-22T14:19:00Z
"If You Invested $1,000 In Twitter When Jack Dorsey Stepped Down, Here's How Much You'd Have Now (Plus: Would You Make Money From Musk Bid?)",2022-04-22T14:51:48Z
Will X Mark The Spot For Musk As Streaming Wars Heat Up?,2022-04-22T14:55:49Z
Tesla Is Crushing Competition -- Here's How,2022-04-22T15:23:11Z
Why Nio Shares Bounced Back Friday,2022-04-22T15:55:49Z
This Investor Has The Right To Purchase Millions Of Tesla Shares For Pennies On The Dollar,2022-04-22T16:29:03Z
Why Tesla Stock Popped Today,2022-04-22T16:30:52Z
Tesla Owner Crashes Model Y Into $3.5 Million Jet Using Autonomous Smart Summon Feature: Video,2022-04-22T18:27:24Z
Why Rivian Stock Crashed This Week and Could Head Even Lower,2022-04-22T18:29:00Z
Twitter Buoyed By Elon Musk's Acquisition Plans: Here's What Lies Ahead For The Stock,2022-04-22T18:42:08Z
"Biden's Earth Day: Seattle stop brings EO on forests, caps another week of trying to revive a 'green' Build Back Better bill",2022-04-22T19:23:00Z
"Why Nio Stock Plunged 12% This Week, but Could Bottom",2022-04-22T19:47:36Z
Internet Rumor Connects Vitalik Buterin And Elon Musk To Creating Shiba Inu: Here's How,2022-04-22T19:56:05Z
"Once the Square CEO, Jack Dorsey is now officially 'Block Head'",2022-04-23T00:11:00Z
1 Undeniable Lesson Tesla Shareholders Should Learn From Netflix,2022-04-23T10:45:00Z
Will Lucid Group Be a Trillion-Dollar Stock by 2030?,2022-04-23T10:55:00Z
3 Slam-Dunk Investing Lessons for Bull Markets and Bear Markets,2022-04-23T11:17:00Z
Wall Street Breakfast: What Moved Markets,2022-04-23T11:38:10Z
Should You Buy Amazon Now or Wait Until After the Stock Split?,2022-04-23T12:05:00Z
Weekend reads: How to position your investments before the Federal Reserve causes a bear market,2022-04-23T12:51:00Z
Shopify Follows FAANG With Its Own Stock Split. Time to Buy?,2022-04-23T13:05:00Z
"Tesla earnings 'strong,' but Wall Street 'not willing to bet on' latest robotaxi vehicle",2022-04-23T14:11:00Z
Leaked Texts Show Elon Musk Confronting Bill Gates About Shorting Tesla,2022-04-23T15:51:17Z
Cathie Wood’s flagship fund is down 45% this year. Money is still flowing in.,2022-04-23T18:24:00Z
"How to invest as inflation, higher interest rates and war roil markets",2022-04-23T18:26:00Z
"Winners and losers in the ESG-investing push: Garbage companies, utilities and convenience stores",2022-04-23T19:16:00Z
EVs can store power for our homes and the grid: Why 'vehicle-to-everything' technology is a must-follow investing theme,2022-04-23T19:53:00Z
Why This Analyst Thinks Tesla's Disruptive Potential Can Put These Companies Out Of Business,2022-04-23T19:57:00Z
Do poison pills work? A finance expert explains the anti-takeover tool that Twitter hopes will keep Elon Musk at bay,2022-04-23T22:59:00Z
3 Incredible Charts That Show Tesla's Strength,2022-04-24T10:10:00Z
"1 Stock To Buy, 1 To Dump When Markets Open: Tesla, PayPal",2022-04-24T12:04:00Z
The Risk/Reward for Opendoor Stock Is Amazing,2022-04-24T12:05:00Z
This Automaker Is Challenging Tesla's EV Dominance in China,2022-04-24T12:45:00Z
Will Tesla's Potential Stock Split Make You Rich?,2022-04-24T13:29:00Z
Netflix's Implosion Is a Warning for Tesla,2022-04-24T14:50:00Z
"World's Richest Man Is Homeless? Yes, Elon Musk Says He's Sleeping At Friends' Houses",2022-04-24T15:11:11Z
Algae farming and an ocean 'antacid' among top ideas to fight pollution in Elon Musk's XPRIZE Earth Day contest,2022-04-24T16:28:00Z
"Is Tesla R&D Budget Really Much Lower Than That Of Volkswagen, Ford Or GM? Here's What Elon Musk Thinks",2022-04-25T02:21:11Z
Shark Tank's Kevin O'Leary Says Twitter's Biggest Risk Is If Elon Musk 'Goes Away',2022-04-25T03:32:36Z
Elon Musk's Purchase Of Twitter Could Be Finalized This Week: WSJ,2022-04-25T04:03:01Z
Big Week For Tech (Part II),2022-04-25T04:16:00Z
"Nio, Xpeng Fall Over 4%: What's Pulling Hong Kong EV Stocks Down Today?",2022-04-25T04:50:03Z
Elon Musk Causes Frenzy With 'Moving On...' Tweet — Offers Clarification Hours Later,2022-04-25T07:56:33Z
'The SpaceX Factor?' Analyst On Why China Is Lagging Behind In LEO Satellite Race,2022-04-25T08:13:36Z
This sleek-looking Lexus is the automaker's first electric car made for the U.S. market,2022-04-25T09:01:00Z
Elon Musk Was Right: Space Stocks Are the Best Stocks,2022-04-25T09:05:00Z
A Peek Into The Markets: US Stock Futures Down Following Friday's Sell-Off,2022-04-25T09:10:58Z
"The stock market selloff still has another 20% to go, says the godfather of liquidity",2022-04-25T11:46:00Z
3 Stocks to Avoid This Week,2022-04-25T12:15:00Z
Analyst Sees 'Beginning Of End' Of Twitter As Public Company Amid Reports That Sale To Elon Musk Could Happen Today,2022-04-25T12:16:44Z
Here's the Secret Behind Tesla's Industry-Leading Margins,2022-04-25T12:33:00Z
Indian Energy Tycoon Just $3B Behind Warren Buffett On Global Rich List As Power Arm Hits Key Milestone,2022-04-25T12:33:34Z
Looking for Passive Income? Consider This Monster Dividend Aristocrat,2022-04-25T12:47:00Z
"Here is What to Know Beyond Why Tesla, Inc. (TSLA) is a Trending Stock",2022-04-25T13:00:06Z
"As Elon Musk Aims To Take Twitter Private, Filings Reveal Aftermath Of What Happened When He Tried The Same With Tesla",2022-04-25T13:01:34Z
Tesla China Announces Battery Design Challenge For Highly-Anticipated Cyberquad  EV: What You Should Know,2022-04-25T13:16:58Z
Are Electric Vehicle Stocks Overhyped?,2022-04-25T13:18:00Z
Why Is Dogecoin Spiking All Of A Sudden?,2022-04-25T13:26:42Z
