title,published_utc
"Catalyst Watch: Housing Indicators, Tesla Earnings (Podcast)",2023-04-15T11:00:00Z
Best Artificial Intelligence (AI) Stock to Buy: Tesla vs. Palantir vs. Nvidia vs. Microsoft,2023-04-15T12:15:00Z
"Tesla Model 3 'Highland' Leak, Rivian Loses Bullish Recommendation, EPA Emission Standards A Boost For EVs And More: Biggest EV Stories Of The Week",2023-04-15T13:29:22Z
"Check out the 33 stocks that have rallied more than 1,000% in the last 10 years",2023-04-15T13:48:00Z
"Stocks To Watch: Eyes On The Health Of Financials, Housing Sector",2023-04-15T14:00:25Z
Don't Underestimate This Fast-Growing Tesla Business,2023-04-15T14:06:00Z
The Tesla Effect Is Real and There's No Denying It,2023-04-15T14:15:00Z
"U.S. billionaires have grown nearly one-third richer during the pandemic, while a 'permanent underclass' struggles, Oxfam says",2023-04-15T16:08:00Z
4 financial-planning rules the world has forgotten,2023-04-15T17:29:00Z
The Stock That's Set to Win the EV Arms Race,2023-04-16T10:37:00Z
AI Could Have a $14 Trillion Impact by 2030: Here Are 3 Top Stocks to Buy Now,2023-04-16T11:09:00Z
Rivian's Sharp Downgrade: 5 Big Analyst Calls,2023-04-16T11:21:00Z
2 Top Growth Stocks to Buy Right Now and Hold for the Long Term,2023-04-16T11:58:00Z
"1 Stock to Buy, 1 Stock to Sell This Week: Netflix, Tesla",2023-04-16T12:12:00Z
"Up 19% in 2023, Is It Safe to Invest in the Nasdaq Right Now?",2023-04-16T12:45:00Z
2 Hot Stocks to Buy and Hold Until You Retire,2023-04-16T13:37:00Z
"Tesla, Netflix earnings due: Cheaper cars, cheaper content, more workout videos, as 'earnings recession' seems likely",2023-04-16T14:01:00Z
Is Tesla Done With Price Cuts? Analyst Shares Expectations Ahead Of Q1 Results,2023-04-17T07:07:02Z
"Options Expiration, Earnings to Provide Huge Turning Point for Stocks This Week",2023-04-17T07:34:00Z
More Americans are snapping up used electric cars,2023-04-17T09:01:00Z
"S&P 500 Settles Lower But Records Weekly Gain, Market Volatility Decreases",2023-04-17T09:50:20Z
"Which Stocks Pass Warren Buffett's $10,000 Test?",2023-04-17T09:56:00Z
"Amazon: 100 Hated Stocks, These 4 Worth Considering",2023-04-17T11:32:42Z
"Biden adds more EV charging across U.S., with pledges from Uber, Walmart, PG&E and others",2023-04-17T12:13:00Z
Is Lucid Group Stock a Buy Now?,2023-04-17T12:13:00Z
Bad News for Lucid and Tesla Stock Investors,2023-04-17T12:15:07Z
Visa To Rally 15%? Here Are 10 Other Analyst Forecasts For Monday,2023-04-17T12:19:38Z
"If You Invested $10,000 In ChargePoint In 2021, This Is How Much You Would Have Today",2023-04-17T12:30:00Z
"Elon Musk Warns Of 2 'Insanely Hard' Hurdles For EV Startups, Summers Slams Saudi-Russian Alliance, Apple's MR Headset Challenges iPhone And More: 5 Key Weekend Stories You May Have Missed",2023-04-17T12:37:21Z
Should You Buy Tesla (TSLA) Ahead of Earnings?,2023-04-17T12:48:00Z
"'Gradually, then suddenly.' Earnings expectations may be about to drop, says Morgan Stanley strategist.",2023-04-17T13:58:00Z
TurboTax vs. hiring an accountant: What’s the best way to do your taxes?,2023-04-17T13:59:00Z
"Tesla Charges Up For A Move As Big Tech Earnings Kick Off: The Bull, Bear Case",2023-04-17T14:46:21Z
U.S. Economic Growth Risks Weigh as Q1 Earnings Season Begins,2023-04-17T15:42:00Z
"Why NIO, XPeng, and Li Auto Shares Jumped Monday Morning",2023-04-17T15:48:31Z
The Latest Analyst Ratings for Tesla,2023-04-17T18:01:50Z
"Q1 Earnings: Tesla, Netflix On Deck",2023-04-17T18:39:00Z
"Why Rivian and Nikola Popped, but Fisker Dropped",2023-04-17T18:41:14Z
3 Critical Earnings Reports to Watch This Week,2023-04-17T19:34:00Z
Rivian Just Lost the Biggest EV Tax Break -- Here's What It Means,2023-04-17T20:30:00Z
Google CEO Sundar Pichai is worried that AI will 'impact every product across every company',2023-04-17T20:54:00Z
3 Stocks to Avoid This Week,2023-04-17T21:00:00Z
Q1 Earnings Season Kicks Off Better than Expected,2023-04-17T21:53:00Z
Time to Buy Tesla Stock Before Q1 Earnings?,2023-04-17T23:45:00Z
"China's Strong Q1 Economic Rebound Sparks Optimism for Apple, Tesla And These Companies",2023-04-18T05:57:20Z
4 ideas for travelers who want to reduce their carbon footprint,2023-04-18T09:00:00Z
"The 2023 Lucid Air: It’s powerful and plush, with an unbeatable 516-mile range",2023-04-18T09:03:00Z
"S&P 500 Settles Higher Ahead Of Big Bank Earnings, Market Volatility Decreases",2023-04-18T09:52:28Z
"Buckle Up, Tesla Investors: Analyst Spots 2 Red Flags Ahead of Q1 Report",2023-04-18T11:47:34Z
Tesla Earnings: Why Guidance Is Key,2023-04-18T11:51:00Z
"Zacks Investment Ideas feature highlights: JPMorgan, Wells Fargo, Citigroup, Netflix and Tesla",2023-04-18T12:19:00Z
Luminar stock surges as Chinese demand for LiDAR-equipped vehicles prompts factory expansion in Asia,2023-04-18T12:37:00Z
"If King Dollar is wobbling, this asset is your best investment, says Citi",2023-04-18T13:37:00Z
A New EV Manufacturing Giant in the Making -- Which Stocks Will Win?,2023-04-18T13:45:44Z
Stock Picking in a Range-Bound Market: 2 Top Market Winners for 2023,2023-04-18T13:57:00Z
China EV Price War Reaches Fever Pitch: An Analysis,2023-04-18T14:29:00Z
What Lies Ahead for Tesla ETFs in Q1 Earnings?,2023-04-18T15:15:00Z
"Tesla Teases Manufacturing Process That Could Cut Costs Drastically For New $25,000 BEV",2023-04-18T16:01:20Z
Price Cuts & High Deliveries to Fuel Tesla (TSLA) Q1 Earnings,2023-04-18T17:05:00Z
3 Reasons the Sleepy Action in Stocks is Set to End,2023-04-18T20:29:00Z
"'We want to pay more taxes,' ultra-wealthy Americans tell Congress on Tax Day",2023-04-18T21:13:00Z
Tesla Reports Q1 Results Today: What to Look For,2023-04-19T04:30:00Z
Tracking Cathie Wood's ARK Invest 13F Portfolio - Q1 2023 Update,2023-04-19T05:27:02Z
Investor Optimism Declines Following Earnings Reports,2023-04-19T07:40:53Z
"Morgan Stanley, Tesla And 3 Stocks To Watch Heading Into Wednesday",2023-04-19T08:19:46Z
1 Robinhood Stock That Could Crush the Market,2023-04-19T09:30:00Z
Tesla Likely To Report Lower Q1 Earnings; Here's A Look At Recent Price Target Changes By The Most Accurate Analysts,2023-04-19T09:37:25Z
3 10-Bagger Stocks to Buy Now and Hold for the Long Haul,2023-04-19T10:03:00Z
Most day traders flop. These researchers say one popular strategy works.,2023-04-19T11:23:00Z
What Is Driving Tesla Stock Lower Ahead Of Q1 Results?,2023-04-19T11:30:52Z
Tesla stock drops in premarket after another round of U.S. price cuts as earnings loom,2023-04-19T11:42:00Z
Options Trader Anticipates Tesla Stock Downturn Following Q1 Earnings Release,2023-04-19T12:27:26Z
"4 Auto Giants Whose EVs Qualify for $7,500 US Tax Credit",2023-04-19T13:11:00Z
2 Growth Stocks Ken Griffin (the Most Profitable Hedge Fund Manager Ever) Is Buying in a Nasdaq Bear Market,2023-04-19T13:23:00Z
Tesla's Crucial Q1 Earnings Reveal: Can Margin And Volume Outlook Ignite A Stock Resurgence?,2023-04-19T13:47:55Z
"Morgan Stanley, USB Beat in Q1; Pre-Markets Down",2023-04-19T14:27:00Z
Earnings Data Deluge,2023-04-19T14:52:00Z
5 Key Earnings Charts,2023-04-19T14:53:00Z
What I Wish I Knew Before Becoming A Dividend Investor,2023-04-19T15:21:48Z
You'll Never Guess Who Is Beating Tesla in Autonomous Driving,2023-04-19T16:15:00Z
"Top Analyst Reports for Tesla, Oracle & Union Pacific",2023-04-19T16:53:00Z
Tesla Announces Further Price Cuts Ahead of Q1 Earnings: What's in Store?,2023-04-19T17:14:00Z
"US Stocks Struggle To Advance As Investors Digest Earnings, Evaluate Fed Rate Hike Path",2023-04-19T17:42:00Z
"Tesla and Netflix stocks fall, Western Alliance shares surge, and other stocks on the move",2023-04-19T18:24:00Z
Here's how much Tesla short sellers have lost so far this year,2023-04-19T18:52:00Z
Trading Strategies For Tesla Stock Before And After Q1 Earnings,2023-04-19T19:08:40Z
3 Ways to Gain an Edge this Earnings Season,2023-04-19T19:21:00Z
"S&P 500, Nasdaq end flat as investors weigh Beige Book, mixed earnings from Morgan Stanley, Netflix",2023-04-19T20:29:00Z
"Tesla Q1 Earnings Highlights: Revenue Beat, EPS In Line, Cybertruck Update, Model Y Bestselling Vehicle And More",2023-04-19T20:31:33Z
Tesla (TSLA) Q1 Earnings Surpass Estimates,2023-04-19T21:35:08Z
Why Investors Hit the Brakes on Fisker Stock Today,2023-04-19T21:48:00Z
"Tesla (TSLA) and IBM (IBM) Mixed in Q1, ZION Misses",2023-04-19T21:57:00Z
"Compared to Estimates, Tesla (TSLA) Q1 Earnings: A Look at Key Metrics",2023-04-19T23:30:05Z
"Inflation is the 'one thing' holding up revenue growth, warns Morgan Stanley's Wilson of a potential selloff in stocks",2023-04-19T23:47:00Z
Tesla stock falls 6% as price cuts hit quarterly profit margins,2023-04-19T23:54:00Z
Tesla Earnings Drop 21% Driven By Price Cuts: 7 Metrics You Should See,2023-04-20T00:27:04Z
"With Tesla stock and margins under pressure, Elon Musk falls back on his favorite fantasy",2023-04-20T02:00:00Z
Is Tesla's Demand Starting To Dry Up? Analyst Says Recent Price Cuts Are A Warning Sign,2023-04-20T05:06:37Z
"Elon Musk's 'Razor-And-Blade' Strategy Could Jeopardize Tesla's Long-Term Growth, Says Munster",2023-04-20T06:46:48Z
"Tesla, AT&T And 3 Stocks To Watch Heading Into Thursday",2023-04-20T08:13:41Z
Rising Inventory for 2 Ultra-Popular Electric-Vehicle (EV) Stocks Is an Ominous Warning for Investors,2023-04-20T09:21:00Z
Tesla Stock Sold On Facts: What's Next?,2023-04-20T09:42:51Z
CBOE Volatility Index Drops To Lowest Level Since November 2021; S&P 500 Ends Almost Flat,2023-04-20T09:50:42Z
Why Tesla Stock Is Skidding Toward Mid-March Lows Premarket Today,2023-04-20T10:05:45Z
Prediction: These 2 Growth Stocks Will Be Worth $1 Trillion by 2030,2023-04-20T10:08:00Z
Tesla Is Choosing Volume Over Margin,2023-04-20T10:41:00Z
"If You Invested $1,000 in Lemonade in 2020, This Is How Much You Would Have Today",2023-04-20T10:50:00Z
"Tesla, Nokia, Zions Bancorp And Other Big Stocks Moving Lower In Thursday's Pre-Market Session",2023-04-20T10:52:05Z
Why MIND Technology Shares Are Trading Higher By Around 15%; Here Are 20 Stocks Moving Premarket,2023-04-20T12:07:02Z
Prediction: These Will Be 3 of the Most Valuable Stocks by 2050,2023-04-20T12:19:00Z
"Tesla price cuts do not 'come without pain,' but the EV maker is thinking long term on customer value",2023-04-20T12:32:00Z
"'No Rose-Colored Glasses': Tesla's Auto Gross Margin Dipping Below 'Magical 20% Threshold' Sparks Concern, Says 'Very Bullish' Analyst",2023-04-20T12:38:59Z
"Zacks Investment Ideas feature highlights: Virgin Galactic, Alphabet and Tesla",2023-04-20T12:54:00Z
"These five synchronized assets are pointing to a 'black swan event,' says market veteran",2023-04-20T13:39:00Z
Is Now a Good Time to Buy Tesla?,2023-04-20T13:46:51Z
Abbott Laboratories To Rally 17%? Here Are 10 Other Analyst Forecasts For Thursday,2023-04-20T13:56:29Z
"Tesla's stock slide drags down other carmakers; IBM, D.R. Horton shares rise, and more big movers",2023-04-20T14:02:00Z
"Tesla (TSLA) Q1 Earnings Beat Estimates, Sales Rise 24% Y/Y",2023-04-20T14:15:00Z
"The Zacks Analyst Blog Highlights General Motors, Ford, Stellantis and Tesla",2023-04-20T14:16:00Z
"The Zacks Analyst Blog Highlights Tesla, Oracle Union Pacific, The Estee Lauder and Intercontinental Exchange",2023-04-20T14:23:00Z
Dow Tumbles 150 Points; Tesla Shares Drop After Q1 Results,2023-04-20T14:23:45Z
"Jobless Claims Higher, Philly Fed & AmEx Lower",2023-04-20T14:36:00Z
"4 Tesla Analysts On EV Giant's Margin Strategy: 'Stormy Weather For Now, Sunny In Spring Next Year'",2023-04-20T14:38:53Z
Jobless Claims Increased More Than Expected,2023-04-20T14:53:00Z
Why Tesla Shares Plunged After Earnings,2023-04-20T14:55:04Z
"Benzinga's Top Ratings Upgrades, Downgrades For April 20, 2023",2023-04-20T15:00:51Z
Finally: Here Comes Tesla's Cybertruck,2023-04-20T15:08:00Z
"Tesla Q1 Earnings Beat Estimates, Decline YoY: ETFs in Focus",2023-04-20T15:11:00Z
"A Makeup Retailer Just Hit New All-Time Highs, Is Outperforming Apple, Tesla, Microsoft",2023-04-20T16:27:09Z
JP Morgan Maintains Underweight Rating for Tesla: Here's What You Need To Know,2023-04-20T17:00:29Z
Why I Just Doubled My Tesla Position,2023-04-20T17:13:49Z
Why Nevro Shares Are Trading Lower By Around 19%? Here Are Other Stocks Moving In Thursday's Mid-Day Session,2023-04-20T17:33:20Z
US Stocks Remain Under Pressure On Rising Economic Fears: Tesla Sinks 10% On Its Worst Day In 2023,2023-04-20T17:58:00Z
Tesla: Margins Dip Below 20% Despite Previous Promises,2023-04-20T18:30:00Z
Most Interesting New ETFs of Q1 2023,2023-04-20T19:57:00Z
"Dow posts 3-day losing streak as Tesla, energy shares drag down Wall Street",2023-04-20T20:54:00Z
Zuckerberg runs down Elon as Meta's market cap tops Tesla for first time in 16 months,2023-04-20T23:31:00Z
"Tesla's stock confirms bearish 'double top,' and other chart patterns",2023-04-21T00:35:00Z
Investor Optimism Declines Following Tesla Earnings Report,2023-04-21T07:02:52Z
"Cathie Wood Has New Price Target For Tesla Stock As Ark Models Nearly 1,230% Upside Over 4 Years",2023-04-21T09:46:43Z
"S&P 500 Settles Lower As Investors Digest Earnings Reports, Market Volatility Increases",2023-04-21T10:03:19Z
"A Fed pause looms. Be careful what you wish for, say these analysts.",2023-04-21T10:19:00Z
Barrick Gold To Rally Over 47%? Here Are 10 Other Analyst Forecasts For Friday,2023-04-21T11:37:51Z
Tesla raises Model S and Model X prices after margin pressure dents stock,2023-04-21T12:02:00Z
Tesla's 'brazen' willingness to accept lower margins earns stock a downgrade,2023-04-21T12:54:00Z
"Stock Market News for Apr 21, 2023",2023-04-21T13:23:00Z
Cathie Wood Goes Bargain Hunting: 3 Stocks She Just Bought,2023-04-21T14:00:00Z
"SpaceX Starship Launch 'Still A Success' Says Analyst, Despite Rocket Exploding After Takeoff",2023-04-21T14:50:13Z
"1 Unstoppable Stock With 1,127% Upside, According to Cathie Wood's Ark Invest",2023-04-21T14:55:23Z
"Benzinga's Top Ratings Upgrades, Downgrades For April 21, 2023",2023-04-21T15:00:46Z
Leading Economic Indicator Points To Looming Recession,2023-04-21T15:10:17Z
Why does the stock market rise when there’s so much bad news?,2023-04-21T15:24:00Z
SpaceX’s Starship rocket launches but explodes minutes after takeoff,2023-04-21T15:42:00Z
"AT&T's stock rebounds, HCA and P&G shares head higher after earnings, and more stock movers",2023-04-21T15:50:00Z
Listen When Tesla Says Its Competition Is Crushing It,2023-04-21T16:27:52Z
S&P 500 Headed To Weekly Losses After Five Straight Wins As Investors Fear Higher Rates For Longer,2023-04-21T17:05:00Z
Why Fisker Stock Hit an All-Time Low Friday,2023-04-21T17:05:24Z
Buying Shares Post-Split: Good or Bad Idea?,2023-04-21T17:36:00Z
Tesla Stock: Why the Market Has Got It All Wrong,2023-04-21T17:49:52Z
Biden aims to take on 'environmental racism' with executive action,2023-04-21T19:10:00Z
"S&P 500 Trades Lower With Possible Recession On The Horizon, China's Economy Grows",2023-04-21T19:58:44Z
"Next Week's Earnings Reports Could Be 'Final Round' Battle Between Hot Stock Market, Slumping Economy",2023-04-21T20:00:05Z
"Dow ekes out gain Friday, but books weekly loss to snap four-week win streak as investors digest earnings",2023-04-21T20:39:00Z
Is Rivian Stock a Buy?,2023-04-21T21:31:00Z
This Stock Could 10x in a Decade,2023-04-22T11:00:00Z
Tesla: Elon Musk Is Running Out Of Aces,2023-04-22T12:00:00Z
Why I Bought More Shares of Tesla Despite a 'Weak' Quarter,2023-04-22T14:30:00Z
Here’s what Tesla earnings might mean for GM earnings next week,2023-04-22T14:31:00Z
Tesla Stock: Headed to $85?,2023-04-22T15:01:00Z
Elon Musk loses $12.6 billion in a single day as Tesla shares tumble and SpaceX rocket explodes,2023-04-22T15:30:00Z
Tesla Investors Slam Elon Musk In Open Letter: 'The Board Has Allowed The CEO To Be Overcommitted',2023-04-22T16:24:03Z
"Elon Musk Shares Thoughts On Whether God Exists, Says He's Okay With 'Going To Hell'",2023-04-22T19:01:08Z
10 Earth Day actions beyond recycling that get results,2023-04-22T19:29:00Z
Earth Day EV checklist: See which electric vehicles get a tax break on new list,2023-04-22T19:32:00Z
Is the Stock Market Overreacting to Tesla's Earnings?,2023-04-23T13:18:48Z
Google Co-Founder Sergey Brin Sold $366M Tesla Shares To Set Up Nonprofit,2023-04-23T15:33:54Z
"Tesla's Price Cuts Produce 'Sugar High' But Lack Long-Term Benefit, Says Analyst: Ad Campaign 'Would Surely Help'",2023-04-24T07:11:57Z
Tesla Stripped of Buy Rating: 5 Huge Analyst Calls | Pro Recap,2023-04-24T08:44:00Z
1 Stock-Split Stock to Buy Hand Over Fist and 1 to Avoid if a Recession Takes Shape,2023-04-24T09:21:00Z
Tesla Stock: What Did Elon Musk Say About This Key Problem?,2023-04-24T09:39:00Z
"S&P 500 Edges Higher Ahead Of Big Earnings, Market Volatility Decreases",2023-04-24T09:44:41Z
"2 Top Trends to Invest $1,000 in Right Now",2023-04-24T10:45:00Z
Tesla Borrows a Page From Apple's Playbook. Genius Move or Red Flag?,2023-04-24T10:51:00Z
"Tesla investors urge vote against former CTO J.B. Straubel, for board independence",2023-04-24T13:00:00Z
Sell in May and Go Away? 1 Stock You'll Want to Buy Hand Over Fist Instead,2023-04-24T13:04:00Z
3 Reasons to Buy Tesla Stock Before It Skyrockets,2023-04-24T14:00:00Z
Tesla Does What Apple Did 16 Years Ago,2023-04-24T14:15:00Z
"Even without an 'earnings apocalypse,' stocks still need to drop 15%, says strategist",2023-04-24T14:16:00Z
Elon Musk Is Sending These Stocks Higher (and Tesla Isn't One of Them),2023-04-24T15:40:00Z
"Donald Trump Praises Elon Musk With One Word Answer, Remains Critical Of Electric Vehicles",2023-04-24T17:21:39Z
"Wall Street Headlines, International Investing, and Stocks to Watch",2023-04-24T19:49:11Z
What Is A Marketing Strategy?,2023-04-24T20:49:48Z
What Should Investors Do with Tesla Stock Following Q1 Earnings?,2023-04-24T21:28:00Z
That Time When Elon Musk Thanked Ferrari CEO For Praising Tesla For Sounding A 'Wake-Up Call',2023-04-25T06:23:59Z
ChatGPT revolution has driven half the gains in the stock market this year: JPMorgan,2023-04-25T08:13:00Z
Looking at EV Stocks for the Next Tesla? Avoid This Huge Mistake.,2023-04-25T09:03:00Z
Sell These 2 Popular Dividends on the Rip Buy These 2 Instead,2023-04-25T09:04:00Z
"S&P 500 Edges Higher Ahead Of Earnings, Economic Data; Market Volatility Rises",2023-04-25T09:31:35Z
"Tesla, Inc. (TSLA) Is a Trending Stock: Facts to Know Before Betting on It",2023-04-25T13:00:12Z
"Company News for Apr 25, 2023",2023-04-25T13:03:00Z
Big Tech and Employment in Focus for First Peak Week of Q1 Earnings,2023-04-25T13:15:00Z
"Tesla Stock Could Soar by Over 1,000%, According to Cathie Wood",2023-04-25T13:16:53Z
These fund managers have held Microsoft stock since it was $5 a share. Here are 2 of their current lesser-known tech picks.,2023-04-25T13:35:00Z
The U.S. Government Just Picked 4 Electric Vehicle Stocks to Win,2023-04-25T14:25:00Z
SpaceX's Rocket Just Exploded. So What?,2023-04-25T14:51:00Z
Tesla Got Over 1 Billion Social Views Last Year: Did Twitter Acquisition Help?,2023-04-25T17:08:52Z
Why the broader U.S. stock market has ‘a lot riding’ on Big Tech earnings ,2023-04-25T19:03:00Z
Tesla Has a Pricing Problem,2023-04-25T19:44:45Z
"Tesla Stock Updates: Battery Endurance, Canadian Expansion, and Robotaxi Competition",2023-04-25T20:23:24Z
"Take That, Jim Cramer And Bill Gates! Joe Rogan Thinks The Cybertruck Is Great — Here's What He Says",2023-04-25T21:34:35Z
These 3 Tech Stocks Are Building the Future,2023-04-26T09:52:00Z
Tesla stock gets a downgrade: 'Growing up can be hard to do',2023-04-26T10:21:00Z
Is Tesla Implementing  the Wrong Market Strategy?,2023-04-26T10:44:00Z
Here are the times when buy-the-dip works — and Wednesday fits the criteria,2023-04-26T12:01:00Z
"Tesla Analyst Downgrades Stock, Cuts Price Target By About 20%: 'Hard To Get Comfortable With Near-Term Earnings'",2023-04-26T12:15:53Z
PACCAR (PCAR) Q1 Earnings Beat Estimates on Record Revenues,2023-04-26T13:02:00Z
Unusual Earnings Events in Energy and Financials Offer Clues on Market’s Next Move,2023-04-26T13:04:00Z
"General Motors (GM) Beats on Q1 Earnings, Ups '23 EPS View",2023-04-26T13:13:00Z
"Benzinga's Top Ratings Upgrades, Downgrades For April 26, 2023",2023-04-26T15:00:26Z
GM vs. TSLA: Which Stock Is the Better Value Option?,2023-04-26T15:40:10Z
"Why Tesla Fell Today, Even on a Good Day for the Nasdaq",2023-04-26T18:13:20Z
Electric vehicles will cut oil demand by 5 million barrels a day as soon as 2030: IEA,2023-04-26T18:44:00Z
General Motors Is in Better Shape Than You Think,2023-04-26T19:16:36Z
"Tesla’s stock falls below another key chart level, dipping into a ‘gap’ support zone",2023-04-26T19:26:00Z
Tesla's Controversial Yoke Steering Wheel Now Costs $250,2023-04-26T21:32:15Z
Tesla Price Cuts Might Be Failing To Boost Demand As US Inventories Seem To Be At Record Highs,2023-04-27T05:01:35Z
"4 Reasons Cathie Wood's $2,000 Tesla Price Target Is Utter Nonsense",2023-04-27T09:21:00Z
3 Stocks That Could Be Worth More Than Berkshire Hathaway by 2030,2023-04-27T09:25:00Z
Did Tesla and Elon Musk Just Throw Nvidia Stock Investors a Huge Lifeline?,2023-04-27T10:00:00Z
Tesla's Production Costs Continue to Fall: Time to Buy the Stock?,2023-04-27T10:06:00Z
Is Tesla's AI Tech its Biggest Competitive Advantage?,2023-04-27T10:25:00Z
Wish You Could Invest in Elon Musk's StarLink? Here's 1 Way to Invest in Space Internet Now,2023-04-27T11:01:00Z
The AI Revolution: How Companies like Nvidia and Tesla Are Leading the Way,2023-04-27T11:15:00Z
The Future of Tech: AI Stocks to Keep on Your Radar,2023-04-27T11:30:00Z
"Tesla breached labor protections when it told workers not to discuss wages, judge finds",2023-04-27T12:12:00Z
Buy the Dip On This Top EV Stock,2023-04-27T12:23:00Z
"An undiscovered universe of stocks is trading at 'near generational lows,' asset manager says",2023-04-27T13:33:00Z
O'Reilly (ORLY) Q1 Earnings Exceed Estimates on Strong Comps,2023-04-27T14:21:00Z
The Shake-Up at NBCUniversal and Johnson & Johnson's Spinoff Plans,2023-04-27T14:43:29Z
"Wolfspeed Shares Tank On Heels Of Tesla SiC Cut Down, Analysts Focus On 200mm Delay",2023-04-27T14:56:17Z
Stinky Breadth: FAANG Masks Market Weakness Beneath the Surface,2023-04-27T15:13:00Z
Mobileye stock faces worst day with more than 30% drop as price cuts in China force slashed outlook,2023-04-27T17:08:00Z
Tax Efficiency & Trading Tips with ETFs,2023-04-27T20:36:00Z
What's Going On With Tesla Stock?,2023-04-28T09:00:00Z
4 Tesla Quotes You Need to See to Believe,2023-04-28T09:30:00Z
"S&P 500 should be sold above 4,200, says Bank of America",2023-04-28T11:51:00Z
How the Fed could cause a stock-market crash — and how to play it safe,2023-04-28T15:52:00Z
Group 1's (GPI) Earnings & Sales Beat Streak Continues in Q1,2023-04-28T16:41:00Z
"Asbury's (ABG) Q1 Earnings Beat, Sales Miss, Decline Y/Y",2023-04-28T16:45:00Z
Is Tesla's Chart Signaling a Buy?,2023-04-28T18:02:00Z
"Attention Investors! Buy Mobileye At Current Levels, Analysts Say Post Q1 Results Snubbing Softness In Chinese EV Demand",2023-04-28T18:51:29Z
The Bears Are Right About Tesla,2023-04-28T21:02:00Z
A Bull Market Is Coming: 2 Stocks That Could Skyrocket,2023-04-28T21:42:00Z
Tesla Makes Huge Strategic Decision With Massive Implications for Tesla Stock Investors,2023-04-29T10:00:00Z
"For Investors, Boring Can Be Wonderful",2023-04-29T10:45:00Z
2 Things the Smartest Investors Know About Tesla Stock,2023-04-29T11:40:00Z
What Happened to Tesla This Week,2023-04-29T14:15:00Z
"The Chevy Bolt will be gone soon. Good luck finding an EV for less than $30,000",2023-04-29T14:56:00Z
7 Best Stocks to Buy in May 2023,2023-04-29T15:19:08Z
A Bull Market Is Coming: 3 Stocks to Buy Without Hesitation,2023-04-30T09:02:00Z
3 Growth Stocks That Could 10X Over the Next 10 Years,2023-04-30T09:15:00Z
Why Is Everyone Talking About Tesla Stock?,2023-04-30T10:15:00Z
Investors May Not Have Seen the Worst of Tesla Stock. Here's Why.,2023-04-30T11:06:00Z
Is Elon Musk Listening? This Tesla Analyst Might Have A Solution That Tackles The Company's Mounting Model 3 Inventories,2023-04-30T14:58:59Z
Bull of the Day: General Motors (GM),2023-05-01T08:00:00Z
"S&P 500 Primed To Cross 4,200 Today, Says Analyst — But Could A 700-Point Drop Be Coming?",2023-05-01T08:32:09Z
"As Chevy nixes its Bolt EVs, there’s just one electric car for under $30K",2023-05-01T09:01:00Z
S&P Records Second Straight Monthly Gain; Market Volatility Decreases Further,2023-05-01T10:07:45Z
"A volatile summer is coming as Fed pause, debt tussle meet. Shelter in these stocks, says strategist",2023-05-01T12:28:00Z
"Will Tesla Continue In This Trend Or Is A Gap Fill On The Horizon? The Bull, Bear Case",2023-05-01T13:58:00Z
4 Top Stocks to Buy in May and Put Away,2023-05-01T14:30:00Z
"NIO's April deliveries rise more than 30%, but stock turns red",2023-05-01T14:58:00Z
"First Republic sinks after JPMorgan takeover, while Norwegian Cruise, Lordstown Motors and SoFi shares are also on the move",2023-05-01T15:55:00Z
Tesla Model Y Outsells Next 5 Closest Competitors Combined In Norway,2023-05-01T16:30:14Z
Lear (LEA) Beats Q1 Earnings Estimates on Seating Unit Strength,2023-05-01T16:50:00Z
Financial Whirlwind: 5 Stocks Feeling The Jitters Ahead Of Expected Fed Interest Rate Hike,2023-05-01T21:03:20Z
The EVs that need a battery replacement most often,2023-05-02T09:01:00Z
1 Stock-Split Stock That's a Surefire May Buy and 1 to Avoid,2023-05-02T09:06:00Z
S&P Edges Lower Ahead of Fed's Decision; Market Volatility Increases,2023-05-02T09:21:13Z
Should You Invest in the Fidelity MSCI Consumer Discretionary Index ETF (FDIS)?,2023-05-02T10:20:05Z
Should You Invest in the Invesco S&P 500 Equal Weight Consumer Discretionary ETF (RCD)?,2023-05-02T10:20:08Z
Tesla investors' top questions? This analyst says he has the answers,2023-05-02T11:59:00Z
MGM Resorts To Rally Around 33%? Here Are 10 Other Analyst Forecasts For Tuesday,2023-05-02T12:00:09Z
"Apple and 10 other stocks tied to China supply chains are at risk, but 7 others may benefit, says Morgan Stanley",2023-05-02T12:46:00Z
