title,published_utc
"Elon Musk meets with India's Modi, hints at Tesla expansion",2023-06-21T00:29:00Z
Nvidia and Amazon Joined the $1 Trillion Club in 2023 -- These 2 Growth Stocks Could Get There by 2033,2023-06-21T09:45:00Z
5 Stocks at All-Time Highs Set to Report Stellar Earnings,2023-06-21T10:07:00Z
CBOE Volatility Index Drops; S&P 500 Closes Lower,2023-06-21T10:11:05Z
Uber To Rally Around 55%? Here Are 10 Other Analyst Forecasts For Wednesday,2023-06-21T12:00:00Z
Rivian (RIVN) Gains 5.5% on Plans to Embrace Tesla's NACS Port,2023-06-21T12:30:00Z
"'Modi Fan' Elon Musk Eyes India Visit Next Year, Hopes For Starlink Approval In Rural Areas",2023-06-21T12:40:13Z
"The AI boom will stay with the S&P 500, says one of most pessimistic Wall Street firms heading into 2023",2023-06-21T12:42:00Z
"Tesla may be the 'original' meme stock, but Barclays warns latest surge has been 'too sharp'",2023-06-21T13:57:00Z
"Bill Ackman Says Elon Musk Was ""Not An Expert,"" But Did This to Become a Billionaire Entrepreneur",2023-06-21T14:00:00Z
"Tesla Analyst Drops Bullish Stance As Near-Term Storm Takes Shape, But Sees Elon Musk-Led Company As Long-Term EV Winner",2023-06-21T14:43:44Z
"Benzinga's Top Ratings Upgrades, Downgrades For June 21, 2023",2023-06-21T15:01:49Z
"FedEx and Tesla shares fall, Generac shares extend gains — and other stocks on the move",2023-06-21T15:26:00Z
Tesla Stock Is Up Almost 50% in Just 1 Month. Time to Sell?,2023-06-21T15:58:00Z
Why Shares of Rivian Hit a Pothole Today,2023-06-21T16:54:52Z
"Tech Stocks Sink, AI Rally Dwindles As Powell Hints At Further Hikes: What's Driving Markets Wednesday",2023-06-21T18:02:11Z
Why Tesla Stock Stepped on the Brakes Wednesday Morning,2023-06-21T18:39:15Z
"Tesla's Falling, but This Downgraded Nasdaq Stock Is Taking an Even Harder Hit",2023-06-21T18:47:00Z
U.S. stocks fall for third day as Powell reaffirms the Fed is not done raising interest rates,2023-06-21T20:17:00Z
Rivian Joins Ford and GM on Tesla's Supercharger Network. Will Other Automakers Follow?,2023-06-21T20:39:35Z
"Apple, Microsoft, Alphabet, Amazon, and Nvidia Are Trillion-Dollar Companies: These 3 Stocks Are the Best Bets to Join the Club Next",2023-06-22T09:21:00Z
Elon Musk Says Artificial Intelligence (AI) Will Be the Primary Growth Driver for Tesla Stock,2023-06-22T10:51:00Z
"Interested in Robotaxis? Don't Buy Tesla, Buy This Stock Instead",2023-06-22T11:00:00Z
"Why Tesla Stock Is Down For 2nd Straight Session: 'End Of Historical Run,' Says Analyst",2023-06-22T11:23:17Z
Nordson To Rally Over 14%? Here Are 10 Other Analyst Forecasts For Thursday,2023-06-22T11:43:40Z
"Rivian buys mapping app  Iternio, which plans routes, finds EV charging stations",2023-06-22T11:57:00Z
32 Analysts Have This to Say About Tesla,2023-06-22T12:01:05Z
Tesla’s stock suffers deepest loss in two months,2023-06-22T12:20:00Z
Ford Just Shoved 'All In',2023-06-22T13:00:00Z
Did AI Just Kill the Bear Market?,2023-06-22T13:04:49Z
"This Bud's for investors. Buy the stock even if Bud Light sales never recover, says analyst.",2023-06-22T13:31:00Z
3 Stocks to Watch as China Extends EV Tax Exemption,2023-06-22T14:07:00Z
Tesla Hit With Back-To-Back Downgrades: Why Morgan Stanley Is Stepping To Sidelines Despite Touting EV Stock As 'Must-Own',2023-06-22T14:07:10Z
Elon Musk to Invest In India? What That Could Mean For Tesla Shareholders,2023-06-22T14:13:02Z
"Benzinga's Top Ratings Upgrades, Downgrades For June 22, 2023",2023-06-22T15:02:26Z
Why Lucid Stock Dropped Today,2023-06-22T15:50:23Z
A known Tesla bull is the latest analyst to turn cautious on Tesla stock,2023-06-22T15:59:00Z
Elon Musk and Mark Zuckerberg challenge each other to a cage fight,2023-06-22T17:18:00Z
Nvidia DGX: Workhorse of AI Will Drive NVDA to $2 Trillion,2023-06-22T17:35:00Z
"Tesla, Anheuser-Busch, Logitech stocks rise, AMC, iRobot, Virgin Galactic shares fall, and other stocks on the move",2023-06-22T19:38:00Z
U.S. stocks shake off rate-hike worries to end mostly higher,2023-06-22T20:27:00Z
Tesla (TSLA) Outpaces Stock Market Gains: What You Should Know,2023-06-22T21:45:21Z
Investor Sentiment Improves After Nasdaq Snaps 3-Session Losing Streak,2023-06-23T06:11:14Z
"The Zacks Analyst Blog Highlights Tesla, Li Auto, NIO and XPeng",2023-06-23T09:00:00Z
Elon Musk and Mark Zuckerberg Agree to Cage Fight -- but Can Twitter Fight Off Meta's New Rival App?,2023-06-23T09:08:00Z
The U.K. stock market has turned into a wasteland as pension funds recoil. Why U.S. funds may pull back too,2023-06-23T10:41:00Z
2 Beaten-Down Large-Cap Stocks to Buy for Long-Term Growth,2023-06-23T12:00:00Z
2 Hot Growth Stocks Investors Should Avoid,2023-06-23T12:15:00Z
Tesla Bull Ron Baron Says Charging Deals Present 'Really Big Opportunity' For EV Giant,2023-06-23T12:42:46Z
Bill Gates and Jeff Bezos Are Backing This $1 Billion Mining Company That Uses AI to Find Rare Earth Metals,2023-06-23T14:00:00Z
3 Reasons Why a Major Market Pullback Is Coming - And How to Prepare for It,2023-06-23T15:04:00Z
Tesla stock set for first weekly loss in six weeks,2023-06-23T16:14:00Z
Why EV Stocks Got Crushed This Week,2023-06-23T17:55:55Z
Time to Offload Tesla? Inverse ETFs to Earn Profits,2023-06-23T18:11:00Z
Toyota Trumps Tesla,2023-06-23T19:30:01Z
"Elon Musk Implies That Tesla Is Overvalued, Buy Toyota Instead",2023-06-23T23:05:47Z
"Cathie Wood Sells $7M Tesla Stock Friday Amid Pullback, Bets Big On This Crypto-Linked Stock",2023-06-24T06:34:12Z
Expect a Roaring S&P 500 Bull Market? Here Are the 10 Stocks You'll Want to Own,2023-06-24T09:50:00Z
"Lithium Americas: 40 Top Stocks, These 4 Worth Considering",2023-06-24T09:57:03Z
Three Questions Tesla Needs to Answer,2023-06-24T10:45:00Z
Will Tesla's Price Cuts Actually Hurt Rivian?,2023-06-24T11:15:00Z
Wall Street Breakfast: What Moved Markets,2023-06-24T12:21:55Z
Think Tesla Is Slowing Down? This Chart Says Otherwise,2023-06-24T13:15:00Z
"Tesla Cybertruck Buzz Gets Louder, Rivian Jumps On NACS Bandwagon But Lucid Holds Off, Nikola's Fire Mishap, And More: Biggest EV Stories Of The Week",2023-06-24T14:13:20Z
Tesla Has a Peculiar Problem,2023-06-24T14:15:00Z
"How To Build A Dividend Portfolio With $25,000 Among June's Top 30 Stocks",2023-06-24T17:00:00Z
Andrew Tate Offers To Train Musk For Cage Fight With Zuckerberg: 'You Will Not Lose',2023-06-24T17:52:36Z
Beyond QuantumScape: 3 Top Battery Tech Stocks You Need to Know,2023-06-25T09:04:00Z
Is Ford Stock a Buy?,2023-06-25T09:32:00Z
Tesla Just Turned a Huge Financial Burden Into a $12.9 Billion Revenue Opportunity,2023-06-25T12:00:00Z
Cathie Wood Says Tesla's AI Training Ramp-up Will Give EV Maker A Headstart In Robotaxis: 'A Winner-Take-Most' Opportunity With 'SaaS-Like Margins',2023-06-25T15:42:02Z
"Zacks Investment Ideas feature highlights: Enphase Energy, Public Storage, Tesla and Nvidia",2023-06-26T09:00:00Z
Market Volatility Increases; S&P 500 Snaps 5-Week Winning Streak,2023-06-26T09:27:32Z
"Tesla stock slips on downgrade, IBM shares ease on reported deal and other stocks on the move",2023-06-26T09:37:00Z
"Putin's Flight From Moscow, Trump's 'Penny-Wise' Move In Sexual Misconduct Case, Tesla's AI Future And More: 5 Key Stories You May Have Missed From This Weekend",2023-06-26T10:08:13Z
"Mercury Systems, Tesla And Other Big Stocks Moving Lower In Monday's Pre-Market Session",2023-06-26T10:26:19Z
Why Tesla Stock Is On Reverse Gear In Premarket Today,2023-06-26T10:43:19Z
Is Nikola Stock a Buy?,2023-06-26T11:03:00Z
"Tesla stock drops again after Goldman Sachs downgrades, as yet another Wall Street firm slashes rating",2023-06-26T11:28:00Z
Musk vs. Zuckerberg: Which tech heavyweight is already winning the Wall Street cage match?,2023-06-26T12:24:00Z
"Tesla, Inc. (TSLA) Is a Trending Stock: Facts to Know Before Betting on It",2023-06-26T13:00:12Z
United Airlines To Rally Around 37%? Here Are 10 Other Analyst Forecasts For Monday,2023-06-26T13:00:22Z
Is Tesla's Stock a Buy?,2023-06-26T13:03:00Z
Goldman Sachs Drops Bullish Stance On Tesla Stock: Has The EV Rally Hit A Turning Point?,2023-06-26T13:18:42Z
Tesla (TSLA) Poses Investment Dilemma: Cash Out or Hold Tight?,2023-06-26T13:27:00Z
US Stocks Edge Higher; Goldman Sachs Downgrades Tesla To Neutral,2023-06-26T13:44:45Z
"Benzinga's Top Ratings Upgrades, Downgrades For June 26, 2023",2023-06-26T15:01:50Z
Tesla Stock Keeps Moving Up. Will It Reach $1 Trillion?,2023-06-26T15:20:00Z
Billionaire Chamath Palihapitiya Predicts New Law Showering Billions On Clean Energy To Create World's First Trillionaire,2023-06-26T17:19:03Z
"US Stocks Struggle, Big Tech Sinks, VIX Spikes And Analysts Raise Bearish Calls: What's Driving Markets Monday",2023-06-26T17:30:20Z
"Tesla's stock suffers a 'correction' as Cathie Wood's ETFs have sold more than 500,000 shares in June",2023-06-26T17:50:00Z
Why Tesla Stock Fell Today,2023-06-26T20:08:15Z
Dow extends longest losing streak since September after Russia chaos as economic worries reverberate,2023-06-26T20:30:00Z
"Tesla investors should pump the brakes on Supercharger enthusiasm, one bear says",2023-06-26T21:33:00Z
Why Tesla and Carnival Saw Their Stocks Fall Monday,2023-06-26T23:05:00Z
Tesla's Competitive Environment in Florida Will Become Sunnier on July 1,2023-06-27T00:45:00Z
Investor Sentiment Declines Further After Nasdaq Drops Over 1%,2023-06-27T07:19:30Z
The critical role that battery recycling will play in an electrified future,2023-06-27T09:01:00Z
10 picks for the best electric cars in 2023,2023-06-27T09:01:00Z
"Alphabet, Amazon, Tesla, and Nvidia Have Split Their Shares: These 4 Companies Should Be the Next Stock-Split Stocks",2023-06-27T09:21:00Z
Is Tesla Stock a Buy Now? Tesla Stock Analysis,2023-06-27T10:00:00Z
Meta vs. Tesla: Who Wins This Clash of Titans in the Financial Arena?,2023-06-27T10:49:00Z
Income Investing On Steroids: 39 Trades To Potentially Generate A Big Fat Yield,2023-06-27T11:00:00Z
Market Volatility Increases Sharply; S&P 500 Settles Lower,2023-06-27T11:06:12Z
Is Nio Stock Following in Tesla's Footsteps?,2023-06-27T11:45:00Z
"Tesla risks some 'operational hiccups' as the year goes on, analyst says",2023-06-27T12:52:00Z
"Company News for Jun 27, 2023",2023-06-27T13:28:00Z
"EV Roundup: NIO Raises More Than $700M, RIVN to Ride TSLA's NACS Wave & More",2023-06-27T13:58:00Z
A summer battle of the stock bulls and bears is brewing. Here's how you play both sides of that.,2023-06-27T14:07:00Z
When Russia was NVIDIA -- why you shouldn't chase the stock-market darlings,2023-06-27T14:14:00Z
Tesla Stock: No AI Hype Here - Buy The Dip,2023-06-27T14:29:20Z
Is Tesla Stock a Buy?,2023-06-27T14:33:00Z
"Delta Air Lines, Generac stocks rally, Walgreens and Lordstown Motors shares tumble, and other stocks on the move",2023-06-27T16:21:00Z
"Stocks Rebound, Tech Rallies As Dip Buyers Return: What's Driving Markets Tuesday?",2023-06-27T17:43:37Z
Best AI Stocks to Buy: Nvidia vs. Tesla,2023-06-28T07:45:00Z
Market Volatility Drops; S&P 500 Settles Higher Following Economic Reports,2023-06-28T09:40:58Z
"Cathie Wood's Ark Outshines S&P 500, Nasdaq In H1: Here Are The Major Trades It Made",2023-06-28T09:59:52Z
Tesla China On Track To Hit Record Q2 Sales Even As Market Share Shrinks Amid Heated Rivalry: Analyst,2023-06-28T10:16:26Z
2 Dirt Cheap Stocks Set to Soar From Artificial Intelligence and Electric Vehicles,2023-06-28T10:40:00Z
"After Lordstown bankruptcy, a shakeout is expected in the EV market",2023-06-28T12:04:00Z
"Happy Birthday, Elon Musk! If You Invested $1,000 In Tesla IPO 13 Years Ago, Here's How Much It Would Be Worth Now",2023-06-28T12:10:21Z
Biden is declaring victory on the economy. Wall Street is grudgingly coming around.,2023-06-28T12:32:00Z
"ChargePoint, Tesla stocks get a lift as EV maker inks another charging win",2023-06-28T12:49:00Z
Tesla Just Announced Its Next Multi-Hundred-Billion-Dollar Business,2023-06-28T14:15:00Z
Tesla (TSLA) NACS Connector to Become a Charging Standard,2023-06-28T14:26:00Z
How Much Is Capital Gains Tax? All the Details You Need,2023-06-28T15:33:13Z
Tesla is opening its Supercharger network to rival EV makers. That could turbocharge the stock.,2023-06-28T16:58:00Z
"Why Rivian, Fisker, and Lucid Stocks Powered Higher Today",2023-06-28T17:03:43Z
Investing in TaaS,2023-06-28T21:10:26Z
"Lucid's Future Shaky, 2 More EV Makers At Risk of Bankruptcy, Warns Analyst After Lordstown's Fall",2023-06-29T05:59:14Z
"Wall Street Has a ""Big"" Problem, and It May Spell Serious Trouble for Stocks",2023-06-29T09:06:00Z
Best Stocks to Buy: Palantir vs. Tesla,2023-06-29T09:15:00Z
3 High-Flying Stocks That Wall Street Believes Can Plunge Up to 91%,2023-06-29T09:21:00Z
"The stock market can rally further, but here's why it's too early to celebrate the bear's demise",2023-06-29T10:23:00Z
Can AI Help Tesla Stock Hit a New All-Time High This Year?,2023-06-29T10:30:00Z
2 Cruise Stocks Boosting the S&P 500 Rally in 1H 2023,2023-06-29T12:37:00Z
Apple's Bull Run Is Different From Other Tech Giants,2023-06-29T13:04:00Z
Cathie Wood Sold Tesla Stock to Buy Robinhood Stock. Here's Why,2023-06-29T14:15:00Z
Friday Showdown: Markets Brace For Fed's Preferred Inflation Data While July Interest Rate Hike Bets Surge,2023-06-29T16:18:49Z
Tesla (TSLA) Outpaces Stock Market Gains: What You Should Know,2023-06-29T21:45:24Z
Why Rivian Stock Zoomed 9% Higher Today,2023-06-29T22:07:06Z
"The Zacks Analyst Blog Highlights NVIDIA, Tesla, Apple, Royal Caribbean Cruises and Carnival",2023-06-30T09:00:00Z
"The futuristic 2023 Mercedes-EQ EQS electric sedan offers up thrilling performance, high-tech luxury",2023-06-30T09:02:00Z
"Why AI Stocks Unity, Aurora, and SoundHound Are Soaring Again This Week",2023-06-30T11:21:00Z
"These strategists say investors need quality, so sell Tesla and AMD, and buy these stocks instead.",2023-06-30T14:05:00Z
Tesla (TSLA) NACS to Become a Part of Electrify America,2023-06-30T15:22:00Z
XPeng stock soars toward best month in nearly 3 years as new G6 coupe SUV is launched,2023-06-30T15:32:00Z
GM vs. TSLA: Which Stock Is the Better Value Option?,2023-06-30T15:40:11Z
EV Stocks Popped This Week: What You Need to Know,2023-06-30T16:47:20Z
Do Not Disturb: Tenants brace for more office landlords to go belly up on their property debts,2023-06-30T17:48:00Z
Why This Tesla Analyst Is Shooting For Below-Consensus Q2 Deliveries,2023-06-30T20:01:40Z
Wall Street Finishes a Strong First Half of 2023. What's Next?,2023-06-30T22:40:00Z
Cathie Wood Offloads Whopping $19M Tesla Stock Even As Bulls Brace For Q2 Deliveries Sunday,2023-07-01T02:44:58Z
EVs Get Supercharged,2023-07-01T11:30:00Z
These are the best-performing stocks in the 2023 bull market — and the worst,2023-07-01T12:16:00Z
What Happened to Tesla This Week?,2023-07-01T14:30:00Z
7 Best Stocks to Buy in July 2023,2023-07-01T14:30:26Z
This new bull market is just getting started. Buy stocks on weakness.,2023-07-01T15:34:00Z
The next catalyst for Tesla's stock is around the corner,2023-07-01T17:49:00Z
