title,published_utc
3 Steps to Indentifying the Market Environment,2023-05-02T13:05:00Z
This Partnership Could Supercharge Growth for EV Stocks,2023-05-02T13:22:00Z
Is Canoo Stock a Buy?,2023-05-02T14:02:00Z
"Tesla Has a Problem, but Demand Isn't It",2023-05-02T15:00:00Z
Ford to reopen orders and cut prices for its electric Mustang SUV ,2023-05-02T16:37:00Z
"Cummins (CMI) Q1 Earnings & Sales Beat, 2023 View Raised",2023-05-02T17:37:00Z
Ford Is Losing Money on Every EV -- It Still Could Be a Stock To Buy Now,2023-05-02T22:15:02Z
"Tesla raises U.S. prices for Model 3, Model Y vehicles by $250",2023-05-02T22:50:00Z
Can Tesla Beat Apple In Market Value? Analyst Points To 'Huge Missed Opportunity',2023-05-03T08:16:29Z
The Maserati Grecale goes electric: When can you get one?,2023-05-03T09:02:00Z
Is It Time to Buy the S&P 500's 3 Worst-Performing April Stocks?,2023-05-03T09:31:00Z
S&P Drops Over 1%; Market Volatility Rises Sharply,2023-05-03T09:43:49Z
Rivian Has a Lot to Prove Right Now,2023-05-03T10:30:00Z
This top-performing macro fund is about to load up on cyclical stocks. Here's why.,2023-05-03T11:11:00Z
Sprout Social stock sinks 18% as revenue forecast for current quarter falls short,2023-05-03T11:55:00Z
Here's How Ford Plans to Win Tesla's Price War,2023-05-03T15:09:05Z
"Top Research Reports for Berkshire Hathaway, Tesla & JPMorgan Chase",2023-05-03T15:55:00Z
"U.S. car sales could surprise on the upside, Cox says",2023-05-03T16:28:00Z
Ford (F) Q1 Earnings Beat on Better-Than-Expected Sales,2023-05-03T16:48:00Z
Fed Meeting Live Updates: 10 Takeaways From May FOMC Meeting & Statement,2023-05-03T17:22:50Z
"The Zacks Analyst Blog Highlights Berkshire Hathaway, Tesla, JPMorgan Chase, Abbott Laboratories and Comcast",2023-05-04T09:16:00Z
Here's when history says the post-Fed pause rally should start — and the two unlikely sectors to benefit,2023-05-04T12:49:00Z
"Tesla Stock Plunged 15% in April, But Here's Why That's a Long-Term Opportunity",2023-05-04T13:00:00Z
"Bitcoin could soon reach $45,000 if this pattern repeats, analyst says. Has the crypto started a new bull market? ",2023-05-04T15:46:00Z
Tesla: Charles Munger Made Some Good Points,2023-05-04T15:48:40Z
BorgWarner (BWA) Q1 Earnings Snap Beat Streak But Rise Y/Y,2023-05-04T16:45:00Z
"Tesla Teases Model S Plaid Track Package, With Speeds Up To 200 MPH",2023-05-04T17:41:11Z
U.S. and China are on a collision course that could heat up their cold war,2023-05-04T17:53:00Z
"Microsoft, Alphabet, and ChapGPT-Creator OpenAI Summoned to the White House for AI Summit",2023-05-04T19:49:40Z
Rivian vs. Tesla: Which AI-Powered Electric Vehicle Maker Is the Better Investment?,2023-05-05T10:23:38Z
"The EV Market Through The Eyes Of Warren Buffett, Adam Smith And Charles Darwin: An Analyst's Take",2023-05-05T11:41:14Z
"The S&P 500 will not break above its range soon, says Goldman Sachs. Here are 6 reasons why.",2023-05-05T12:42:00Z
Why Fisker Stock Leaped Nearly 7% Higher Today,2023-05-05T22:32:51Z
Is Tesla a Tech Stock? This Indicator Might Flip the Narrative.,2023-05-06T11:30:00Z
Why Tesla Plunged 20.8% in April,2023-05-06T12:26:37Z
75% of These Wall Street Analysts Recommend Buying 1 Unstoppable Stock,2023-05-06T13:15:00Z
2 Reasons to Buy Tesla Stock Before it Skyrockets,2023-05-06T13:45:00Z
Tesla Is Doing Exactly What You Wouldn't Think It Would Do,2023-05-06T14:30:00Z
"Elon Musk and others may try, but controlling AI is an impossible mission",2023-05-06T15:17:00Z
"1 Stock to Buy, 1 Stock to Sell This Week: Airbnb, Rivian",2023-05-07T12:21:00Z
"Panasonic: Buffett Bets On Japan, But This Is My Favorite Japanese Play",2023-05-08T05:26:28Z
Could Warren Buffett Finally Make A Bet On Tesla After Praising Elon Musk? Top Analyst Reacts,2023-05-08T08:51:04Z
Here are some of the most advanced car tech features ​you should know about,2023-05-08T09:01:00Z
4 Stocks that Moved the Market in April,2023-05-08T09:22:00Z
"Is Tesla Cheap After Recent Pullback? Analyst Says Stock Discounts High Expectations, Low-Probability Outcomes",2023-05-08T12:32:20Z
"Tesla, Inc. (TSLA) is Attracting Investor Attention: Here is What You Should Know",2023-05-08T13:00:14Z
"Five regional banks and an ETF that are ready to soar, says Fundstrat.",2023-05-08T13:42:00Z
"Biden, McCarthy To Discuss Debt Ceiling On Tuesday: What Investors Need To Know",2023-05-08T15:11:02Z
Why Fisker Stock Zoomed 6% Higher on Monday,2023-05-08T22:07:00Z
"Lucid's Q1 Miss: Elon Musk Spells Out 'Easy,' 'Hard' And 'Excruciating' Parts Of Making EVs",2023-05-09T06:39:20Z
Are airlines doing anything for the planet? Not so much.,2023-05-09T09:00:00Z
3 Ultra-Popular Artificial Intelligence (AI) Stocks I Wouldn't Buy With Free Money,2023-05-09T09:21:00Z
S&P Settles Almost Flat; Market Volatility Drops,2023-05-09T10:02:14Z
Wall Street Breakfast Podcast: Palantir Technologies Stock Soars,2023-05-09T11:00:39Z
Tesla breaks ground on Texas lithium refinery,2023-05-09T11:14:00Z
Tesla Stock: Headed to $280?,2023-05-09T11:31:00Z
Why Tesla Rival Lucid Is On Reverse Gear In Tuesday's Premarket,2023-05-09T11:45:23Z
Is Lucid an EV Stock to Buy Now?,2023-05-09T12:14:00Z
"Insiders Selling Tesla, Amazon And This Tech Giant",2023-05-09T12:17:19Z
Who's the EV Stock Leader? Warren Buffett Says There Isn't One,2023-05-09T13:01:03Z
"'It's ridiculous.' Buy short-term Treasury bills because debt-ceiling deal will come, says bond legend Bill Gross",2023-05-09T13:38:00Z
Nikola Plans to Shift Focus to North America: What It Means for Investors,2023-05-09T15:14:36Z
Are Lucid's Latest Numbers a Warning Signal for Investors?,2023-05-09T15:19:23Z
How To Trade US CPI: The Top 5 Mega-Cap Gainers And Losers Following Last 3 Inflation Reports,2023-05-09T16:42:39Z
2 Stocks to Buy Now and Hold for Decades,2023-05-09T17:01:00Z
Elon Musk joins long list of billionaires who’ve said giving away money is hard — including Andrew Carnegie,2023-05-09T19:45:00Z
Elon Musk Can Leverage Tucker Carlson's Twitter Broadcast To Tesla's Advantage: Analyst Explains How,2023-05-10T06:36:39Z
"Tesla Peak Earnings In 'Rear View' As EV Maker Falters In China, Says Analyst: 'Wall Street Remains ... Criminally Bullish'",2023-05-10T09:53:43Z
1 Growth Stock Down 75% You'll Regret Not Buying on the Dip,2023-05-10T10:09:00Z
S&P Settles Lower Ahead Of CPI; Market Volatility Increases,2023-05-10T10:11:49Z
Tesla Gears Up to Offer Free AI-Powered Self-Driving Trial: Time to Buy the Stock?,2023-05-10T10:15:00Z
Is commercial real estate about to keel over? What tightening lending standards have historically meant for the economy.,2023-05-10T10:56:00Z
"CPI Reactions: S&P 500 Eyes Bull Market, Dollar Sinks, Treasuries And Gold Climb As Markets Embrace Potential Fed Pause",2023-05-10T14:01:04Z
Rivian Stock: 3 Words That Should Scare the EV Company's Bulls,2023-05-10T14:37:00Z
Tesla’s stock back to green as Rivian and broader stock market provide support,2023-05-10T15:43:00Z
"Cybertruck Prototype Gets Stuck In Field In Texas, Quickly Goes Viral On Twitter",2023-05-10T17:08:31Z
"Robinhood Q1 Earnings Highlights: Revenue And EPS Beat, 24-Hour Trading Launch Featuring Select Stocks Such As Tesla",2023-05-10T21:06:44Z
Riding the $14 Trillion AI Wave: Here Are 2 Top Stocks to Buy Now,2023-05-11T09:40:00Z
Should You Invest in the Consumer Discretionary Select Sector SPDR ETF (XLY)?,2023-05-11T10:20:09Z
"Senators ask Tesla to end forced arbitration, saying it helps company hide discrimination and safety claims",2023-05-11T13:10:00Z
Why investors should pay particular attention to one recent Warren Buffett move,2023-05-11T13:46:00Z
Biden's EPA proposes first-ever restrictions on greenhouse gases from power plants,2023-05-11T14:54:00Z
'Trading hours haven’t changed since the '80s': Robinhood's Tenev talks about 24-hour stock trading as skeptics question need,2023-05-11T15:25:00Z
What Is the Fortune 100?,2023-05-11T20:26:58Z
Elon Musk says he's hired new CEO for Twitter; is it NBCUniversal's Linda Yaccarino?,2023-05-12T00:12:00Z
Bank News and a New Normal for Investors to Consider,2023-05-12T01:03:00Z
"Cathie Wood Unfazed By Autopilot Concerns, Calls Tesla's FSD 'Most Impactful AI Project'",2023-05-12T05:58:59Z
Tesla Analysts Applaud Musk's Exit As Twitter CEO: 'Finally Reading The Room',2023-05-12T06:23:22Z
Why This Tesla Analyst Expects Stock To Spike Over Next 3 Sessions,2023-05-12T07:51:23Z
Should Goldman Sachs ActiveBeta U.S. Large Cap Equity ETF (GSLC) Be on Your Investing Radar?,2023-05-12T10:20:08Z
Unleashing the Power of Innovation: Why High-Growth Investors Can't Afford to Ignore Tesla and Coinbase,2023-05-12T10:30:00Z
"Tesla raises prices on the Model S, Model X and Model Y",2023-05-12T11:56:00Z
Why the stock market has actually thrived as regional banks flounder.,2023-05-12T12:03:00Z
"Tesla Raises Prices Again, but This Lesser-Known EV Stock Is Friday's Highflier",2023-05-12T13:15:30Z
GM or TSLA: Which Is the Better Value Stock Right Now?,2023-05-12T15:40:07Z
Why Rivian Stock Keeps Falling,2023-05-12T15:51:23Z
"US Stocks Drop, Dollar Jumps As Cautious Sentiment Dominates: S&P 500 On Track To Close Another Week In The Red",2023-05-12T16:46:03Z
Musk makes it official: Yaccarino is new Twitter CEO,2023-05-12T17:04:00Z
"Getaround stock soars on deal news, First Solar, Tesla, Beyond Meat and other stocks on the move ",2023-05-12T17:47:00Z
Analyst Ratings for Tesla,2023-05-12T18:00:41Z
Tesla stock moves lower as boost from Musk's Twitter CEO pick proves short-lived,2023-05-12T18:02:00Z
"Dow, S&P 500 book back-to-back weekly losses, as poor consumer sentiment report reignites recession fears",2023-05-12T20:42:00Z
"Soros bet on railroads, fitness, gig economy and lightened load on Disney, Amazon, dumped Tesla",2023-05-12T21:30:00Z
Ford Loses This Whopping Amount of Money on Each EV It Makes,2023-05-13T09:02:00Z
Apple: 2 Billion Reasons Buffett's Favorite Company Just Changed The Game,2023-05-13T12:00:00Z
"Elon Musk Committed To Tesla, Rivian Shuns Price Cuts, Fisker Stutters At Start And More: Biggest EV Stories Of The Week",2023-05-13T12:33:37Z
"'The Fed is way late and they’ve already screwed it up.' This stock strategist is banking on gold, silver and Treasurys to weather a recession.",2023-05-13T12:48:00Z
Here's why people are still worried about regional banks and commercial real estate,2023-05-13T13:01:00Z
Cathie Wood Loves These AI Stocks. Should You?,2023-05-13T13:10:00Z
"Rivian, Lucid and Fisker navigate a 'treacherous road' as they struggle to match Tesla's success",2023-05-13T16:31:00Z
Rivian Stock Investors Need to Hear What Its CEO Just Said,2023-05-14T09:48:00Z
"This Electric Vehicle Maker Just Zoomed Into 1st Place With Investors, but Is That Justified?",2023-05-14T09:51:00Z
3 Things I Wish I Had Known When I Started Building My Retirement Savings,2023-05-14T09:53:00Z
2 Reasons to Be Bullish on Tesla Stock,2023-05-14T12:06:00Z
"What's the Future of Bitcoin? Here Are the Best, Worst, and Most Likely Scenarios.",2023-05-14T13:21:00Z
The Best Renewable Energy Stocks to Buy Right Now With $500,2023-05-15T09:16:00Z
S&P 500 Settles Lower Amid Decline In Consumer Sentiment; Market Volatility Increases,2023-05-15T09:31:41Z
"The 'end of the runway' is nearing for lofty tech and soggy banks. Get ready, says this strategist",2023-05-15T11:06:00Z
Tesla's Path To Warren Buffett's Portfolio: How Much Should Stock Drop To Get Berkshire's Attention?,2023-05-15T12:51:34Z
"Tesla Breaks Down From Trend Ahead Of Shareholder Meeting: The Bull, Bear Case For The EV Stock",2023-05-15T14:39:09Z
The Narrative Is Changing for Tesla. Be Ready.,2023-05-15T15:18:46Z
Tesla Makes Room For New Production Line In Fremont,2023-05-15T17:49:35Z
"Now is the time to lease, not buy, an EV",2023-05-16T09:02:00Z
"Biden wants more rural utilities to tap renewable energy, carbon capture",2023-05-16T09:03:00Z
Is It Time to Sell Shiba Inu?,2023-05-16T09:30:00Z
Prediction: These Will Be 5 of the Most Valuable AI Stocks by 2050,2023-05-16T09:33:00Z
This Stock Market Indicator Has Never Been Worse. Here's What Could Be Coming.,2023-05-16T09:52:00Z
Earnings Stock Sell-Off: 3 Once-in-a-Decade Buying Opportunities for Patient Investors,2023-05-16T10:00:00Z
Here's Why Gen Z Should Stock Up On Growth Stocks During the Dip,2023-05-16T10:40:00Z
"These 2 Stocks Carry a Lot of Risk, But Their Upside Is Huge",2023-05-16T10:50:00Z
"David Tepper's Appaloosa reveals new Tesla, Nvidia, FedEx positions",2023-05-16T12:16:00Z
Why Automakers Will Struggle To Mint Money With Subscription Features,2023-05-16T12:48:30Z
"Here's the big thing holding up the stock market, says Bank of America",2023-05-16T13:40:00Z
The Biggest Reason Why Warren Buffett Does Not Own Tesla Stock,2023-05-16T14:02:54Z
Twitter CEO: 4 things to know about new Twitter chief Linda Yaccarino,2023-05-16T14:38:00Z
Elon Musk to Step Down from Twitter: Is Tesla Stock Now a Buy?,2023-05-16T14:51:00Z
"Tesla stock rises ahead of shareholder meeting with board independence, demand in focus",2023-05-16T15:31:00Z
"Elon Musk says George Soros hates humanity — while, unrelatedly, a filing shows the financier sold his Tesla stake",2023-05-16T17:17:00Z
"Capital One’s stock rallies, Home Depot shares dip, and other stocks on the move",2023-05-16T17:35:00Z
Musk Addresses Tesla's Profitability And Economic Challenges At Annual Shareholders' Meeting,2023-05-16T21:46:56Z
Musk Expresses Concern Over Federal Reserve's Decision-Making Latency Impacting Broader Economy,2023-05-16T23:18:32Z
Tesla's Elon Musk expects 'a year of difficulty' for the global economy,2023-05-17T00:39:00Z
Tracking George Soros's Portfolio - Q1 2023 Update,2023-05-17T04:19:41Z
Tesla Bulls Cheer Elon Musk's Decision To Try Some Advertising: 'It Could Be Amazingly Successful',2023-05-17T07:43:17Z
Tesla Analyst Says Rivian Potential Survivor As Elon Musk Warns Of Tough 12 Months For Auto Industry,2023-05-17T08:41:30Z
"Review: The all-new 2023 Lexus RZ luxury electric SUV—range, charging and more",2023-05-17T09:00:00Z
Are electric vehicles any good at towing? Here are the pros and cons.,2023-05-17T09:01:00Z
'Welcome to the automobile business.' Here's Jim Chanos on Elon Musk's Tesla,2023-05-17T09:32:00Z
Prediction: 2 Growth Stocks Will Be Worth $2 Trillion by 2033 (Besides Apple and Microsoft),2023-05-17T09:38:00Z
Confirmed: Tesla to Start Cybertruck Deliveries This Year,2023-05-17T10:01:00Z
Tesla Has a Battery Problem,2023-05-17T10:15:00Z
Don't Overlook This EV Stock,2023-05-17T11:00:00Z
Lots of office workers want to work from home. Elon Musk thinks it's 'morally wrong.',2023-05-17T11:30:00Z
"The Nasdaq is on the verge of exhaustion, says famed technical strategist Tom DeMark",2023-05-17T12:53:00Z
3 Reasons to Buy Tesla Stock Hand Over Fist,2023-05-17T13:15:00Z
Elon Musk says he's not stepping down and four other takeaways from Tesla shareholder meeting,2023-05-17T15:37:00Z
"One Tesla Analyst Expects Shares To Accelerate, Another Sees The Stock Reversing Following EV Company's Shareholder Meeting",2023-05-17T15:45:00Z
"US Stocks Climb On Growing Optimism Over Debt Ceiling Deal; Regional Banks Rally, Energy And Financials Lead Gains",2023-05-17T17:37:00Z
Elon Musk Just Unveiled His Vision for Tesla's Robotaxi -- Should Uber Be Worried?,2023-05-17T18:16:46Z
"Comerica leads S&P 500 gainers in regional-bank rally, Target gains and other stocks on the move",2023-05-17T18:25:00Z
Why Tesla Shares Jumped Today,2023-05-17T19:48:00Z
"Dow ends up 400 points on optimism about potential debt-ceiling deal, rebound in regional banks",2023-05-17T20:28:00Z
Why Electric Vehicle Stock Canoo Zoomed Ahead Today,2023-05-17T22:41:33Z
Rivian: Buyers Fled As It Exploded Last Week,2023-05-18T01:35:57Z
S&P 500 Surges Over 1% On Debt Ceiling Resolution Hopes; Market Volatility Drops Sharply,2023-05-18T09:50:58Z
"Elon Musk Predicts Tesla's AI ""ChatGPT Moment"" Is Coming Soon -- Is the Stock a Buy?",2023-05-18T11:05:00Z
"Debt ceiling is a buy-the-rumor but sell-the-news event, cautions this strategist",2023-05-18T11:25:00Z
Alibaba Demolishes Fiscal Q4 Earnings Estimates,2023-05-18T14:30:01Z
"Lithium miner Albemarle's stock at 'attractive point,' UBS says in rating upgrade",2023-05-18T15:26:00Z
"Tesla's Elon Musk is a 'rejuvenated' leader with more time to be devoted to EV maker, analyst says",2023-05-18T18:26:00Z
Tesla (TSLA) Addresses Crucial Topics in Shareholder Meeting,2023-05-18T18:36:00Z
Elon Musk 'can afford to include AM radio in his Teslas': Democrats and Republicans agree AM should go in EVs ,2023-05-18T20:43:00Z
Here’s where BlackRock sees a top thematic ETF investing opportunity as tech soars,2023-05-18T21:02:00Z
'Shark Tank' Investor Kevin O'Leary Wants 'Crazy-Looking' Tesla Cybertruck Because 'Ugly Is Interesting',2023-05-19T07:20:47Z
Daimler Picked Up A Stake In Tesla 14 Years Ago —But What Happened Next Was 'Worse Than Blockbuster Not Buying Netflix',2023-05-19T07:49:20Z
3 Ultra-Popular Growth Stocks Billionaire Money Managers Kicked to the Curb,2023-05-19T09:21:00Z
Is Ford Stock Finally a Buy?,2023-05-19T09:37:00Z
"If You Invested $1,000 in Tesla 1 Year Ago, This Is How Much You'd Have Today",2023-05-19T10:03:00Z
Is Invesco S&P 500 Equal Weight Consumer Discretionary ETF (RCD) a Strong ETF Right Now?,2023-05-19T10:20:06Z
Tesla or BYD: Which EV Investment Is Better?,2023-05-19T10:24:00Z
"Stocks are rallying, but investors say they're miserable. That's a good thing.",2023-05-19T10:46:00Z
"Tesla's Electric Visionary: 'Rejuvenated' Musk To Remain CEO For At Least 5 More Years, Says Analyst",2023-05-19T11:52:58Z
"Is Trending Stock Tesla, Inc. (TSLA) a Buy Now?",2023-05-19T13:00:13Z
AI or Bust,2023-05-19T13:33:00Z
Tesla: Prepare For A Macroeconomic Storm,2023-05-19T15:03:31Z
"Cathie Wood Says Tesla Stock Could Soar 1,030% by 2027 -- Elon Musk Says It's the Best Analysis He's Seen",2023-05-19T15:19:54Z
2 Stocks That Could Create Lasting Generational Wealth,2023-05-19T15:28:49Z
Tesla (TSLA) Up 8.5% Since Last Earnings Report: Can It Continue?,2023-05-19T15:30:24Z
Instagram is readying a Twitter-like service: report,2023-05-19T18:33:00Z
"Up 35% in This Bear Market, Is Tesla a Buy?",2023-05-19T21:17:00Z
20 AI stocks expected to post the highest compound annual sales growth through 2025,2023-05-20T02:22:00Z
"QQQ: Trading Legend Tom DeMark Sees NASDAQ 100 Nearing Exhaustion, And We Agree",2023-05-20T06:06:39Z
"As Tesla Stock Hits 1-Month High, Analyst Lists 6 Key Catalysts That Drove This Week's Rally",2023-05-20T07:42:27Z
"Elon Musk Just Issued An Ominous Warning About Banks, and That May Mean Bad News for Tesla",2023-05-20T10:00:00Z
Here's What Tesla's Decision to Start Advertising Could Mean for Tesla Stock Investors,2023-05-20T12:00:00Z
Tesla's Energy Storage Business Is Growing Like Gangbusters,2023-05-20T15:30:00Z
How to invest in one of the hottest stock market sectors while cutting your risk,2023-05-20T17:08:00Z
These 2 High-Growth Stocks Could Power the Bull Market's Next Record Run,2023-05-21T09:30:00Z
"Got $1,000? 5 Buffett Stocks to Buy and Hold Forever",2023-05-21T10:04:00Z
5 Struggling Stocks to Buy at a Discount,2023-05-21T11:45:00Z
Parade of retailers to face inflation doubts while Nvidia and Zoom answer questions about tech,2023-05-21T18:45:00Z
"'There surely will be failures.' As competition builds, some EV startups may fall by the wayside.",2023-05-22T09:00:00Z
EV startup VinFast gets shredded by reviewers test-driving the VF 8,2023-05-22T09:01:00Z
Tesla CEO Elon Musk Just Put a Huge Rumor to Bed,2023-05-22T09:21:00Z
Better Buy: Lemonade or Upstart?,2023-05-22T09:30:00Z
Best Stock to Buy Now: Tesla vs. Rivian,2023-05-22T10:30:00Z
1 Thing Cathie Wood Just Said About Ark Invest -- and Why It's Utterly Wrong,2023-05-22T13:31:12Z
The Tesla Train Continues to Move Forward,2023-05-22T14:00:00Z
"Investors rushing into stocks are wandering into a bull trap, warns Morgan Stanley Mike Wilson and others",2023-05-22T14:20:00Z
Why Nio Shares Jumped Higher Monday,2023-05-22T15:45:04Z
Cathie Wood's Advice on How to Excel in Your Job in the Wake of AI,2023-05-22T17:11:04Z
"Tesla Stock Charges Higher, Confirming Uptrend: The Bull, Bear Case",2023-05-22T19:14:28Z
3 Intriguing Tech Stocks to Buy After Earnings,2023-05-22T20:54:00Z
Here's Why Tesla Shares Rallied Again Today,2023-05-22T21:03:07Z
US Stocks Settle Mixed Amid Debt Ceiling Talks; Market Volatility Increases,2023-05-23T09:42:37Z
"Stay bullish on stocks, bearish on commodities as deflation clouds gather, says this quant strategy",2023-05-23T11:31:00Z
Tesla Stock Surged After Elon Musk Said These 5 Things Last Week,2023-05-23T12:08:00Z
How India's Richest Man Could Play A Key Role In Tesla's Expansion Plans,2023-05-23T12:50:41Z
Tesla Is No Ad Rookie: 8 Epic Marketing Stunts That Prove They're Already Pros,2023-05-23T13:16:42Z
Tesla’s stock suffering first drop in 6 days as it pulls back from 7-week high,2023-05-23T13:49:00Z
"Tesla price cuts are working as demand increased, analyst says",2023-05-23T16:48:00Z
Model Y Burst Into Flames On Side Of The Road: Tesla Told Owner To Bring 'Fully Burned' Vehicle To Service Center,2023-05-23T20:17:10Z
Elon Musk Teases Cybertruck Progress Again: 'Tough Product To Design ... But It'll Be Great!',2023-05-24T05:20:09Z
"As Europe luxury stocks slide, so does the wealth of the world's richest man",2023-05-24T07:44:00Z
Prediction: This Cathie Wood AI Stock Will Be 1 of the Top 5 Largest Companies by 2030,2023-05-24T09:05:00Z
"Got $1,000? Buy These Hot Growth Stocks Before They Take Off",2023-05-24T09:20:00Z
Best Stock to Buy: Tesla vs. Plug Power,2023-05-24T09:30:00Z
Tesla Has a Growing Inventory Problem,2023-05-24T09:30:00Z
S&P 500 Down Over 1% Ahead Of Fed Minutes; Market Volatility Increases,2023-05-24T09:35:15Z
"1 Super Stock That Could Join Apple, Microsoft, Amazon, and Alphabet in the $1 Trillion Club",2023-05-24T10:01:00Z
"The backdrop for stocks is as muddy as ever — and that's great news, says this banking giant",2023-05-24T10:47:00Z
2 Robinhood Stocks With Market-Beating Potential,2023-05-24T10:55:00Z
Rivian Just Gave Investors a Warning,2023-05-24T11:00:00Z
Q1 Earnings Season Highlights: Top 10 Winners and Losers According to InvestingPro,2023-05-24T11:57:00Z
"After pressure from Washington, Ford scraps plan to remove AM radio from its cars",2023-05-24T12:40:00Z
Ron DeSantis will launch presidential bid during Twitter chat with Elon Musk,2023-05-24T12:45:00Z
Elon Musk Invested $50 Million in OpenAI: 2 Glaring Concerns He Has Now,2023-05-24T13:08:15Z
Implied Volatility Surging for Tesla (TSLA) Stock Options,2023-05-24T13:39:00Z
Why EV Stocks Went Off the Road Wednesday,2023-05-24T18:44:00Z
Nvidia barrels toward rare $1 trillion valuation after putting a dollar figure on AI boost,2023-05-25T00:23:00Z
"Warren Buffett Says Elon Musk Is ""Solving the Impossible"" -- What Happens Next?",2023-05-25T09:15:00Z
S&P 500 Settles Lower Amid Debt-Ceiling Concerns; Market Volatility Jumps,2023-05-25T10:03:06Z
Tesla Stock: You Have Been Pumped And Warned By Elon Musk,2023-05-25T12:30:00Z
"Nvidia Stock After Q1 F2024: After A 165% YTD Rally, We Just Landed On Mars",2023-05-25T12:45:35Z
3 High-Flying Cathie Wood Stocks That Are Up Over 50% This Year,2023-05-25T13:15:00Z
The World's Richest Person Just Lost $11 Billion in a Single Day. Here's How,2023-05-25T13:19:22Z
"Elon Musk Says Not to ""Bet the Farm"" on Crypto and Dogecoin",2023-05-25T16:13:13Z
Tesla (TSLA) Gains But Lags Market: What You Should Know,2023-05-25T21:45:07Z
Dow drags behind Nasdaq by widest margin yet as blue-chip gauge misses out on Nvidia rally,2023-05-25T21:50:00Z
Ford EVs will be able to use Tesla charging stations under new agreement,2023-05-25T22:44:00Z
"AI news is driving tech 'building blocks' stocks like Nvidia. But another 'power' area will also benefit, say these veteran investors",2023-05-26T05:49:00Z
Stocks Rally on Nvidia’s AI Fervor and Debt Deal Optimism,2023-05-26T06:55:00Z
Tesla's 'Golden Goose' Quest: Analyst Assesses Potential To Achieve 30-50% Battery Cost Cuts,2023-05-26T09:07:19Z
3 Stocks to Buy While They Are on Sale,2023-05-26T09:35:00Z
"On the heels of Nvidia's blockbuster day, Marvell stock boosted by AI revenue expectations, while Gap rallies on surprise profit",2023-05-26T09:43:00Z
Advertising Isn't What Tesla Needs,2023-05-26T09:45:00Z
"Watch Out Uber, This Technology Could Make You Obsolete",2023-05-26T11:15:00Z
"Alphabet CEO Sundar Pichai Commits to ""AI Pact"": What Does This Really Mean?",2023-05-26T13:15:56Z
Ford (F) to Add Tesla Chargers to Its Electric Lineup,2023-05-26T15:20:00Z
What Will Tesla Gain from the Ford Partnership?,2023-05-26T15:36:52Z
Electrifying Opportunities in EV ETFs as Tesla & Ford Join Forces,2023-05-26T19:27:00Z
Why Tesla Shares Jumped Higher Today,2023-05-26T20:30:00Z
"U.S. stocks close sharply higher, with tech shares rallying on hopes for debt-ceiling deal",2023-05-26T20:34:00Z
Did Tesla Just Give Away Its Biggest Competitive Advantage?,2023-05-27T09:48:00Z
Why Rivian Should Sell Itself Before It's Too Late,2023-05-27T10:15:00Z
Rivian Stock: Bull vs. Bear,2023-05-27T12:06:00Z
Ford Just Hit The Jackpot,2023-05-27T13:00:00Z
Tesla Is Already the Best-Selling Car Worldwide and a Second Might Soon Follow,2023-05-27T14:15:00Z
AI buzz pushes tech stocks higher – but here’s why the ripple effect in stocks may still be ‘narrow’,2023-05-27T16:39:00Z
Could These 3 Stocks Be Worth $1 Trillion by 2030?,2023-05-27T18:15:00Z
Tesla Model Y is the first electric vehicle to be the world’s best-selling car,2023-05-27T18:18:00Z
The Tesla Model Y Is Now The World's Bestselling Car,2023-05-27T19:20:15Z
2 Top Growth Stocks to Buy Right Now and Hold for the Long-Term,2023-05-28T09:35:00Z
3 Cathie Wood Stocks Expected to Rise 245% to 980% Over the Next Few Years,2023-05-28T13:00:00Z
Cathie Wood's ARK Sees Tesla Cybertruck Being As Mainstream As Model Y: Low Expectations 'Based On Blind Spot',2023-05-29T06:01:27Z
2 Ultra-Popular AI Stocks Billionaire Investors Are Buying Hand Over Fist and 1 They're Selling,2023-05-29T09:21:00Z
