title,published_utc
Should You Invest in the iShares U.S. Consumer Discretionary ETF (IYC)?,2023-05-29T10:20:07Z
Tesla Revs Up India Market Entry: Elon Musk's Next Big EV Frontier?,2023-05-29T12:17:31Z
GM vs. TSLA: Which Stock Is the Better Value Option?,2023-05-29T15:40:11Z
"Musk Expected To Visit China This Week, Meet Officials: Report",2023-05-29T18:33:56Z
Elon Musk's Reminder On Excesses That Led To 2006-07 Housing Market Collapse: 'They Dug Their Own Graves',2023-05-30T07:05:50Z
"For the First Time in 23 Years, the S&P 500 Is Displaying an Ominous Warning to Wall Street",2023-05-30T09:06:00Z
110 of the S&P 500 Companies Are Talking About AI -- 2 Stocks to Buy Right Now,2023-05-30T09:20:00Z
2 AI Stocks Wall Street Believes Will Have Trillion-Dollar Valuations,2023-05-30T09:21:00Z
Elon Musk's Decision to Try Out Advertising for Tesla Could Be Game-Changing,2023-05-30T11:30:00Z
Cathie Wood Challenges The Hype: Is Nvidia Really The Only AI Play?,2023-05-30T11:45:08Z
Musk In China: Tesla Analyst Says 'Golden Goose Of EV Market' Key To Global Dominance,2023-05-30T12:38:33Z
Ryan Serhant on real estate: Bedrooms and home offices  rank over price per square foot,2023-05-30T12:46:00Z
"Here is What to Know Beyond Why Tesla, Inc. (TSLA) is a Trending Stock",2023-05-30T13:00:12Z
Why Nvidia and Tesla Keep Sending the Nasdaq Higher,2023-05-30T13:15:27Z
"Auto Roundup: TSLA & F's Game-Changing Deal, AZO's Quarterly Results & More",2023-05-30T14:28:00Z
"AI could bring ‘extinction’ and requires nuclear-war-level preparations, experts warn",2023-05-30T14:39:00Z
Why Tesla Stock Moved Higher Again Today,2023-05-30T15:29:46Z
Ford Deal Supercharges Tesla,2023-05-30T15:34:00Z
"Tech Stocks Advance On Epic AI-Driven Rally; S&P 500, Dow Retreat Amid Debt Deal Vote, Rate Hike Fears",2023-05-30T17:48:00Z
"Top Research Reports for Tesla, TotalEnergies & Intuitive Surgical",2023-05-30T20:29:00Z
Top 5 Artificial Intelligence Start-ups to Watch in 2023,2023-05-30T20:30:48Z
"ARK Innovation ETF rises sharply, Cathie Wood views its top holding Tesla as ‘most obvious beneficiary’ of recent AI breakthroughs",2023-05-30T20:37:00Z
Dow ends lower as debt-ceiling deal goes to Congress,2023-05-30T20:38:00Z
Nvidia comes up $10 billion short of $1 trillion market-cap milestone,2023-05-30T21:03:00Z
"The Zacks Analyst Blog Highlights Tesla, TotalEnergies, Intuitive Surgical, Charles Schwab and Monster Beverage",2023-05-31T08:51:00Z
S&P 500 Settles Almost Flat; Market Volatility Decreases,2023-05-31T09:35:16Z
Is Nuveen ESG Large-Cap Growth ETF (NULG) a Strong ETF Right Now?,2023-05-31T10:20:07Z
"A default wave is building, says Deutsche Bank. Here's how bad it may get.",2023-05-31T12:43:00Z
Tesla Is Doing Something It Has Never Done Before,2023-05-31T12:45:00Z
"Company News for May 31, 2023",2023-05-31T13:36:00Z
Prediction: These Stock-Split Stocks Will Lead Gains in the Next Bull Market,2023-05-31T18:00:00Z
Nasdaq outperforms Dow in May by widest margin since dot-com crash as 'Magnificent Seven' stocks power higher,2023-05-31T21:30:00Z
Tesla (TSLA) Gains As Market Dips: What You Should Know,2023-05-31T21:45:18Z
"Time to Buy These ""Trillion Dollar"" Stocks for More Upside",2023-06-01T04:47:00Z
Should You Invest in the Vanguard Consumer Discretionary ETF (VCR)?,2023-06-01T10:20:09Z
Top 5 Consumer Stocks That You May Want To Dump In June,2023-06-01T11:37:35Z
Beyond Tesla: This AI-Driven EV Stock Could Outperform the Competition,2023-06-01T11:39:00Z
5 Reasons to Buy Tesla Now,2023-06-01T12:13:00Z
Is Tesla 'Blackberry Of EV Industry?' Why Analyst Sees Its Valuation At Risk of Collapse,2023-06-01T12:22:09Z
"10 stocks that will benefit from higher earnings on company cash, and 10 that have a debt problem",2023-06-01T13:27:00Z
Cathie Wood Says Software Is the Next Big AI Buying Opportunity -- And These 4 Stocks Could Skyrocket,2023-06-01T13:47:37Z
Nio's stock tumbles toward 3-year low after May deliveries fall,2023-06-01T14:19:00Z
Why Is Ford Motor Company (F) Up 1.8% Since Last Earnings Report?,2023-06-01T15:31:18Z
"AI, Tech Fuel Rebound Of Vanguard Growth ETF, Eroding Value's 2022 Outperformance",2023-06-01T16:56:58Z
"ChatGPT Is Fabricating Information: Why That's a Problem For Every Industry, Not Just Journalism",2023-06-01T19:10:50Z
The 2023 Rivian R1S is a rare combination of a large electric SUV with off-road chops and a luxury cabin,2023-06-02T09:00:00Z
"Zacks Investment Ideas feature highlights: Tesla, Apple, General Motors, Honda Motor and Ford",2023-06-02T09:00:00Z
The Future of Logistics: How AI Is Changing the Transportation Industry,2023-06-02T09:00:00Z
Better Buy: Rivian vs. Lucid Group,2023-06-02T09:01:00Z
"Of All These Chip Stocks, This One Could Benefit the Most From the AI Boom",2023-06-02T09:10:00Z
3 Cathie Wood Stocks That Could Deliver Bigger Gains Than the Market,2023-06-02T09:15:00Z
Jim Cramer Says These 'Magnificent Seven' Stocks Are Winners: 'You Don't Want To Be Their Competitor',2023-06-02T09:21:10Z
Beware the 'June Swoon' for stocks as AI-ebullience leaves tech overbought,2023-06-02T12:42:00Z
Upcoming Stock Splits 2023,2023-06-02T13:18:09Z
"Elon Musk Praises Quality of Made in China Teslas, Exxon Eyes Double Output With New Fracking Tech, Netflix Shareholders Vote Against Fat Exec. Pay: Today's Top Stories",2023-06-02T13:31:57Z
Elon Musk Reclaims Title of World's Richest Man: Here's How Much Of His Wealth Is In Tesla Stock,2023-06-02T13:43:09Z
Is Tesla Stock Still a Buy After Multiple Analyst Downgrades?,2023-06-02T14:20:00Z
NIO: It's Time To Wake Up,2023-06-02T20:00:00Z
"'Buy China, Sell AI' Is The Ultimate Contrarian Trade By This Top Wall Street Analyst: Find Out Why",2023-06-02T20:09:26Z
Wall Street Breakfast: What Moved Markets,2023-06-03T11:13:26Z
"Microsoft, Tesla, and Amazon Are Among 110 S&P 500 Companies Discussing AI -- 2 Other AI Stocks to Buy Hand Over Fist",2023-06-03T12:20:00Z
Rule Breaker Investor Habit No. 6: Aim for 60% Accuracy,2023-06-03T13:30:00Z
Tesla Investors Can Slowly Get More Excited About This,2023-06-03T14:15:00Z
Nvidia and other tech plays are overpriced. Here's where you'll find the next big-money stocks.,2023-06-03T15:40:00Z
"U.S. car sales are stronger than a year ago, but rising interest rates could hit demand",2023-06-03T16:30:00Z
"Twitter is worth just 33% of what Elon Musk bought it for, Fidelity says",2023-06-03T18:20:00Z
"Beyond OpenAI: 7 promising startups that have saved lives, sped up drug development and improved manufacturing",2023-06-03T19:19:00Z
Traders Bet Billions On A 2023 Fed Pivot: Powell Could Crush Them,2023-06-04T11:00:00Z
"1 Stock to Buy, 1 Stock to Sell This Week: Apple, Nio",2023-06-04T12:29:00Z
"Why Tesla and Rivian Soared, but Nikola Plunged, in May",2023-06-04T20:33:37Z
Sell-Off Expected: Treasury Unleashes $100B+ In Debt This Week,2023-06-05T04:31:17Z
Can Bulls Achieve Escape Velocity?,2023-06-05T07:34:00Z
Tesla Up 40% Since Late-April Lows: Analyst Outlines 4 Factors That Can Keep Stock Turbocharged,2023-06-05T08:58:02Z
Kia jumps into electric car price wars by bringing back the EV6 Light,2023-06-05T09:02:00Z
3 Stocks to Hedge Against a Possible Market Reversal,2023-06-05T09:42:00Z
Market Volatility Falls Sharply Following Jobs Report; S&P 500 Records Weekly Gain,2023-06-05T09:47:13Z
Intel Stock: Recent Hits and Misses in Its Foundry Business,2023-06-05T10:45:00Z
"Tesla May Have Just Unlocked a New, Profitable Revenue Stream",2023-06-05T12:45:00Z
Jamie Dimon Says Fed Should Pause Rate Hikes: History Says the Stock Market Will Do This Next,2023-06-05T13:06:49Z
"Tesla recalls some Model Y EVs, stock jumps toward 7-day win streak",2023-06-05T13:45:00Z
Tesla Stock Could Provide Solid Entry Point Within This Trend,2023-06-05T14:19:46Z
Morgan Stanley sees an earnings wipe out ahead for Wall Street's unloved stock rally,2023-06-05T14:36:00Z
2 Artificial Intelligence (AI) Growth Stocks Make Up 14% of Cathie Wood's Portfolio,2023-06-05T14:45:00Z
"Former YouTube CEO joins Giving Pledge, promises to give away most of her $780 million fortune",2023-06-05T19:59:00Z
"Morgan Stanley Analyst Warns If Tesla 'Doesn't Drive Lower' On Prices, The Chinese Will",2023-06-06T03:09:21Z
"‘Magnificent 7’ Lead Market Rally, but for How Long?",2023-06-06T07:07:00Z
"Company News for Jun 6, 2023",2023-06-06T08:25:00Z
Market Volatility Increases; S&P 500 Settles Lower,2023-06-06T09:58:54Z
Tesla: Should You Ride the Momentum or Cash Out?,2023-06-06T12:16:00Z
New Investor? Follow in the Footsteps of These 3 Trailblazing Female Investors.,2023-06-06T12:30:00Z
"SEC Accuses Binance & Coinbase Of Acting As Unregistered Broker, Binance Takes Biggest Hit As $300M In Crypto Positions Liquidated In 24 Hours, JPMorgan Clarifies CEO Jamie Dimon Not Running For Presidency: Today's Top Stories",2023-06-06T13:44:10Z
"Here's the red flag that says a tech stock selloff could arrive soon, according to Citi",2023-06-06T13:57:00Z
NIO: Penny Range Soon - We Were Wrong,2023-06-06T14:00:00Z
This High-Flying Auto Company Isn't Even Making Full EVs and It's Still a Buy Now,2023-06-06T14:38:00Z
This Billionaire Just Sold Out of Tesla Stock. Should You Follow?,2023-06-06T14:52:00Z
"Tesla Model 3s now qualify for $7,500 in federal tax credits",2023-06-06T16:59:00Z
"These stocks can play catch-up with megacap tech, lifting the S&P 500: Stifel's Bannister",2023-06-06T20:36:00Z
Expert Ratings for Tesla,2023-06-06T21:01:47Z
Tesla (TSLA) Outpaces Stock Market Gains: What You Should Know,2023-06-06T21:45:21Z
3 Investing Lessons Courtesy of Ted Lasso,2023-06-07T09:37:00Z
Market Volatility Drops Ahead Of Inflation Data; S&P 500 Settles Slightly Higher,2023-06-07T10:19:39Z
"AI can further boost the S&P 500, says Goldman Sachs. Here's how much.",2023-06-07T10:26:00Z
Tesla/Ford Partnership Changes EV Charging Forever,2023-06-07T11:30:00Z
"Big Tech's added bulk in S&P 500 in 2023 outweighs index’s energy sector, DataTrek says",2023-06-07T11:52:00Z
"How To Ride The Growing Autonomous Vehicles Market: Analyst Covers Mobileye, Aurora",2023-06-07T16:22:01Z
Stock Market Stumbles After Double Top Signal: Investor Anxiety Grows Over Potential Fed Rate Hike,2023-06-07T17:23:00Z
2 Market Heavyweights Stealing the Spotlight in June,2023-06-07T21:02:00Z
"Real Estate Market Turmoil Looms As Tech Giants Flee Offices: Watch These 5 Stocks, Short Sellers Circling For Potential Collapse",2023-06-07T21:14:20Z
What Does Tesla's Deal With Ford Mean for ChargePoint?,2023-06-07T22:57:26Z
Tesla’s stock rises to longest winning streak in more than 2 years,2023-06-08T01:27:00Z
Tesla: How and Why It Will Reach $300,2023-06-08T06:48:00Z
A Bull Market Is Coming: These 2 Cathie Wood Stocks Could Skyrocket,2023-06-08T09:30:00Z
3 Unconventional Stocks Millennials Can't Resist,2023-06-08T10:08:00Z
Prediction: These Will Be 4 of the Most Valuable Stocks by 2040,2023-06-08T11:45:00Z
"Elon Musk Wants to License Tesla's Self-Driving Tech to Other Brands, and It Could Be Worth Billions",2023-06-08T13:20:35Z
Auto Stocks get Upgraded: 3 Top-Ranked Stocks to Buy Now,2023-06-08T20:27:00Z
Tesla And General Motors Shares Are Popping After Hours: What's Going On?,2023-06-08T21:02:16Z
3 Auto Stocks to Buy in June,2023-06-08T22:51:00Z
"Tesla stock surges to its 10th straight gain, highest close since October",2023-06-08T22:52:00Z
Is ChargePoint a Screaming Buy After Ford-Tesla Charging Deal? Not So Fast,2023-06-09T09:02:00Z
Elon Musk Just Issued a Stark Warning to Nvidia,2023-06-09T10:10:00Z
Market Volatility Drops To Record Lows Ahead Of Fed Decision; S&P 500 Settles Higher,2023-06-09T10:20:06Z
Tesla's stock rises toward 11th straight gain as company seen 'playing chess while others are playing checkers',2023-06-09T10:53:00Z
Tesla's Hot Streak Spurs First Price Target Boost: 'Musk Playing Chess While Other Automakers Playing Checkers',2023-06-09T11:00:34Z
"Stocks would fall right back into a bear market if they adopted economic view of bond market, JPMorgan says",2023-06-09T12:24:00Z
Musk Tops the Rich List as Tesla (TSLA) Hits 2023 High,2023-06-09T13:28:00Z
GM Joins the Tesla Bandwagon,2023-06-09T13:28:20Z
U.S. Stock Futures Mixed to Close an Eventful Week,2023-06-09T13:58:00Z
What Will Tesla Gain From the GM Partnership?,2023-06-09T14:00:00Z
S&P 500 ETF Enters Bull Market: 5 Best Stocks YTD,2023-06-09T14:05:00Z
Tesla To Rally Around 21%? Here Are 10 Other Analyst Forecasts For Friday,2023-06-09T14:18:03Z
"Sientra, Tesla and GM shares rise and EvGo and Planet Labs slump, along with more stocks on the move",2023-06-09T14:21:00Z
Why Tesla Stock Jumped on Friday,2023-06-09T14:21:09Z
General Motors (GM) to Integrate Tesla's NACS Plugs Into EVs,2023-06-09T14:26:00Z
Major Development in U.S. Auto Sector,2023-06-09T14:39:00Z
"Tesla, Adobe, Mission Produce And Other Big Stocks Moving Higher On Friday",2023-06-09T15:23:26Z
"S&P 500 Bull Market Kicks Off, But The Dominance Of 7 Stocks Leaves S&P 493 In The Dust",2023-06-09T15:29:11Z
Long-Term Investors' 9 Favorite Index Funds,2023-06-09T15:45:43Z
Dow Edges Lower; Sientra Shares Spike Higher,2023-06-09T16:03:49Z
IPOs Quietly Leads this Market: 3 Top-Ranked Stocks to Consider,2023-06-09T16:32:00Z
"While NIO Struggles To Break Q1 Headwinds, What's Going On With Other Chinese EV Makers?",2023-06-09T17:42:39Z
"Top Analyst Reports for Coca-Cola, Petrbras & Shopify",2023-06-09T17:58:00Z
Stock Market Holds Firm: S&P 500 Bull Market Begins With Caution Ahead Of Next Week's Key Events,2023-06-09T18:05:00Z
Here’s why Tesla’s latest EV-charging deal is more problematic for EVgo than ChargePoint,2023-06-09T18:21:00Z
Breaking Down The Big 7 Tech Players' Outsized Roles,2023-06-09T18:47:00Z
Tesla's $3B Jackpot: Analyst Projects Rival EV Makers Could Supercharge Its Growth By 2030,2023-06-09T18:58:10Z
Tech Sector Fuels S&P 500 To New Highs While Crypto Endures Regulatory Challenges,2023-06-09T20:00:30Z
"U.S. stocks end higher, S&P 500 books longest weekly win streak since August 2022 after bear-market exit",2023-06-09T20:43:00Z
Author Ashlee Vance Helps Separate Real From Hype in the Space Industry,2023-06-10T12:00:00Z
Wall Street Breakfast: What Moved Markets,2023-06-10T12:17:25Z
"Tesla In Early Innings Of 'Golden Success Story;' Fisker, Lucid Come Calling To China; Ford's Farley On 'EV Price Parity' And More: Biggest EV Stories Of The Week",2023-06-10T13:47:07Z
Tesla Stock Is on a Historic Run. Will It Continue?,2023-06-10T14:15:00Z
Tesla Stock: Headed to $300?,2023-06-10T14:35:00Z
You may be betting one-sixth of your retirement portfolio on TV’s Jim Cramer,2023-06-10T18:29:00Z
What A Fed Rate Pause May Mean For Markets,2023-06-11T06:21:34Z
Here's the Next AI Stock Most Likely to Join the $1 Trillion Club (Besides Nvidia),2023-06-11T09:51:00Z
Driving Revolution: Uber and Waymo Join Forces,2023-06-11T11:00:00Z
3 Stocks to Avoid This Week,2023-06-11T12:15:00Z
Is It Finally Time to Dump Dogecoin?,2023-06-11T13:00:00Z
S&P 500 Officially Enters Bull Market: Unstoppable Surge Or House Of Cards?,2023-06-11T13:00:00Z
Is Nio Stock a Buy Now?,2023-06-11T13:30:00Z
"Billionaire George Soros hands control of financial empire to his son, Alex",2023-06-11T21:25:00Z
Powering the Future: 3 Industries to Benefit from a Changing Energy Backdrop,2023-06-11T23:19:00Z
Market Volatility Increases; S&P 500 Rises To New 2023 Highs,2023-06-12T10:07:06Z
How a hawkish Fed could kill a baby bull-market rally in U.S. stocks,2023-06-12T11:23:00Z
Small Indian Company Rockets 40% On Tie-Up With Tesla — But Not The One Run By Elon Musk,2023-06-12T11:56:46Z
"Apple, Amazon, Alphabet, Microsoft, Meta, Nvidia & Tesla are part of Zacks Earnings Preview",2023-06-12T12:10:00Z
"Zacks Investment Ideas feature highlights: IPO, Li Auto, Bentley Systems, Unity Software and Tesla",2023-06-12T12:16:00Z
"Trump's Defiance, Fed Faces Destructive Blame, Tesla's Growing Autopilot Issues And More: 5 Key Stories From The Weekend",2023-06-12T12:36:47Z
"Investors Heavily Search Tesla, Inc. (TSLA): Here is What You Need to Know",2023-06-12T13:00:13Z
"Stock Market News for Jun 12, 2023",2023-06-12T13:32:00Z
"Goldman pushes back against bearish Morgan Stanley's Mike Wilson with new 4,500 S&P 500 target",2023-06-12T13:44:00Z
GM-TSLA Pact Jolts EV Charging Stocks: An Overblown Reaction?,2023-06-12T13:53:00Z
"XPeng's New EV Is a Hit, but This Biotech Stock Is Leaving It in the Dust",2023-06-12T14:07:43Z
"Benzinga's Top Ratings Upgrades, Downgrades For June 12, 2023",2023-06-12T15:00:47Z
Why Nio Stock Shot Higher Today,2023-06-12T15:16:01Z
"Biogen, Carnival and Oracle post solid gains, while Nasdaq and KeyCorp slump",2023-06-12T17:58:00Z
"Nasdaq, S&P 500 end at almost 14-month high ahead of this week’s inflation data, Fed decision",2023-06-12T20:46:00Z
Tesla's Surge Boosts EV ETFs,2023-06-12T20:47:00Z
Ray Dalio says AI technology both 'fabulous' and 'dangerous',2023-06-12T21:37:00Z
Why Rivian Stock Crawled Only Marginally Higher Today,2023-06-12T22:52:42Z
Why Blink Charging Stock Crushed the Market on Monday,2023-06-12T23:09:31Z
"Tesla stock rises again, for record 12-day win streak",2023-06-12T23:55:00Z
Cathie Wood Sells $98M Worth Of Tesla Shares Ahead Of Possible Fed-Induced Market Volatility,2023-06-13T01:15:25Z
Pre-CPI Musings,2023-06-13T05:47:00Z
Time For Tesla Financial Services? Morgan Stanley Analyst Thinks Now Is The Right Moment,2023-06-13T06:43:20Z
Tesla Stock Comes Across Major Resistance,2023-06-13T07:19:00Z
Fisker Ocean out-ranges Tesla Model Y by 30 miles,2023-06-13T09:01:00Z
2 Stocks I'm Never Selling,2023-06-13T09:07:00Z
"1 Stock-Split Stock Set to Join Apple, Microsoft, Amazon, and Alphabet in the $1 Trillion Club",2023-06-13T09:25:00Z
Market Volatility Rises Sharply; S&P 500 Records Gain,2023-06-13T09:30:58Z
Tesla Stock: 1 Analyst Bets Shares Soar to $335,2023-06-13T10:51:00Z
"Cathie Wood's Chip Pair Trade: Ark Offloads More Nvidia, Adds $10M Of This Giant After 2 Years",2023-06-13T11:00:12Z
Tesla Stock: Headed to $300?,2023-06-13T11:01:00Z
"Cathie Wood's ARK dumps some Tesla, Nvidia stock while scooping up Meta shares",2023-06-13T11:08:00Z
"CPI Report Live: May Inflation Report Is Out, Here’s What It Shows",2023-06-13T12:42:11Z
Cathie Wood Says Robotaxi Revenue is Headed Toward $4 Trillion -- 2 Growth Stocks to Buy Now,2023-06-13T13:02:58Z
"EV Roundup: GM-TSLA Charging Deal, BWA's ""Charging Forward: 2027"" & More",2023-06-13T13:26:00Z
"Apple's stock is no longer worth buying after reaching a record, says Wall Street firm",2023-06-13T13:50:00Z
'Crowded' tech trade? Investors still haven't piled into these two big names.,2023-06-13T13:52:00Z
3 Hot Stocks That Can Double Again in 2023,2023-06-13T15:55:00Z
"Tesla stock set to extend record win streak to 13 days, notch biggest gain since September",2023-06-13T15:55:00Z
"Oracle, Tesla, Anheuser-Busch stocks rise, Apple shares slip and other stocks on the move",2023-06-13T15:57:00Z
"NIO Slashes Prices of All Models, Ends Free Battery Swapping",2023-06-13T15:59:00Z
Time to Sell Tesla? Inverse ETFs to Earn Profits,2023-06-13T17:00:00Z
"Larry Ellison Surpasses Bill Gates' Wealth, Thanks to Oracle Cloud Market Share Gains",2023-06-13T17:06:28Z
"US Stocks Climb, Dollar Drops As Falling Inflation Raises Optimism On End of Fed Tightening: What's Driving Markets Today",2023-06-13T17:29:00Z
Tesla's Cybertruck Spotted In Californian Roads Under Camouflage: Here's What Elon Musk Has To Say,2023-06-14T06:05:02Z
3 Industry-Leading AI Stocks Outside the Tech Sector That Are on the Cutting Edge of Innovation,2023-06-14T09:06:00Z
3 Growth Stocks for the Next 10 Years and Beyond,2023-06-14T09:20:00Z
Market Volatility Drops Ahead Of Fed's Decision; S&P 500 Settles Higher,2023-06-14T09:50:07Z
Cathie Wood Thinks This Stock Is the Biggest AI Play in the Market,2023-06-14T09:55:00Z
Your Guide to All 6 Cathie Wood ETFs,2023-06-14T10:12:00Z
3 Bargain Investments That Cathie Wood Loves,2023-06-14T10:45:00Z
Tesla again raises starting price of Model Y by $250 in U.S.,2023-06-14T11:27:00Z
"The Best Stocks to Invest $50,000 in Right Now",2023-06-14T11:30:00Z
Nvidia officially closes in $1 trillion territory,2023-06-14T11:34:00Z
Opinion: These Will Be the 4 Largest Stocks by 2035,2023-06-14T11:45:00Z
2 Undervalued Tech Stocks to Buy as Fed Hits Pause on Rate Hikes,2023-06-14T12:00:00Z
Could Canoo Really Become the Next Tesla?,2023-06-14T13:06:26Z
This EV Stock Is Lifting Its Entire Nation's Stock Market,2023-06-14T13:10:33Z
"Stock Market News for Jun 14, 2023",2023-06-14T13:32:00Z
EV Charging Space in for a Paradigm Shift With Tesla's NACS,2023-06-14T14:00:00Z
Recession? Who cares! Deutsche Bank shares Goldman's bullish stocks view as banks split on downturn.,2023-06-14T14:06:00Z
GM or TSLA: Which Is the Better Value Stock Right Now?,2023-06-14T15:40:10Z
Tesla short sellers are down billions after stock's winning streak,2023-06-14T16:05:00Z
Revolutionary Shift: IEA Forecasts Peak In World Oil Demand By 2028 As EVs Disrupt Global Energy Markets – 3 ETFs Tracking EV Stocks,2023-06-14T16:30:55Z
"US Stocks Tick Higher, Dollar Falls To 1-Month Low Ahead Of Fed News: What's Driving Markets Today",2023-06-14T16:42:00Z
U.S. stocks end mixed on Fed decision to hold interest rates steady but leave door open to more increases,2023-06-14T20:47:00Z
Tesla (TSLA) Stock Sinks As Market Gains: What You Should Know,2023-06-14T21:45:25Z
"3 Stock-Split Stocks With 52% to 701% Upside, According to Wall Street",2023-06-15T09:21:00Z
"If I Had $1,000 to Invest Between Amazon, Johnson & Johnson, and Tesla Stocks, Here's How I'd Do It",2023-06-15T09:30:00Z
The Most Successful Hedge Fund Manager in History Is Selling Tesla Stock and Buying This Nasdaq Index Fund,2023-06-15T11:10:00Z
Price War Makes EV Stocks a Lot Less Attractive,2023-06-15T12:15:00Z
"How Tesla Can Make An EV That Costs Below $30K, According To An Ark Analyst",2023-06-15T12:40:07Z
Tesla's stock is the most overbought in nearly 2 years,2023-06-15T12:45:00Z
Is Tesla Stock Headed Back to a Trillion-Dollar Market Cap?,2023-06-15T13:45:00Z
Toyota's (TM) Green Revolution: Time to Bet on This EV Underdog?,2023-06-15T13:48:00Z
Tesla's robotaxi future sparks more optimism for its stock,2023-06-15T14:26:00Z
Single-Stock Tesla ETF Racing to Hit Billion-Dollar AUM,2023-06-15T15:10:00Z
Have You Missed the 2023 Stock Rally?,2023-06-15T15:36:00Z
"Stocks Continue To Climb, Dismissing Rate Hike Fears, While Dollar Tumbles On Hawkish ECB: What's Driving Markets Today?",2023-06-15T17:36:23Z
"Tesla Set To Rally After Pause? Analyst Sees Q2 Deliveries, Cybertruck Frenzy Boosting Stock",2023-06-16T09:21:04Z
"As BlackRock files for daily bitcoin product, here's how another SEC debate may shape ethereum",2023-06-16T10:38:00Z
"Tesla’s EV charging standard is becoming widely adopted, in another boost for the stock",2023-06-16T11:57:00Z
"Top Wall Street Analyst Sounds Alarm: Major Market Collapse Could Follow AI-Driven Rally, Echoing 2000 And 2008",2023-06-16T13:14:22Z
3 Top Stocks to Buy and Hold for the Next Decade,2023-06-16T14:15:00Z
The 'Magnificent Seven' Spurs Stock Market Gains,2023-06-16T19:00:00Z
Why Renewable Energy Stocks Popped This Week,2023-06-16T19:38:49Z
Cathie Wood's Cumulative Tesla Stock Sales For Week Hit $117M: Here Are 4 Stocks Ark Added Friday,2023-06-17T06:59:03Z
Elon Musk Talks About 2 of the Biggest Risks to Civilization. But He's Betting Big on 1 of Them.,2023-06-17T09:55:00Z
Everyone Wants a Piece of Tesla These Days,2023-06-17T14:15:00Z
Experts say the stock market is in a bull market. What bull market?,2023-06-17T14:20:00Z
Elon Musk tells remote workers to get off their ‘moral high horse.’ Google tracks ID badge swipes. Employees cry foul.,2023-06-18T07:58:00Z
Better EV Stock: NIO vs. ChargePoint,2023-06-18T09:08:00Z
Want to Get Richer? 5 Top Stocks to Buy Now and Hold Forever,2023-06-18T12:30:00Z
Top EV ETFs for Electrifying Gains as Charging Network Expands,2023-06-18T20:56:00Z
"Tesla's Discounting Better Than Price Cuts, But This Analyst Has A Better Suggestion For Boosting Volume",2023-06-19T03:38:28Z
Tesla Stock: Volume Spike Tells the Tale,2023-06-19T08:24:00Z
Here's Why You Should Take Warren Buffett's Advice on EV Stocks,2023-06-19T10:22:00Z
The Fed Is Bluffing And Rates Are Likely Headed Lower: SPY Implications,2023-06-19T12:00:00Z
"The consumer-led recession you're worried about already ended months ago, the stock market says",2023-06-19T12:20:00Z
Is the Bear Market Over? Big Tech Already Told You the Answer,2023-06-19T13:02:56Z
"EV Roundup: TSLA's NACS Wave, NKLA's Cost Optimization Drive & More",2023-06-19T13:14:00Z
3 Stocks to Avoid This Week,2023-06-19T13:15:00Z
Best Artificial Intelligence Stock to Buy: C3.ai vs. Tesla,2023-06-19T15:44:39Z
"Secret 'Elon Mode' Allows Tesla Self-Driving Cars To Go Hands-Off, Hacker Says",2023-06-19T19:57:29Z
The 1999 Hype Cycle May Be Back,2023-06-20T04:23:37Z
3 Ultra-Popular AI Stocks That Have Billionaires Running for the Exit,2023-06-20T09:21:00Z
"Tesla, Nvidia And 2 Other Stocks Insiders Are Selling",2023-06-20T11:48:01Z
Tesla Giga India Speculations Ignite As Narendra Modi To Reportedly Meet Elon Musk,2023-06-20T12:36:41Z
Student-loan payments are coming back — and these are the stocks most at risk,2023-06-20T13:36:00Z
"Rivian inks Tesla fast-charging agreement, joining Ford and GM",2023-06-20T15:31:00Z
"Alibaba, Nio stocks fall, Rivian and Nikola shares rally and other stocks on the move",2023-06-20T15:51:00Z
Nio's stock turns briefly positive after more than $1 billion investment from Abu Dhabi fund,2023-06-20T17:29:00Z
Should Investors Buy Shares Post-Split?,2023-06-20T20:40:00Z
"If You Invested $1,000 In Tesla Stock When Tesla Superchargers Were Unveiled, Here's How Much You'd Have Today",2023-06-20T21:01:50Z
Tesla Won EV Charging. Now What?,2023-06-20T21:29:57Z
"Tesla Stock: I Was Wrong, But I'm Reiterating Sell",2023-06-20T21:59:47Z
Why Tesla Stock Blasted 5% Higher on Tuesday,2023-06-20T22:13:00Z
Tesla's and Rivian's Tuesday Gains Paled Next to This Car Stock,2023-06-20T23:59:00Z
