title,published_utc
Lucid Troubles Keep Building,2024-02-24T05:43:01Z
"Tesla Bull Gary Black Says Elon Musk Added 'Fuel To The Fire,' But Clarifies That Billionaire's Comments Not Sole Cause For 35% Fall In Rivian Stock",2024-02-24T06:54:27Z
"Which ""Magnificent Seven"" Stock Is Poised for the Most Spectacular Growth? Here's the Hands-Down Winner.",2024-02-24T09:14:00Z
Some investors switch direction as Nvidia and AI stocks soar,2024-02-24T10:22:00Z
"Nvidia’s surge ripples across stock market — lifting AI, tech and semiconductor ETFs",2024-02-24T10:44:00Z
1 Unfavorable Trend Explains the 21% Plunge in Tesla Stock in 2024,2024-02-24T11:50:00Z
History Says the Nasdaq Could Soar in 2024: 1 Artificial Intelligence (AI) Stock to Buy Hand Over Fist Before It Does,2024-02-24T13:10:00Z
Elon Musk Is Still Attempting To Defend Hateful Speech Amid X's Growing Pains And Public Backlash: Report,2024-02-24T18:40:41Z
"This Electric Vehicle Stock Has 75% Upside, According to 1 Wall Street Analyst",2024-02-25T13:10:00Z
Missed Out on Nvidia? Buy These Artificial Intelligence (AI) Stocks Instead.,2024-02-25T19:26:00Z
Opinion: The Tesla Growth Story Is Officially Dead,2024-02-26T10:21:00Z
"Here's the Only ""Magnificent Seven"" Stock That's Not Overpriced, According to the ""Dean of Valuation""",2024-02-26T10:48:00Z
3 Things You Need to Know If You Buy Rivian Today,2024-02-26T10:57:00Z
What Now as Nvidia-Fueled Rally Stalls? Levels to Watch,2024-02-26T11:44:00Z
This investor has a huge bet on Berkshire Hathaway and says Apple is overvalued,2024-02-26T12:27:00Z
Is Tesla Stock a Buy in 2024?,2024-02-26T13:05:00Z
Forget Nvidia FOMO: 8 Underdog Stocks With Greater Earnings Growth Potential,2024-02-26T13:59:00Z
"Rising to the Challenge: This Aspiring ""Magnificent Seven"" Stock Is One to Watch in 2024",2024-02-26T14:07:00Z
"Forget Tesla: I Think This Stock Should Replace It in the ""Magnificent Seven""",2024-02-26T15:00:00Z
PCAR or TSLA: Which Is the Better Value Stock Right Now?,2024-02-26T16:40:13Z
Why Rivian Stock Bounced Higher Today,2024-02-26T17:52:36Z
Biden Calls In Budget Big Guns: But What Happens If Government Shutdown Can't Be Avoided?,2024-02-26T18:15:28Z
"Why BYD is rolling out a $233,000 ‘supercar’ while Tesla and Rivian try selling cheaper EVs",2024-02-26T18:55:00Z
"US Stocks Pause, Alphabet Falls On Gemini Woes, Tesla, Bitcoin Rally: What's Driving Markets Monday?",2024-02-26T19:35:44Z
Broadcom stock rises to a record after $4 billion deal to sell its EUC Division,2024-02-26T21:25:00Z
"EXCLUSIVE: Roundhill's AI, Magnificent 7 ETFs Shine In Tech Market Rally, Draw $100M Inflow In 1 Month",2024-02-26T21:32:01Z
Lucid Rallied Today -- Is It Time to Buy the EV Stock?,2024-02-26T22:07:37Z
Why Tesla Stock Motored Nearly 4% Higher Today,2024-02-26T22:44:36Z
Who's Holding Tesla Stock Up? Jim Cramer Smells A 'Cathie Wood Imitator' Out There: 'Almost Conspiratorial',2024-02-27T08:36:56Z
Here are the 10 cheapest new electric cars of 2024,2024-02-27T10:00:00Z
"Forget Nvidia: These 3 Artificial Intelligence (AI) Stocks Have Up to 203% Upside, According to Select Wall Street Analysts",2024-02-27T10:21:00Z
Nvidia is now the king of the U.S. options market,2024-02-27T12:05:00Z
Trader who nailed the 2022 selloff says set aside some cash to buy a looming 10% stock pullback,2024-02-27T12:26:00Z
"AI momentum is underpriced in the options market, says Bank of America",2024-02-27T12:32:00Z
"Better ""Magnificent Seven"" Buy: Nvidia or Tesla",2024-02-27T13:30:00Z
"2 ""Magnificent Seven"" Stocks to Buy Before They Soar 78% and 80%, According to Select Wall Street Analysts",2024-02-27T15:00:00Z
Is Tesla Stock Worth Your Money in 2024?,2024-02-27T15:30:00Z
Apple's EV Fiasco Stirs Fear In Bullish Analyst About Elon Musk's Company: 'I Hope Tesla Is Not Working On A Phone',2024-02-28T07:54:31Z
"1 ""Magnificent Seven"" Stock to Buy on the Dip",2024-02-28T09:50:00Z
"Meet the 2 ""Magnificent Seven"" Stocks Currently Held in Warren Buffett's $621 Million ""Secret"" Portfolio",2024-02-28T10:06:00Z
Will Reaching Positive Gross Profit Be Enough to Turn Rivian Stock Around?,2024-02-28T10:41:00Z
Elon Musk says ‘radically’ different Tesla Roadster will ship in 2025,2024-02-28T10:56:00Z
"1 Unstoppable Multibagger Up 950% in the Last Decade That Is Secretly Powering the ""Magnificent Seven""",2024-02-28T11:12:00Z
Don't Buy EV Stocks (Including Tesla) Until You See This,2024-02-28T11:15:00Z
Is Nuveen ESG Large-Cap Growth ETF (NULG) a Strong ETF Right Now?,2024-02-28T11:20:06Z
"Only 3 of the ""Magnificent Seven"" Stocks Have Been 10-Baggers Over the Past 10 Years",2024-02-28T12:55:21Z
Apple reportedly abandons its long-running plan to build a self-driving EV,2024-02-28T13:08:00Z
"It turns out, the U.S. is one of the least concentrated stock markets in the world",2024-02-28T13:35:00Z
Apple Finally Admits It's Not Tesla -- Here's Why That's a Good Thing for Shareholders,2024-02-28T15:15:00Z
"'Enormous 8' Member Netflix Just Made New 52-Week High, Valuations Suggest Profit-Taking Opportunity",2024-02-28T15:52:56Z
"Opportunities For Investors Beyond AI And Nvidia – Biotech Breaks Out, New GDP Data Shows Inflation Pressure",2024-02-28T17:19:37Z
Why Are ARKK Investors Jumping Ship? Cathie Wood's Poor Picks Lag Behind The Competition,2024-02-28T18:02:38Z
Nvidia Stock Gained $1.5 Trillion To Surpass The FAANGs - Apple Is Next,2024-02-28T20:05:40Z
Jamie Dimon says New York officials ‘don’t want business’ but Texas does,2024-02-28T20:43:00Z
Tesla (TSLA) Rises As Market Takes a Dip: Key Facts,2024-02-28T22:45:19Z
Ross Gerber Suspects Elon Musk Has 'A Little Ego Thing Going On' With BYD's Yangwang After Tesla CEO Promises Speedier Roadster,2024-02-29T11:01:41Z
"This Artificial Intelligence (AI) Stock Has Been Hailed as a ""Stealth Nvidia."" Time to Buy?",2024-02-29T11:55:00Z
"An AI surprise could fuel a 20% rally for the S&P 500 in 2024, says UBS",2024-02-29T12:42:00Z
The Hidden Winners From Artificial Intelligence's Explosive Growth,2024-02-29T12:45:00Z
Is General Motors Stock a Buy?,2024-02-29T14:19:00Z
"Tech Stocks Set To Rise Thursday As January Inflation Data Fails To Scare Markets, Small Caps Surge",2024-02-29T14:20:35Z
5 Millionaire-Maker Technology Stocks,2024-02-29T14:30:00Z
"Company News for Feb 29, 2024",2024-02-29T14:39:00Z
"Fed's Favorite Inflation Gauge Rises By Most In A Year, Bitcoin Soars, Putin's Nuclear Threat",2024-02-29T16:46:26Z
EXCLUSIVE: Magnificent 7 Takes Center Stage In Roundhill's Expanded ETF Lineup With Inverse And Leveraged Options,2024-02-29T18:36:24Z
Top Stocks Not Named Nvidia You Need To Know About In 2024: Here's What Investors Think About Them (Wall Street Vs. Reddit),2024-02-29T21:57:48Z
U.S. stocks are off to their best start to a year since 2019 — and the rally is not just about the ‘Magnificent Seven’,2024-02-29T22:30:00Z
"Strategically Building A $50,000 Dividend Portfolio With Tesla As The Largest Position",2024-02-29T23:00:00Z
"Hertz: Take The Wheel, Contrarians",2024-03-01T05:54:21Z
"Tesla Analyst Believes Megapack Is A $120B Sleeping Giant That Could Surpass EV Business, Flags Next Big Catalyst For Stock",2024-03-01T06:27:08Z
1 Simple Reason Why Rivian Will Never Be Tesla,2024-03-01T10:50:00Z
"Stocks can still rise even as momentum signals suggest caution, history finds.",2024-03-01T11:36:00Z
"Kyle Bass buys more real estate in Florida, Texas, and Tennessee ",2024-03-01T12:13:00Z
2 Reasons You Can Still Buy Rivian Now,2024-03-01T13:05:00Z
Q&A With Wall Street: Tesla Stock Analysis,2024-03-01T13:30:00Z
"Stock Market News for Mar 1, 2024",2024-03-01T14:32:00Z
Elon Musk sues OpenAI and Sam Altman for putting profits over humanity,2024-03-01T15:37:00Z
Markets Await ISM Manufacturing PMI Data,2024-03-01T16:01:00Z
Tech Rally Or Dotcom Déjà Vu? The Magnificent Seven's Secret Sauce Unveiled,2024-03-01T20:06:29Z
"Record-High S&P 500 Propels SPY ETF To $500-Billion Milestone, Nvidia Tops $2 Trillion, Broadcom Surpasses Tesla",2024-03-01T21:05:12Z
Tesla Bulls Optimistic After Elon Musk's EV Giant Opens Supercharger Network To Rival Ford: 'Will Vastly Increase EV Adoption',2024-03-02T07:48:39Z
"2 Cheap Growth Stocks to Buy Before They Soar 71% and 100%, According to Certain Wall Street Analysts",2024-03-02T10:00:00Z
How investors can ride along as a global commodity market shifts away from China,2024-03-02T10:17:00Z
"Billionaires David Tepper and George Soros Both Own These ""Magnificent Seven"" Stocks. Should You?",2024-03-02T10:49:00Z
"AI, software and semiconductor stocks are too popular for their own good",2024-03-02T12:36:00Z
‘GRANOLAS’ vs. the Magnificent Seven: Which should you dig into now?,2024-03-02T13:41:00Z
"1 ""Magnificent Seven"" Stock Down 52% to Buy and Hold Forever",2024-03-02T15:03:00Z
How the U.S. economy could slide into a Japan-like ‘lost decade’,2024-03-02T16:44:00Z
Expect this ‘Roaring 2020s’ market to keep stocks up and bring inflation down,2024-03-02T17:53:00Z
"1 Stock to Buy, 1 Stock to Sell This Week: CrowdStrike, Nio",2024-03-03T11:05:00Z
Is Tesla Still a Phenomenal Growth Stock?,2024-03-03T12:25:00Z
Nvidia Bound For A Drop Like Tesla? Investors Draw Parallels Between AI And EV Frenzy,2024-03-04T06:26:42Z
"Nvidia, Meta, Microsoft And Amazon Among Dan Niles' Top Picks For 2024 Amid AI Bubble Concerns: 'We Have A Lot More Room To Go'",2024-03-04T07:05:54Z
Tesla Bull Wants Musk's Company To Think About How Apple Convinced Dumb Phone Users To Switch To iPhones Amid EV Slowdown: 'Effective Communication',2024-03-04T07:51:36Z
Tesla has the most loyal buyers and the most ‘conquests’ in 2024 vehicle loyalty ​study,2024-03-04T10:01:00Z
5 Stock(s) That Artificial Intelligence (AI) Could Propel Into the $2 Trillion Club,2024-03-04T10:10:00Z
"Bank of America boosts S&P 500 target to 5,400. Here’s how it got there.",2024-03-04T13:08:00Z
4 Best Inverse/Leveraged ETF Areas of Last Week,2024-03-04T13:26:00Z
"Tesla, Inc. (TSLA) Is a Trending Stock: Facts to Know Before Betting on It",2024-03-04T14:00:16Z
Goldman Sachs says this tech stock rally is grounded in reality,2024-03-04T14:24:00Z
"Tesla, Spirit Airlines, New York Community Bancorp And Other Big Stocks Moving Lower On Monday",2024-03-04T15:40:18Z
Massive News for Tesla Stock Investors,2024-03-04T16:52:00Z
Tesla’s stock slides 5% after fresh volley of price cuts and discounts from EV maker,2024-03-04T16:53:00Z
S&P 500’s breadth ‘still narrow’ after record peak — with these four stocks driving February gains,2024-03-04T18:26:00Z
Two more stock indexes are on track for records: What that means for the bull market,2024-03-04T18:32:00Z
"Stocks Stall, Magnificent 7 Crack As Apple, Tesla And Google Face Headwinds; Bitcoin, Gold Eye Record Highs: What's Driving Markets Monday?",2024-03-04T18:36:04Z
"Tesla Cuts Prices and the Stock Falls, Dragging Rivian and Lucid With It",2024-03-04T20:09:18Z
Nasdaq has gone more than 300 days without a major pullback. Does that mean a shakeout is overdue?,2024-03-04T21:54:00Z
Nvidia and These Tech Giants Just Invested in This Artificial Intelligence (AI) and Robotics Start-Up,2024-03-04T22:10:04Z
"Fund Manager Says He 'Would Avoid' Tesla, But Recommends These 'Phenomenal' Auto Stocks: 'Race To Develop EVs Is Going To Be Profitless...'",2024-03-05T02:04:08Z
S&P 500 Ripe for Pullback as Bearish Rising Wedge Forms: Support Levels to Watch,2024-03-05T05:43:00Z
"Company News for Mar 5, 2024",2024-03-05T09:20:00Z
Tesla Bear Wonders If Wall Street Is Looking For 'New Narrative' Of Energy Hype Because EV Giant's Stock Price Is 'Too High',2024-03-05T09:44:41Z
Why Market Bubble Fears Might Be Overblown,2024-03-05T09:47:00Z
"10 top used sedan models you can get for under $30,000",2024-03-05T10:03:00Z
"Xos, Inc. (XOS) Stock Jumps 28.0%: Will It Continue to Soar?",2024-03-05T10:41:00Z
Ross Gerber Says Tesla Should Be Seeing 'Rally Period' Now Because Cybertrucks Are Selling 'Left And Right' But Earnings Are Going Down: 'That Needs To Be Addressed',2024-03-05T10:59:52Z
Wall Street Breakfast Podcast: Philip Morris Hit With Lawsuit Over Zyn,2024-03-05T11:57:32Z
"These 4 ""Magnificent Seven"" Stocks Are Brilliant Buys in March",2024-03-05T12:45:00Z
This Is Disastrous News for EV Stocks,2024-03-05T12:58:24Z
How Morgan Stanley’s bearish strategist may be right for the wrong reason,2024-03-05T13:22:00Z
5 Best ETF Areas of Last Week,2024-03-05T13:42:00Z
Tesla: Here's Why It's Down 24%,2024-03-05T14:53:49Z
"Forget Tesla, Buy This Magnificent Auto Stock Instead",2024-03-05T15:03:00Z
"Tesla’s Berlin factory halted, extremist group claims responsibility for power outage",2024-03-05T15:09:00Z
U.S. investors may be chasing the wrong target,2024-03-05T15:19:00Z
"Tesla Stock Has Nearly 60% Upside, According to 1 Wall Street Analyst",2024-03-05T15:50:00Z
The Magnificent 7 Are Falling Like Dominos; Only 3 Remain,2024-03-05T17:36:28Z
Bears Prowl Wall Street As Magnificent 7 Tumble; Bitcoin Sinks After Record High: What's Driving Markets Tuesday?,2024-03-05T19:01:09Z
3 Top Ranked Stocks with Bargain Valuations,2024-03-05T19:29:00Z
"Cathie Wood Sells $31 Million In Coinbase Stock After Site Crashes Amidst Bitcoin Rally, Warren Buffet Warns Of 'Casino-Like' Behavior In Markets",2024-03-05T20:49:37Z
"‘Magnificent Seven’ shed $233 billion in market cap, dragging down stock market",2024-03-05T22:14:00Z
Nvidia: Time To Admit My Big Mistake (Rating Upgrade),2024-03-06T03:44:47Z
"Tesla Faces Uphill Battle: Morgan Stanley Analyst Adam Jonas Cuts Target Price, Forecasts Lower FY24 Sales Volume",2024-03-06T03:57:19Z
Why Investors Slammed the Brakes on Tesla Stock Today,2024-03-06T04:33:28Z
"OpenAI says Elon Musk backed for-profit plans, and that it has emails proving it",2024-03-06T04:40:00Z
"Tesla Bull Says EV Giant Is Going Through 'Brutal Transition,' Blames This For 80% Of Stock Sell-Off",2024-03-06T07:07:54Z
"Jim Cramer Weighs In On Tuesday Market Decline, Says It Reflects A Market Top, Not A Bubble",2024-03-06T08:50:24Z
"The 2024 GMC Hummer EV SUV: Reimagined, futuristic, luxurious and an off-road champ",2024-03-06T10:02:00Z
"1 ""Magnificent Seven"" Stock to Buy Hand Over Fist in March, and 1 to Avoid Like the Plague",2024-03-06T10:06:00Z
Nvidia and 7 Other Semiconductor Stocks That Can Benefit From Artificial Intelligence (AI) Robots,2024-03-06T10:30:00Z
"Zacks Investment Ideas feature highlights: Perion Networks, Honda, Tesla and KKR",2024-03-06T10:36:00Z
"Nvidia, Microsoft, and Jeff Bezos Invested in a $2.6 Billion Robotics Start-Up. Here's Why That's Good News for Tesla.",2024-03-06T11:15:00Z
"Should You Buy the Worst-Performing ""Magnificent Seven"" Stock of the Past Decade?",2024-03-06T11:16:00Z
Will the R2 Unveiling on March 7 Be the Saving Grace for Rivian Investors?,2024-03-06T12:22:00Z
There’s one big mystery in the everything rally: gold’s record-setting ascent,2024-03-06T13:34:00Z
Elon Musk says he’s not donating to Trump after they reportedly met about potential contribution,2024-03-06T15:43:00Z
Magnificent Seven no longer a monolith as performance continues to diverge,2024-03-06T16:29:00Z
"Buying Ahead Of Powell On Hopium Key Apple Level, Bitcoin Whales Take Profits",2024-03-06T17:03:36Z
"A Tesla bull turns bearish, and warns EV maker could lose money this year",2024-03-06T17:07:00Z
"If ‘Magnificent Seven’s’ stock swings are stressing you, think about their bonds",2024-03-06T19:03:00Z
"With NVDA in the Driver's Seat, What Will the Nasdaq 100 Do Next?",2024-03-06T20:25:00Z
Tesla is not one of the 10 largest U.S. companies for first time in 13 months,2024-03-06T22:43:00Z
Looking Ahead to Q1 Earnings: What's Next?,2024-03-07T00:46:00Z
Looking Ahead to Q1 Earnings: What's Next?,2024-03-07T00:50:00Z
Cathie Wood's Ark Invest Sells Over $48M Worth Of Coinbase Shares Amid Steaming Bitcoin Rally — Seizes The Tesla Dip,2024-03-07T03:20:22Z
ChargePoint: It's Only Getting Worse,2024-03-07T05:44:43Z
Nasdaq 100: Today's Move to Decide If Correction Is Starting - Watch This Level,2024-03-07T07:22:00Z
Things Just Went From Bad to Worse for General Motors and Self-Driving Start-Up Cruise. Here's Why I Think Tesla Is the Big Winner,2024-03-07T11:55:00Z
Tesla Stock Set To Lose For 4th Straight Day? Fund Manager Warns Wall Street May Slash Q1 Delivery Estimates Soon,2024-03-07T12:14:10Z
Tesla Vs. BYD: Is the Chinese Powerhouse the Better EV Bet Going Forward?,2024-03-07T13:52:00Z
Rivian’s stock dubbed a buy as EV company comes closest to Tesla’s ‘spirit’,2024-03-07T14:05:00Z
"Wall Street is divided on whether bitcoin is ‘frothy,’ and  will undo Fed’s rate-cut plans",2024-03-07T14:37:00Z
Market Leaders Rolling Over: Time to Rotate into Defensive Stocks?,2024-03-07T17:25:00Z
"S&P 500 Reclaims All-Time Highs As Powell Hints At Rate Cuts, Nvidia Breaks $900, Bitcoin Nears Record Levels: What's Driving Market Thursday?",2024-03-07T18:32:36Z
Rivian unveils its new R2 EV. Here’s what you need to know.,2024-03-07T18:42:00Z
Apple Vs. Nvidia: Only 1 Adds $1 Trillion In 67 Days In Battle For Mega-Cap Dominance,2024-03-07T20:20:02Z
Do These 2 Stocks Belong in the Magnificent 7?,2024-03-07T20:28:00Z
Tesla (TSLA) Laps the Stock Market: Here's Why,2024-03-07T22:45:18Z
"Broadcom’s stock falls, with AI set for stronger showing as other areas sag",2024-03-08T01:22:00Z
Tesla Is Great. Here's Why You Shouldn't Buy It,2024-03-08T10:26:00Z
"2 ""Magnificent Seven"" Stocks to Buy Hand Over Fist in March",2024-03-08T10:31:00Z
"Zacks Investment Ideas feature highlights: Apple, Tesla, HCA Healthcare, DaVita and The Progressive",2024-03-08T11:00:00Z
"Fund Manager Substantially Reduces Tesla Holding, Citing 2 Reasons That Undermine His Positive View",2024-03-08T13:32:27Z
"Here’s what 100 years of history shows about periods of extreme market concentration, according to Goldman Sachs",2024-03-08T13:40:00Z
Rivian looks like it’s trying to get Apple’s attention,2024-03-08T14:50:00Z
Unfortunate News for Tesla Stock Investors,2024-03-08T15:08:00Z
"Investors have sold a record amount of tech stocks, says Bank of America",2024-03-08T15:47:00Z
Mother Of All Reports Give Ammunition To Both Bull And Bears,2024-03-08T15:47:21Z
Why Tesla Stock Fell This Week,2024-03-08T15:59:19Z
Why This Analyst Halves Lucid Group's Price Forecast Despite 12%-23% Higher Tech Efficiency Than Tesla,2024-03-08T18:08:50Z
Complaints about stock market’s ‘bad breadth’ are overblown. Here’s why.,2024-03-08T20:36:00Z
Why Rivian Was the 1 EV Stock That Didn't Drop This Week,2024-03-08T22:55:43Z
"Billionaire Ken Griffin Owns Every Single One of the ""Magnificent Seven"" Stocks. Should You?",2024-03-09T10:50:00Z
This isn’t a bull market — it’s a ‘duck’ market. Here’s why.,2024-03-09T12:24:00Z
"Forget Tesla: This Stock Should Replace It in the ""Magnificent Seven""",2024-03-09T12:50:00Z
Is It Too Late to Buy Nvidia Stock?,2024-03-09T13:55:00Z
Why is Elon Musk suing Open AI and Sam Altman? In a word: Microsoft.,2024-03-09T15:03:00Z
"This ‘greatest job in America’ can pay $200,000 a year and typically more — but you probably can’t get it",2024-03-09T18:45:00Z
"The S&P 500 and Nasdaq Hit All-Time Highs, but It Could Be Just the Beginning If These 3 Stocks Join the Rally",2024-03-10T08:49:00Z
"Forget the ""Magnificent Seven"": Warren Buffett Has Plowed $73.6 Billion Into This Stock Since 2019 Instead",2024-03-10T10:57:00Z
"Tesla Stock Has 80% Upside, According to This Wall Street Analyst",2024-03-10T12:20:00Z
"Forget Tesla: I Think This Stock Should Replace It in the ""Magnificent Seven""",2024-03-10T13:29:00Z
"A Third ""Magnificent Seven"" Stock Just Broke Below This Key Indicator. Should Investors Be Worried?",2024-03-11T07:07:00Z
Is Tesla Stock a Buy?,2024-03-11T08:33:00Z
Turn signals on a car’s touchscreen? European safety agency draws the line.,2024-03-11T08:59:00Z
Just one of these World Car of the Year finalists is American-made,2024-03-11T09:01:00Z
"Forget Nvidia: 2 Members of the ""Magnificent Seven"" Appear Poised to Become Wall Street's Next Stock-Split Stocks",2024-03-11T09:06:00Z
The Good News and Bad News About Tesla's EV Price Cuts,2024-03-11T09:30:00Z
"Dogecoin Has Skyrocketed 8,000% in the Last 5 Years; Is It the Best Crypto to Buy With $1,000 Right Now?",2024-03-11T09:45:00Z
"These 2 ""Magnificent Seven"" Artificial Intelligence (AI) Stocks Are Surprisingly Cheap",2024-03-11T10:05:00Z
Should You Invest in the Fidelity MSCI Consumer Discretionary Index ETF (FDIS)?,2024-03-11T10:20:05Z
Candlesticks and supernovas: why action in Nvidia is a worry for market gazers,2024-03-11T11:18:00Z
"The ‘Magnificent Seven’ stocks are actually undervalued vs. the rest of the market, JPMorgan says",2024-03-11T15:11:00Z
"Nvidia Traces A Bearish Pattern – Hedging Right At The Top, Central Banks Buy Gold",2024-03-11T15:51:12Z
Alphabet is the bargain stock among the ‘Magnificent Seven’,2024-03-11T17:09:00Z
Why are stocks so expensive right now? One Wall Street strategist has a theory.,2024-03-11T18:02:00Z
"Why BofA is bullish on U.S. consumers despite inflation, interest-rate worries",2024-03-11T18:34:00Z
1 Wall Street Analyst Cuts Nio's Price Target by 23%: Here's Why He's Right,2024-03-11T19:17:45Z
Trump’s TikTok flip-flop and what it means for Chinese stocks,2024-03-11T19:39:00Z
Exciting News for Tesla Stock Investors,2024-03-11T19:50:09Z
History Says You Should Sell EV Stocks Before It's Too Late,2024-03-11T20:38:35Z
Is The Tesla-Bitcoin Bromance Over? Morgan Stanley Analyst Sees Correlation Plummeting After EV Giant's Earnings Miss,2024-03-12T05:58:06Z
First Of Many Wall Street Cuts For Tesla? Fund Manager Sees Domino Effect In Motion After Deutsche Bank Lowers Delivery Estimate,2024-03-12T07:59:34Z
"The Single Best ""Magnificent Seven"" Stock to Buy Right Now, According to Wall Street",2024-03-12T09:00:00Z
"The 2024 Toyota bZ4X review: Pricing, range and more for this futuristic all-electric SUV",2024-03-12T09:01:00Z
Tesla Analyst Lists 3 Things That Need To Happen For 'Stock To Really Get Its Legs' Amid 'Pause-Period',2024-03-12T10:45:11Z
Pain or Gain Ahead of Electric Vehicle ETFs?,2024-03-12T11:00:00Z
Nvidia Has Added $1 Trillion to Its Market Cap in 50 Days. Here's Why Its Growth Isn't Done.,2024-03-12T11:05:00Z
"Illegal immigration is giving Fed more scope to let economy run hot, researchers say.",2024-03-12T13:13:00Z
"Coinbase Hits 3-Year High: Cathie Wood's Top Pick Surges As Bitcoin Rockets Past $72,000",2024-03-12T14:10:28Z
"Inflation Hotter Than Expected – Momo Buys The Bad News, JP Morgan CEO Says Recession Not 'Off The Table'",2024-03-12T15:00:04Z
No more free lunches: How laid-off tech workers are surviving a tight job market,2024-03-12T16:18:00Z
The Magnificent Three: Unveiling the Top Performers Among Tech Titans,2024-03-12T16:52:00Z
"Tesla’s Autopilot, other driver-assistance systems get poor ratings from auto-insurance group",2024-03-12T17:23:00Z
Tesla’s stock chart sends warning to bears that momentum may have bottomed,2024-03-12T17:41:00Z
"Rivian Designs 'Beautiful Products' But Needs To Prove It Can Produce Vehicles Profitably, Analyst Says",2024-03-12T17:48:02Z
AXS 2X Innovation ETF (TARK) Looks To Break Up From Technical Pattern As Coinbase Continues To Surge Higher,2024-03-12T19:34:23Z
"Top Research Reports for Novo Nordisk, Tesla & Airbnb",2024-03-12T21:58:00Z
Bull of the Day: Li Auto (LI),2024-03-13T08:00:00Z
"Can This Beaten-Down Growth Stock Outperform the ""Magnificent Seven"" Over the Next 5 Years?",2024-03-13T08:55:00Z
Cathie Wood's Ark Invest Is Selling Nvidia Stock and Buying This Artificial Intelligence (AI) Stock,2024-03-13T09:00:00Z
"The Biggest Loser in the ""Magnificent Seven"" Could Soar 1,140%, According to Cathie Wood's Ark Invest",2024-03-13T10:00:00Z
US Stock Futures Indicate Flat Open After Mini-Relief Rally; Bitcoin Goes Past $73K While Gold Dulls: Analyst Stresses Need For Robust Earnings,2024-03-13T10:49:21Z
"2 ""Magnificent Seven"" Stocks That Are Screaming Buys in March",2024-03-13T11:10:00Z
Rough Patch or Dip in the Road? 6 Reasons to Keep Your Eyes on Tesla,2024-03-13T11:15:00Z
"Top rated manager flags three overlooked small stocks, including an under-the-radar AI play",2024-03-13T11:57:00Z
"'Now Is NOT The Time To Throw In The Towel' On Tesla, Says Wedbush's Dan Ives: AI And FSD Could Drive The Stock Over $1 Trillion",2024-03-13T12:49:22Z
"The Zacks Analyst Blog Highlights Novo Nordisk, Tesla, Airbnb, ONEOK and CDW",2024-03-13T13:48:00Z
Tesla Is Dead Money,2024-03-13T14:00:22Z
1 Wall Street Analyst Thinks Tesla Stock Is Going to $125. Is It a Sell?,2024-03-13T14:12:40Z
"Dollar Tree Reports Weak Earnings, Joins Tesla, Arcos Dorados And Other Big Stocks Moving Lower On Wednesday",2024-03-13T14:22:00Z
"This Company Has Posted More Profits than Nvidia, Meta, Tesla and Amazon Combined",2024-03-13T14:50:00Z
PCAR vs. TSLA: Which Stock Is the Better Value Option?,2024-03-13T15:40:12Z
Nvidia And Gamma Squeeze Overpower Hotter Inflation Data,2024-03-13T15:44:23Z
"Tech Stocks Ease As Treasury Yields Rise, Commodity Rally Fuels Sector Rotation: What's Driving Markets Wednesday?",2024-03-13T17:55:37Z
Tesla now worth less than JPMorgan as stock slapped with new bearish call,2024-03-13T18:19:00Z
"Boeing Now the Second-Worst Performer in the S&P 500 YTD, Only Behind Tesla",2024-03-13T19:27:00Z
"Dow ekes out gain, S&P 500 slips following its 17th record high this year",2024-03-13T20:22:00Z
Wedbush's Dan Ives On Recent Tesla Downgrade: 'Even The New York City Cab Driver Is Bearish',2024-03-14T06:18:54Z
"Tesla Investor Shorts Stock, Saying 'Don't Think All Of The Bad Is Priced In Yet' — Predicts Possible Fall To This Level",2024-03-14T07:24:33Z
Ross Gerber's Wake-Up Call For Tesla: 'Investors Need To Face Reality' As The 'Market Is Finally Revaluing',2024-03-14T09:18:54Z
"This Artificial Intelligence (AI) ""Magnificent Seven"" Stock Could be a Once-in-a-Generation Investment Opportunity Right Now",2024-03-14T10:05:00Z
