title,published_utc
Opinion: 10 Figures That Show Tesla Is Completely Uninvestable Right Now,2024-04-26T09:21:00Z
"Nvidia, Meta Among Tech Stocks That Stand To Benefit From 'Lots Of Infrastructure Spending On AI,' Says Tesla Bull Ross Gerber",2024-04-26T14:06:12Z
Stock Market Dodges A Bullet – Momo Gurus Proven Wrong,2024-04-26T14:22:11Z
"Why Shares of EV Stocks Nio, Li Auto, and XPeng Are Racing Higher Today",2024-04-26T18:03:43Z
Does Mag 7 Leadership Remain Intact Post-Tesla and Meta Disappointments?,2024-04-26T22:23:00Z
"Should This Phenomenal Stock Replace Tesla in the ""Magnificent Seven""?",2024-04-27T07:32:00Z
What Rivian Needs to Do to Become Tesla,2024-04-27T07:59:00Z
"Worried About a Stock Market Sell-Off? Buy This ""Magnificent Seven"" Stock",2024-04-27T09:15:00Z
Tesla Stock Investors Cheer Progress on Its Artificial Intelligence (AI) Future,2024-04-27T10:00:00Z
"1 ""Magnificent Seven"" Stock With 1,234% Upside, According to Cathie Wood",2024-04-27T10:16:00Z
Great News for Tesla Stock Investors,2024-04-27T10:30:00Z
"The ""Magnificent Seven"" Day of Reckoning Has Arrived: Three Moves to Make Now",2024-04-27T12:10:00Z
Elon Musk Called Tesla an Artificial Intelligence (AI) Robotics Company. Does That Make It a Buy?,2024-04-27T14:05:00Z
Is Lucid Motors a Millionaire Maker?,2024-04-27T15:01:00Z
Can Tesla Become a Trillion-Dollar Stock by 2030?,2024-04-27T17:05:00Z
"For Tesla Stock Investors, There Are Only Three Letters That Matter",2024-04-27T21:05:00Z
"With Its Shares Down 59%, Should You Pile Into This ""Magnificent Seven"" Stock?",2024-04-28T07:07:00Z
3 Things to Know About Tesla Before You Buy the Stock,2024-04-28T08:09:00Z
1 Wall Street Analyst Thinks Tesla Stock Is Going to $293. Is It a Buy Around $170?,2024-04-28T09:00:00Z
Want to Outperform the S&P 500 With Minimal Risk? Buy This ETF.,2024-04-28T09:47:00Z
Wall Street Breakfast: The Week Ahead,2024-04-28T11:22:26Z
"Artificial Intelligence Could Propel This ""Magnificent Seven"" Stock 33% Higher, a Wall Street Analyst Says",2024-04-28T12:15:00Z
Is Tesla the Best Electric Vehicle (EV) Stock for You?,2024-04-28T16:37:00Z
"'Watershed Moment,' Says Tesla Analyst As Elon Musk Makes Surprise China Visit To Reportedly Discuss FSD Rollout And Data Transfer Overseas",2024-04-28T18:09:06Z
Where Will Tesla Stock Be in Five Years?,2024-04-28T18:22:00Z
"Billionaire Investor Chamath Palihapitiya Ranks Tesla's Non-EV Businesses, Picks This As No. 1 'Absolute Probably By An Order Of Magnitude'",2024-04-29T04:01:33Z
Did Cathie Wood Just Throw Shade At Google? Ark Invest CEO This Is What Separates Tesla From 'Auto And Tech Packs',2024-04-29T06:53:15Z
4 Artificial Intelligence (AI) Stocks Members of Congress Can't Stop Buying (and Nvidia Isn't 1 of Them!),2024-04-29T09:06:00Z
Billionaires Are Selling Nvidia Stock and Buying This Supercharged AI Index Fund Instead,2024-04-29T09:12:00Z
"Alphabet, Microsoft, Meta and Tesla are part of Zacks Earnings Preview",2024-04-29T09:28:00Z
"US Stocks Set To Approach New Week With Caution Ahead Of Fed Meeting, Tech Earnings: Analyst Says 'Buy The Dip' Contingent On This Condition",2024-04-29T10:54:21Z
5 Leveraged ETF Winners on S&P 500's Best Week Since November,2024-04-29T12:00:00Z
"Billionaire Investor Jim Simons Just Bought These 3 ""Magnificent Seven"" Stocks",2024-04-29T12:00:00Z
"Apple And Tesla 'Only Two Companies Able To Thread The Needle In Terms Of China-US', Says Top Analyst After Tim Cook And Elon Musk's Recent China Visits",2024-04-29T13:52:26Z
Cathie Wood Goes Bargain Hunting: 3 Stocks She Just Bought,2024-04-29T13:59:52Z
You Won't Believe What Elon Musk Just Said,2024-04-29T14:04:26Z
Elon Musk Just Made Another Big Statement on Tesla,2024-04-29T14:20:16Z
3 Stocks That Blew the Market Away Last Week,2024-04-29T15:05:00Z
What's Going on With Tesla Stock?,2024-04-29T15:06:05Z
Why Tesla Stock Rocketed Higher Today,2024-04-29T15:27:00Z
Tesla Stock Investors Receive Key Insights from the CFO,2024-04-29T15:29:54Z
Why Is ON Semiconductor Stock Trading Higher On Monday?,2024-04-29T15:34:30Z
"US Stocks Kick Off The Week In The Green, Tesla Rockets On China's FSD Approval, Yen Rallies: What's Driving Markets Monday?",2024-04-29T18:14:53Z
Tesla's Robotaxi Plans: Potential Threat Or Future Partner For Uber?,2024-04-29T18:58:19Z
Why Baidu Stock Jumped Today,2024-04-29T21:26:09Z
"Markets Up on Tesla, Q1 Earnings; Q1 Beats After the Bell",2024-04-29T22:10:00Z
