title,published_utc
"Tesla's Sudden Third Robotaxi Announcement, After 2019 And 2016",2024-04-06T04:06:28Z
"Tesla Stock Has 29% Downside, According to This Wall Street Analyst",2024-04-06T07:30:00Z
"Gene Munster Backs Tesla's Focus On Robotaxis Over Low-Cost EV, Gary Black Skeptical Of Strategy: 'Institutions Would Dump The Stock'",2024-04-06T08:10:17Z
Elon Musk Just Made One of the Biggest Announcements for Tesla,2024-04-06T09:05:00Z
"Here's the Artificial Intelligence (AI) Stock I Think Will Be the Next to Join Microsoft, Apple, Nvidia, Alphabet, Amazon, and Meta in the $1 Trillion Club",2024-04-06T09:45:00Z
"Is Tesla Scrapping the $25,000 Car or Not?",2024-04-06T10:15:00Z
Cathie Wood Hails Elon Musk's Visionary Impact: 'He's Transforming The World. Saving Humanity From Itself ... Is Extremely Important To Him'',2024-04-06T20:38:35Z
What's Going on With Tesla Stock?,2024-04-07T09:04:00Z
Tech Titans Clash: Mark Zuckerberg Rises As Elon Musk Falters In Billionaire Rankings,2024-04-07T16:47:10Z
Is It Time to Give Up on Lucid?,2024-04-08T07:02:00Z
Is Tesla Stock a Buy?,2024-04-08T07:14:00Z
'Don't Always Believe What You Read:' Tesla Chief Designer Says 'Just Stay Tuned' About Low-Cost Car Development After Musk Rubbishes Rumors,2024-04-08T07:45:14Z
Massive News for Tesla Stock Investors,2024-04-08T09:02:00Z
Cathie Wood Goes Bargain Hunting: 3 Stocks She Just Bought,2024-04-08T09:28:00Z
"Tesla Increasingly A 'Bet On Autonomy,' Says 'Unabashed And Unrelenting' Autonomy Uber-Bull: Here's Why",2024-04-08T09:56:35Z
US Stocks Set For Nervous Start To Week As Investors Eye Inflation Data; Bitcoin Tops $72K: Why This Analyst Sees Strong First Half For April,2024-04-08T11:04:55Z
"Investors Heavily Search Tesla, Inc. (TSLA): Here is What You Need to Know",2024-04-08T13:00:14Z
"EV Stock Roundup: Q1 Deliveries of TSLA, NIO, XPEV, LI & RIVN in Focus",2024-04-08T13:17:00Z
"Company News for Apr 8, 2024",2024-04-08T13:27:00Z
Why Tesla Stock Put Pedal to Metal Today,2024-04-08T14:46:35Z
Tesla (TSLA) to Unveil Its Much-Awaited Robotaxi on Aug 8,2024-04-08T15:58:00Z
Best Inverse/Leveraged ETFs of Last Week,2024-04-08T17:00:00Z
"Stocks Falter Ahead Of Data-Rich Week, Tesla Rallies On 'Robotaxi' Push, Bitcoin Reclaims $71,500: What's Driving Markets Monday?",2024-04-08T17:49:06Z
"Tesla Decision To Pause $25,000 Vehicle Could Be 'Thesis-Changing': Analyst Looks For Clarity On Robotaxi Timeline",2024-04-08T20:49:08Z
Why Electric Vehicle and Affiliated Stocks Zoomed Higher Today,2024-04-08T22:44:09Z
The Most Costly Investing Lesson I Ever Learned Also Became the Most Valuable,2024-04-09T08:00:00Z
"5 Artificial Intelligence (AI) Stocks That Can Plunge Up to 86%, According to Select Wall Street Analysts",2024-04-09T09:06:00Z
What Tesla Stock Investors Should Know About Recent Artificial Intelligence (AI) Updates,2024-04-09T09:15:00Z
"'Magnificent 7' Expected To Do Heavy Lifting Yet Again For Q1 Earnings, But Will The Other '493' On S&P 500 Fire On All Cylinders? Analyst Weighs In",2024-04-09T09:20:53Z
This New EV Truck Could Crush Rivian's R1T and Ford's F-150 Lightning,2024-04-09T09:40:00Z
Why Is Everyone Talking About Tesla Stock?,2024-04-09T10:05:00Z
Tesla Back As Ark's Darling: EV Giant Reclaims Top Spot In Cathie Wood's Flagship Fund After Over 2 Years,2024-04-09T12:19:47Z
Robinhood To Rally Around 51%? Here Are 10 Top Analyst Forecasts For Tuesday,2024-04-09T12:39:10Z
"Tesla's Robotaxi Won't Get Investors 'Excited,' Say Analysts: 'We See...Unveiling On August 8 As More Aspirational'",2024-04-09T13:32:08Z
"BlackBerry, Nurix Therapeutics, Tesla And Other Big Stocks Moving Higher On Tuesday",2024-04-09T14:43:45Z
"Bank Of America Sees Gold At $3,000, Warns Of A Copper Supply Crisis: Metals 'Dance To Their Own Tune'",2024-04-09T14:44:38Z
Is It Time to Buy the Nasdaq's Worst-Performing 2024 Stock?,2024-04-09T15:00:00Z
Shock For ChargePoint - Analyst Downgrades Amid Sluggish EV Market And Rising Competition,2024-04-09T16:29:55Z
Why Nio Stock Plunged in March but Could Recover,2024-04-09T16:37:46Z
Best ETFs of Last Week,2024-04-09T17:00:00Z
"If Tesla Hits Brakes On $25K EV, It 'Would Be A Meaningful Negative For The Stock': Goldman Sachs",2024-04-09T19:03:53Z
ClearBridge Appreciation Strategy Q1 2024 Portfolio Manager Commentary,2024-04-10T05:50:00Z
EV Slowdown: Trend or Blip?,2024-04-10T06:06:52Z
Nuvei's Going Private,2024-04-10T07:01:11Z
Elon Musk Said To Be In Talks With India's Richest Man To Help Establish Tesla Factory,2024-04-10T08:00:20Z
3 Things You Need to Know If You're Considering Buying Tesla Stock Today,2024-04-10T08:02:00Z
"Motley Fool Co-Founder David Gardner on Financial Freedom, AI, and a Numbers Game",2024-04-10T08:08:15Z
"Forget the ""Magnificent Seven,"" All Eyes Should Be on the ""Fab Four""",2024-04-10T08:10:00Z
"Meet the Only ""Magnificent Seven"" Stock Billionaire Investors Are Absolutely Piling Into",2024-04-10T09:06:00Z
A Once-in-a-Generation Investment Opportunity: 1 Artificial Intelligence (AI) Stock to Buy Now and Hold Forever This April,2024-04-10T10:54:00Z
"NVIDIA Tops, Tesla Flops Among Magnificent 7 in Q1: Here's Why",2024-04-10T11:51:00Z
Wall Street Analysts Adjust Targets For Nvidia And Tesla Amid Market Movements,2024-04-10T12:14:39Z
Tesla To $205? Here Are 10 Top Analyst Forecasts For Wednesday,2024-04-10T12:34:56Z
Cathie Wood Is Dumping Nvidia and Buying Tesla: Is She Making a Huge Mistake?,2024-04-10T14:00:08Z
"Raise Cash, New Data Shows Hotter Inflation – Momo Gurus Wrong Again, Bull Market Intact",2024-04-10T15:36:37Z
"Tesla Stock Faces Challenges In 2024, 2025: Analyst Highlights This Key Future Item, 'We Still Think TSLA Warrants A Place In Clients' Portfolios'",2024-04-10T17:14:38Z
Why Ascent Solar Technologies Shares Are Trading Lower By Around 50%? Here Are Other Stocks Moving In Wednesday's Mid-Day Session,2024-04-10T18:07:05Z
AI Leaders Retreat: Generational Buying Opportunity?,2024-04-10T19:08:00Z
"The Ultimate EV Stock to Buy With $1,000 Right Now",2024-04-11T08:11:00Z
GM's Answer to Tesla's FSD Is Back!,2024-04-11T10:00:00Z
Has Tesla Stock Bottomed Out? Fund Manager Says Much Of Bad Fundamentals News 'May Already Be Discounted',2024-04-11T10:14:42Z
"Elon Musk Should Pledge 3-5 Year Tenure As CEO, Says Wedbush's Dan Ives: '70% Of The Value Of Tesla Is Musk'",2024-04-11T13:17:27Z
General Motors' (GM) Cruise to Restart Operation in Arizona,2024-04-11T15:17:00Z
Is Tesla Stock a Buy?,2024-04-11T16:43:00Z
"Tesla Stock Has 30% Upside, According to 1 Wall Street Analyst",2024-04-11T16:56:00Z
Tesla (TSLA) Surpasses Market Returns: Some Facts Worth Knowing,2024-04-11T21:45:21Z
"Tesla Robotaxis No 'Magic Model' To Replace Sub-$30K EV, Says Analyst: 'Musk Needs To Give Clear Roadmap'",2024-04-12T05:52:16Z
Tesla Bull Predicts Q1 Beat On Back Of This Factor But Hopes Elon Musk 'For Credibility' Doesn't Blame High Interest Rates For Delivery Slide,2024-04-12T09:51:15Z
'F Inflation!' — Tesla Investor Ross Gerber And Critic Gordon Johnson Clash On True Cost Of EV Versus 'Evil Gas Car',2024-04-12T10:19:19Z
Why This Tesla Bull Feels More Optimistic About Energy Storage Than Robotaxis Or FSD V12,2024-04-12T12:16:07Z
Tesla To $180? Here Are 10 Top Analyst Forecasts For Friday,2024-04-12T13:07:48Z
Apple: Why I Sold All My Shares,2024-04-12T13:17:45Z
Magnificent Seven ETF (MAGS) Hits New 52-Week High,2024-04-12T13:44:00Z
Two Of America's Biggest Companies Have Made A 'Massive Bet' On China: 'They Can't Just Abandon…' Says Wedbush's Dan Ives,2024-04-12T14:04:04Z
5 ETFs Leading the Tech Rebound: Will the Rally Continue?,2024-04-12T15:25:00Z
"Market Turmoil Resumes As Inflation Rises More Than Expected, Oil Prices Spike, Gold At Record Highs: This Week In The Markets",2024-04-12T20:27:12Z
"Forget Rivian, Buy This Magnificent Electric Vehicle Stock Instead",2024-04-13T07:01:00Z
Rivian Stock Hits All-Time Low: News Goes From Bad to Worse,2024-04-13T10:09:00Z
"A Once-in-a-Generation Investment Opportunity: 1 Warren Buffett and Cathie Wood Artificial Intelligence (AI) Stock to Buy Hand Over Fist Before It Surges 16%, According to 1 Wall Street Analyst",2024-04-14T11:00:00Z
"Forget the ""Fab Four"": These 3 Artificial Intelligence (AI) Stocks Are Magnificent Buys Today",2024-04-14T13:00:00Z
Tesla's Q1 US Sales Mainly Held Back By Very Model That Saved It From Bankruptcy Years Ago,2024-04-15T08:41:00Z
'Wow:' Elon Musk Stunned By Reminder Of How Tesla Bull's Optimistic 2021 Rivian Prediction 'Didn't Age Well' (CORRECTED),2024-04-15T09:10:10Z
Tesla Quietly Signed Deal With India's Tata Electronics To Source Chips: Report,2024-04-15T09:47:18Z
"US Stocks Look Set To Start Week On Solid Note Despite Iran-Israel Conflict, Bitcoin Tops $66K: Why This Analyst Sees Another Tech Bull Run",2024-04-15T11:27:19Z
Wall Street Downgrades Tesla's Earnings Expectations as Competition Intensifies,2024-04-15T14:48:11Z
"Auto Roundup: KMX's Weak Quarterly Results, TSLA's FSD Price Cut & More",2024-04-15T14:52:00Z
Tesla (TSLA) Reduces FSD Monthly Subscription Price by 50%,2024-04-15T15:24:00Z
PCAR or TSLA: Which Is the Better Value Stock Right Now?,2024-04-15T15:40:12Z
"Best Of All Scenarios In The Middle East, Apple iPhone Sales Fall 10%, Tesla To Layoff 10%",2024-04-15T16:08:17Z
Massive News for Tesla Stock Investors,2024-04-15T16:12:58Z
"Stocks Stay Afloat On Strong Retail Sales, Middle East Relief; Bonds Drop: What's Driving Markets Monday?",2024-04-15T17:25:23Z
"Why Bitcoin, Ethereum, and Dogecoin Slipped Over the Weekend",2024-04-15T17:52:05Z
Huge News for Tesla Investors: 1 Billion Reasons to Keep an Eye on the Stock,2024-04-15T18:00:00Z
Marks Cannot Sustain Rebound Amid High Bond Rates,2024-04-15T21:49:00Z
Why Investors Slammed the Brakes on Electric Vehicle and Related Stocks Monday,2024-04-15T22:39:37Z
"'Not Good' For Tesla If It's True, Says Fund Manager, As New Report Says EV Maker Has Put Sub-$30K Vehicle On Hold",2024-04-16T02:45:55Z
3 Artificial Intelligence (AI) Predictions That Undeniably Go Against the Grain,2024-04-16T09:06:00Z
Tesla Stock Is Down 60%. How Much Further Could It Tumble?,2024-04-16T10:30:00Z
Wall Street Braces For Mixed Open As Middle-East Tensions Offset Earnings Optimism: Analyst Points To Silver Lining In Rally Break,2024-04-16T11:24:45Z
1 Wall Street Analyst Thinks Tesla Stock Is Going to $120. Is It a Sell?,2024-04-16T12:07:22Z
Tesla's Latest Price Cut Looks Desperate,2024-04-16T12:30:00Z
Tesla (TSLA) to Cut Jobs by 10% to Manage Costs Amid Low EV Sales,2024-04-16T12:31:00Z
"Company News for Apr 16, 2024",2024-04-16T13:29:00Z
Earnings Preview: Tesla (TSLA) Q1 Earnings Expected to Decline,2024-04-16T14:00:46Z
Tesla's (TSLA) Q1 Earnings Likely to Disappoint: Here's Why,2024-04-16T14:22:00Z
Bear of the Day: Tesla (TSLA),2024-04-16T14:41:00Z
Why Tesla Stock Keeps Falling,2024-04-16T15:10:16Z
Prudent Investors Pay Attention To The Extraordinary Treasuries' Move – Momo Obliviously Buys Stocks,2024-04-16T15:30:07Z
Why Rivian Stock Bounced Back on Tuesday,2024-04-16T16:42:40Z
What Lies Ahead of Electric Vehicle (EV) ETFs?,2024-04-16T17:00:00Z
"Stocks Grapple With Geopolitical Pressures, Gold Eyes $2,400, Bitcoin Falls Below $62,000: What's Driving Markets Tuesday?",2024-04-16T17:28:14Z
"Cathie Wood's Ark Laps Up $3.3M Worth Of Tesla As Stock Falls For 3rd Straight Session, Sheds Shares Of This Sports Betting Company",2024-04-17T02:18:22Z
"Tesla's Cybertruck Outpaces Porsche Taycan In Q1 Despite Lagging Behind Ford's F-150 Lightning, Rivian R1T: Research Data",2024-04-17T04:44:36Z
Why This Tesla Bull Remains Stubbornly Optimistic About EV Giant Amid Cloud Of Doubts: 'Every Headline Is Either World-Ending Or World-Beating...',2024-04-17T08:51:27Z
"Cathie Wood Believes This Fast-Paced Artificial Intelligence (AI) Stock Can Skyrocket 1,138%, but Congress' Most Active Stock Trader Is Selling Shares",2024-04-17T09:50:00Z
"3 Unstoppable Growth ETFs to Turn $100 per Month Into $500,000 or More",2024-04-17T10:00:00Z
"If You'd Invested $1,000 in Tesla 5 Years Ago, Here's How Much You'd Have Today",2024-04-17T11:07:00Z
Tesla Bull Says 'Don't Know…What's Going To Happen To TSLA Stock Next Week' Ahead Of Earnings Call: 'Much Depends On…',2024-04-17T11:17:34Z
CyberArk and Manitowoc have been highlighted as Zacks Bull and Bear of the Day,2024-04-17T12:55:00Z
"Billionaire David Tepper Thinks the ""Magnificent Seven"" Is Really a Fabulous Five",2024-04-17T13:30:00Z
Markets Try to Shake Off April Blues,2024-04-17T14:32:00Z
Tesla Analyst Says Expect 'Fireworks' Into Shareholder Meeting After EV Giant's Proxy Filing: 'Clock Has Struck Midnight For Musk',2024-04-17T14:43:52Z
Huge News for Tesla Stock Investors,2024-04-17T15:00:00Z
Q1 Earnings Review,2024-04-17T15:04:00Z
"Powell Shifts But Does Not Admit He Was Wrong, Opportunity In AI Driven Semiconductor Chip Equipment Maker",2024-04-17T15:19:23Z
"Canoo Has 'A Multi-Billion Revenue Opportunity,' Says Bullish Analyst",2024-04-17T16:13:19Z
Tesla (TSLA) Sees a More Significant Dip Than Broader Market: Some Facts to Know,2024-04-17T21:45:21Z
Cathie Wood's Ark Invest Swoops In To Buy $10.3M Worth Of Tesla Shares Amid Downturn In Price,2024-04-18T02:02:34Z
Tesla Stock Fell Over 9% After Past 4 Earnings Reports: Fund Manager Offers Advice On How Elon Musk Can Break Woeful Streak,2024-04-18T06:52:23Z
The Most Active Stock Trader in Congress Is Buying Shares of This Magnificent Stock-Split Stock,2024-04-18T08:41:00Z
"Tesla Stock Has 85% Downside, According to 1 Wall Street Analyst",2024-04-18T08:45:00Z
You Won't Believe What Federal Reserve Chairman Jerome Powell Just Did!,2024-04-18T09:00:00Z
"2 Growth Stocks That Turned $10,000 Into More Than $100,000 in Just 10 Years",2024-04-18T09:10:00Z
"Is This ""Magnificent Seven"" Stock a Good Contrarian Buy?",2024-04-18T09:15:00Z
Tesla Analyst Feels Core Auto Unit Worth Only $62 Per Share But Remains 'Overweight' On Stock Amid Incoming 'EV Recession:' Here's Why,2024-04-18T09:28:29Z
Tesla Balance Sheet Analysis: Stock Price Decline Will Not Put Company in Financial Distress,2024-04-18T09:30:00Z
Tesla's Price Cuts and Layoffs Indicate There's More Downside in the Stock,2024-04-18T10:03:00Z
3 Artificial Intelligence Stocks With More Potential Than Any Cryptocurrency,2024-04-18T10:05:00Z
Legal Expert Says Tesla Shareholder Vote To Approve Elon Musk's Pay 'For His Past Work' Is Like Setting 'Assets On Fire Without Benefit To Company',2024-04-18T10:21:15Z
Magnificent 7: Earnings Preview (SA Quant),2024-04-18T12:00:00Z
"'I Think You Just Don't Like Elon,' Tesla Bull Tells Shortseller Even As She Admits Situation Right Now Is 'Murky'",2024-04-18T12:21:45Z
Tesla To $123? Here Are 10 Top Analyst Forecasts For Thursday,2024-04-18T12:46:42Z
Tesla: All Bricked Up,2024-04-18T13:13:38Z
Insights Into Tesla (TSLA) Q1: Wall Street Projections for Key Metrics,2024-04-18T13:15:21Z
Tesla's Autonomous Driving Efforts Win Praise From Goldman Sachs: Wall Street Firm Projects Long-Term Growth From Robotaxi Services,2024-04-18T13:31:42Z
"Stocks Edge Higher As Earnings Provide Support, Tesla Sinks To 15-Month Lows, Bitcoin Rebounds: What's Driving Markets Thursday?",2024-04-18T17:11:07Z
To The Moon! A Look Inside An ETF Focused On Companies At The Cutting Edge Of Innovation,2024-04-18T18:29:09Z
Tesla Stock: Plunging Toward My Price Target,2024-04-18T20:52:25Z
"Cathie Wood Sees Value In Tesla Wreckage As Ark Buys $13M Worth Of EV Giant's Stock, Loads Up On Bitcoin And Ethereum ETFs",2024-04-19T06:20:24Z
Tracking Cathie Wood's ARK Invest 13F Portfolio - Q1 2024 Update,2024-04-19T07:54:17Z
"2 Popular Artificial Intelligence (AI) Stocks to Sell Before They Drop 29% and 77%, According to Certain Wall Street Analysts",2024-04-19T08:15:00Z
"Tesla Stock Going Down to $115, According to 1 Wall Street Analyst",2024-04-19T10:40:00Z
"Wall Street On Track For 6th Day Of Losses? Netflix, Geopolitical Tensions Drag Futures Down: Analyst Tells Why Next 2 Weeks Are Pivotal",2024-04-19T10:48:22Z
"Tesla, Inc. (TSLA) Is a Trending Stock: Facts to Know Before Betting on It",2024-04-19T13:00:16Z
Are These Beaten-Down S&P 500 Members Worth a Buy?,2024-04-19T14:15:00Z
"Tesla, Musk Face 'Moment Of Truth' With Q1 Earnings Call: 'Believers Are Giving Up On The Story And Throwing In The White Towel'",2024-04-19T14:55:51Z
Why VinFast Auto Stock Collapsed This Week,2024-04-19T17:46:02Z
"S&P 500 Nears 6-Day Slide, Nasdaq 100 Faces Worst Week Since Late 2022: What's Driving Markets Friday?",2024-04-19T18:37:45Z
Why EV and Renewable Energy Stocks Collapsed This Week,2024-04-19T18:57:43Z
Why Tesla Stock Was Falling (Again) This Week,2024-04-19T19:16:15Z
What Can Investors Expect From Big Tech Earnings?,2024-04-19T21:39:00Z
"Forget Tesla: Here Are 2 Better ""Magnificent Seven"" Stocks to Buy in April",2024-04-20T07:30:00Z
Could Rivian Become the Next Tesla?,2024-04-20T07:35:00Z
Should You Buy Tesla Stock Before Aug. 8?,2024-04-20T14:05:00Z
Tesla's Stock Price Just Plunged. Is Now the Time to Invest?,2024-04-20T15:41:00Z
Democrats Crushed Republicans in Average Stock Market Returns in 2023: Here's Their Not-So-Subtle Secret to Success.,2024-04-21T09:50:00Z
Wall Street Breakfast: The Week Ahead,2024-04-21T10:46:42Z
"Cathie Wood's Ark Buys More Of Its In-House Spot Bitcoin ETF Ahead Of Halving, Pauses Tesla Buying",2024-04-21T12:43:59Z
Wall Street Brunch: Megacaps Highlight Big Earnings Week,2024-04-21T13:10:00Z
Rivian Stock Hits All-Time Low. Could the Growth Stock Continue Selling Off?,2024-04-21T13:37:00Z
"Several Companies Under Elon Musk Billed Each Other Approximately $9 Million In Expenses, Raising Serious Questions About Corporate Governance",2024-04-21T14:47:28Z
Magnificent 5 Or 7? Earnings Preview With Steven Cress,2024-04-21T21:00:00Z
"Can Magnificent 7 Help Script Market Turnaround? Earnings Pick Up Pace With Microsoft, Meta, Alphabet And Tesla Expected This Week",2024-04-21T21:45:15Z
"It's Time to Ditch These 2 ""Magnificent Seven"" Stocks and Replace Them With 2 Bona Fide Outperformers",2024-04-22T09:21:00Z
Buy Or Subscribe Monthly To Tesla FSD? Ross Gerber Says This Option Would 'Not Be A Smart Use Of Money',2024-04-22T10:01:41Z
US Stocks Set To Open Fresh Week Higher On Big Tech Earnings Hopes: Analyst Warns Any Letdown Could Push Market 'Deeper Into Oversold Territory',2024-04-22T10:44:48Z
"ETF Winners Amid Last Week's Record Loss in ""Magnificent 7""",2024-04-22T12:00:00Z
"Tesla, Meta Platforms, Microsoft and Alphabet are part of Zacks Earnings Preview",2024-04-22T12:17:00Z
Maybe Buying Tesla Stock Was A Bad Idea,2024-04-22T13:30:00Z
Tesla Bears Drive EV Stock To New 52-Week Lows: Will Q1 Earnings Shift Gears?,2024-04-22T14:21:46Z
Busy Week Hoping to Shake Some Life into Markets,2024-04-22T14:29:00Z
My Tesla Stock Prediction for 2024,2024-04-22T14:47:53Z
Q1 Earnings Season Gathers Pace,2024-04-22T14:50:00Z
Is It Time to Sell Tesla Stock and Look Elsewhere?,2024-04-22T15:03:10Z
3 Companies I'm Watching Closely This Earnings Week,2024-04-22T15:11:42Z
What's in Store for Magnificent 7 Stocks in Q1 Earnings?,2024-04-22T16:26:00Z
Should You Buy the Dip in Magnificent 7 ETFs Before Q1 Earnings?,2024-04-22T17:00:00Z
Why Tesla Stock Tumbled Today,2024-04-22T17:43:04Z
"Auto Roundup: GPC's Quarterly Results, GPI's Buyout Deal of $439M & More",2024-04-22T18:10:00Z
"Stocks Set To Snap Worst Losing Streak In Nearly 2 Years, Gold Sinks, Bitcoin Reclaims $66,000: What's Driving Markets Monday?",2024-04-22T18:16:36Z
Why Investors Should Choose the Nasdaq-100 Over the Ark Innovation ETF,2024-04-22T18:17:00Z
"3 ""Magnificent 7"" Stock Earnings Coming Up: What to Expect",2024-04-22T18:35:00Z
GM Earnings Preview: What to Expect in Q1 2024,2024-04-22T19:02:17Z
ChargePoint Hits All-Time Low: Can It Recover?,2024-04-22T19:04:22Z
Should You Buy Tesla Stock Before Earnings?,2024-04-22T20:23:44Z
Nasdaq 100 Breaks 3-Day Losing Streak As Tech Stocks Rebound Ahead Of Earnings Week,2024-04-22T20:28:31Z
Markets Close in the Green; Mag 7 Earnings This Week,2024-04-22T21:59:00Z
"Tesla Q1 Earnings Preview: Is EV Giant No Longer A 'Growth Stock?' Analysts Cautious, Want Answers About Robotaxis, Model 2",2024-04-22T22:32:32Z
"Cathie Wood's Ark Invest Seizes Tesla Dip, Acquires Over $17M in Shares Ahead Of Q1 Results — Zoom Stock Dumped",2024-04-23T02:42:24Z
The Magnificent 7 Get Set To Report Amidst An S&P 500 Losing Streak,2024-04-23T04:55:00Z
I Was Incredibly Wrong About the Tesla Cybertruck,2024-04-23T08:30:00Z
'Tesla Isn't Growing:' Investor Ross Gerber Predicts Bad Q1 Earnings And Pokes Holes In Growth Strategy,2024-04-23T08:56:04Z
Should You Invest in the Vanguard Consumer Discretionary ETF (VCR)?,2024-04-23T10:20:06Z
Elon Musk Reacts As ARK Invest Analyst Says 'It's Going To Be Very Hard' For Tesla Rivals 'To Catch Up To Them' In Pricing: 'Accurate',2024-04-23T10:36:08Z
Wall Street Set To Open Higher As Tesla Kicks Off 'Magnificent 7' Earnings: Why This Analyst Thinks Market Weakness Is A 'Healthy Pullback',2024-04-23T10:55:31Z
Disaster at Tesla? Previewing Today's Earnings,2024-04-23T12:57:10Z
"The Zacks Analyst Blog Highlights NVIDIA, Tesla, Microsoft, Meta Platforms and Alphabet",2024-04-23T13:07:00Z
"Stock Market News for Apr 23, 2024",2024-04-23T13:24:00Z
Tesla Pre EPS Turmoil: 3 Long-Term Factors to Consider,2024-04-23T14:23:00Z
"Pre-Markets Up, Q1 Earnings Beats for GM, UPS, Pepsi",2024-04-23T14:24:00Z
Tech Companies Start Reporting Q1 Earnings,2024-04-23T14:54:00Z
This Week's 5 Must-See Earnings Charts,2024-04-23T16:09:00Z
Cathie Wood's Ark Empire Bleeds As Investor Outflows Spike: 'The Loyal Shareholders Have Become Frustrated',2024-04-23T17:20:20Z
"Stocks Rally On Weaker PMI Data, Tech Earnings Optimism, Dollar Falls: What's Driving Markets Tuesday?",2024-04-23T17:33:38Z
Alphabet (GOOGL) Vs. Microsoft (MSFT): Which Tech Giant is More Attractive Ahead of Earnings,2024-04-23T18:00:00Z
Tesla (TSLA) Q1 Earnings and Revenues Miss Estimates,2024-04-23T21:15:05Z
Time to Buy General Motors (GM) Stock After Strong Q1 Results,2024-04-23T21:32:00Z
"Tesla Up +7% After Q1 Misses, TXN, Visa Beat on Top & Bottom",2024-04-23T21:49:00Z
Tesla (TSLA) Reports Q1 Earnings: What Key Metrics Have to Say,2024-04-23T22:00:06Z
Tesla (TSLA) Q1 2024 Earnings Call Transcript,2024-04-24T01:30:13Z
"Cathie Wood's Ark Invest Remains Bullish Despite Tesla's Q1 Earnings Slip, Revenue Drop — Buys $4.3M in EV Maker Stock",2024-04-24T01:57:06Z
"Tesla, Inc. 2024 Q1 - Results - Earnings Call Presentation",2024-04-24T05:31:32Z
Is It Too Late to Buy Lucid Stock?,2024-04-24T08:40:00Z
"Meet the 3 ""Magnificent Seven"" Stocks Members of Congress Can't Stop Selling",2024-04-24T09:06:00Z
"Tesla (TSLA) Q1 Earnings Miss Expectations, Decline Y/Y",2024-04-24T09:36:00Z
General Motors' Shocking Turnaround and Bright Future,2024-04-24T09:55:00Z
"Tesla Bulls Praise Musk's Q1 Earnings Call, See EV Giant On Collision Course With Uber And Lyft — But Critic Says 'Christmas Just Came Early' For Bears",2024-04-24T10:11:59Z
"Nasdaq Futures Get A Lift From Tesla, Texas Instruments Earnings: Analyst Points To Key Catalyst For Boosting Rally",2024-04-24T10:37:30Z
"Tesla's No Good, Very Bad Quarter",2024-04-24T11:02:00Z
Why Is Tesla Stock Surging Premarket Despite Q1 Miss?,2024-04-24T11:05:00Z
Tesla (TSLA) Soars 13.1% After-Hours on Affordable EV Promise,2024-04-24T11:20:00Z
Tesla To $180? Here Are 10 Top Analyst Forecasts For Wednesday,2024-04-24T11:44:42Z
"Tesla Stock Gains 13% as Investors Cheer Plan to ""Accelerate the Launch"" of Lower-Priced EVs",2024-04-24T12:00:00Z
Tesla Bull Says Elon Musk Delivered 'Rip The Band-Aid Off' Q1 But Cautions This Could Derail Bullish Thesis,2024-04-24T12:43:33Z
Tesla Sent a Clear Message to Wall Street on Tuesday,2024-04-24T13:25:55Z
Tesla Rises on Future EV Plans Despite Q1 Miss: ETFs in Focus,2024-04-24T14:00:00Z
Tesla Just Shared Some Spectacular News for Nvidia Stock Investors,2024-04-24T14:50:02Z
The Investment Case for Tesla (TSLA) After a Weak Q1 Show,2024-04-24T14:57:00Z
"""Bad News"" is Good News for these 3 Stocks",2024-04-24T16:15:00Z
Why Tesla Stock Was Soaring Today,2024-04-24T16:28:13Z
"8 Tesla Analysts Size Up Next-Gen Vehicles, FSD, AI And More: 'Potential To Be A Transformational Technology Company, Deliver Outsized Returns'",2024-04-24T16:50:57Z
AI Server Market Is Expanding Rapidly - Analysts Highlight Super Micro Computer's Importance In The Game,2024-04-24T18:38:58Z
Tesla Posts Strongest Session Since January 2022: Is A Trend Reversal Underway?,2024-04-24T20:11:13Z
Tesla Stock Soars as Elon Musk Overshadows Current Troubles With Future Hopes,2024-04-24T21:02:49Z
"To Lower Or Not? EV Pricing Dilemma Hampers Ford's Profitability, Warns Analyst",2024-04-25T08:46:01Z
"US Stocks Brace For Negative Start Amid Tech Earnings Disappointments, Caution Ahead Of Data: 'Worst Of This Two-Week Decline Is Behind Us,' Says Analyst",2024-04-25T10:17:18Z
Should You Invest in the iShares U.S. Consumer Discretionary ETF (IYC)?,2024-04-25T10:20:05Z
"Zacks Investment Ideas feature highlights: Enphase Energy, Tesla and Boeing",2024-04-25T12:04:00Z
"Artificial Intelligence (AI) Robots Are a $38 Billion Market, According to Goldman Sachs. Here's How the ""Magnificent Seven"" Are Investing in the Technology.",2024-04-25T12:20:00Z
"Stock Market News for Apr 25, 2024",2024-04-25T13:34:00Z
"Magnificent 7 Tumble, Wipe Out $300 Billion On Meta's Weak Guidance, Q1 Stagflation Woes",2024-04-25T15:35:13Z
"Can Tesla's Earnings Struggle Take Down the ""Mag 7""?",2024-04-25T19:10:00Z
Tesla Investor Touts EV Giant's Billions-Mile Leap In Gathering Self-Driving Data: 'How Can Any Automaker Catch Up?',2024-04-26T05:39:15Z
"Bull of the Day: Uber Technologies, Inc. (UBER)",2024-04-26T08:00:00Z
"Tesla's Robotaxi Plan Hasn't Excited Investors, But Fund Manager Gary Black Says This Is What Matters More: 'No Other Way To Interpret This...'",2024-04-26T08:30:00Z
Tesla's Robotaxi Ambition Is Great News for Nvidia Stock Investors,2024-04-26T09:09:00Z
