title,published_utc
Why Japan’s stock market could keep soaring — plus three stock picks there,2024-03-14T11:08:00Z
"Wall Street Eyes Strong Start Ahead Of More Inflation Data, Gold & Bitcoin Dip: Why This Analyst Looks Beyond AI For Growth",2024-03-14T11:39:29Z
Tesla To $165? Here Are 10 Top Analyst Forecasts For Thursday,2024-03-14T12:33:32Z
Tesla Vs. Li Auto: Which EV Stock to Back in 2024?,2024-03-14T12:50:00Z
"‘Run with the bulls.’ Don’t worry about the S&P 500 until it reaches 6,250, says SocGen.",2024-03-14T14:17:00Z
Market Cap Game Show: Andy Cross vs. Emily Flippen,2024-03-14T15:50:20Z
"Hotter Producer Inflation And Declining Retail Sales – Momo Crowd In La La Land, Oil Deficit Prediction",2024-03-14T16:47:11Z
"Wall Street has another grim take on Tesla, and the stock is at a 10-month low",2024-03-14T17:30:00Z
"Stocks Fall As Hot Inflation Data Derails Fed Cut Bets, Bonds Tumble, VIX Rallies, Oil Tops $80: What's Driving Markets Thursday? (CORRECTED)",2024-03-14T18:23:54Z
Tesla Worst Performing S&P 500 Stock Year-To-Date: Analyst Warns More Trouble Ahead With 'Slower EV Demand',2024-03-14T20:02:55Z
Dogecoin Rips Then Slips On Most Recent Elon Musk Comments,2024-03-14T21:04:36Z
Fisker breaks silence about potential bankruptcy. Here’s what it had to say.,2024-03-14T21:57:00Z
Popular QQQ ETF is losing steam this month — even as growth stocks outperform in 2024,2024-03-14T22:29:00Z
Cathie Wood To Tesla's Rescue? Ark Invest Scoops Up $35M Of EV Giant's Sliding Stock,2024-03-15T02:08:56Z
"Tesla Needs 'Real CEO' To Reverse Recent Stock Decline, Says Long-Time Investor Ross Gerber: '...Or Elon Changes His Tune And Actually Comes Back To Working'",2024-03-15T02:17:29Z
"'This Is A Long-Term Bull Market': Expert Ed Yardeni Stands By His 5,400 Year-End S&P 500 Target, Predicts 26% Upside By 2026",2024-03-15T04:09:34Z
"As Tesla, Apple Slide, Peter Schiff Sounds Alarm On Magnificent Seven Stocks: 'Calls Into Question The Prospects For The Other Five'",2024-03-15T04:49:28Z
"Tesla Bull Unfazed By Stock Slump On Elon Musk's 'Decades Perspective,' Says This Factor Will Be Next Major Boost",2024-03-15T06:09:03Z
"The ""Magnificent Seven"" Stocks Ranked From Cheapest to Most Expensive",2024-03-15T08:06:00Z
Cracks In Tesla's Armor? Bearish Analyst Shares Value Investor's Take On Why Wall Street's 'More-Than-A-Car-Company' Thesis Is Flawed,2024-03-15T09:30:12Z
Did the R2 Just Mark a Turning Point for Rivian Stock?,2024-03-15T10:02:00Z
"Does Tesla Still Belong in the ""Magnificent Seven?""",2024-03-15T10:06:00Z
"Forget the ""Magnificent Seven."" Buy These 2 Incredible Growth Stocks Instead.",2024-03-15T10:30:00Z
Tesla Bull Gary Black Says Competition From Figure-OpenAI's Humanoid Robot Is Another Reason 'It's Difficult To Add A Value For Optimus',2024-03-15T11:47:00Z
"Tesla, Inc. (TSLA) is Attracting Investor Attention: Here is What You Should Know",2024-03-15T13:00:16Z
Dan Ives Keeps Faith In Tesla Through 'White-Knuckle' Times: 'Not The End Of The Growth Story',2024-03-15T13:24:06Z
"Company News for Mar 15, 2024",2024-03-15T13:25:00Z
Tesla (TSLA) to Produce Semi Truck at Gigafactory Berlin,2024-03-15T13:27:00Z
"Nvidia led Phase 1 of the AI trade, and these are the next three, says Goldman Sachs",2024-03-15T14:01:00Z
RFK Jr. talks AI and Elon Musk,2024-03-15T14:46:00Z
What Is Going On With Tesla Stock?,2024-03-15T15:25:58Z
"Cathie Wood’s ETFs load up on Tesla’s stock, but not enough to stop the selling",2024-03-15T17:21:00Z
"Auto Analyst Compares Detroit 3 - Ford, GM, Stellantis - And 2 Auto Suppliers BorgWarner, Mobileye: Which 2 Stocks Have Top Ratings?",2024-03-15T17:33:41Z
QQQI: The Undiscovered Nasdaq-100 Covered Call ETF You've Been Looking For (14.4% Distribution Yield),2024-03-15T19:32:22Z
Are These 3 Beaten-Down S&P 500 Members Worth a Look?,2024-03-15T20:09:00Z
Tesla (TSLA) Ascends While Market Falls: Some Facts to Note,2024-03-15T21:45:19Z
3 Hot Auto Stocks to Buy in March,2024-03-15T23:58:00Z
"Morgan Stanley Analyst Increasingly Bullish On Elon Musk's Tesla Optimus Venture As Jeff Bezos, Nvidia, Microsoft Pour $675M In FigureAI",2024-03-16T02:27:54Z
'Tesla…Best House On A Bad Block': Analyst Sees Multiple Catalysts For Elon Musk's EV Giant Despite Stock Slump,2024-03-16T09:00:10Z
"Should Broadcom Be in the ""Magnificent Seven?""",2024-03-16T09:10:00Z
Tesla Stock Just Reached Its Lowest Level Since May 17 of Last Year. Should Investors Be Worried?,2024-03-16T09:12:00Z
"It's Not Too Late to Invest in Artificial Intelligence: 2 ""Magnificent Seven"" Stocks to Buy and Hold Forever",2024-03-16T09:56:00Z
Can Tesla's Charging Network Supercharge Its Stock?,2024-03-16T10:45:00Z
"This NFL player tried to buy a Tesla Cybertruck for $100,000 over asking — and was blocked by his financial adviser",2024-03-16T11:57:00Z
"Meet the ""Magnificent Seven"" Stock That Pays More Dividends Than Any Other U.S.-Based Company",2024-03-16T12:15:00Z
"Jensen Huang Just Said ""Humanoid Robotics Should Be Right Around the Corner."" Here's How Nvidia Could Benefit.",2024-03-16T12:40:00Z
"Ahead Of Nvidia's 'Grand' Event, This Analyst Compares AI Revolution To '10 PM In A Party That Goes To 4:30 AM'",2024-03-16T12:54:11Z
"Could Every ""Magnificent Seven"" Stock Be in The Dow Jones Industrial Average by 2030?",2024-03-17T13:40:00Z
Google: Strong Buy - The Cheapest Trillionaire,2024-03-17T15:59:56Z
"Tesla Bull Gary Black Fumes Over Personal Attacks By EV Giant's Fans After Trimming Stake: 'Valuation Is Based On Forecasts, Not Hype'",2024-03-18T07:35:57Z
Security researchers find an easy way to hack and steal Teslas,2024-03-18T09:03:00Z
"The ‘EV penalty’: Electric car owners are paying more taxes and fees in 35 states, study finds",2024-03-18T09:03:00Z
"Forget Nvidia: Billionaires Are Selling It and Buying This ""Magnificent Seven"" Stock Instead",2024-03-18T09:06:00Z
"U.S. stocks have beaten European equities but not for much longer, says JPMorgan",2024-03-18T10:27:00Z
Tesla (TSLA) to Hike Prices of All Model Y Vehicles in the US,2024-03-18T10:30:00Z
Cathie Wood Goes Bargain Hunting: 3 Stocks She Bought Last Week,2024-03-18T10:50:00Z
NVIDIA To Rally Around 20%? Here Are 10 Top Analyst Forecasts For Monday,2024-03-18T11:52:31Z
"Nvidia’s stock is cheap in many ways, says this analyst who sees 34% upside",2024-03-18T12:18:00Z
Tesla: The Ultimate Sentiment Machine (Technical Analysis),2024-03-18T12:35:24Z
Elon Musk questioned by Don Lemon over diversity and content moderation,2024-03-18T12:59:00Z
"Tesla Stock Price Projections Lowered Due To Production, Sales Challenges: Goldman Sachs",2024-03-18T13:09:44Z
Tesla Stock Investors Should Start Realizing This Now,2024-03-18T13:20:36Z
Tesla’s stock rallies as prices for Model Y EVs will increase in April,2024-03-18T14:24:00Z
"3 ""Magnificent Seven"" Stocks to Buy Now",2024-03-18T15:00:00Z
Why S&P 500’s consumer-discretionary sector is ‘left behind’ in U.S. stock market,2024-03-18T17:14:00Z
Good news: Car prices are falling. Bad news: It’s a terrible time to trade in your car. Here’s why.,2024-03-18T17:43:00Z
"Stocks Rally With Google, Tesla At The Helm, But Rising Oil Prices Spark Inflation Fears: What's Driving Markets Monday?",2024-03-18T18:01:55Z
Why Tesla Stock Was Climbing Today,2024-03-18T19:33:40Z
Jensen Huang Sends A.I. Partners Higher in Late Trading,2024-03-18T21:40:00Z
"Nvidia reveals highly anticipated Blackwell chip lineup at GTC, but stock dips",2024-03-19T00:46:00Z
Tesla Bull Suggests EV Giant Break Out AI Revenue And Profit As 4th Segment In Earnings Reports To Grab More Investor Eyeballs,2024-03-19T06:22:26Z
"This Is the Cheapest ""Magnificent Seven"" Stock, According to Peter Lynch's Favorite Valuation Metric",2024-03-19T09:36:00Z
3 Actively Managed ETFs to Put on Your Radar in 2024,2024-03-19T10:03:00Z
Should You Invest in the Consumer Discretionary Select Sector SPDR ETF (XLY)?,2024-03-19T10:20:06Z
"Jim Cramer Weighs In On Tesla's Potential After Stock Gained Over 6% On Monday: 'Not A Fan Of It, But Not Against It'",2024-03-19T10:39:41Z
Where Will Tesla Stock Be in 3 Years?,2024-03-19T12:16:00Z
"EV Roundup: WKHS' Quarterly Results, NIO-CATL Alliance Draw Attention",2024-03-19T13:09:00Z
Don’t want to chase Big Tech? Money manager flags three unloved stocks to bet on now.,2024-03-19T13:51:00Z
Biden’s EPA to roll out regulation that GOP blasts as ‘EV mandate’,2024-03-19T19:49:00Z
"Why Bitcoin, Ethereum, and Dogecoin Are Losing Ground Today",2024-03-19T20:46:25Z
Why the ‘Magnificent Seven’ and other momentum stocks may be hitting a wall,2024-03-19T21:19:00Z
Is Tesla's Supercharger Network Enough to Buoy a Waning Stock?,2024-03-20T08:17:00Z
"Nike Earnings Preview: EPS, Revenue Estimates Declining but Free-Cash Yield Helps",2024-03-20T08:32:00Z
The 2024 Volkswagen ID.4 review: This electric small SUV keeps getting better,2024-03-20T09:01:00Z
"The big tech rally is living on borrowed time, says UBS",2024-03-20T09:22:00Z
"This Artificial Intelligence Giant Could Be the Next to Join the ""Magnificent Seven""",2024-03-20T10:00:00Z
Will Shiba Inu Overtake Dogecoin in Market Cap?,2024-03-20T10:50:00Z
Tesla Bull Recommends A 'Great Deal' For Elon Musk's EV Giant As It Grapples With Slowing Sales Growth,2024-03-20T13:10:46Z
Stocks At Record Levels Even As Rate Cut Hopes Fade: 'The Strength Of AI Hype Is Truly Historic',2024-03-20T13:22:36Z
"There’s gas in the tank for a post-Fed rally so stick with the stock-market winners, says Wall Street bull",2024-03-20T14:05:00Z
Fund Managers Left Puzzled By Tesla's Price Hike Warning: 'Hard To Read Between The Lines' Or 'Kind Of An Old Trick',2024-03-20T14:43:12Z
"Stock Market Momo Crowd Wants The Fed To Bow To Them, What Happens To The Stock Market If The Fed Disappoints?",2024-03-20T15:32:02Z
Ford (F) Defers Three-Row Electric SUV to Launch Cheaper EVs,2024-03-20T16:05:00Z
5 Things To Know In Investing This Week - The Stagflation And Doom Issue,2024-03-20T17:09:06Z
"Biden’s EPA rolls out regulation to accelerate EV adoption, as carmakers say it’s a stretch",2024-03-20T18:36:00Z
"Cathie Wood's ARKK Still Leaking, Loses Over 3% In Value And 2% Of Net Assets In A Week",2024-03-20T19:00:33Z
"Massive Warning for Rivian, Lucid, and Even Tesla Investors",2024-03-20T20:48:04Z
Great News for Tesla Stock Investors!,2024-03-20T20:56:03Z
"Meet Wall Street's Newest Stock-Split Stock, Along With the Artificial Intelligence (AI) Stock Likeliest to Follow in Its Footsteps",2024-03-21T08:06:00Z
"Can This Beaten-Down Stock Skyrocket More Than the ""Magnificent Seven"" Over the Next 3 Years?",2024-03-21T09:05:00Z
3 Billionaires Are Selling Artificial Intelligence (AI) Stock Nvidia and Buying These 10 AI Stocks Instead,2024-03-21T09:06:00Z
"Forget the Magnificent Seven Stocks: 1 Magnificent Cryptocurrency Could Soar 635% in 5 Years, According to a Wall Street Analyst",2024-03-21T09:35:00Z
"The Surprising ""Magnificent Seven"" Stock That Has the Most Upside, According to Wall Street",2024-03-21T10:15:00Z
"Tesla Bull Gary Black Remains Optimistic On Cybertruck, Sees It Becoming A 'Key Catalyst' To 2025 Earnings",2024-03-21T12:08:21Z
"3 Reasons to Buy This ""Magnificent Seven"" Stock Before It Rises 40%",2024-03-21T12:15:00Z
"AI Memory Sold Out – Blowout Micron Earnings, Gold Over $2200 For First time Ever, Apple In Trouble",2024-03-21T18:02:13Z
Tesla (TSLA) Stock Drops Despite Market Gains: Important Facts to Note,2024-03-21T21:45:20Z
"Xos, Inc. (XOS) Reports Q4 Loss, Lags Revenue Estimates",2024-03-21T21:50:02Z
Tracking Ron Baron's BAMCO Portfolio - Q4 2023 Update,2024-03-22T04:23:00Z
Could Rivian Become the Next Tesla?,2024-03-22T08:11:00Z
Is Nio Stock a Buy?,2024-03-22T08:44:00Z
Wall Street Eyes Strong Finish To Week As Focus Turns To Fed Chair Powell's Speech: Analyst Tells Why S&P 500 Rally This Year Is 'Perfectly Normal',2024-03-22T11:38:11Z
Can Dogecoin Reach $1 by 2030?,2024-03-22T11:50:00Z
"Federal Reserve Pushes Stocks To Record Highs As Rate Cuts Loom, Nvidia Rallies, Apple Faces Legal Woes: This Week In The Markets",2024-03-22T20:34:39Z
Where Will Tesla Stock Be in 1 Year?,2024-03-22T21:49:14Z
1 Magnificent Stock Near 52-Week Lows to Buy Today,2024-03-23T07:29:00Z
Will Nvidia Stock Crash Like Tesla? 3 Points To Consider,2024-03-23T11:00:00Z
1 Stock I Wouldn't Touch With a 10-Foot Pole,2024-03-23T11:30:00Z
"2 ""Magnificent Seven"" Stocks to Buy Hand Over Fist Right Now",2024-03-23T20:10:00Z
Tesla: Being Between 2 Major Growth Waves Creates Opportunity For Investors (Rating Upgrade),2024-03-24T06:32:01Z
"59% of This Vanguard ETF Is Invested in the ""Magnificent Seven"" Stocks. Is It a No-Brainer Buy Right Now?",2024-03-24T10:50:00Z
"If the ""Magnificent Seven"" Is So Great, Then Why Is Tesla the Worst-Performing S&P 500 Stock in 2024?",2024-03-24T11:15:00Z
Tesla's Growth Engine Stuttering? Deliveries Miss Looms As Analyst Questions High Valuation: 'Looks Vulnerable',2024-03-25T05:33:16Z
"Tesla Stock: Buy, Sell, or Hold?",2024-03-25T07:30:00Z
Rivian Has No Choice; It Has to Find a Way to Reduce Costs,2024-03-25T07:50:00Z
Beyond US Stocks: 3 Emerging Markets That Should Be on Your Portfolio,2024-03-25T07:57:00Z
"History Suggests the Nasdaq Will Surge in 2024: 2 ""Magnificent Seven"" Stocks to Buy Right Now",2024-03-25T08:15:00Z
"Cathie Wood's Ark Doubles Down On Tesla Despite Dip, But Dumps $56M In This Bitcoin-Linked Stock Amid Crypto Cooldown",2024-03-25T08:29:20Z
Huge News for Tesla Stock Investors,2024-03-25T09:07:00Z
"Meet a $496 Billion Artificial Intelligence (AI) Stock That's Not in the ""Magnificent Seven""",2024-03-25T09:50:00Z
Best Stocks to Buy: Tesla Stock vs. Nio Stock vs. Rivian Stock,2024-03-25T11:00:00Z
Tesla Bear Wonders If Price Hike Warnings Are Signs Of Looming Production Slump: 'Simply An Also-Ran Auto Company After All?',2024-03-25T11:00:16Z
Wall Street Set To Open Weak Lower As Tech Feels China Chill: Analyst Says Stay Bullish 'If And Until This Changes',2024-03-25T11:39:57Z
Why Is Tesla Stock Falling Over 1% Premarket Today?,2024-03-25T11:56:14Z
"The Ultimate EV Stock to Buy With $1,000 Today",2024-03-25T12:43:00Z
Can Tesla Surprise Wall Street Again?,2024-03-25T13:14:10Z
Tesla's Tactical Change May Deliver Fewer Vehicles But Could Raise Profitability: Analyst,2024-03-25T16:05:37Z
"Tesla, Rivian, Nio Hit With Downgrades As EV Demand Slows",2024-03-25T17:18:22Z
Tesla Bear? Nvidia Bull? Leveraged And Inverse Single Stock ETFs Can Help You Maximize Your View,2024-03-25T17:45:51Z
Buy the Dip on Tesla Stock? Forget It -- Here's Why.,2024-03-25T18:36:00Z
"Tesla Stock Has Just 14% Upside Now, According to 1 Wall Street Analyst",2024-03-25T20:02:27Z
Where Will Tesla Stock Be in 2030?,2024-03-25T21:43:49Z
"Cathie Wood's Ark Ups Tesla Bet With $28M Stock Buy Amid Rebound, Also Loads Up On This Online Game Platform",2024-03-26T06:25:36Z
"Expert Raises Alarm As Apple, Tesla, Amazon And Other Magnificent 7 Fall Behind Amid Speculative Stock Surge: 'It's The Greater Fool Theory'",2024-03-26T07:39:36Z
"Nasdaq, S&P 500 Futures Surge Amid Risk-On Mood; Bitcoin, Gold Rally — Analyst Says 'Hard To Fight This Powerful Trend'",2024-03-26T11:33:44Z
Tesla To $120? Here Are 10 Top Analyst Forecasts For Tuesday,2024-03-26T12:30:05Z
Tesla Is the Analyst's Most Downgraded Stock: How Low Can It Go?,2024-03-26T12:46:00Z
"Here is What to Know Beyond Why Tesla, Inc. (TSLA) is a Trending Stock",2024-03-26T13:00:14Z
BYD Zooms Past Tesla in Sales: Can Elon Musk's Company Retake the Lead?,2024-03-26T14:32:00Z
"Tesla, Krispy Kreme, McCormick And Other Big Stocks Moving Higher On Tuesday",2024-03-26T14:36:08Z
Why Tesla Stock Just Popped 5%,2024-03-26T15:33:48Z
Cathie Wood Goes Bargain Hunting: 3 Stocks She Just Bought,2024-03-26T15:55:00Z
"Tesla Stock Has Another 33% Downside, According to 1 Wall Street Analyst",2024-03-26T16:10:20Z
"Tesla Faces Tough Road Ahead, Analyst Predicts Lower Earnings Citing Market and Production Hurdles",2024-03-26T17:03:58Z
Why Westport Fuel Systems Shares Are Trading Lower By Around 10%? Here Are Other Stocks Moving In Tuesday's Mid-Day Session,2024-03-26T17:45:27Z
"Tesla-CATL 'Power Couple' Can Recharge US EV Market, Says Morgan Stanley Analyst Adam Jonas: '...Could Be A Game-Changer'",2024-03-27T03:22:17Z
"Investor Sentiment Falls Further, S&P 500 Falls For 3rd Session",2024-03-27T08:00:27Z
"Forget Tesla: 1 Unstoppable Artificial Intelligence (AI) Stock Belongs in the ""Magnificent Seven"" Instead",2024-03-27T08:27:00Z
This Fantastic Stock Has Outperformed Tesla in the Past 3 Years and It Just Got Much Cheaper,2024-03-27T09:30:00Z
"Forget Tesla: I Think This Stock Should Replace It in the ""Magnificent Seven""",2024-03-27T09:50:00Z
"Company News for Mar 27, 2024",2024-03-27T13:26:00Z
Better Electric Vehicle Stock: Tesla or Rivian?,2024-03-27T13:53:00Z
This Semiconductor Growth Stock Dropped Over 20% on Monday -- Is It Time to Buy Hand Over Fist?,2024-03-27T14:32:45Z
Cracking The Code: Understanding Analyst Reviews For Tesla,2024-03-27T16:01:02Z
Tesla (TSLA) Outpaces Stock Market Gains: What You Should Know,2024-03-27T21:45:18Z
"Tesla Bull Trims Price Target Ahead Of Q1 Deliveries Update, Warns Of 'Darker Days' Ahead: 'For Musk, This Is A Fork-In-The-Road Time'",2024-03-28T05:42:04Z
"Will This $900 Billion Stock Replace Tesla in the ""Magnificent Seven""?",2024-03-28T10:45:00Z
"Prediction: This Will Be the Next ""Magnificent Seven"" Stock",2024-03-28T10:50:00Z
"1 Wall Street Analyst Thinks Telsa Is Going to $194 -- Is 2024's Worst-Performing ""Magnificent Seven"" Stock a Buy?",2024-03-28T13:40:51Z
A Closer Look at China's Changing EV Landscape,2024-03-28T13:48:00Z
Easter's Bitter Surprise: Cocoa Is Up 240% In A Year – What Can A Ton Of The Chocolate Commodity Get You Today?,2024-03-28T17:29:18Z
"Tesla Is  Navigating Free FSD Trials, Gigafactory Challenges, and Governance Hurdles: Analyst",2024-03-28T17:51:51Z
"Why Dogecoin, Floki Inu, and Bonk Are Surging Today",2024-03-28T20:16:01Z
5 Popular Stocks on Sale: Values or Traps?,2024-03-28T20:38:00Z
"Cathie Wood's Ark Continues Tesla Stock Buying Spree, Acquires Over $14M Worth Of Shares Amid Dip",2024-03-29T02:09:46Z
Tesla Bull Says He Knows Why Wall Street Doesn't 'Yet Get How Great FSD' Is: 'Won't Add Value To TSLA's Valuation Unless...',2024-03-29T05:45:32Z
"Did Bitcoin, Gold Or S&P 500 Make You Richer This Quarter? What $1000 Invested In These Asset Classes Would've Returned",2024-03-29T06:24:23Z
"Tesla Stock Has 71% Upside, According to 1 Wall Street Analyst",2024-03-29T08:15:00Z
"The ""Magnificent Seven"" Stocks, Ranked From Best to Worst Performance Over Time",2024-03-29T10:45:00Z
"Are the ""Magnificent Seven"" Too Expensive to Buy?",2024-03-29T11:15:00Z
"Tesla Q1 Deliveries Preview: Analysts Cut Targets, 'Nightmare Quarter For Tesla'",2024-03-29T14:44:06Z
PCAR or TSLA: Which Is the Better Value Stock Right Now?,2024-03-29T15:40:09Z
"Which ""Magnificent Seven"" Stocks Are Attracting More of the Big Money?",2024-03-30T09:48:00Z
"Forget Apple: I Think This Stock Should Replace It in the ""Magnificent Seven""",2024-03-30T11:09:00Z
"Better ""Magnificent Seven"" Stock: Apple or Tesla?",2024-03-30T11:15:00Z
"Are Nike, Lululemon, Apple, Tesla, and Starbucks Waving a Red Flag for the Stock Market?",2024-03-31T07:50:00Z
"Here's How Much Dividend Income You'd Make by Investing $70,000 in the ""Magnificent Seven"" Stocks",2024-03-31T09:59:00Z
"Some Skeptics Say Crypto Is Too Expensive. I Disagree, and Here's Why.",2024-03-31T11:30:00Z
Wall Street Breakfast: The Week Ahead,2024-03-31T11:38:40Z
"Can Tesla Stock Reach $1,000 by 2030?",2024-03-31T13:27:00Z
"'Congrats Tesla Team,' Says Elon Musk As EV Giant Hits 6M Production Milestone: What Does It Mean For Q1 Deliveries?",2024-03-31T15:25:09Z
"Down More Than 50%, This ""Magnificent Seven"" Stock Is a Screaming Buy",2024-04-01T07:58:00Z
Bull of the Day: Ford Motor (F),2024-04-01T08:00:00Z
Cathie Wood's Ark Invest Has 14% of Its Portfolio Invested in 2 Growth Stocks,2024-04-01T09:35:00Z
"Here's the Best ""Magnificent Seven"" Stock to Buy in April, According to Wall Street",2024-04-01T09:50:00Z
"Tesla Bull Anticipates Lower Q1 Volume, But Does Not Rule Out Stock Rally If This Happens",2024-04-01T09:52:01Z
"Zacks Value Investor Highlights: Paolo Alto, Lululemon, Tesla, Nike and Starbucks",2024-04-01T10:19:00Z
US Stocks Set To Start Fresh Week On Positive Note As Traders Take Inflation Data In Their Stride: Analyst Explains Why Rally Will Likely Extend Through 2024,2024-04-01T11:50:50Z
"Nvidia Leads, Tesla Lags Among Magnificent Seven Stocks: Q1 Market Shake-Up",2024-04-01T13:50:19Z
"As Tesla, Apple Falter, These Remaining 'Fab Four' From The Mag 7 Lot Are 'Still Holding Up' The Market",2024-04-01T14:56:37Z
Tesla Stock: No Longer An Obvious Sell,2024-04-01T18:34:01Z
Tesla's Strides in This Game-Changing Technology Make the Stock a Magnificent Buy,2024-04-01T18:49:00Z
Tesla Sentiment Is Reaching a Tipping Point,2024-04-01T20:11:40Z
"Tesla Stock Has 27% Downside, According to 1 Wall Street Analyst",2024-04-01T20:15:10Z
4 Top Growth Stocks to Buy in April,2024-04-01T20:19:09Z
"Cathie Wood's Ark Amasses Nearly $15M Tesla Shares Ahead Of Crucial Q1 Deliveries Report - Continues To Offload Nvidia, Coinbase And Robinhood",2024-04-02T02:53:39Z
1 Growth Stock Down 56% to Buy Right Now,2024-04-02T08:47:00Z
Tesla: 4 Strengths and 4 Weaknesses,2024-04-02T11:00:00Z
"Wall Street Set For Weak Open As Fed Speeches, Key Data Eyed: Amid Bitcoin Plunge And Gold Spike, Market Analyst Sees 'Nothing Breaking The Upward Trend'",2024-04-02T11:24:00Z
2024 Q1 Market Recap: Bullish Momentum Persists Despite Challenges,2024-04-02T11:47:00Z
Historic S&P 500 Rally In Q1 Flashes Bullish Signals For 2024: 'Only The Ninth Time Since 1940',2024-04-02T13:23:24Z
"FSD Is Incredible, but Tesla Has a Massive Flaw Autonomy Can't Overcome",2024-04-02T15:19:09Z
Why Nikola Stock Ran Out of Gas Today,2024-04-02T15:38:26Z
"Tesla Analysts Size Up Ugly Q1 Numbers: Disaster, Train Wreck, Horror Show, Nightmare — Will Storm Pass Or Are Darker Days Ahead?",2024-04-02T15:54:48Z
Why Tesla Stock Lost 13% in March,2024-04-03T00:36:47Z
"Why EV Stocks Tesla, Rivian, and Lucid All Fell Today",2024-04-03T00:48:00Z
"Cathie Wood's Ark Invest Unfazed By Tesla's Big Q1 Sales Miss, Hoards $39M Of EV Giant's Stock Tuesday — Nvidia Offloading Continues",2024-04-03T02:35:45Z
"Company News for Apr 3, 2024",2024-04-03T07:25:00Z
"Tesla Stock Has 87% Downside, According to 1 Wall Street Analyst",2024-04-03T08:00:00Z
Tesla's Q1 2024 Delivery Bust,2024-04-03T08:20:58Z
Tesla Catches Analysts Off Guard With 'Kitchen Sink' Q1: Why This Fund Manager Says It's 'Hard To Be Bullish' On EV Giant's Stock,2024-04-03T08:44:51Z
"1 ""Magnificent Seven"" Stock to Buy Hand Over Fist in April, and 1 to Avoid Like the Plague",2024-04-03T09:06:00Z
'He Can't Even Tell He's An Idiot:' Elon Musk Furious As Ross Gerber Accuses Tesla CEO's 'Toxic' Behavior For 'Crappy' Q1 Sales And Demands Board Overhaul (UPDATED),2024-04-03T09:10:42Z
Shocking Stat: Tesla Is Underperforming GM by 58.6% in 2024,2024-04-03T10:30:00Z
"Wall Street Set To Stumble At Open As Traders Eye Key Data, Fed Chair Powell's Speech: Analyst Finds 2 Reasons To Stay Optimistic In April",2024-04-03T11:45:45Z
"The Good, the Bad, and the Ugly Truth About Tesla Right Now",2024-04-03T12:30:46Z
"Tesla Stock Has 17% Downside, According to 1 Wall Street Analyst",2024-04-03T14:20:11Z
Tesla Stock Sinks After a Big Q1 Delivery Miss: ETFs in Focus,2024-04-03T15:05:00Z
"Tesla Struggles with Delivery Goals and AI Tech Expectations, Analysts Adjust Financial Forecasts",2024-04-03T18:19:48Z
Tesla (TSLA) Laps the Stock Market: Here's Why,2024-04-03T21:45:20Z
"Tesla Stock Still Has Over 30% Downside, According to 1 Wall Street Analyst",2024-04-04T08:20:00Z
This Is Terrible News for Tesla Stock Investors,2024-04-04T09:00:00Z
This Is a Massive Red Flag for Rivian and Lucid,2024-04-04T09:15:00Z
3 Warren Buffett Stocks to Buy Hand Over Fist in April,2024-04-04T09:55:00Z
Tesla Stock Is Down More Than 30% This Year. Time to Buy?,2024-04-04T10:31:00Z
Huge News for Tesla Stock Investors,2024-04-04T11:00:00Z
"Tesla Bull Asks Grok AI On EV Giant's 2023 Ad Spend, Pushes Elon Musk Yet Again For Marketing Blitz",2024-04-04T13:41:25Z
"S&P 500, Nasdaq 100 Eye Record Close As Magnificent 7 Rally, Bitcoin Rebounds: What's Driving Markets Thursday?",2024-04-04T17:50:02Z
US Treasury Chief Yellen Pursues Closer China Ties But Calls Out Excess Manufacturing Concerns,2024-04-05T06:42:01Z
"These 2 ""Magnificent Seven"" Stocks Are in the Spotlight for All the Wrong Reasons",2024-04-05T08:03:00Z
"Tesla's ""Nightmare"" Quarter Just Became Reality. Should Investors Sell Tesla Stock?",2024-04-05T09:29:00Z
'Beautiful Truck:' Tesla Investor Ross Gerber Praises 'Nice People At Rivian' For Fulfilling R1S Order Even As His Cybertruck Wait Prolongs,2024-04-05T09:31:20Z
3 No-Brainer Cathie Wood Stocks to Buy Right Now,2024-04-05T09:50:00Z
These 2 Analysts Think Tesla Stock Could Fall Much Further,2024-04-05T10:41:00Z
Best Stock to Buy: Tesla Stock vs. Rivian Stock vs. Ford Stock,2024-04-05T13:00:50Z
"US Labor Market Heats Up In March: Payrolls Grow By 303,000, Highest In 10 Months, Dampen June Rate Cut Hopes (UPDATED)",2024-04-05T13:18:08Z
Ford (F) Defers Launch of Three-Row Electric SUV Until 2027,2024-04-05T15:16:00Z
"Jobs Rocket Past Estimates, Be Careful Listening To Stock Market Permabulls",2024-04-05T18:26:32Z
"Why ""Magnificent Seven"" Stocks Meta and Amazon Rallied Today, While Tesla Stock Tapped the Brakes",2024-04-05T18:30:31Z
"In Defiance of Recent Rhetoric, 1 Wall Street Analyst Says Tesla Stock Still Has 88% Upside",2024-04-05T19:14:54Z
"Traders Rethink Interest Rate Cuts, Labor Market Heats Up, Oil Prices Quietly Reach 6-Month High: This Week In The Markets",2024-04-05T20:23:32Z
"Cathie Wood's Ark Invest Doubles Down On Tesla Despite 3.6% Plunge Amid Model 2 Rumors, Adds $22M Worth Of Shares",2024-04-06T03:22:45Z
